Sheet: Sheet1
A1: ID | B1: 年份 | C1: 排名 | D1: 姓名 | E1: 财富_亿人民币 | F1: 性别 | G1: 年龄段 | H1: 年龄 | I1: 公司 | J1: 省 | K1: 市 | L1: 行业
A2: 1 | B2: 2014 | C2: 1 | D2: 马云 | E2: 1193.4000000000001 | F2: 男 | G2: =INT(RC[1]/10)*10 -> 50 | H2: 50 | I2: 阿里巴巴 | J2: 浙江 | K2: 杭州 | L2: 软件及互联网
A3: 2 | B3: 2014 | C3: 2 | D3: 李彦宏 | E3: 899.6 | F3: 男 | G3: =INT(RC[1]/10)*10 -> 40 | H3: 45 | I3: 百度 | J3: 北京 | K3: 北京 | L3: 软件及互联网
A4: 3 | B4: 2014 | C4: 3 | D4: 马化腾 | E4: 881.3 | F4: 男 | G4: =INT(RC[1]/10)*10 -> 40 | H4: 43 | I4: 腾讯 | J4: 广东 | K4: 深圳 | L4: 软件及互联网
A5: 4 | B5: 2014 | C5: 4 | D5: 王健林 | E5: 807.8 | F5: 男 | G5: =INT(RC[1]/10)*10 -> 60 | H5: 60 | I5: 大连万达集团 | J5: 北京 | K5: 北京 | L5: 房地产
A6: 5 | B6: 2014 | C6: 5 | D6: 李河君 | E6: 795.6 | F6: 男 | G6: =INT(RC[1]/10)*10 -> 40 | H6: 47 | I6: 汉能控股集团 | J6: 北京 | K6: 北京 | L6: 能源
A7: 6 | B7: 2014 | C7: 6 | D7: 宗庆后 | E7: 673.2 | F7: 男 | G7: =INT(RC[1]/10)*10 -> 60 | H7: 69 | I7: 娃哈哈集团 | J7: 浙江 | K7: 杭州 | L7: 食品饮料
A8: 7 | B8: 2014 | C8: 7 | D8: 王文银 | E8: 612 | F8: 男 | G8: =INT(RC[1]/10)*10 -> 40 | H8: 46 | I8: 正威国际 | J8: 广东 | K8: 深圳 | L8: 原材料
A9: 8 | B9: 2014 | C9: 8 | D9: 雷军 | E9: 556.9 | F9: 男 | G9: =INT(RC[1]/10)*10 -> 40 | H9: 44 | I9: 小米科技 | J9: 北京 | K9: 北京 | L9: 电脑与通讯设备、多元金融
A10: 9 | B10: 2014 | C10: 9 | D10: 何享健 | E10: 459 | F10: 男 | G10: =INT(RC[1]/10)*10 -> 70 | H10: 72 | I10: 美的集团 | J10: 广东 | K10: 佛山 | L10: 耐用消费品与服装
A11: 10 | B11: 2014 | C11: 10 | D11: 刘强东 | E11: 434.5 | F11: 男 | G11: =INT(RC[1]/10)*10 -> 40 | H11: 40 | I11: 京东商城 | J11: 北京 | K11: 北京 | L11: 软件及互联网
A12: 11 | B12: 2014 | C12: 11 | D12: 刘永行 | E12: 397.8 | F12: 男 | G12: =INT(RC[1]/10)*10 -> 60 | H12: 66 | I12: 东方希望集团 | J12: 上海 | K12: 上海 | L12: 原材料、石油化工、多元金融
A13: 12 | B13: 2014 | C13: 12 | D13: 王靖 | E13: 391.7 | F13: 男 | G13: =INT(RC[1]/10)*10 -> 40 | H13: 41 | I13: 信威集团 | J13: 北京 | K13: 北京 | L13: 电脑与通讯设备
A14: 13 | B14: 2014 | C14: 13 | D14: 陈丽华家族 | E14: 373.3 | F14: 女 | G14: =INT(RC[1]/10)*10 -> 70 | H14: 73 | I14: 富华国际集团 | J14: 北京 | K14: 北京 | L14: 房地产
A15: 14 | B15: 2014 | C15: 14 | D15: 魏建军 | E15: 367.2 | F15: 男 | G15: =INT(RC[1]/10)*10 -> 50 | H15: 50 | I15: 长城汽车 | J15: 河北 | K15: 保定 | L15: 汽车与汽车零部件
A16: 15 | B16: 2014 | C16: 15 | D16: 许家印 | E16: 361.1 | F16: 男 | G16: =INT(RC[1]/10)*10 -> 50 | H16: 56 | I16: 恒大集团 | J16: 广东 | K16: 广州 | L16: 房地产、农业、食品饮料、体育
A17: 16 | B17: 2014 | C17: 16 | D17: 鲁冠球父子 | E17: 330.5 | F17: 男 | G17: =INT(RC[1]/10)*10 -> 60 | H17: 69 | I17: 万向集团 | J17: 浙江 | K17: 杭州 | L17: 汽车与汽车零部件、原材料、房地产、多元金融
A18: 17 | B18: 2014 | C18: 16 | D18: 许荣茂 | E18: 330.5 | F18: 男 | G18: =INT(RC[1]/10)*10 -> 60 | H18: 64 | I18: 世茂集团 | J18: 香港 | K18: 香港 | L18: 房地产
A19: 18 | B19: 2014 | C19: 18 | D19: 张志东 | E19: 318.2 | F19: 男 | G19: =INT(RC[1]/10)*10 -> 40 | H19: 42 | I19: 腾讯 | J19: 广东 | K19: 深圳 | L19: 软件及互联网
A20: 19 | B20: 2014 | C20: 19 | D20: 丁磊 | E20: 299.89999999999998 | F20: 男 | G20: =INT(RC[1]/10)*10 -> 40 | H20: 43 | I20: 网易 | J20: 广东 | K20: 广州 | L20: 软件及互联网
A21: 20 | B21: 2014 | C21: 19 | D21: 杨惠妍 | E21: 299.89999999999998 | F21: 女 | G21: =INT(RC[1]/10)*10 -> 30 | H21: 33 | I21: 碧桂园 | J21: 广东 | K21: 佛山 | L21: 房地产
A22: 21 | B22: 2014 | C22: 21 | D22: 童锦泉 | E22: 293.8 | F22: 男 | G22: =INT(RC[1]/10)*10 -> 50 | H22: 59 | I22: 长峰房地产 | J22: 上海 | K22: 上海 | L22: 房地产
A23: 22 | B23: 2014 | C23: 22 | D23: 王传福 | E23: 287.60000000000002 | F23: 男 | G23: =INT(RC[1]/10)*10 -> 40 | H23: 48 | I23: 比亚迪 | J23: 广东 | K23: 深圳 | L23: 汽车与汽车零部件、环保与新能源
A24: 23 | B24: 2014 | C24: 23 | D24: 张士平家族 | E24: 269.3 | F24: 男 | G24: =INT(RC[1]/10)*10 -> 60 | H24: 67 | I24: 中国宏桥集团、山东魏桥创业集团 | J24: 山东 | K24: 滨州 | L24: 原材料、纺织
A25: 24 | B25: 2014 | C25: 23 | D25: 周建平家族 | E25: 269.3 | F25: 男 | G25: =INT(RC[1]/10)*10 -> 50 | H25: 54 | I25: 海澜集团 | J25: 江苏 | K25: 江阴 | L25: 耐用消费品与服装
A26: 25 | B26: 2014 | C26: 25 | D26: 郭广昌 | E26: 263.2 | F26: 男 | G26: =INT(RC[1]/10)*10 -> 40 | H26: 47 | I26: 复星国际 | J26: 上海 | K26: 上海 | L26: 原材料、房地产、制药与生物科技、多元金融
A27: 26 | B27: 2014 | C27: 26 | D27: 王卫 | E27: 257 | F27: 男 | G27: / | H27: / | I27: 顺丰速运 | J27: 广东 | K27: 深圳 | L27: 物流
A28: 27 | B28: 2014 | C28: 27 | D28: 梁稳根 | E28: 244.8 | F28: 男 | G28: =INT(RC[1]/10)*10 -> 50 | H28: 57 | I28: 三一集团 | J28: 湖南 | K28: 长沙 | L28: 工业设备
A29: 28 | B29: 2014 | C29: 28 | D29: 卢志强 | E29: 232.6 | F29: 男 | G29: =INT(RC[1]/10)*10 -> 60 | H29: 62 | I29: 泛海集团 | J29: 北京 | K29: 北京 | L29: 多元金融、房地产
A30: 29 | B30: 2014 | C30: 28 | D30: 孙广信 | E30: 232.6 | F30: 男 | G30: =INT(RC[1]/10)*10 -> 50 | H30: 51 | I30: 新疆广汇实业投资(集团) | J30: 新疆 | K30: 乌鲁木齐 | L30: 能源、贸易、房地产
A31: 30 | B31: 2014 | C31: 30 | D31: 刘永好家族 | E31: 226.4 | F31: 男 | G31: =INT(RC[1]/10)*10 -> 60 | H31: 63 | I31: 新希望集团 | J31: 四川 | K31: 成都 | L31: 原材料、房地产、多元金融、石油化工
A32: 31 | B32: 2014 | C32: 30 | D32: 张欣夫妇 | E32: 226.4 | F32: 女 | G32: =INT(RC[1]/10)*10 -> 40 | H32: 49 | I32: SOHO中国 | J32: 北京 | K32: 北京 | L32: 房地产
A33: 32 | B33: 2014 | C33: 32 | D33: 龚虹嘉夫妇 | E33: 208.1 | F33: 男 | G33: =INT(RC[1]/10)*10 -> 40 | H33: 49 | I33: 海康威视 | J33: 香港 | K33: 香港 | L33: 电子产品制造
A34: 33 | B34: 2014 | C34: 32 | D34: 刘忠田 | E34: 208.1 | F34: 男 | G34: =INT(RC[1]/10)*10 -> 50 | H34: 50 | I34: 忠旺集团 | J34: 辽宁 | K34: 辽阳 | L34: 制造业
A35: 34 | B35: 2014 | C35: 32 | D35: 吕向阳 | E35: 208.1 | F35: 男 | G35: =INT(RC[1]/10)*10 -> 50 | H35: 51 | I35: 融捷投资、比亚迪股份 | J35: 广东 | K35: 广州 | L35: 多元金融
A36: 35 | B36: 2014 | C36: 35 | D36: 姜滨夫妇 | E36: 202 | F36: 男 | G36: =INT(RC[1]/10)*10 -> 40 | H36: 48 | I36: 歌尔声学 | J36: 山东 | K36: 潍坊 | L36: 电子产品制造
A37: 36 | B37: 2014 | C37: 36 | D37: 潘政民夫妇 | E37: 195.8 | F37: 男 | G37: =INT(RC[1]/10)*10 -> 40 | H37: 44 | I37: AAC声学科技 | J37: 广东 | K37: 深圳 | L37: 电子产品制造
A38: 37 | B38: 2014 | C38: 36 | D38: 史玉柱父女 | E38: 195.8 | F38: 男 | G38: =INT(RC[1]/10)*10 -> 50 | H38: 52 | I38: 巨人集团 | J38: 上海 | K38: 上海 | L38: 制药与生物科技、软件与服务、多元金融
A39: 38 | B39: 2014 | C39: 36 | D39: 吴亚军 | E39: 195.8 | F39: 女 | G39: =INT(RC[1]/10)*10 -> 50 | H39: 50 | I39: 龙湖地产 | J39: 北京 | K39: 北京 | L39: 房地产
A40: 39 | B40: 2014 | C40: 36 | D40: 张近东 | E40: 195.8 | F40: 男 | G40: =INT(RC[1]/10)*10 -> 50 | H40: 51 | I40: 苏宁云商、苏宁置业 | J40: 江苏 | K40: 南京 | L40: 零售、房地产
A41: 40 | B41: 2014 | C41: 40 | D41: 邱光和家族 | E41: 189.7 | F41: 男 | G41: =INT(RC[1]/10)*10 -> 60 | H41: 62 | I41: 森马服饰 | J41: 浙江 | K41: 温州 | L41: 耐用消费品与服装
A42: 41 | B42: 2014 | C42: 40 | D42: 王玉锁夫妇 | E42: 189.7 | F42: 男 | G42: =INT(RC[1]/10)*10 -> 50 | H42: 50 | I42: 新奥集团 | J42: 河北 | K42: 廊坊 | L42: 能源、房地产
A43: 42 | B43: 2014 | C43: 42 | D43: 黄如论 | E43: 183.6 | F43: 男 | G43: =INT(RC[1]/10)*10 -> 60 | H43: 63 | I43: 世纪金源集团 | J43: 北京 | K43: 北京 | L43: 房地产、多元金融
A44: 43 | B44: 2014 | C44: 43 | D44: 黄世再 | E44: 177.5 | F44: 男 | G44: =INT(RC[1]/10)*10 -> 60 | H44: 63 | I44: 大中华国际 | J44: 广东 | K44: 深圳 | L44: 房地产
A45: 44 | B45: 2014 | C45: 44 | D45: 李锂夫妇 | E45: 165.2 | F45: 男 | G45: =INT(RC[1]/10)*10 -> 50 | H45: 50 | I45: 海普瑞 | J45: 广东 | K45: 深圳 | L45: 制药与生物科技
A46: 45 | B46: 2014 | C46: 44 | D46: 叶澄海家族 | E46: 165.2 | F46: 男 | G46: =INT(RC[1]/10)*10 -> 70 | H46: 71 | I46: 信立泰 | J46: 香港 | K46: 香港 | L46: 制药与生物科技
A47: 46 | B47: 2014 | C47: 46 | D47: 庞康 | E47: 159.1 | F47: 男 | G47: =INT(RC[1]/10)*10 -> 50 | H47: 58 | I47: 海天味业 | J47: 广东 | K47: 佛山 | L47: 食品饮料
A48: 47 | B48: 2014 | C48: 47 | D48: 车冯升 | E48: 153 | F48: 男 | G48: =INT(RC[1]/10)*10 -> 50 | H48: 51 | I48: 四环医药 | J48: 海南 | K48: 海口 | L48: 制药与生物科技
A49: 48 | B49: 2014 | C49: 47 | D49: 陈发树 | E49: 153 | F49: 男 | G49: =INT(RC[1]/10)*10 -> 50 | H49: 54 | I49: 新华都实业集团 | J49: 福建 | K49: 福州 | L49: 零售、多元金融、房地产
A50: 49 | B50: 2014 | C50: 47 | D50: 施文博 | E50: 153 | F50: 男 | G50: =INT(RC[1]/10)*10 -> 60 | H50: 64 | I50: 恒安集团 | J50: 福建 | K50: 晋江 | L50: 耐用消费品与服装
A51: 50 | B51: 2014 | C51: 50 | D51: 傅利泉夫妇 | E51: 149.9 | F51: 男 | G51: =INT(RC[1]/10)*10 -> 40 | H51: 47 | I51: 大华股份 | J51: 浙江 | K51: 杭州 | L51: 电子产品制造
A52: 51 | B52: 2014 | C52: 50 | D52: 柯希平夫妇 | E52: 149.9 | F52: 男 | G52: =INT(RC[1]/10)*10 -> 50 | H52: 54 | I52: 厦门恒兴集团 | J52: 福建 | K52: 厦门 | L52: 房地产、原材料、多元金融
A53: 52 | B53: 2014 | C53: 50 | D53: 许连捷 | E53: 149.9 | F53: 男 | G53: =INT(RC[1]/10)*10 -> 60 | H53: 61 | I53: 恒安集团 | J53: 福建 | K53: 晋江 | L53: 耐用消费品与服装
A54: 53 | B54: 2014 | C54: 53 | D54: 李书福 | E54: 146.9 | F54: 男 | G54: =INT(RC[1]/10)*10 -> 50 | H54: 51 | I54: 吉利集团 | J54: 浙江 | K54: 杭州 | L54: 汽车与汽车零部件
A55: 54 | B55: 2014 | C55: 53 | D55: 马建荣 | E55: 146.9 | F55: 男 | G55: =INT(RC[1]/10)*10 -> 50 | H55: 50 | I55: 申洲国际 | J55: 浙江 | K55: 宁波 | L55: 纺织、耐用消费品与服装
A56: 55 | B56: 2014 | C56: 53 | D56: 朱兴良 | E56: 146.9 | F56: 男 | G56: =INT(RC[1]/10)*10 -> 50 | H56: 55 | I56: 金螳螂 | J56: 江苏 | K56: 苏州 | L56: 建筑与工程
A57: 56 | B57: 2014 | C57: 56 | D57: 宋作文 | E57: 143.80000000000001 | F57: 男 | G57: =INT(RC[1]/10)*10 -> 60 | H57: 67 | I57: 山东南山集团 | J57: 山东 | K57: 龙口 | L57: 建筑与工程、纺织、房地产、航空
A58: 57 | B58: 2014 | C58: 57 | D58: 曹龙祥家族 | E58: 140.80000000000001 | F58: 男 | G58: =INT(RC[1]/10)*10 -> 50 | H58: 57 | I58: 济川药业集团 | J58: 江苏 | K58: 泰兴 | L58: 制药与生物科技
A59: 58 | B59: 2014 | C59: 57 | D59: 林建华 | E59: 140.80000000000001 | F59: 男 | G59: =INT(RC[1]/10)*10 -> 50 | H59: 52 | I59: 福斯特 | J59: 浙江 | K59: 临安 | L59: 环保与新能源
A60: 59 | B60: 2014 | C60: 57 | D60: 谢炳 | E60: 140.80000000000001 | F60: 男 | G60: =INT(RC[1]/10)*10 -> 60 | H60: 62 | I60: 中国生物制药 | J60: 香港 | K60: 香港 | L60: 制药与生物科技
A61: 60 | B61: 2014 | C61: 57 | D61: 薛光林 | E61: 140.80000000000001 | F61: 男 | G61: =INT(RC[1]/10)*10 -> 40 | H61: 46 | I61: 光汇石油 | J61: 香港 | K61: 香港 | L61: 石油化工
A62: 61 | B62: 2014 | C62: 61 | D62: 李仲初家族 | E62: 137.69999999999999 | F62: 男 | G62: =INT(RC[1]/10)*10 -> 50 | H62: 51 | I62: 石基信息 | J62: 北京 | K62: 北京 | L62: 软件与服务
A63: 62 | B63: 2014 | C63: 62 | D63: 蒋仁生父子 | E63: 134.6 | F63: 男 | G63: =INT(RC[1]/10)*10 -> 60 | H63: 61 | I63: 智飞生物 | J63: 重庆 | K63: 重庆 | L63: 制药与生物科技
A64: 63 | B64: 2014 | C64: 63 | D64: 朱林瑶 | E64: 131.6 | F64: 女 | G64: =INT(RC[1]/10)*10 -> 40 | H64: 44 | I64: 华宝国际 | J64: 香港 | K64: 香港 | L64: 原材料
A65: 64 | B65: 2014 | C65: 64 | D65: 朱共山 | E65: 129.69999999999999 | F65: 男 | G65: =INT(RC[1]/10)*10 -> 50 | H65: 56 | I65: 协鑫控股 | J65: 江苏 | K65: 徐州 | L65: 环保与新能源
A66: 65 | B66: 2014 | C66: 65 | D66: 黄伟夫妇 | E66: 128.5 | F66: 男 | G66: =INT(RC[1]/10)*10 -> 50 | H66: 55 | I66: 新湖集团 | J66: 浙江 | K66: 杭州 | L66: 房地产、多元金融、原材料、制药与生物科技
A67: 66 | B67: 2014 | C67: 65 | D67: 林刚 | E67: 128.5 | F67: 男 | G67: =INT(RC[1]/10)*10 -> 50 | H67: 50 | I67: 康哲药业控股 | J67: 香港 | K67: 香港 | L67: 制药与生物科技
A68: 67 | B68: 2014 | C68: 65 | D68: 王文学 | E68: 128.5 | F68: 男 | G68: =INT(RC[1]/10)*10 -> 40 | H68: 47 | I68: 华夏幸福 | J68: 河北 | K68: 廊坊 | L68: 房地产
A69: 68 | B69: 2014 | C69: 68 | D69: 孙飘扬 | E69: 125.5 | F69: 男 | G69: =INT(RC[1]/10)*10 -> 50 | H69: 56 | I69: 恒瑞医药 | J69: 江苏 | K69: 连云港 | L69: 制药与生物科技
A70: 69 | B70: 2014 | C70: 68 | D70: 魏奇 | E70: 125.5 | F70: 男 | G70: =INT(RC[1]/10)*10 -> 50 | H70: 59 | I70: 天合化工 | J70: 辽宁 | K70: 沈阳 | L70: 石油化工
A71: 70 | B71: 2014 | C71: 70 | D71: 蔡奎 | E71: 122.4 | F71: 男 | G71: =INT(RC[1]/10)*10 -> 50 | H71: 51 | I71: 龙湖地产 | J71: 四川 | K71: 成都 | L71: 房地产
A72: 71 | B72: 2014 | C72: 70 | D72: 沈国军 | E72: 122.4 | F72: 男 | G72: =INT(RC[1]/10)*10 -> 50 | H72: 52 | I72: 银泰集团 | J72: 北京 | K72: 北京 | L72: 零售、房地产
A73: 72 | B73: 2014 | C73: 70 | D73: 严彬 | E73: 122.4 | F73: 男 | G73: =INT(RC[1]/10)*10 -> 60 | H73: 60 | I73: 华彬国际集团 | J73: 北京 | K73: 北京 | L73: 房地产、食品饮料、旅游业、贸易
A74: 73 | B74: 2014 | C74: 73 | D74: 李留法家族 | E74: 119.3 | F74: 男 | G74: =INT(RC[1]/10)*10 -> 50 | H74: 57 | I74: 天瑞集团 | J74: 河南 | K74: 汝州 | L74: 原材料、旅游业
A75: 74 | B75: 2014 | C75: 73 | D75: 王长田夫妇 | E75: 119.3 | F75: 男 | G75: =INT(RC[1]/10)*10 -> 40 | H75: 49 | I75: 光线传媒 | J75: 北京 | K75: 北京 | L75: 传媒
A76: 75 | B76: 2014 | C76: 75 | D76: 方威 | E76: 116.3 | F76: 男 | G76: =INT(RC[1]/10)*10 -> 40 | H76: 41 | I76: 辽宁方大集团 | J76: 北京 | K76: 北京 | L76: 原材料、石油化工
A77: 76 | B77: 2014 | C77: 75 | D77: 傅梅城夫妇 | E77: 116.3 | F77: 男 | G77: =INT(RC[1]/10)*10 -> 50 | H77: 57 | I77: 华策影视 | J77: 浙江 | K77: 杭州 | L77: 文化娱乐
A78: 77 | B78: 2014 | C78: 75 | D78: 景百孚 | E78: 116.3 | F78: 男 | G78: =INT(RC[1]/10)*10 -> 40 | H78: 44 | I78: 嘉年华国际 | J78: 北京 | K78: 北京 | L78: 房地产
A79: 78 | B79: 2014 | C79: 78 | D79: 贾跃亭 | E79: 113.2 | F79: 男 | G79: =INT(RC[1]/10)*10 -> 40 | H79: 41 | I79: 乐视网 | J79: 北京 | K79: 北京 | L79: 软件与服务
A80: 79 | B80: 2014 | C80: 78 | D80: 郑建明 | E80: 113.2 | F80: 男 | G80: / | H80: / | I80: 顺风光电 | J80: 香港 | K80: 香港 | L80: 环保与新能源
A81: 80 | B81: 2014 | C81: 80 | D81: 陈金霞 | E81: 112 | F81: 女 | G81: =INT(RC[1]/10)*10 -> 40 | H81: 46 | I81: 涌金集团 | J81: 上海 | K81: 上海 | L81: 多元金融、制药与生物科技
A82: 81 | B82: 2014 | C82: 81 | D82: 蔡东青 | E82: 110.2 | F82: 男 | G82: =INT(RC[1]/10)*10 -> 40 | H82: 45 | I82: 奥飞动漫 | J82: 广东 | K82: 广州 | L82: 文化娱乐
A83: 82 | B83: 2014 | C83: 81 | D83: 黄振达家族 | E83: 110.2 | F83: 男 | G83: =INT(RC[1]/10)*10 -> 60 | H83: 67 | I83: 广东联泰集团 | J83: 广东 | K83: 汕头 | L83: 建筑与工程、房地产
A84: 83 | B84: 2014 | C84: 81 | D84: 熊续强夫妇 | E84: 110.2 | F84: 男 | G84: =INT(RC[1]/10)*10 -> 50 | H84: 58 | I84: 宁波银亿集团 | J84: 浙江 | K84: 宁波 | L84: 房地产、原材料
A85: 84 | B85: 2014 | C85: 84 | D85: 薛向东家族 | E85: 108.9 | F85: 男 | G85: =INT(RC[1]/10)*10 -> 50 | H85: 55 | I85: 东华软件 | J85: 北京 | K85: 北京 | L85: 软件与服务
A86: 85 | B86: 2014 | C86: 85 | D86: 吴以岭家族 | E86: 107.7 | F86: 男 | G86: =INT(RC[1]/10)*10 -> 60 | H86: 65 | I86: 以岭药业 | J86: 河北 | K86: 石家庄 | L86: 制药与生物科技
A87: 86 | B87: 2014 | C87: 86 | D87: 梁允超 | E87: 107.1 | F87: 男 | G87: =INT(RC[1]/10)*10 -> 40 | H87: 45 | I87: 汤臣倍健 | J87: 广东 | K87: 广州 | L87: 制药与生物科技
A88: 87 | B88: 2014 | C88: 86 | D88: 杨凯 | E88: 107.1 | F88: 男 | G88: =INT(RC[1]/10)*10 -> 50 | H88: 57 | I88: 辉山乳业 | J88: 辽宁 | K88: 沈阳 | L88: 食品饮料
A89: 88 | B89: 2014 | C89: 86 | D89: 张力 | E89: 107.1 | F89: 男 | G89: =INT(RC[1]/10)*10 -> 60 | H89: 61 | I89: 富力集团、力量矿业 | J89: 广东 | K89: 广州 | L89: 房地产、原材料
A90: 89 | B90: 2014 | C90: 89 | D90: 张志熔 | E90: 106.5 | F90: 男 | G90: =INT(RC[1]/10)*10 -> 40 | H90: 45 | I90: 恒盛地产、熔盛重工 | J90: 香港 | K90: 香港 | L90: 房地产、制造业
A91: 90 | B91: 2014 | C91: 90 | D91: 冯海良 | E91: 105.3 | F91: 男 | G91: =INT(RC[1]/10)*10 -> 50 | H91: 54 | I91: 海亮集团 | J91: 浙江 | K91: 诸暨 | L91: 原材料、房地产、教育、农业
A92: 91 | B92: 2014 | C92: 91 | D92: 姜照柏 | E92: 104 | F92: 男 | G92: =INT(RC[1]/10)*10 -> 50 | H92: 51 | I92: 鹏欣集团 | J92: 上海 | K92: 上海 | L92: 房地产、农业、多元金融
A93: 92 | B93: 2014 | C93: 91 | D93: 吴光明父子 | E93: 104 | F93: 男 | G93: =INT(RC[1]/10)*10 -> 50 | H93: 52 | I93: 鱼跃医疗 | J93: 江苏 | K93: 丹阳 | L93: 医疗保健设备与服务
A94: 93 | B94: 2014 | C94: 91 | D94: 周群飞夫妇 | E94: 104 | F94: 女 | G94: =INT(RC[1]/10)*10 -> 40 | H94: 44 | I94: 蓝思科技 | J94: 香港 | K94: 香港 | L94: 电脑与通讯设备
A95: 94 | B95: 2014 | C95: 94 | D95: 李水荣 | E95: 101 | F95: 男 | G95: =INT(RC[1]/10)*10 -> 50 | H95: 58 | I95: 浙江荣盛控股集团 | J95: 浙江 | K95: 杭州 | L95: 原材料、房地产
A96: 95 | B96: 2014 | C96: 94 | D96: 周成建父女 | E96: 101 | F96: 男 | G96: =INT(RC[1]/10)*10 -> 40 | H96: 49 | I96: 美邦服饰 | J96: 上海 | K96: 上海 | L96: 耐用消费品与服装
A97: 96 | B97: 2014 | C97: 96 | D97: 马秀慧夫妇 | E97: 99.8 | F97: 女 | G97: =INT(RC[1]/10)*10 -> 40 | H97: 43 | I97: 欧普照明 | J97: 上海 | K97: 上海 | L97: 电子电气设备
A98: 97 | B98: 2014 | C98: 97 | D98: 林秀成家族 | E98: 99.1 | F98: 男 | G98: =INT(RC[1]/10)*10 -> 50 | H98: 59 | I98: 福建三安集团 | J98: 福建 | K98: 厦门 | L98: 电子电气设备、原材料
A99: 98 | B99: 2014 | C99: 98 | D99: 黄立家族 | E99: 98.5 | F99: 男 | G99: =INT(RC[1]/10)*10 -> 50 | H99: 51 | I99: 高德红外 | J99: 湖北 | K99: 武汉 | L99: 电子电气设备
A100: 99 | B100: 2014 | C100: 98 | D100: 梁信军 | E100: 98.5 | F100: 男 | G100: =INT(RC[1]/10)*10 -> 40 | H100: 46 | I100: 复星国际 | J100: 上海 | K100: 上海 | L100: 原材料、房地产、制药与生物科技、零售、多元金融
A101: 100 | B101: 2014 | C101: 100 | D101: 刘宝林 | E101: 97.9 | F101: 男 | G101: =INT(RC[1]/10)*10 -> 60 | H101: 61 | I101: 九州通 | J101: 湖北 | K101: 武汉 | L101: 零售
A102: 101 | B102: 2014 | C102: 101 | D102: 仇建平夫妇 | E102: 97.3 | F102: 男 | G102: =INT(RC[1]/10)*10 -> 50 | H102: 52 | I102: 巨星科技 | J102: 浙江 | K102: 杭州 | L102: 工业设备
A103: 102 | B103: 2014 | C103: 101 | D103: 姜伟 | E103: 97.3 | F103: 男 | G103: =INT(RC[1]/10)*10 -> 50 | H103: 52 | I103: 贵州百灵 | J103: 贵州 | K103: 安顺 | L103: 制药与生物科技、房地产
A104: 103 | B104: 2014 | C104: 101 | D104: 王俊民 | E104: 97.3 | F104: 男 | G104: =INT(RC[1]/10)*10 -> 40 | H104: 45 | I104: 西藏海思科药业 | J104: 四川 | K104: 成都 | L104: 制药与生物科技
A105: 104 | B105: 2014 | C105: 104 | D105: 黄光裕夫妇 | E105: 96.7 | F105: 男 | G105: =INT(RC[1]/10)*10 -> 40 | H105: 45 | I105: 鹏润投资 | J105: 北京 | K105: 北京 | L105: 零售、房地产
A106: 105 | B106: 2014 | C106: 104 | D106: 王清涛 | E106: 96.7 | F106: 男 | G106: =INT(RC[1]/10)*10 -> 50 | H106: 52 | I106: 山东焦化集团 | J106: 山东 | K106: 济南 | L106: 能源
A107: 106 | B107: 2014 | C107: 106 | D107: 陈建华夫妇 | E107: 94.9 | F107: 男 | G107: =INT(RC[1]/10)*10 -> 40 | H107: 43 | I107: 恒力集团 | J107: 江苏 | K107: 吴江 | L107: 石油化工、旅游
A108: 107 | B108: 2014 | C108: 106 | D108: 马兴田家族 | E108: 94.9 | F108: 男 | G108: =INT(RC[1]/10)*10 -> 40 | H108: 45 | I108: 康美药业 | J108: 广东 | K108: 普宁 | L108: 制药与生物科技
A109: 108 | B109: 2014 | C109: 106 | D109: 帅放文夫妇 | E109: 94.9 | F109: 男 | G109: =INT(RC[1]/10)*10 -> 40 | H109: 48 | I109: 尔康制药 | J109: 广东 | K109: 广州 | L109: 制药与生物科技
A110: 109 | B110: 2014 | C110: 106 | D110: 徐镜人父子 | E110: 94.9 | F110: 男 | G110: =INT(RC[1]/10)*10 -> 70 | H110: 70 | I110: 扬子江药业 | J110: 江苏 | K110: 泰州 | L110: 制药与生物科技
A111: 110 | B111: 2014 | C111: 106 | D111: 张宏伟 | E111: 94.9 | F111: 男 | G111: =INT(RC[1]/10)*10 -> 50 | H111: 59 | I111: 北京东方集团 | J111: 北京 | K111: 北京 | L111: 零售、多元金融、原材料
A112: 111 | B112: 2014 | C112: 111 | D112: 陈宁宁家族 | E112: 93.6 | F112: 女 | G112: =INT(RC[1]/10)*10 -> 40 | H112: 43 | I112: 香港嘉鑫控股集团 | J112: 香港 | K112: 香港 | L112: 多元金融
A113: 112 | B113: 2014 | C113: 111 | D113: 阙文彬夫妇 | E113: 93.6 | F113: 男 | G113: =INT(RC[1]/10)*10 -> 50 | H113: 51 | I113: 独一味 、西部资源 | J113: 四川 | K113: 成都 | L113: 制药与生物科技、原材料
A114: 113 | B114: 2014 | C114: 113 | D114: 文一波夫妇 | E114: 93 | F114: 男 | G114: =INT(RC[1]/10)*10 -> 40 | H114: 49 | I114: 桑德集团 | J114: 北京 | K114: 北京 | L114: 环保与新能源
A115: 114 | B115: 2014 | C115: 114 | D115: 林立 | E115: 92.4 | F115: 男 | G115: =INT(RC[1]/10)*10 -> 50 | H115: 51 | I115: 深圳立业集团 | J115: 广东 | K115: 深圳 | L115: 多元金融
A116: 115 | B116: 2014 | C116: 115 | D116: 陈邦 | E116: 91.8 | F116: 男 | G116: =INT(RC[1]/10)*10 -> 40 | H116: 49 | I116: 爱尔眼科 | J116: 湖南 | K116: 长沙 | L116: 医疗保健设备与服务
A117: 116 | B117: 2014 | C117: 115 | D117: 丁世家 | E117: 91.8 | F117: 男 | G117: =INT(RC[1]/10)*10 -> 50 | H117: 50 | I117: 安踏体育 | J117: 福建 | K117: 泉州 | L117: 耐用消费品与服装
A118: 117 | B118: 2014 | C118: 115 | D118: 刘学景家族 | E118: 91.8 | F118: 男 | G118: =INT(RC[1]/10)*10 -> 60 | H118: 63 | I118: 新凤祥控股 | J118: 山东 | K118: 聊城 | L118: 原材料、农林牧渔
A119: 118 | B119: 2014 | C119: 115 | D119: 秦英林夫妇 | E119: 91.8 | F119: 男 | G119: =INT(RC[1]/10)*10 -> 40 | H119: 49 | I119: 牧原股份 | J119: 河南 | K119: 南阳 | L119: 农林牧渔
A120: 119 | B120: 2014 | C120: 115 | D120: 邵根伙 | E120: 91.8 | F120: 男 | G120: =INT(RC[1]/10)*10 -> 40 | H120: 49 | I120: 大北农 | J120: 北京 | K120: 北京 | L120: 农林牧渔、食品饮料
A121: 120 | B121: 2014 | C121: 115 | D121: 沈亚 | E121: 91.8 | F121: 男 | G121: =INT(RC[1]/10)*10 -> 40 | H121: 43 | I121: 唯品会 | J121: 广东 | K121: 广州 | L121: 软件及互联网
A122: 121 | B122: 2014 | C122: 115 | D122: 孙寿宽家族 | E122: 91.8 | F122: 男 | G122: =INT(RC[1]/10)*10 -> 60 | H122: 65 | I122: 嘉晨集团 | J122: 辽宁 | K122: 营口 | L122: 原材料、石油化工
A123: 122 | B123: 2014 | C123: 115 | D123: 孙伟杰 | E123: 91.8 | F123: 男 | G123: =INT(RC[1]/10)*10 -> 50 | H123: 51 | I123: 杰瑞股份 | J123: 山东 | K123: 烟台 | L123: 工业设备
A124: 123 | B124: 2014 | C124: 115 | D124: 叶成 | E124: 91.8 | F124: 男 | G124: =INT(RC[1]/10)*10 -> 50 | H124: 52 | I124: 山东岚桥集团 | J124: 山东 | K124: 日照 | L124: 能源、建筑与工程
A125: 124 | B125: 2014 | C125: 115 | D125: 周奕丰家族 | E125: 91.8 | F125: 男 | G125: =INT(RC[1]/10)*10 -> 40 | H125: 45 | I125: 鸿达兴业集团 | J125: 广东 | K125: 广州 | L125: 原材料、石油化工
A126: 125 | B126: 2014 | C126: 125 | D126: 丁世忠 | E126: 88.7 | F126: 男 | G126: =INT(RC[1]/10)*10 -> 40 | H126: 43 | I126: 安踏体育 | J126: 福建 | K126: 泉州 | L126: 耐用消费品与服装
A127: 126 | B127: 2014 | C127: 125 | D127: 雷菊芳 | E127: 88.7 | F127: 女 | G127: =INT(RC[1]/10)*10 -> 60 | H127: 61 | I127: 奇正藏药 | J127: 甘肃 | K127: 兰州 | L127: 制药与生物科技
A128: 127 | B128: 2014 | C128: 125 | D128: 田明 | E128: 88.7 | F128: 男 | G128: =INT(RC[1]/10)*10 -> 60 | H128: 60 | I128: 美亚光电 | J128: 安徽 | K128: 合肥 | L128: 工业设备
A129: 128 | B129: 2014 | C129: 125 | D129: 杨爱华 | E129: 88.7 | F129: 男 | G129: =INT(RC[1]/10)*10 -> 50 | H129: 53 | I129: 宝信汽车集团 | J129: 上海 | K129: 上海 | L129: 零售
A130: 129 | B130: 2014 | C130: 129 | D130: 朱吉满夫妇 | E130: 87.5 | F130: 男 | G130: =INT(RC[1]/10)*10 -> 50 | H130: 50 | I130: 誉衡药业 | J130: 黑龙江 | K130: 哈尔滨 | L130: 制药与生物科技
A131: 130 | B131: 2014 | C131: 130 | D131: 顾伟 | E131: 86.9 | F131: 男 | G131: =INT(RC[1]/10)*10 -> 40 | H131: 49 | I131: 兆驰股份 | J131: 广东 | K131: 深圳 | L131: 耐用消费品与服装
A132: 131 | B132: 2014 | C132: 131 | D132: 陈天桥夫妇 | E132: 85.7 | F132: 男 | G132: =INT(RC[1]/10)*10 -> 40 | H132: 41 | I132: 盛大网络 | J132: 上海 | K132: 上海 | L132: 软件及互联网
A133: 132 | B133: 2014 | C133: 131 | D133: 高德康家族 | E133: 85.7 | F133: 男 | G133: =INT(RC[1]/10)*10 -> 60 | H133: 62 | I133: 波司登 | J133: 江苏 | K133: 常熟 | L133: 耐用消费品与服装
A134: 133 | B134: 2014 | C134: 131 | D134: 纪海鹏家族 | E134: 85.7 | F134: 男 | G134: =INT(RC[1]/10)*10 -> 40 | H134: 48 | I134: 龙光地产 | J134: 香港 | K134: 香港 | L134: 房地产
A135: 134 | B135: 2014 | C135: 131 | D135: 刘殿波 | E135: 85.7 | F135: 男 | G135: =INT(RC[1]/10)*10 -> 40 | H135: 49 | I135: 绿叶制药 | J135: 山东 | K135: 烟台 | L135: 制药与生物科技
A136: 135 | B136: 2014 | C136: 131 | D136: 昝圣达 | E136: 85.7 | F136: 男 | G136: =INT(RC[1]/10)*10 -> 50 | H136: 51 | I136: 综艺集团 | J136: 江苏 | K136: 南通 | L136: 环保与新能源、多元金融、软件与服务
A137: 136 | B137: 2014 | C137: 131 | D137: 周鸿祎 | E137: 85.7 | F137: 男 | G137: =INT(RC[1]/10)*10 -> 40 | H137: 44 | I137: 奇虎360 | J137: 北京 | K137: 北京 | L137: 软件与服务
A138: 137 | B138: 2014 | C138: 137 | D138: 胡凯军 | E138: 85.1 | F138: 男 | G138: =INT(RC[1]/10)*10 -> 50 | H138: 52 | I138: 中国远大集团 | J138: 北京 | K138: 北京 | L138: 制药与生物科技
A139: 138 | B139: 2014 | C139: 138 | D139: 傅光明家族 | E139: 84.5 | F139: 男 | G139: =INT(RC[1]/10)*10 -> 60 | H139: 61 | I139: 圣农实业 | J139: 福建 | K139: 南平 | L139: 农林牧渔
A140: 139 | B140: 2014 | C140: 138 | D140: 黄联禧 | E140: 84.5 | F140: 男 | G140: =INT(RC[1]/10)*10 -> 50 | H140: 52 | I140: 中国联塑集团 | J140: 香港 | K140: 香港 | L140: 制造业
A141: 140 | B141: 2014 | C141: 140 | D141: 孙尚传夫妇 | E141: 83.8 | F141: 男 | G141: =INT(RC[1]/10)*10 -> 50 | H141: 51 | I141: 大富科技 | J141: 广东 | K141: 深圳 | L141: 电脑与通讯设备
A142: 141 | B142: 2014 | C142: 141 | D142: 丁欣欣夫妇 | E142: 83.2 | F142: 男 | G142: =INT(RC[1]/10)*10 -> 50 | H142: 56 | I142: 亚厦控股 | J142: 浙江 | K142: 杭州 | L142: 建筑与工程
A143: 142 | B143: 2014 | C143: 142 | D143: 曹德旺夫妇 | E143: 82.6 | F143: 男 | G143: =INT(RC[1]/10)*10 -> 60 | H143: 68 | I143: 福耀集团 | J143: 福建 | K143: 福清 | L143: 制造业
A144: 143 | B144: 2014 | C144: 142 | D144: 何亚民家族 | E144: 82.6 | F144: 男 | G144: =INT(RC[1]/10)*10 -> 50 | H144: 57 | I144: 利君股份 | J144: 四川 | K144: 成都 | L144: 工业设备
A145: 144 | B145: 2014 | C145: 142 | D145: 黄红云家族 | E145: 82.6 | F145: 男 | G145: =INT(RC[1]/10)*10 -> 40 | H145: 48 | I145: 金科股份 | J145: 重庆 | K145: 重庆 | L145: 房地产
A146: 145 | B146: 2014 | C146: 142 | D146: 柳长庆家族 | E146: 82.6 | F146: 男 | G146: =INT(RC[1]/10)*10 -> 60 | H146: 61 | I146: 聚龙股份 | J146: 辽宁 | K146: 鞍山 | L146: 工业设备
A147: 146 | B147: 2014 | C147: 142 | D147: 缪寿良 | E147: 82.6 | F147: 男 | G147: =INT(RC[1]/10)*10 -> 50 | H147: 59 | I147: 富源集团 | J147: 广东 | K147: 深圳 | L147: 房地产、教育、环保与新能源
A148: 147 | B148: 2014 | C148: 142 | D148: 邵仲毅 | E148: 82.6 | F148: 男 | G148: =INT(RC[1]/10)*10 -> 40 | H148: 46 | I148: 山东晨曦集团 | J148: 山东 | K148: 日照 | L148: 贸易、石油化工
A149: 148 | B149: 2014 | C149: 142 | D149: 修涞贵 | E149: 82.6 | F149: 男 | G149: =INT(RC[1]/10)*10 -> 60 | H149: 60 | I149: 修正药业集团 | J149: 吉林 | K149: 通化 | L149: 制药与生物科技
A150: 149 | B150: 2014 | C150: 149 | D150: 曹克坚 | E150: 79.599999999999994 | F150: 男 | G150: =INT(RC[1]/10)*10 -> 50 | H150: 52 | I150: 开山集团 | J150: 浙江 | K150: 衢州 | L150: 工业设备
A151: 150 | B151: 2014 | C151: 149 | D151: 莫天全 | E151: 79.599999999999994 | F151: 男 | G151: =INT(RC[1]/10)*10 -> 50 | H151: 50 | I151: 搜房 | J151: 北京 | K151: 北京 | L151: 软件与服务
A152: 151 | B152: 2014 | C152: 149 | D152: 倪召兴家族 | E152: 79.599999999999994 | F152: 男 | G152: =INT(RC[1]/10)*10 -> 50 | H152: 58 | I152: 中融集团 | J152: 上海 | K152: 上海 | L152: 房地产、能源
A153: 152 | B153: 2014 | C153: 149 | D153: 孙喜双家族 | E153: 79.599999999999994 | F153: 男 | G153: =INT(RC[1]/10)*10 -> 60 | H153: 61 | I153: 大连一方集团 | J153: 北京 | K153: 北京 | L153: 房地产、多元金融
A154: 153 | B154: 2014 | C154: 149 | D154: 阎志 | E154: 79.599999999999994 | F154: 男 | G154: =INT(RC[1]/10)*10 -> 40 | H154: 41 | I154: 卓尔发展 | J154: 湖北 | K154: 武汉 | L154: 房地产
A155: 154 | B155: 2014 | C155: 149 | D155: 于泳 | E155: 79.599999999999994 | F155: 男 | G155: =INT(RC[1]/10)*10 -> 50 | H155: 53 | I155: 上海鸿商产业控股集团 | J155: 上海 | K155: 上海 | L155: 多元金融
A156: 155 | B156: 2014 | C156: 149 | D156: 虞松波 | E156: 79.599999999999994 | F156: 男 | G156: =INT(RC[1]/10)*10 -> 50 | H156: 50 | I156: 和润集团 | J156: 浙江 | K156: 舟山 | L156: 房地产、能源、物流、农林牧渔、旅游
A157: 156 | B157: 2014 | C157: 149 | D157: 朱崇恽夫妇 | E157: 79.599999999999994 | F157: 女 | G157: =INT(RC[1]/10)*10 -> 50 | H157: 50 | I157: 玛丝菲尔 | J157: 广东 | K157: 深圳 | L157: 耐用消费品与服装
A158: 157 | B158: 2014 | C158: 149 | D158: 祝义材夫妇 | E158: 79.599999999999994 | F158: 男 | G158: =INT(RC[1]/10)*10 -> 50 | H158: 50 | I158: 雨润集团 | J158: 江苏 | K158: 南京 | L158: 食品饮料、房地产
A159: 158 | B159: 2014 | C159: 158 | D159: 汪建 | E159: 78 | F159: 男 | G159: / | H159: / | I159: 华大基因 | J159: 广东 | K159: 深圳 | L159: 制药与生物科技
A160: 159 | B160: 2014 | C160: 159 | D160: 郭维成 | E160: 77.099999999999994 | F160: 男 | G160: =INT(RC[1]/10)*10 -> 50 | H160: 51 | I160: 四环医药 | J160: 黑龙江 | K160: 哈尔滨 | L160: 制药与生物科技
A161: 160 | B161: 2014 | C161: 159 | D161: 王来春 | E161: 77.099999999999994 | F161: 女 | G161: =INT(RC[1]/10)*10 -> 40 | H161: 47 | I161: 立讯精密 | J161: 广东 | K161: 深圳 | L161: 电子电气设备
A162: 161 | B162: 2014 | C162: 159 | D162: 王来胜 | E162: 77.099999999999994 | F162: 男 | G162: =INT(RC[1]/10)*10 -> 40 | H162: 49 | I162: 立讯精密 | J162: 广东 | K162: 深圳 | L162: 电子电气设备
A163: 162 | B163: 2014 | C163: 159 | D163: 王文京 | E163: 77.099999999999994 | F163: 男 | G163: =INT(RC[1]/10)*10 -> 40 | H163: 49 | I163: 用友软件 | J163: 北京 | K163: 北京 | L163: 软件与服务
A164: 163 | B164: 2014 | C164: 159 | D164: 尹明善家族 | E164: 77.099999999999994 | F164: 男 | G164: =INT(RC[1]/10)*10 -> 70 | H164: 76 | I164: 力帆集团 | J164: 重庆 | K164: 重庆 | L164: 汽车与汽车零部件
A165: 164 | B165: 2014 | C165: 164 | D165: 陈欧 | E165: 76.5 | F165: 男 | G165: =INT(RC[1]/10)*10 -> 30 | H165: 31 | I165: 聚美优品 | J165: 北京 | K165: 北京 | L165: 软件及互联网
A166: 165 | B166: 2014 | C166: 164 | D166: 霍庆华 | E166: 76.5 | F166: 男 | G166: =INT(RC[1]/10)*10 -> 50 | H166: 53 | I166: 中国庆华集团 | J166: 北京 | K166: 北京 | L166: 原材料、石油化工
A167: 166 | B167: 2014 | C167: 164 | D167: 刘志强夫妇 | E167: 76.5 | F167: 男 | G167: =INT(RC[1]/10)*10 -> 50 | H167: 50 | I167: 广东香江集团 | J167: 广东 | K167: 广州 | L167: 房地产、能源、多元金融
A168: 167 | B168: 2014 | C168: 164 | D168: 文剑平 | E168: 76.5 | F168: 男 | G168: =INT(RC[1]/10)*10 -> 50 | H168: 52 | I168: 碧水源 | J168: 北京 | K168: 北京 | L168: 环保与新能源
A169: 168 | B169: 2014 | C169: 164 | D169: 张桂平父子 | E169: 76.5 | F169: 男 | G169: =INT(RC[1]/10)*10 -> 60 | H169: 63 | I169: 苏宁环球集团 | J169: 江苏 | K169: 南京 | L169: 房地产、文化娱乐
A170: 169 | B170: 2014 | C170: 169 | D170: 魏少军 | E170: 75.900000000000006 | F170: 男 | G170: =INT(RC[1]/10)*10 -> 50 | H170: 51 | I170: 隆基泰和 | J170: 河北 | K170: 保定 | L170: 房地产、零售
A171: 170 | B171: 2014 | C171: 170 | D171: 程先锋 | E171: 73.400000000000006 | F171: 男 | G171: =INT(RC[1]/10)*10 -> 40 | H171: 45 | I171: 合肥亿帆药业 | J171: 安徽 | K171: 合肥 | L171: 制药与生物科技
A172: 171 | B172: 2014 | C172: 170 | D172: 何巧女夫妇 | E172: 73.400000000000006 | F172: 女 | G172: =INT(RC[1]/10)*10 -> 40 | H172: 48 | I172: 东方园林 | J172: 北京 | K172: 北京 | L172: 建筑与工程
A173: 172 | B173: 2014 | C173: 170 | D173: 蒋宁 | E173: 73.400000000000006 | F173: 男 | G173: =INT(RC[1]/10)*10 -> 40 | H173: 40 | I173: 信威集团 | J173: 北京 | K173: 北京 | L173: 电脑与通讯设备
A174: 173 | B174: 2014 | C174: 170 | D174: 李永军 | E174: 73.400000000000006 | F174: 男 | G174: =INT(RC[1]/10)*10 -> 40 | H174: 47 | I174: 喜之郎 | J174: 广东 | K174: 深圳 | L174: 食品饮料
A175: 174 | B175: 2014 | C175: 170 | D175: 王兴 | E175: 73.400000000000006 | F175: 男 | G175: / | H175: / | I175: 美团网 | J175: 北京 | K175: 北京 | L175: 软件及互联网
A176: 175 | B176: 2014 | C176: 170 | D176: 张章笋 | E176: 73.400000000000006 | F176: 男 | G176: =INT(RC[1]/10)*10 -> 50 | H176: 57 | I176: 国瑞置业 | J176: 北京 | K176: 北京 | L176: 房地产
A177: 176 | B177: 2014 | C177: 176 | D177: 耿建明 | E177: 71.599999999999994 | F177: 男 | G177: =INT(RC[1]/10)*10 -> 50 | H177: 52 | I177: 荣盛控股 | J177: 河北 | K177: 廊坊 | L177: 房地产
A178: 177 | B178: 2014 | C178: 176 | D178: 黄楚龙 | E178: 71.599999999999994 | F178: 男 | G178: / | H178: / | I178: 星河集团 | J178: 广东 | K178: 深圳 | L178: 房地产
A179: 178 | B179: 2014 | C179: 178 | D179: 南存辉 | E179: 71 | F179: 男 | G179: =INT(RC[1]/10)*10 -> 50 | H179: 51 | I179: 正泰集团 | J179: 浙江 | K179: 温州 | L179: 工业设备
A180: 179 | B180: 2014 | C180: 179 | D180: 孔健岷 | E180: 70.400000000000006 | F180: 男 | G180: =INT(RC[1]/10)*10 -> 40 | H180: 46 | I180: 合景泰富地产 | J180: 广东 | K180: 广州 | L180: 房地产
A181: 180 | B181: 2014 | C181: 179 | D181: 楼忠福家族 | E181: 70.400000000000006 | F181: 男 | G181: =INT(RC[1]/10)*10 -> 60 | H181: 60 | I181: 广厦集团 | J181: 浙江 | K181: 杭州 | L181: 房地产、建筑与工程、文化娱乐
A182: 181 | B182: 2014 | C182: 179 | D182: 沈文荣 | E182: 70.400000000000006 | F182: 男 | G182: =INT(RC[1]/10)*10 -> 60 | H182: 68 | I182: 江苏沙钢集团 | J182: 江苏 | K182: 张家港 | L182: 原材料、多元金融
A183: 182 | B183: 2014 | C183: 179 | D183: 王金书 | E183: 70.400000000000006 | F183: 男 | G183: =INT(RC[1]/10)*10 -> 50 | H183: 57 | I183: 山东玉皇化工集团 | J183: 山东 | K183: 菏泽 | L183: 石油化工
A184: 183 | B184: 2014 | C184: 179 | D184: 杨元庆 | E184: 70.400000000000006 | F184: 男 | G184: =INT(RC[1]/10)*10 -> 40 | H184: 49 | I184: 联想集团 | J184: 北京 | K184: 北京 | L184: 电脑与通讯设备
A185: 184 | B185: 2014 | C185: 179 | D185: 朱孟依父子 | E185: 70.400000000000006 | F185: 男 | G185: =INT(RC[1]/10)*10 -> 50 | H185: 54 | I185: 合生创展 | J185: 广东 | K185: 广州 | L185: 房地产
A186: 185 | B186: 2014 | C186: 185 | D186: 梁光伟 | E186: 69.8 | F186: 男 | G186: =INT(RC[1]/10)*10 -> 50 | H186: 51 | I186: 华强集团 | J186: 广东 | K186: 深圳 | L186: 文化娱乐、电子电器设备、旅游
A187: 186 | B187: 2014 | C187: 186 | D187: 任正非 | E187: 69.2 | F187: 男 | G187: =INT(RC[1]/10)*10 -> 70 | H187: 70 | I187: 华为技术 | J187: 广东 | K187: 深圳 | L187: 电脑与通讯设备
A188: 187 | B188: 2014 | C188: 187 | D188: 阮水龙家族 | E188: 68.5 | F188: 男 | G188: =INT(RC[1]/10)*10 -> 70 | H188: 78 | I188: 浙江龙盛 | J188: 浙江 | K188: 上虞 | L188: 石油化工
A189: 188 | B189: 2014 | C189: 187 | D189: 赵步长父子 | E189: 68.5 | F189: 男 | G189: =INT(RC[1]/10)*10 -> 70 | H189: 71 | I189: 步长集团 | J189: 陕西 | K189: 西安 | L189: 制药与生物科技
A190: 189 | B190: 2014 | C190: 189 | D190: 陈鸿道家族 | E190: 67.3 | F190: 男 | G190: / | H190: / | I190: 加多宝集团 | J190: 香港 | K190: 香港 | L190: 食品饮料
A191: 190 | B191: 2014 | C191: 189 | D191: 高振东 | E191: 67.3 | F191: 男 | G191: =INT(RC[1]/10)*10 -> 40 | H191: 49 | I191: 苏州宝时得电动工具 | J191: 江苏 | K191: 苏州 | L191: 工业设备
A192: 191 | B192: 2014 | C192: 189 | D192: 黄文仔 | E192: 67.3 | F192: 男 | G192: =INT(RC[1]/10)*10 -> 60 | H192: 61 | I192: 星河湾 | J192: 广东 | K192: 广州 | L192: 房地产
A193: 192 | B193: 2014 | C193: 189 | D193: 黄晞家族 | E193: 67.3 | F193: 女 | G193: =INT(RC[1]/10)*10 -> 50 | H193: 52 | I193: 福信集团 | J193: 福建 | K193: 厦门 | L193: 房地产、多元金融
A194: 193 | B194: 2014 | C194: 189 | D194: 刘明辉 | E194: 67.3 | F194: 男 | G194: =INT(RC[1]/10)*10 -> 50 | H194: 51 | I194: 中国燃气 | J194: 香港 | K194: 香港 | L194: 天然气
A195: 194 | B195: 2014 | C195: 189 | D195: 欧宗洪 | E195: 67.3 | F195: 男 | G195: =INT(RC[1]/10)*10 -> 40 | H195: 44 | I195: 融信集团 | J195: 福建 | K195: 福州 | L195: 房地产
A196: 195 | B196: 2014 | C196: 189 | D196: 沈南鹏 | E196: 67.3 | F196: 男 | G196: =INT(RC[1]/10)*10 -> 40 | H196: 45 | I196: 红杉资本 | J196: 上海 | K196: 上海 | L196: 多元金融
A197: 196 | B197: 2014 | C197: 189 | D197: 谢世煌 | E197: 67.3 | F197: 男 | G197: / | H197: / | I197: 阿里巴巴 | J197: 浙江 | K197: 杭州 | L197: 软件及互联网、多元金融
A198: 197 | B198: 2014 | C198: 189 | D198: 徐宇 | E198: 67.3 | F198: 男 | G198: / | H198: / | I198: 赫基国际集团 | J198: 广东 | K198: 广州 | L198: 耐用消费品与服装
A199: 198 | B199: 2014 | C199: 189 | D199: 闫希军家族 | E199: 67.3 | F199: 男 | G199: =INT(RC[1]/10)*10 -> 60 | H199: 61 | I199: 天士力 | J199: 天津 | K199: 天津 | L199: 制药与生物科技
A200: 199 | B200: 2014 | C200: 189 | D200: 杨铿夫妇 | E200: 67.3 | F200: 男 | G200: =INT(RC[1]/10)*10 -> 50 | H200: 53 | I200: 四川蓝光 | J200: 四川 | K200: 成都 | L200: 房地产
A201: 200 | B201: 2014 | C201: 200 | D201: 王勇萍 | E201: 66.7 | F201: 男 | G201: =INT(RC[1]/10)*10 -> 40 | H201: 43 | I201: 信威集团 | J201: 山东 | K201: 青州 | L201: 电脑与通讯设备
A202: 201 | B202: 2014 | C202: 201 | D202: 刘革新 | E202: 66.099999999999994 | F202: 男 | G202: =INT(RC[1]/10)*10 -> 60 | H202: 63 | I202: 科伦药业 | J202: 四川 | K202: 成都 | L202: 制药与生物科技
A203: 202 | B203: 2014 | C203: 201 | D203: 涂建华 | E203: 66.099999999999994 | F203: 男 | G203: =INT(RC[1]/10)*10 -> 50 | H203: 51 | I203: 隆鑫控股 | J203: 重庆 | K203: 重庆 | L203: 房地产、汽车与汽车零部件、多元金融
A204: 203 | B204: 2014 | C204: 203 | D204: 安康 | E204: 65.5 | F204: 男 | G204: =INT(RC[1]/10)*10 -> 60 | H204: 65 | I204: 华兰生物 | J204: 河南 | K204: 新乡 | L204: 制药与生物科技
A205: 204 | B205: 2014 | C205: 203 | D205: 袁富根家族 | E205: 65.5 | F205: 男 | G205: =INT(RC[1]/10)*10 -> 60 | H205: 63 | I205: 苏州东山精密 | J205: 江苏 | K205: 苏州 | L205: 工业设备
A206: 205 | B206: 2014 | C206: 205 | D206: 楚金甫 | E206: 64.3 | F206: 男 | G206: =INT(RC[1]/10)*10 -> 50 | H206: 57 | I206: 森源电气 | J206: 河南 | K206: 长葛 | L206: 电子电器设备
A207: 206 | B207: 2014 | C207: 205 | D207: 黄炳文家族 | E207: 64.3 | F207: 男 | G207: =INT(RC[1]/10)*10 -> 60 | H207: 60 | I207: 东风股份 | J207: 广东 | K207: 汕头 | L207: 印刷业
A208: 207 | B208: 2014 | C208: 205 | D208: 黄绍武 | E208: 64.3 | F208: 男 | G208: =INT(RC[1]/10)*10 -> 40 | H208: 43 | I208: 爱施德 | J208: 广东 | K208: 深圳 | L208: 电脑与通讯设备
A209: 208 | B209: 2014 | C209: 205 | D209: 李登海 | E209: 64.3 | F209: 男 | G209: =INT(RC[1]/10)*10 -> 60 | H209: 65 | I209: 登海种业 | J209: 山东 | K209: 莱州 | L209: 农林牧渔
A210: 209 | B210: 2014 | C210: 205 | D210: 王剑峰家族 | E210: 64.3 | F210: 男 | G210: =INT(RC[1]/10)*10 -> 40 | H210: 44 | I210: 均胜电子 | J210: 浙江 | K210: 宁波 | L210: 汽车与汽车零部件
A211: 210 | B211: 2014 | C211: 210 | D211: 洪晓波 | E211: 63.6 | F211: 男 | G211: =INT(RC[1]/10)*10 -> 40 | H211: 42 | I211: 唯品会 | J211: 广东 | K211: 广州 | L211: 软件及互联网
A212: 211 | B212: 2014 | C212: 211 | D212: 林天福 | E212: 63 | F212: 男 | G212: =INT(RC[1]/10)*10 -> 50 | H212: 52 | I212: 贵人鸟 | J212: 香港 | K212: 香港 | L212: 耐用消费品与服装
A213: 212 | B213: 2014 | C213: 211 | D213: 其实家族 | E213: 63 | F213: 男 | G213: =INT(RC[1]/10)*10 -> 40 | H213: 44 | I213: 东方财富 | J213: 上海 | K213: 上海 | L213: 软件与服务
A214: 213 | B214: 2014 | C214: 211 | D214: 王坤晓 | E214: 63 | F214: 男 | G214: =INT(RC[1]/10)*10 -> 40 | H214: 45 | I214: 杰瑞股份 | J214: 山东 | K214: 烟台 | L214: 工业设备
A215: 214 | B215: 2014 | C215: 211 | D215: 张邦鑫 | E215: 63 | F215: 男 | G215: =INT(RC[1]/10)*10 -> 30 | H215: 34 | I215: 好未来 | J215: 北京 | K215: 北京 | L215: 教育
A216: 215 | B216: 2014 | C216: 211 | D216: 张中能夫妇 | E216: 63 | F216: 男 | G216: =INT(RC[1]/10)*10 -> 50 | H216: 51 | I216: 东阳光实业 | J216: 广东 | K216: 深圳 | L216: 原材料、制药与生物科技、酒店
A217: 216 | B217: 2014 | C217: 216 | D217: 陆永华夫妇 | E217: 62.4 | F217: 男 | G217: =INT(RC[1]/10)*10 -> 50 | H217: 51 | I217: 林洋电子 | J217: 上海 | K217: 上海 | L217: 电子电器设备
A218: 217 | B218: 2014 | C218: 216 | D218: 张茵 | E218: 62.4 | F218: 女 | G218: =INT(RC[1]/10)*10 -> 50 | H218: 57 | I218: 玖龙纸业 | J218: 广东 | K218: 东莞 | L218: 造纸
A219: 218 | B219: 2014 | C219: 218 | D219: 刘沧龙 | E219: 61.8 | F219: 男 | G219: =INT(RC[1]/10)*10 -> 50 | H219: 59 | I219: 四川宏达集团 | J219: 四川 | K219: 成都 | L219: 原材料、石油化工、房地产、多元金融
A220: 219 | B220: 2014 | C220: 218 | D220: 阮加根家族（过世） | E220: 61.8 | F220: 男 | G220: =INT(RC[1]/10)*10 -> 50 | H220: 54 | I220: 浙江闰土 | J220: 浙江 | K220: 上虞 | L220: 石油化工
A221: 220 | B221: 2014 | C221: 220 | D221: 代德明 | E221: 61.2 | F221: 男 | G221: / | H221: / | I221: 恒信德龙 | J221: 湖北 | K221: 武汉 | L221: 零售
A222: 221 | B222: 2014 | C222: 220 | D222: 范朝霞夫妇 | E222: 61.2 | F222: 女 | G222: =INT(RC[1]/10)*10 -> 40 | H222: 47 | I222: 京运通 | J222: 北京 | K222: 北京 | L222: 环保与新能源
A223: 222 | B223: 2014 | C223: 220 | D223: 何志平夫妇 | E223: 61.2 | F223: 男 | G223: =INT(RC[1]/10)*10 -> 50 | H223: 50 | I223: 上海莱士 | J223: 广东 | K223: 深圳 | L223: 制药与生物科技
A224: 223 | B224: 2014 | C224: 220 | D224: 胡柏藩 | E224: 61.2 | F224: 男 | G224: =INT(RC[1]/10)*10 -> 50 | H224: 52 | I224: 新和成控股集团 | J224: 浙江 | K224: 绍兴 | L224: 制药与生物科技
A225: 224 | B225: 2014 | C225: 220 | D225: 李华 | E225: 61.2 | F225: 男 | G225: =INT(RC[1]/10)*10 -> 40 | H225: 48 | I225: 卓越集团 | J225: 广东 | K225: 深圳 | L225: 房地产
A226: 225 | B226: 2014 | C226: 220 | D226: 李新炎夫妇 | E226: 61.2 | F226: 男 | G226: =INT(RC[1]/10)*10 -> 60 | H226: 64 | I226: 中国龙工集团 | J226: 上海 | K226: 上海 | L226: 工业设备
A227: 226 | B227: 2014 | C227: 220 | D227: 李振江 | E227: 61.2 | F227: 男 | G227: =INT(RC[1]/10)*10 -> 50 | H227: 58 | I227: 神威药业 | J227: 河北 | K227: 石家庄 | L227: 制药与生物科技
A228: 227 | B228: 2014 | C228: 220 | D228: 梁昭贤 | E228: 61.2 | F228: 男 | G228: =INT(RC[1]/10)*10 -> 40 | H228: 49 | I228: 格兰仕 | J228: 广东 | K228: 佛山 | L228: 耐用消费品与服装
A229: 228 | B229: 2014 | C229: 220 | D229: 刘益谦 | E229: 61.2 | F229: 男 | G229: =INT(RC[1]/10)*10 -> 50 | H229: 50 | I229: 新理益集团 | J229: 上海 | K229: 上海 | L229: 多元金融
A230: 229 | B230: 2014 | C230: 220 | D230: 刘振国 | E230: 61.2 | F230: 男 | G230: =INT(RC[1]/10)*10 -> 40 | H230: 49 | I230: 碧水源 | J230: 北京 | K230: 北京 | L230: 环保与新能源
A231: 230 | B231: 2014 | C231: 220 | D231: 孙平范 | E231: 61.2 | F231: 男 | G231: =INT(RC[1]/10)*10 -> 40 | H231: 45 | I231: 慈星股份 | J231: 浙江 | K231: 宁波 | L231: 工业设备
A232: 231 | B232: 2014 | C232: 220 | D232: 王木清 | E232: 61.2 | F232: 男 | G232: =INT(RC[1]/10)*10 -> 60 | H232: 63 | I232: 正通汽车 | J232: 上海 | K232: 上海 | L232: 零售
A233: 232 | B233: 2014 | C233: 220 | D233: 王庆辉 | E233: 61.2 | F233: 男 | G233: =INT(RC[1]/10)*10 -> 40 | H233: 45 | I233: 信威集团 | J233: 海南 | K233: 海口 | L233: 电脑与通讯设备
A234: 233 | B234: 2014 | C234: 220 | D234: 王勇家族 | E234: 61.2 | F234: 男 | G234: =INT(RC[1]/10)*10 -> 60 | H234: 64 | I234: 西王集团 | J234: 山东 | K234: 滨州 | L234: 食品饮料、原材料、房地产、制药与生物科技
A235: 234 | B235: 2014 | C235: 220 | D235: 夏佐全 | E235: 61.2 | F235: 男 | G235: =INT(RC[1]/10)*10 -> 50 | H235: 52 | I235: 比亚迪 | J235: 广东 | K235: 深圳 | L235: 汽车与汽车零部件、新能源
A236: 235 | B236: 2014 | C236: 220 | D236: 姚巨货家族 | E236: 61.2 | F236: 男 | G236: =INT(RC[1]/10)*10 -> 80 | H236: 83 | I236: 美锦集团 | J236: 山西 | K236: 太原 | L236: 原材料、房地产
A237: 236 | B237: 2014 | C237: 220 | D237: 俞敏洪 | E237: 61.2 | F237: 男 | G237: =INT(RC[1]/10)*10 -> 50 | H237: 52 | I237: 新东方教育 | J237: 北京 | K237: 北京 | L237: 教育
A238: 237 | B238: 2014 | C238: 220 | D238: 虞阿五父子 | E238: 61.2 | F238: 男 | G238: =INT(RC[1]/10)*10 -> 70 | H238: 73 | I238: 日月首饰 | J238: 浙江 | K238: 绍兴 | L238: 耐用消费品与服装、房地产、多元金融
A239: 238 | B239: 2014 | C239: 220 | D239: 袁亚非 | E239: 61.2 | F239: 男 | G239: =INT(RC[1]/10)*10 -> 50 | H239: 50 | I239: 三胞集团 | J239: 江苏 | K239: 南京 | L239: 房地产、零售、文化娱乐
A240: 239 | B240: 2014 | C240: 220 | D240: 张磊 | E240: 61.2 | F240: 男 | G240: / | H240: / | I240: 高瓴资本 | L240: 多元金融
A241: 240 | B241: 2014 | C241: 220 | D241: 张长虹 | E241: 61.2 | F241: 男 | G241: =INT(RC[1]/10)*10 -> 50 | H241: 56 | I241: 大智慧 | J241: 上海 | K241: 上海 | L241: 软件与服务
A242: 241 | B242: 2014 | C242: 220 | D242: 郑跃文 | E242: 61.2 | F242: 男 | G242: =INT(RC[1]/10)*10 -> 50 | H242: 52 | I242: 科瑞集团 | J242: 北京 | K242: 北京 | L242: 制药与生物科技、多元金融
A243: 242 | B243: 2014 | C243: 220 | D243: 周泽荣 | E243: 61.2 | F243: 男 | G243: =INT(RC[1]/10)*10 -> 60 | H243: 60 | I243: 侨鑫集团 | J243: 广东 | K243: 广州 | L243: 房地产、餐饮与休闲、媒体
A244: 243 | B244: 2014 | C244: 243 | D244: 王文良 | E244: 60 | F244: 男 | G244: =INT(RC[1]/10)*10 -> 50 | H244: 59 | I244: 日林实业集团 | J244: 辽宁 | K244: 丹东 | L244: 造纸、建筑与工程
A245: 244 | B245: 2014 | C245: 244 | D245: 陈泽民家族 | E245: 59.4 | F245: 男 | G245: =INT(RC[1]/10)*10 -> 70 | H245: 71 | I245: 三全食品 | J245: 河南 | K245: 郑州 | L245: 食品饮料、餐饮与休闲
A246: 245 | B246: 2014 | C246: 244 | D246: 孟庆南家族 | E246: 59.4 | F246: 男 | G246: =INT(RC[1]/10)*10 -> 50 | H246: 56 | I246: 武汉凡谷 | J246: 湖北 | K246: 武汉 | L246: 电脑与通讯设备、电子电器设备
A247: 246 | B247: 2014 | C247: 244 | D247: 缪汉根家族 | E247: 59.4 | F247: 男 | G247: =INT(RC[1]/10)*10 -> 40 | H247: 49 | I247: 盛虹集团 | J247: 江苏 | K247: 苏州 | L247: 原材料、能源、房地产
A248: 247 | B248: 2014 | C248: 244 | D248: 姚新义 | E248: 59.4 | F248: 男 | G248: =INT(RC[1]/10)*10 -> 40 | H248: 49 | I248: 盾安集团 | J248: 浙江 | K248: 杭州 | L248: 工业设备、房地产、能源
A249: 248 | B249: 2014 | C249: 248 | D249: 陆克平家族 | E249: 58.8 | F249: 男 | G249: =INT(RC[1]/10)*10 -> 70 | H249: 70 | I249: 江苏阳光集团 | J249: 江苏 | K249: 江阴 | L249: 纺织、环保与新能源
A250: 249 | B250: 2014 | C250: 248 | D250: 欧宗荣 | E250: 58.8 | F250: 男 | G250: =INT(RC[1]/10)*10 -> 50 | H250: 50 | I250: 正荣集团 | J250: 福建 | K250: 福州 | L250: 房地产
A251: 250 | B251: 2014 | C251: 248 | D251: 朱文臣 | E251: 58.8 | F251: 男 | G251: =INT(RC[1]/10)*10 -> 40 | H251: 48 | I251: 辅仁药业集团 | J251: 河南 | K251: 郑州 | L251: 制药与生物科技、食品饮料
A252: 251 | B252: 2014 | C252: 251 | D252: 黄毅 | E252: 58.1 | F252: 男 | G252: =INT(RC[1]/10)*10 -> 50 | H252: 52 | I252: 中升集团 | J252: 辽宁 | K252: 大连 | L252: 零售
A253: 252 | B253: 2014 | C253: 251 | D253: 蒋卫平夫妇 | E253: 58.1 | F253: 男 | G253: =INT(RC[1]/10)*10 -> 50 | H253: 59 | I253: 天齐锂业 | J253: 四川 | K253: 成都 | L253: 石油化工
A254: 253 | B254: 2014 | C254: 251 | D254: 吕大龙 | E254: 58.1 | F254: 男 | G254: =INT(RC[1]/10)*10 -> 50 | H254: 52 | I254: 信威集团 | J254: 北京 | K254: 北京 | L254: 电脑与通讯设备
A255: 254 | B255: 2014 | C255: 251 | D255: 王超斌 | E255: 58.1 | F255: 男 | G255: =INT(RC[1]/10)*10 -> 50 | H255: 58 | I255: 中陆物流 | J255: 河南 | K255: 郑州 | L255: 房地产、物流
A256: 255 | B256: 2014 | C256: 251 | D256: 徐其明 | E256: 58.1 | F256: 男 | G256: =INT(RC[1]/10)*10 -> 50 | H256: 51 | I256: 徐龙集团 | J256: 浙江 | K256: 宁波 | L256: 农林牧渔
A257: 256 | B257: 2014 | C257: 256 | D257: 吴良定家族 | E257: 57.5 | F257: 男 | G257: =INT(RC[1]/10)*10 -> 60 | H257: 68 | I257: 万丰奥威 | J257: 上海 | K257: 上海 | L257: 汽车与汽车零部件、工业设备
A258: 257 | B258: 2014 | C258: 256 | D258: 郑效东 | E258: 57.5 | F258: 男 | G258: =INT(RC[1]/10)*10 -> 50 | H258: 50 | I258: 东富龙 | J258: 上海 | K258: 上海 | L258: 医疗保健设备与服务
A259: 258 | B259: 2014 | C259: 258 | D259: 陈荣家族 | E259: 56.9 | F259: 男 | G259: =INT(RC[1]/10)*10 -> 50 | H259: 56 | I259: 中路集团 | J259: 上海 | K259: 上海 | L259: 多元金融、文化娱乐
A260: 259 | B260: 2014 | C260: 258 | D260: 杜江涛夫妇 | E260: 56.9 | F260: 男 | G260: =INT(RC[1]/10)*10 -> 40 | H260: 44 | I260: 内蒙君正、博晖创新 | J260: 北京 | K260: 北京 | L260: 石油化工、医疗保健设备与服务
A261: 260 | B261: 2014 | C261: 258 | D261: 万连步 | E261: 56.9 | F261: 男 | G261: =INT(RC[1]/10)*10 -> 40 | H261: 49 | I261: 金正大 | J261: 山东 | K261: 临沂 | L261: 石油化工
A262: 261 | B262: 2014 | C262: 258 | D262: 张克强 | E262: 56.9 | F262: 男 | G262: =INT(RC[1]/10)*10 -> 50 | H262: 54 | I262: 广东华美国际投资集团 | J262: 广东 | K262: 广州 | L262: 教育、多元金融
A263: 262 | B263: 2014 | C263: 258 | D263: 周国辉 | E263: 56.9 | F263: 男 | G263: =INT(RC[1]/10)*10 -> 40 | H263: 49 | I263: 怡亚通 | J263: 广东 | K263: 深圳 | L263: 物流
A264: 263 | B264: 2014 | C264: 263 | D264: 高天国 | E264: 56.3 | F264: 男 | G264: =INT(RC[1]/10)*10 -> 60 | H264: 63 | I264: 安信信托 | J264: 上海 | K264: 上海 | L264: 房地产、多元金融
A265: 264 | B265: 2014 | C265: 263 | D265: 刘满世家族 | E265: 56.3 | F265: 男 | G265: =INT(RC[1]/10)*10 -> 60 | H265: 65 | I265: 内蒙古满世煤炭集团 | J265: 内蒙古 | K265: 鄂尔多斯 | L265: 原材料、石油化工、房地产、多元金融
A266: 265 | B266: 2014 | C266: 263 | D266: 杨卫东家族 | E266: 56.3 | F266: 男 | G266: =INT(RC[1]/10)*10 -> 40 | H266: 46 | I266: 浙江卫星石化 | J266: 浙江 | K266: 嘉兴 | L266: 制药与生物科技
A267: 266 | B267: 2014 | C267: 263 | D267: 姚新泉 | E267: 56.3 | F267: 男 | G267: =INT(RC[1]/10)*10 -> 40 | H267: 47 | I267: 盾安集团 | J267: 浙江 | K267: 杭州 | L267: 工业设备、房地产、能源
A268: 267 | B268: 2014 | C268: 263 | D268: 尤小平父子 | E268: 56.3 | F268: 男 | G268: =INT(RC[1]/10)*10 -> 50 | H268: 56 | I268: 华峰集团 | J268: 浙江 | K268: 温州 | L268: 石油化工
A269: 268 | B269: 2014 | C269: 268 | D269: 卜扬 | E269: 55.7 | F269: 女 | G269: / | H269: / | I269: 苏宁云商 | J269: 浙江 | K269: 南京 | L269: 零售、软件及互联网
A270: 269 | B270: 2014 | C270: 268 | D270: 陈建成家族 | E270: 55.7 | F270: 男 | G270: =INT(RC[1]/10)*10 -> 50 | H270: 55 | I270: 卧龙电气集团 | J270: 浙江 | K270: 上虞 | L270: 电子电器设备、房地产
A271: 270 | B271: 2014 | C271: 268 | D271: 梁社增家族 | E271: 55.7 | F271: 男 | G271: =INT(RC[1]/10)*10 -> 80 | H271: 82 | I271: 世荣兆业 | J271: 广东 | K271: 珠海 | L271: 房地产
A272: 271 | B272: 2014 | C272: 268 | D272: 王忠军 | E272: 55.7 | F272: 男 | G272: =INT(RC[1]/10)*10 -> 50 | H272: 54 | I272: 华谊兄弟 | J272: 北京 | K272: 北京 | L272: 文化娱乐
A273: 272 | B273: 2014 | C273: 272 | D273: 管建忠 | E273: 55.1 | F273: 男 | G273: =INT(RC[1]/10)*10 -> 40 | H273: 46 | I273: 嘉化集团 | J273: 浙江 | K273: 杭州 | L273: 石油化工
A274: 273 | B274: 2014 | C274: 272 | D274: 黄其森 | E274: 55.1 | F274: 男 | G274: =INT(RC[1]/10)*10 -> 40 | H274: 49 | I274: 泰禾集团 | J274: 福建 | K274: 福州 | L274: 房地产、多元金融
A275: 274 | B275: 2014 | C275: 272 | D275: 黄巧灵 | E275: 55.1 | F275: 男 | G275: =INT(RC[1]/10)*10 -> 50 | H275: 55 | I275: 宋城集团 | J275: 浙江 | K275: 杭州 | L275: 旅游
A276: 275 | B276: 2014 | C276: 272 | D276: 黄泽兰夫妇 | E276: 55.1 | F276: 男 | G276: =INT(RC[1]/10)*10 -> 50 | H276: 59 | I276: 章源钨业 | J276: 江西 | K276: 赣州 | L276: 原材料
A277: 276 | B277: 2014 | C277: 272 | D277: 李东军 | E277: 55.1 | F277: 男 | G277: / | H277: / | I277: 锦联控股集团 | J277: 辽宁 | K277: 大连 | L277: 物流
A278: 277 | B278: 2014 | C278: 272 | D278: 罗韶宇夫妇 | E278: 55.1 | F278: 男 | G278: =INT(RC[1]/10)*10 -> 40 | H278: 44 | I278: 重庆东银集团 | J278: 重庆 | K278: 重庆 | L278: 房地产、汽车与汽车零部件、能源
A279: 278 | B279: 2014 | C279: 272 | D279: 戚金兴父子 | E279: 55.1 | F279: 男 | G279: =INT(RC[1]/10)*10 -> 50 | H279: 52 | I279: 滨江集团 | J279: 浙江 | K279: 杭州 | L279: 房地产
A280: 279 | B280: 2014 | C280: 272 | D280: 苏增福父子 | E280: 55.1 | F280: 男 | G280: =INT(RC[1]/10)*10 -> 70 | H280: 73 | I280: 苏泊尔集团 | J280: 浙江 | K280: 杭州 | L280: 制造业
A281: 280 | B281: 2014 | C281: 272 | D281: 万隆 | E281: 55.1 | F281: 男 | G281: =INT(RC[1]/10)*10 -> 70 | H281: 74 | I281: 万洲国际 | J281: 河南 | K281: 漯河 | L281: 食品
A282: 281 | B282: 2014 | C282: 272 | D282: 汪立平家族 | E282: 55.1 | F282: 男 | G282: =INT(RC[1]/10)*10 -> 40 | H282: 48 | I282: 恒立油缸 | J282: 江苏 | K282: 常州 | L282: 工业设备
A283: 282 | B283: 2014 | C283: 272 | D283: 吴征 | E283: 55.1 | F283: 男 | G283: =INT(RC[1]/10)*10 -> 40 | H283: 48 | I283: 阳光媒体集团 | J283: 北京 | K283: 北京 | L283: 媒体、娱乐文化
A284: 283 | B284: 2014 | C284: 272 | D284: 俞培俤家族 | E284: 55.1 | F284: 男 | G284: =INT(RC[1]/10)*10 -> 50 | H284: 54 | I284: 大名城 | J284: 福建 | K284: 福州 | L284: 房地产
A285: 284 | B285: 2014 | C285: 272 | D285: 张峻 | E285: 55.1 | F285: 男 | G285: =INT(RC[1]/10)*10 -> 50 | H285: 51 | I285: 生命人寿 | J285: 广东 | K285: 深圳 | L285: 保险
A286: 285 | B286: 2014 | C286: 272 | D286: 郑元豹 | E286: 55.1 | F286: 男 | G286: =INT(RC[1]/10)*10 -> 50 | H286: 56 | I286: 人民电器集团 | J286: 浙江 | K286: 温州 | L286: 工业设备
A287: 286 | B287: 2014 | C287: 286 | D287: 刘晓东 | E287: 54.5 | F287: 男 | G287: =INT(RC[1]/10)*10 -> 40 | H287: 47 | I287: 百润股份 | J287: 上海 | K287: 上海 | L287: 石油化工
A288: 287 | B288: 2014 | C288: 287 | D288: 李永魁 | E288: 53.9 | F288: 男 | G288: / | H288: / | I288: 喜之郎 | J288: 广东 | K288: 深圳 | L288: 食品
A289: 288 | B289: 2014 | C289: 287 | D289: 李永良 | E289: 53.9 | F289: 男 | G289: / | H289: / | I289: 喜之郎 | J289: 广东 | K289: 深圳 | L289: 食品
A290: 289 | B290: 2014 | C290: 289 | D290: 崔志祥 | E290: 53.2 | F290: 男 | G290: =INT(RC[1]/10)*10 -> 50 | H290: 51 | I290: 东营方圆有色金属 | J290: 山东 | K290: 东营 | L290: 制造业
A291: 290 | B291: 2014 | C291: 289 | D291: 贺正刚 | E291: 53.2 | F291: 男 | G291: =INT(RC[1]/10)*10 -> 60 | H291: 60 | I291: 和邦股份 | J291: 四川 | K291: 乐山 | L291: 石油化工
A292: 291 | B292: 2014 | C292: 289 | D292: 王文彪 | E292: 53.2 | F292: 男 | G292: =INT(RC[1]/10)*10 -> 50 | H292: 57 | I292: 亿利资源集团 | J292: 北京 | K292: 北京 | L292: 能源、环保与新能源
A293: 292 | B293: 2014 | C293: 289 | D293: 杨全玉 | E293: 53.2 | F293: 女 | G293: =INT(RC[1]/10)*10 -> 60 | H293: 66 | I293: 信威集团 | J293: 上海 | K293: 上海 | L293: 电脑与通讯设备
A294: 293 | B294: 2014 | C294: 289 | D294: 周晓光夫妇 | E294: 53.2 | F294: 女 | G294: =INT(RC[1]/10)*10 -> 50 | H294: 52 | I294: 新光控股集团 | J294: 浙江 | K294: 义乌 | L294: 耐用消费品与服装、多元金融、贸易、房地产
A295: 294 | B295: 2014 | C295: 289 | D295: 周耀庭家族 | E295: 53.2 | F295: 男 | G295: =INT(RC[1]/10)*10 -> 70 | H295: 71 | I295: 红豆集团 | J295: 江苏 | K295: 无锡 | L295: 房地产、耐用消费品与服装
A296: 295 | B296: 2014 | C296: 289 | D296: 邹节明家族 | E296: 53.2 | F296: 男 | G296: =INT(RC[1]/10)*10 -> 70 | H296: 71 | I296: 桂林三金 | J296: 广西 | K296: 桂林 | L296: 制药与生物科技
A297: 296 | B297: 2014 | C297: 296 | D297: 姚文琛家族 | E297: 52.6 | F297: 男 | G297: =INT(RC[1]/10)*10 -> 60 | H297: 63 | I297: 姚记扑克 | J297: 上海 | K297: 上海 | L297: 耐用消费品与服装
A298: 297 | B298: 2014 | C298: 297 | D298: 陈学利 | E298: 52 | F298: 男 | G298: =INT(RC[1]/10)*10 -> 60 | H298: 63 | I298: 威高集团 | J298: 山东 | K298: 威海 | L298: 医疗保健设备与服务、制药与生物科技、房地产、多元金融
A299: 298 | B299: 2014 | C299: 297 | D299: 江南春 | E299: 52 | F299: 男 | G299: =INT(RC[1]/10)*10 -> 40 | H299: 41 | I299: 分众传媒 | J299: 上海 | K299: 上海 | L299: 媒体
A300: 299 | B300: 2014 | C300: 297 | D300: 刘绍喜父子 | E300: 52 | F300: 男 | G300: =INT(RC[1]/10)*10 -> 50 | H300: 50 | I300: 宜华企业集团 | J300: 广东 | K300: 汕头 | L300: 农林牧渔、房地产、多元金融
A301: 300 | B301: 2014 | C301: 297 | D301: 牛宜顺家族 | E301: 52 | F301: 男 | G301: =INT(RC[1]/10)*10 -> 50 | H301: 59 | I301: 华勤橡胶工业集团 | J301: 山东 | K301: 兖州 | L301: 制造业
A302: 301 | B302: 2014 | C302: 297 | D302: 荣智健 | E302: 52 | F302: 男 | G302: =INT(RC[1]/10)*10 -> 70 | H302: 72 | I302: 中信泰富 | J302: 香港 | K302: 香港 | L302: 多元金融
A303: 302 | B303: 2014 | C303: 297 | D303: 张志祥 | E303: 52 | F303: 男 | G303: =INT(RC[1]/10)*10 -> 40 | H303: 47 | I303: 北京建龙重工集团 | J303: 北京 | K303: 北京 | L303: 原材料、制造业
A304: 303 | B304: 2014 | C304: 303 | D304: 陈奇星 | E304: 51.4 | F304: 男 | G304: =INT(RC[1]/10)*10 -> 50 | H304: 54 | I304: 长盈精密 | J304: 广东 | K304: 深圳 | L304: 电脑与通讯设备、电子电器设备
A305: 304 | B305: 2014 | C305: 304 | D305: 李新洲 | E305: 50.8 | F305: 男 | G305: =INT(RC[1]/10)*10 -> 50 | H305: 52 | I305: 先锋医药 | J305: 上海 | K305: 上海 | L305: 制药与生物科技
A306: 305 | B306: 2014 | C306: 304 | D306: 李银会 | E306: 50.8 | F306: 男 | G306: =INT(RC[1]/10)*10 -> 40 | H306: 48 | I306: 青青稞酒 | J306: 青海 | K306: 西宁 | L306: 食品饮料
A307: 306 | B307: 2014 | C307: 306 | D307: 车建新 | E307: 50.2 | F307: 男 | G307: =INT(RC[1]/10)*10 -> 40 | H307: 48 | I307: 红星美凯龙 | J307: 上海 | K307: 上海 | L307: 房地产、零售
A308: 307 | B308: 2014 | C308: 306 | D308: 程雪 | E308: 50.2 | F308: 女 | G308: =INT(RC[1]/10)*10 -> 40 | H308: 44 | I308: 海天味业 | J308: 广东 | K308: 佛山 | L308: 食品饮料
A309: 308 | B309: 2014 | C309: 306 | D309: 黄茂如夫妇 | E309: 50.2 | F309: 男 | G309: =INT(RC[1]/10)*10 -> 40 | H309: 49 | I309: 茂业集团 | J309: 广东 | K309: 深圳 | L309: 房地产、零售
A310: 309 | B310: 2014 | C310: 306 | D310: 蒋业华 | E310: 50.2 | F310: 男 | G310: =INT(RC[1]/10)*10 -> 50 | H310: 51 | I310: 重庆华宇集团 | J310: 重庆 | K310: 重庆 | L310: 房地产
A311: 310 | B311: 2014 | C311: 306 | D311: 林中 | E311: 50.2 | F311: 男 | G311: =INT(RC[1]/10)*10 -> 40 | H311: 46 | I311: 旭辉集团 | J311: 上海 | K311: 上海 | L311: 房地产
A312: 311 | B312: 2014 | C312: 306 | D312: 王秀娥家族 | E312: 50.2 | F312: 女 | G312: =INT(RC[1]/10)*10 -> 40 | H312: 45 | I312: 广西霖峰房地产 | J312: 广东 | K312: 深圳 | L312: 房地产、保险
A313: 312 | B313: 2014 | C313: 306 | D313: 杨志茂家族 | E313: 50.2 | F313: 男 | G313: =INT(RC[1]/10)*10 -> 50 | H313: 51 | I313: 锦龙股份 | J313: 广东 | K313: 东莞 | L313: 多元金融、房地产
A314: 313 | B314: 2014 | C314: 313 | D314: 陈金凤 | E314: 49.6 | F314: 女 | G314: =INT(RC[1]/10)*10 -> 50 | H314: 51 | I314: 苏宁云商集团 | J314: 江苏 | K314: 南京 | L314: 软件及互联网、零售
A315: 314 | B315: 2014 | C315: 313 | D315: 牟金香 | E315: 49.6 | F315: 女 | G315: =INT(RC[1]/10)*10 -> 60 | H315: 60 | I315: 联化科技 | J315: 浙江 | K315: 台州 | L315: 石油化工
A316: 315 | B316: 2014 | C316: 313 | D316: 肖文阁 | E316: 49.6 | F316: 男 | G316: / | H316: / | I316: 印纪影视娱乐传媒 | J316: 北京 | K316: 北京 | L316: 文化娱乐
A317: 316 | B317: 2014 | C317: 316 | D317: 敖小强 | E317: 49 | F317: 男 | G317: =INT(RC[1]/10)*10 -> 50 | H317: 50 | I317: 雪迪龙 | J317: 北京 | K317: 北京 | L317: 制造业
A318: 317 | B318: 2014 | C318: 316 | D318: 范秀莲 | E318: 49 | F318: 女 | G318: =INT(RC[1]/10)*10 -> 50 | H318: 50 | I318: 西藏海思科药业 | J318: 辽宁 | K318: 沈阳 | L318: 制药与生物科技
A319: 318 | B319: 2014 | C319: 316 | D319: 韩国龙家族 | E319: 49 | F319: 男 | G319: =INT(RC[1]/10)*10 -> 50 | H319: 59 | I319: 香港冠城集团 | J319: 香港 | K319: 香港 | L319: 房地产、文化娱乐
A320: 319 | B320: 2014 | C320: 316 | D320: 黄怒波 | E320: 49 | F320: 男 | G320: =INT(RC[1]/10)*10 -> 50 | H320: 58 | I320: 中坤集团 | J320: 北京 | K320: 北京 | L320: 房地产、旅游
A321: 320 | B321: 2014 | C321: 316 | D321: 李喜朋夫妇 | E321: 49 | F321: 男 | G321: =INT(RC[1]/10)*10 -> 50 | H321: 50 | I321: 盛润控股 | J321: 河南 | K321: 郑州 | L321: 房地产、建筑与工程、能源
A322: 321 | B322: 2014 | C322: 316 | D322: 刘国本 | E322: 49 | F322: 男 | G322: =INT(RC[1]/10)*10 -> 70 | H322: 70 | I322: 骆驼集团 | J322: 湖北 | K322: 襄樊 | L322: 电子电器设备
A323: 322 | B323: 2014 | C323: 316 | D323: 刘贞峰 | E323: 49 | F323: 男 | G323: =INT(RC[1]/10)*10 -> 50 | H323: 53 | I323: 杰瑞股份 | J323: 山东 | K323: 烟台 | L323: 工业设备
A324: 323 | B324: 2014 | C324: 316 | D324: 王久芳 | E324: 49 | F324: 男 | G324: =INT(RC[1]/10)*10 -> 50 | H324: 50 | I324: 荣安地产 | J324: 浙江 | K324: 宁波 | L324: 房地产
A325: 324 | B325: 2014 | C325: 316 | D325: 王填夫妇 | E325: 49 | F325: 男 | G325: =INT(RC[1]/10)*10 -> 40 | H325: 46 | I325: 步步高商业连锁 | J325: 湖南 | K325: 湘潭 | L325: 零售
A326: 325 | B326: 2014 | C326: 316 | D326: 杨休 | E326: 49 | F326: 男 | G326: =INT(RC[1]/10)*10 -> 50 | H326: 53 | I326: 江苏天地集团 | J326: 江苏 | K326: 徐州 | L326: 房地产、文化娱乐
A327: 326 | B327: 2014 | C327: 316 | D327: 叶立培家族 | E327: 49 | F327: 男 | G327: =INT(RC[1]/10)*10 -> 70 | H327: 70 | I327: 仲盛集团 | J327: 上海 | K327: 上海 | L327: 房地产
A328: 327 | B328: 2014 | C328: 327 | D328: 陈清州夫妇 | E328: 48.3 | F328: 男 | G328: =INT(RC[1]/10)*10 -> 40 | H328: 48 | I328: 海能达通信 | J328: 广东 | K328: 深圳 | L328: 电脑与通讯设备、电子电器设备
A329: 328 | B329: 2014 | C329: 327 | D329: 方同华家族 | E329: 48.3 | F329: 男 | G329: =INT(RC[1]/10)*10 -> 50 | H329: 51 | I329: 黑龙江珍宝岛 | J329: 黑龙江 | K329: 虎林 | L329: 制药与生物科技
A330: 329 | B330: 2014 | C330: 327 | D330: 王海鹏 | E330: 48.3 | F330: 男 | G330: =INT(RC[1]/10)*10 -> 40 | H330: 43 | I330: 美盈森 | J330: 广东 | K330: 深圳 | L330: 造纸
A331: 330 | B331: 2014 | C331: 327 | D331: 谢宏夫妇 | E331: 48.3 | F331: 男 | G331: =INT(RC[1]/10)*10 -> 40 | H331: 49 | I331: 贝因美 | J331: 浙江 | K331: 杭州 | L331: 食品
A332: 331 | B332: 2014 | C332: 331 | D332: 傅军 | E332: 47.7 | F332: 男 | G332: =INT(RC[1]/10)*10 -> 50 | H332: 57 | I332: 新华联集团 | J332: 北京 | K332: 北京 | L332: 房地产、多元金融
A333: 332 | B333: 2014 | C333: 331 | D333: 唐健夫妇 | E333: 47.7 | F333: 男 | G333: =INT(RC[1]/10)*10 -> 50 | H333: 58 | I333: 捷顺科技 | J333: 广东 | K333: 深圳 | L333: 软件与服务
A334: 333 | B334: 2014 | C334: 331 | D334: 叶远西父子 | E334: 47.7 | F334: 男 | G334: =INT(RC[1]/10)*10 -> 50 | H334: 52 | I334: 广田股份 | J334: 广东 | K334: 深圳 | L334: 建筑与工程
A335: 334 | B335: 2014 | C335: 334 | D335: 蔡荣军 | E335: 47.1 | F335: 男 | G335: =INT(RC[1]/10)*10 -> 40 | H335: 41 | I335: 欧菲光科技 | J335: 广东 | K335: 深圳 | L335: 电子电器设备
A336: 335 | B336: 2014 | C336: 334 | D336: 林奇 | E336: 47.1 | F336: 男 | G336: =INT(RC[1]/10)*10 -> 30 | H336: 32 | I336: 游族网络 | J336: 上海 | K336: 上海 | L336: 软件与服务
A337: 336 | B337: 2014 | C337: 334 | D337: 徐湛滔 | E337: 47.1 | F337: 男 | G337: =INT(RC[1]/10)*10 -> 40 | H337: 48 | I337: 中滔环保 | J337: 广东 | K337: 广州 | L337: 建筑与工程
A338: 337 | B338: 2014 | C338: 334 | D338: 杨卓舒 | E338: 47.1 | F338: 男 | G338: =INT(RC[1]/10)*10 -> 60 | H338: 61 | I338: 卓达集团 | J338: 河北 | K338: 石家庄 | L338: 房地产
A339: 338 | B339: 2014 | C339: 334 | D339: 张道才家族 | E339: 47.1 | F339: 男 | G339: =INT(RC[1]/10)*10 -> 60 | H339: 64 | I339: 三花集团 | J339: 浙江 | K339: 绍兴 | L339: 房地产、汽车与汽车零部件
A340: 339 | B340: 2014 | C340: 334 | D340: 周锦明 | E340: 47.1 | F340: 男 | G340: =INT(RC[1]/10)*10 -> 40 | H340: 48 | I340: 潜能恒信 | J340: 北京 | K340: 北京 | L340: 工业设备
A341: 340 | B341: 2014 | C341: 334 | D341: 周云杰 | E341: 47.1 | F341: 男 | G341: =INT(RC[1]/10)*10 -> 50 | H341: 53 | I341: 奥瑞金包装集团 | J341: 北京 | K341: 北京 | L341: 包装
A342: 341 | B342: 2014 | C342: 334 | D342: 朱保国家族 | E342: 47.1 | F342: 男 | G342: =INT(RC[1]/10)*10 -> 50 | H342: 52 | I342: 健康元药业 | J342: 广东 | K342: 深圳 | L342: 制药与生物科技
A343: 342 | B343: 2014 | C343: 342 | D343: 陈劲松夫妇 | E343: 46.5 | F343: 男 | G343: =INT(RC[1]/10)*10 -> 50 | H343: 50 | I343: 世联行 | J343: 广东 | K343: 深圳 | L343: 软件与服务
A344: 343 | B344: 2014 | C344: 342 | D344: 陈夏鑫夫妇 | E344: 46.5 | F344: 男 | G344: =INT(RC[1]/10)*10 -> 50 | H344: 52 | I344: 西子电梯集团 | J344: 浙江 | K344: 杭州 | L344: 工业设备、房地产、零售
A345: 344 | B345: 2014 | C345: 342 | D345: 何思模 | E345: 46.5 | F345: 男 | G345: =INT(RC[1]/10)*10 -> 40 | H345: 49 | I345: 易事特 | J345: 广东 | K345: 东莞 | L345: 电子电器设备
A346: 345 | B346: 2014 | C346: 342 | D346: 胡季强 | E346: 46.5 | F346: 男 | G346: =INT(RC[1]/10)*10 -> 50 | H346: 53 | I346: 康恩贝 | J346: 浙江 | K346: 杭州 | L346: 制药与生物科技
A347: 346 | B347: 2014 | C347: 342 | D347: 刘载望家族 | E347: 46.5 | F347: 男 | G347: =INT(RC[1]/10)*10 -> 40 | H347: 42 | I347: 江河幕墙 | J347: 北京 | K347: 北京 | L347: 建筑与工程
A348: 347 | B348: 2014 | C348: 342 | D348: 吴冠江 | E348: 46.5 | F348: 男 | G348: =INT(RC[1]/10)*10 -> 40 | H348: 45 | I348: 智飞生物 | J348: 重庆 | K348: 重庆 | L348: 制药与生物科技
A349: 348 | B349: 2014 | C349: 342 | D349: 夏鼎湖 | E349: 46.5 | F349: 男 | G349: =INT(RC[1]/10)*10 -> 70 | H349: 70 | I349: 安徽中鼎集团 | J349: 安徽 | K349: 宁国 | L349: 汽车与汽车零部件
A350: 349 | B350: 2014 | C350: 342 | D350: 徐明波 | E350: 46.5 | F350: 男 | G350: =INT(RC[1]/10)*10 -> 50 | H350: 50 | I350: 双鹭药业 | J350: 北京 | K350: 北京 | L350: 制药与生物科技
A351: 350 | B351: 2014 | C351: 342 | D351: 徐子泉夫妇 | E351: 46.5 | F351: 男 | G351: =INT(RC[1]/10)*10 -> 50 | H351: 56 | I351: 捷成世纪科技 | J351: 北京 | K351: 北京 | L351: 软件与服务
A352: 351 | B352: 2014 | C352: 342 | D352: 张秀根家族 | E352: 46.5 | F352: 男 | G352: =INT(RC[1]/10)*10 -> 50 | H352: 53 | I352: 华泰汽车 | J352: 北京 | K352: 北京 | L352: 汽车与汽车零部件
A353: 352 | B353: 2014 | C353: 342 | D353: 周儒欣 | E353: 46.5 | F353: 男 | G353: =INT(RC[1]/10)*10 -> 50 | H353: 51 | I353: 北斗星通 | J353: 北京 | K353: 北京 | L353: 软件与服务
A354: 353 | B354: 2014 | C354: 353 | D354: 陈义红夫妇 | E354: 45.9 | F354: 男 | G354: =INT(RC[1]/10)*10 -> 50 | H354: 56 | I354: 中国动向 | J354: 北京 | K354: 北京 | L354: 耐用消费品与服务
A355: 354 | B355: 2014 | C355: 353 | D355: 高仕军家族 | E355: 45.9 | F355: 男 | G355: =INT(RC[1]/10)*10 -> 40 | H355: 47 | I355: 高力集团 | J355: 江苏 | K355: 南京 | L355: 房地产、零售
A356: 355 | B356: 2014 | C356: 353 | D356: 刘建民夫妇 | E356: 45.9 | F356: 男 | G356: =INT(RC[1]/10)*10 -> 60 | H356: 61 | I356: 甘肃建新实业集团 | J356: 甘肃 | K356: 兰州 | L356: 原材料
A357: 356 | B357: 2014 | C357: 353 | D357: 邵钦祥家族 | E357: 45.9 | F357: 男 | G357: =INT(RC[1]/10)*10 -> 60 | H357: 60 | I357: 花园集团 | J357: 浙江 | K357: 杭州 | L357: 制药与生物科技、建筑与工程、房地产
A358: 357 | B358: 2014 | C358: 353 | D358: 王佳 | E358: 45.9 | F358: 女 | G358: =INT(RC[1]/10)*10 -> 40 | H358: 45 | I358: 启明星辰 | J358: 北京 | K358: 北京 | L358: 软件与服务
A359: 358 | B359: 2014 | C359: 353 | D359: 王以廷 | E359: 45.9 | F359: 男 | G359: =INT(RC[1]/10)*10 -> 60 | H359: 64 | I359: 内蒙古太西煤集团 | J359: 内蒙古 | K359: 阿拉善 | L359: 原材料
A360: 359 | B360: 2014 | C360: 359 | D360: 胡成中 | E360: 45.3 | F360: 男 | G360: =INT(RC[1]/10)*10 -> 50 | H360: 53 | I360: 中国德力西集团 | J360: 浙江 | K360: 温州 | L360: 电子电器设备
A361: 360 | B361: 2014 | C361: 359 | D361: 刘正军 | E361: 45.3 | F361: 男 | G361: =INT(RC[1]/10)*10 -> 40 | H361: 46 | I361: 永清环保 | J361: 湖南 | K361: 长沙 | L361: 环保与新能源
A362: 361 | B362: 2014 | C362: 359 | D362: 齐向东 | E362: 45.3 | F362: 男 | G362: =INT(RC[1]/10)*10 -> 40 | H362: 44 | I362: 奇虎360 | J362: 北京 | K362: 北京 | L362: 软件与服务
A363: 362 | B363: 2014 | C363: 359 | D363: 王东辉家族 | E363: 45.3 | F363: 男 | G363: =INT(RC[1]/10)*10 -> 40 | H363: 48 | I363: 荣之联 | J363: 北京 | K363: 北京 | L363: 软件与服务
A364: 363 | B364: 2014 | C364: 359 | D364: 王伟 | E364: 45.3 | F364: 男 | G364: =INT(RC[1]/10)*10 -> 40 | H364: 43 | I364: 朗玛信息 | J364: 贵州 | K364: 贵阳 | L364: 软件与服务
A365: 364 | B365: 2014 | C365: 359 | D365: 徐锦鑫 | E365: 45.3 | F365: 男 | G365: =INT(RC[1]/10)*10 -> 50 | H365: 59 | I365: 置信电气 | J365: 上海 | K365: 上海 | L365: 电子电器设备
A366: 365 | B366: 2014 | C366: 359 | D366: 姚振华 | E366: 45.3 | F366: 男 | G366: =INT(RC[1]/10)*10 -> 40 | H366: 44 | I366: 宝能集团 | J366: 广东 | K366: 深圳 | L366: 房地产、零售
A367: 366 | B367: 2014 | C367: 359 | D367: 袁志敏家族 | E367: 45.3 | F367: 男 | G367: =INT(RC[1]/10)*10 -> 50 | H367: 53 | I367: 金发科技 | J367: 广东 | K367: 广州 | L367: 原材料、多元金融
A368: 367 | B368: 2014 | C368: 359 | D368: 张德生家族 | E368: 45.3 | F368: 男 | G368: =INT(RC[1]/10)*10 -> 60 | H368: 64 | I368: 浙江万马集团 | J368: 浙江 | K368: 杭州 | L368: 制药与生物科技
A369: 368 | B369: 2014 | C369: 368 | D369: 王伟林夫妇 | E369: 45 | F369: 男 | G369: =INT(RC[1]/10)*10 -> 50 | H369: 52 | I369: 华丽家族 | J369: 上海 | K369: 上海 | L369: 房地产
A370: 369 | B370: 2014 | C370: 369 | D370: 曹仁贤 | E370: 44.7 | F370: 男 | G370: =INT(RC[1]/10)*10 -> 40 | H370: 46 | I370: 阳光电源 | J370: 安徽 | K370: 合肥 | L370: 工业设备
A371: 370 | B371: 2014 | C371: 369 | D371: 曾浩夫妇 | E371: 44.7 | F371: 男 | G371: =INT(RC[1]/10)*10 -> 40 | H371: 43 | I371: 雷柏科技 | J371: 广东 | K371: 深圳 | L371: 电脑与通讯设备、电子电器设备
A372: 371 | B372: 2014 | C372: 369 | D372: 康宝华 | E372: 44.7 | F372: 男 | G372: =INT(RC[1]/10)*10 -> 60 | H372: 61 | I372: 远大中国控股、博林特 | J372: 辽宁 | K372: 沈阳 | L372: 建筑与工程、工业设备
A373: 372 | B373: 2014 | C373: 369 | D373: 李晓波 | E373: 44.7 | F373: 男 | G373: =INT(RC[1]/10)*10 -> 40 | H373: 46 | I373: 信威集团 | J373: 北京 | K373: 北京 | L373: 电脑与通讯设备
A374: 373 | B374: 2014 | C374: 369 | D374: 任建华 | E374: 44.7 | F374: 男 | G374: =INT(RC[1]/10)*10 -> 50 | H374: 58 | I374: 老板电器 | J374: 浙江 | K374: 杭州 | L374: 制造业
A375: 374 | B375: 2014 | C375: 369 | D375: 徐传化父子 | E375: 44.7 | F375: 男 | G375: =INT(RC[1]/10)*10 -> 70 | H375: 79 | I375: 传化集团 | J375: 浙江 | K375: 杭州 | L375: 石油化工、物流、农林牧渔、多元金融
A376: 375 | B376: 2014 | C376: 369 | D376: 杨绍鹏 | E376: 44.7 | F376: 男 | G376: =INT(RC[1]/10)*10 -> 50 | H376: 56 | I376: 海丰国际 | J376: 山东 | K376: 青岛 | L376: 制造业
A377: 376 | B377: 2014 | C377: 369 | D377: 朱庆伊 | E377: 44.7 | F377: 男 | G377: =INT(RC[1]/10)*10 -> 40 | H377: 45 | I377: 珠江投资 | J377: 广东 | K377: 广州 | L377: 房地产、建筑与工程、多元金融
A378: 377 | B378: 2014 | C378: 369 | D378: 左宗申家族 | E378: 44.7 | F378: 男 | G378: =INT(RC[1]/10)*10 -> 60 | H378: 62 | I378: 宗申产业集团 | J378: 重庆 | K378: 重庆 | L378: 工业设备、房地产
A379: 378 | B379: 2014 | C379: 378 | D379: 刘长乐 | E379: 44.4 | F379: 男 | G379: =INT(RC[1]/10)*10 -> 60 | H379: 63 | I379: 凤凰卫视 | J379: 香港 | K379: 香港 | L379: 媒体
A380: 379 | B380: 2014 | C380: 379 | D380: 季琦 | E380: 44.1 | F380: 男 | G380: =INT(RC[1]/10)*10 -> 40 | H380: 48 | I380: 华住酒店集团 | J380: 上海 | K380: 上海 | L380: 餐饮与休闲
A381: 380 | B381: 2014 | C381: 379 | D381: 柯尊洪 | E381: 44.1 | F381: 男 | G381: =INT(RC[1]/10)*10 -> 60 | H381: 60 | I381: 康弘药业 | J381: 四川 | K381: 成都 | L381: 制药与生物科技
A382: 381 | B382: 2014 | C382: 379 | D382: 徐万茂 | E382: 44.1 | F382: 男 | G382: =INT(RC[1]/10)*10 -> 60 | H382: 69 | I382: 宁波华茂 | J382: 浙江 | K382: 宁波 | L382: 教育、多元金融
A383: 382 | B383: 2014 | C383: 382 | D383: 曹世如 | E383: 43.5 | F383: 女 | G383: =INT(RC[1]/10)*10 -> 60 | H383: 62 | I383: 红旗连锁 | J383: 四川 | K383: 成都 | L383: 零售
A384: 383 | B384: 2014 | C384: 382 | D384: 陈隆基 | E384: 43.5 | F384: 男 | G384: =INT(RC[1]/10)*10 -> 50 | H384: 58 | I384: 利嘉国际 | J384: 香港 | K384: 香港 | L384: 多元金融
A385: 384 | B385: 2014 | C385: 382 | D385: 范伟 | E385: 43.5 | F385: 男 | G385: =INT(RC[1]/10)*10 -> 40 | H385: 45 | I385: 复星国际 | J385: 上海 | K385: 上海 | L385: 原材料、房地产、制药与生物科技、多元金融
A386: 385 | B386: 2014 | C386: 382 | D386: 高云峰 | E386: 43.5 | F386: 男 | G386: =INT(RC[1]/10)*10 -> 40 | H386: 47 | I386: 大族激光 | J386: 广东 | K386: 深圳 | L386: 电子产品制造
A387: 386 | B387: 2014 | C387: 382 | D387: 郝镇熙夫妇 | E387: 43.5 | F387: 男 | G387: =INT(RC[1]/10)*10 -> 40 | H387: 46 | I387: 和佳股份 | J387: 广东 | K387: 珠海 | L387: 医疗保健设备与服务
A388: 387 | B388: 2014 | C388: 382 | D388: 蒲忠杰家族 | E388: 43.5 | F388: 男 | G388: =INT(RC[1]/10)*10 -> 50 | H388: 51 | I388: 乐普医疗 | J388: 北京 | K388: 北京 | L388: 医疗保健设备与服务
A389: 388 | B389: 2014 | C389: 382 | D389: 钱毅湘家族 | E389: 43.5 | F389: 男 | G389: =INT(RC[1]/10)*10 -> 40 | H389: 40 | I389: 博耳电力 | J389: 江苏 | K389: 无锡 | L389: 工业设备
A390: 389 | B390: 2014 | C390: 382 | D390: 汪群斌 | E390: 43.5 | F390: 男 | G390: =INT(RC[1]/10)*10 -> 40 | H390: 44 | I390: 复星国际 | J390: 上海 | K390: 上海 | L390: 原材料、房地产、制药与生物科技、多元金融
A391: 390 | B391: 2014 | C391: 382 | D391: 徐新建家族 | E391: 43.5 | F391: 男 | G391: =INT(RC[1]/10)*10 -> 50 | H391: 50 | I391: 日出东方 | J391: 江苏 | K391: 连云港 | L391: 电子电器设备
A392: 391 | B392: 2014 | C392: 382 | D392: 杨文龙夫妇 | E392: 43.5 | F392: 男 | G392: =INT(RC[1]/10)*10 -> 50 | H392: 52 | I392: 仁和集团 | J392: 江西 | K392: 樟树 | L392: 制药与生物科技
A393: 392 | B393: 2014 | C393: 382 | D393: 张开元 | E393: 43.5 | F393: 男 | G393: =INT(RC[1]/10)*10 -> 60 | H393: 60 | I393: 国电清新 | J393: 北京 | K393: 北京 | L393: 环保与新能源
A394: 393 | B394: 2014 | C394: 393 | D394: 范建刚 | E394: 43.1 | F394: 男 | G394: =INT(RC[1]/10)*10 -> 50 | H394: 59 | I394: 风范股份 | J394: 江苏 | K394: 常熟 | L394: 电子电器设备、电脑与通讯设备
A395: 394 | B395: 2014 | C395: 394 | D395: 何金明家族 | E395: 42.8 | F395: 男 | G395: =INT(RC[1]/10)*10 -> 60 | H395: 62 | I395: 人人乐 | J395: 广东 | K395: 深圳 | L395: 零售
A396: 395 | B396: 2014 | C396: 394 | D396: 黄壮勉家族 | E396: 42.8 | F396: 男 | G396: =INT(RC[1]/10)*10 -> 40 | H396: 44 | I396: 飞马国际 | J396: 广东 | K396: 深圳 | L396: 物流
A397: 396 | B397: 2014 | C397: 394 | D397: 林龙安夫妇 | E397: 42.8 | F397: 男 | G397: =INT(RC[1]/10)*10 -> 50 | H397: 50 | I397: 禹洲地产 | J397: 福建 | K397: 厦门 | L397: 房地产
A398: 397 | B398: 2014 | C398: 394 | D398: 吕莉家族 | E398: 42.8 | F398: 女 | G398: =INT(RC[1]/10)*10 -> 30 | H398: 38 | I398: 安洁科技 | J398: 江苏 | K398: 苏州 | L398: 电子产品制造
A399: 398 | B399: 2014 | C399: 394 | D399: 姚文彬 | E399: 42.8 | F399: 男 | G399: =INT(RC[1]/10)*10 -> 40 | H399: 44 | I399: 掌趣科技 | J399: 北京 | K399: 北京 | L399: 软件与服务
A400: 399 | B400: 2014 | C400: 394 | D400: 尹兴满家族 | E400: 42.8 | F400: 男 | G400: =INT(RC[1]/10)*10 -> 50 | H400: 57 | I400: 信质电机 | J400: 浙江 | K400: 台州 | L400: 汽车与汽车零部件
A401: 400 | B401: 2014 | C401: 394 | D401: 周福海家族 | E401: 42.8 | F401: 男 | G401: =INT(RC[1]/10)*10 -> 50 | H401: 54 | I401: 亚太科技 | J401: 江苏 | K401: 无锡 | L401: 制造业
A402: 401 | B402: 2013 | C402: 1 | D402: 王健林 | E402: 860.1 | F402: 男 | G402: =INT(RC[1]/10)*10 -> 50 | H402: 59 | I402: 大连万达集团 | J402: 北京 | K402: 北京 | L402: 房地产
A403: 402 | B403: 2013 | C403: 2 | D403: 宗庆后 | E403: 683.2 | F403: 男 | G403: =INT(RC[1]/10)*10 -> 60 | H403: 68 | I403: 娃哈哈集团 | J403: 浙江 | K403: 杭州 | L403: 饮料
A404: 403 | B404: 2013 | C404: 3 | D404: 李彦宏 | E404: 677.1 | F404: 男 | G404: =INT(RC[1]/10)*10 -> 40 | H404: 44 | I404: 百度 | J404: 北京 | K404: 北京 | L404: 互联网及软件
A405: 404 | B405: 2013 | C405: 4 | D405: 李河君 | E405: 664.9 | F405: 男 | G405: =INT(RC[1]/10)*10 -> 40 | H405: 46 | I405: 汉能控股集团 | J405: 北京 | K405: 北京 | L405: 能源
A406: 405 | B406: 2013 | C406: 5 | D406: 马化腾 | E406: 622.20000000000005 | F406: 男 | G406: =INT(RC[1]/10)*10 -> 40 | H406: 42 | I406: 腾讯 | J406: 广东 | K406: 深圳 | L406: 互联网及软件
A407: 406 | B407: 2013 | C407: 6 | D407: 魏建军 | E407: 549 | F407: 男 | G407: =INT(RC[1]/10)*10 -> 40 | H407: 49 | I407: 长城汽车 | J407: 河北 | K407: 保定 | L407: 汽车制造
A408: 407 | B408: 2013 | C408: 7 | D408: 杨惠妍 | E408: 439.2 | F408: 女 | G408: =INT(RC[1]/10)*10 -> 30 | H408: 32 | I408: 碧桂园 | J408: 广东 | K408: 佛山 | L408: 房地产
A409: 408 | B409: 2013 | C409: 8 | D409: 马云 | E409: 433.1 | F409: 男 | G409: =INT(RC[1]/10)*10 -> 40 | H409: 49 | I409: 阿里巴巴 | J409: 浙江 | K409: 杭州 | L409: 电子商务
A410: 409 | B410: 2013 | C410: 9 | D410: 何享健 | E410: 414.8 | F410: 男 | G410: =INT(RC[1]/10)*10 -> 70 | H410: 71 | I410: 美的集团 | J410: 广东 | K410: 佛山 | L410: 家用电器制造
A411: 410 | B411: 2013 | C411: 10 | D411: 刘永行 | E411: 372.1 | F411: 男 | G411: =INT(RC[1]/10)*10 -> 60 | H411: 65 | I411: 东方希望集团 | J411: 上海 | K411: 上海 | L411: 饲料、重化工业、投资
A412: 411 | B412: 2013 | C412: 11 | D412: 陈丽华家族 | E412: 366 | F412: 女 | G412: =INT(RC[1]/10)*10 -> 70 | H412: 72 | I412: 富华国际集团 | J412: 北京 | K412: 北京 | L412: 房地产
A413: 412 | B413: 2013 | C413: 12 | D413: 许荣茂 | E413: 335.5 | F413: 男 | G413: =INT(RC[1]/10)*10 -> 60 | H413: 63 | I413: 世茂集团 | J413: 香港 | K413: 香港 | L413: 房地产
A414: 413 | B414: 2013 | C414: 13 | D414: 许家印 | E414: 329.4 | F414: 男 | G414: =INT(RC[1]/10)*10 -> 50 | H414: 55 | I414: 恒大集团 | J414: 广东 | K414: 广州 | L414: 房地产
A415: 414 | B415: 2013 | C415: 14 | D415: 梁稳根 | E415: 305 | F415: 男 | G415: =INT(RC[1]/10)*10 -> 50 | H415: 56 | I415: 三一集团 | J415: 湖南 | K415: 长沙 | L415: 机械装备制造
A416: 415 | B416: 2013 | C416: 15 | D416: 姜滨夫妇 | E416: 292.8 | F416: 男 | G416: =INT(RC[1]/10)*10 -> 40 | H416: 47 | I416: 歌尔声学 | J416: 山东 | K416: 潍坊 | L416: 电子元器件制造
A417: 416 | B417: 2013 | C417: 16 | D417: 张近东 | E417: 268.39999999999998 | F417: 男 | G417: =INT(RC[1]/10)*10 -> 50 | H417: 50 | I417: 苏宁云商集团 | J417: 江苏 | K417: 南京 | L417: 家电零售
A418: 417 | B418: 2013 | C418: 17 | D418: 龚虹嘉夫妇 | E418: 262.3 | F418: 男 | G418: =INT(RC[1]/10)*10 -> 40 | H418: 48 | I418: 海康威视 | J418: 香港 | K418: 香港 | L418: 电子设备制造
A419: 418 | B419: 2013 | C419: 18 | D419: 王文银 | E419: 259.3 | F419: 男 | G419: =INT(RC[1]/10)*10 -> 40 | H419: 45 | I419: 正威国际 | J419: 广东 | K419: 深圳 | L419: 矿业
A420: 419 | B420: 2013 | C420: 19 | D420: 丁磊 | E420: 256.2 | F420: 男 | G420: =INT(RC[1]/10)*10 -> 40 | H420: 42 | I420: 网易 | J420: 广东 | K420: 广州 | L420: 互联网及软件
A421: 420 | B421: 2013 | C421: 20 | D421: 吴亚军 | E421: 250.1 | F421: 女 | G421: =INT(RC[1]/10)*10 -> 40 | H421: 49 | I421: 龙湖地产 | J421: 北京 | K421: 北京 | L421: 房地产
A422: 421 | B422: 2013 | C422: 21 | D422: 傅利泉夫妇 | E422: 244 | F422: 男 | G422: =INT(RC[1]/10)*10 -> 40 | H422: 46 | I422: 大华股份 | J422: 浙江 | K422: 杭州 | L422: 安防
A423: 422 | B423: 2013 | C423: 22 | D423: 王卫 | E423: 237.9 | F423: 男 | G423: =INT(RC[1]/10)*10 -> 40 | H423: 42 | I423: 顺丰速运 | J423: 广东 | K423: 深圳 | L423: 物流
A424: 423 | B424: 2013 | C424: 23 | D424: 雷军 | E424: 234.9 | F424: 男 | G424: =INT(RC[1]/10)*10 -> 40 | H424: 43 | I424: 金山软件、UCWEB | J424: 北京 | K424: 北京 | L424: 互联网及软件
A425: 424 | B425: 2013 | C425: 24 | D425: 张欣夫妇 | E425: 231.8 | F425: 女 | G425: =INT(RC[1]/10)*10 -> 40 | H425: 48 | I425: SOHO中国 | J425: 北京 | K425: 北京 | L425: 房地产
A426: 425 | B426: 2013 | C426: 25 | D426: 张志东 | E426: 228.8 | F426: 男 | G426: =INT(RC[1]/10)*10 -> 40 | H426: 41 | I426: 腾讯 | J426: 广东 | K426: 深圳 | L426: 互联网及软件
A427: 426 | B427: 2013 | C427: 26 | D427: 孙广信 | E427: 225.7 | F427: 男 | G427: =INT(RC[1]/10)*10 -> 50 | H427: 50 | I427: 新疆广汇实业投资(集团) | J427: 新疆 | K427: 乌鲁木齐 | L427: 能源、汽车销售、房地产
A428: 427 | B428: 2013 | C428: 27 | D428: 王传福 | E428: 219.6 | F428: 男 | G428: =INT(RC[1]/10)*10 -> 40 | H428: 47 | I428: 比亚迪 | J428: 广东 | K428: 深圳 | L428: 汽车制造、新能源、电子设备制造
A429: 428 | B429: 2013 | C429: 28 | D429: 张士平家族 | E429: 213.5 | F429: 男 | G429: =INT(RC[1]/10)*10 -> 60 | H429: 66 | I429: 中国宏桥集团、山东魏桥创业集团 | J429: 山东 | K429: 滨州 | L429: 矿业、纺织
A430: 429 | B430: 2013 | C430: 29 | D430: 鲁冠球父子 | E430: 207.4 | F430: 男 | G430: =INT(RC[1]/10)*10 -> 60 | H430: 68 | I430: 万向集团 | J430: 浙江 | K430: 杭州 | L430: 汽车零部件、有色金属、房地产、农业
A431: 430 | B431: 2013 | C431: 30 | D431: 刘永好家族 | E431: 201.3 | F431: 男 | G431: =INT(RC[1]/10)*10 -> 60 | H431: 62 | I431: 新希望集团 | J431: 四川 | K431: 成都 | L431: 饲料、房地产、金融、化工
A432: 431 | B432: 2013 | C432: 31 | D432: 郭广昌 | E432: 198.3 | F432: 男 | G432: =INT(RC[1]/10)*10 -> 40 | H432: 46 | I432: 复星国际 | J432: 上海 | K432: 上海 | L432: 钢铁、房地产、医药、金融
A433: 432 | B433: 2013 | C433: 32 | D433: 卢志强 | E433: 195.2 | F433: 男 | G433: =INT(RC[1]/10)*10 -> 60 | H433: 61 | I433: 泛海集团 | J433: 北京 | K433: 北京 | L433: 金融、房地产、投资
A434: 433 | B434: 2013 | C434: 33 | D434: 史玉柱 | E434: 189.1 | F434: 男 | G434: =INT(RC[1]/10)*10 -> 50 | H434: 51 | I434: 巨人集团 | J434: 上海 | K434: 上海 | L434: 保健品、网络游戏、投资
A435: 434 | B435: 2013 | C435: 34 | D435: 施文博 | E435: 176.9 | F435: 男 | G435: =INT(RC[1]/10)*10 -> 60 | H435: 63 | I435: 恒安集团 | J435: 福建 | K435: 晋江 | L435: 个人护理用品
A436: 435 | B436: 2013 | C436: 35 | D436: 王玉锁夫妇 | E436: 173.9 | F436: 男 | G436: =INT(RC[1]/10)*10 -> 40 | H436: 49 | I436: 新奥集团 | J436: 河北 | K436: 廊坊 | L436: 能源、房地产
A437: 436 | B437: 2013 | C437: 35 | D437: 童锦泉 | E437: 173.9 | F437: 男 | G437: =INT(RC[1]/10)*10 -> 50 | H437: 58 | I437: 长峰房地产 | J437: 上海 | K437: 上海 | L437: 房地产
A438: 437 | B438: 2013 | C438: 37 | D438: 许连捷（许自连） | E438: 170.8 | F438: 男 | G438: =INT(RC[1]/10)*10 -> 60 | H438: 60 | I438: 恒安集团 | J438: 福建 | K438: 晋江 | L438: 个人护理用品
A439: 438 | B439: 2013 | C439: 38 | D439: 黄如论 | E439: 167.8 | F439: 男 | G439: =INT(RC[1]/10)*10 -> 60 | H439: 62 | I439: 世纪金源集团 | J439: 北京 | K439: 北京 | L439: 房地产、投资
A440: 439 | B440: 2013 | C440: 38 | D440: 叶澄海家族 | E440: 167.8 | F440: 男 | G440: =INT(RC[1]/10)*10 -> 70 | H440: 70 | I440: 信立泰 | J440: 香港 | K440: 香港 | L440: 医药
A441: 440 | B441: 2013 | C441: 40 | D441: 潘政民夫妇 | E441: 164.7 | F441: 男 | G441: =INT(RC[1]/10)*10 -> 40 | H441: 43 | I441: AAC声学科技 | J441: 广东 | K441: 深圳 | L441: 电子元器件制造
A442: 441 | B442: 2013 | C442: 41 | D442: 吕向阳 | E442: 161.69999999999999 | F442: 男 | G442: =INT(RC[1]/10)*10 -> 50 | H442: 50 | I442: 融捷投资、比亚迪股份 | J442: 广东 | K442: 广州 | L442: 投资
A443: 442 | B443: 2013 | C443: 42 | D443: 祝义材夫妇 | E443: 158.6 | F443: 男 | G443: =INT(RC[1]/10)*10 -> 40 | H443: 49 | I443: 雨润集团 | J443: 江苏 | K443: 南京 | L443: 食品、房地产
A444: 443 | B444: 2013 | C444: 42 | D444: 蔡奎 | E444: 158.6 | F444: 男 | G444: =INT(RC[1]/10)*10 -> 50 | H444: 50 | I444: 龙湖地产 | J444: 四川 | K444: 成都 | L444: 房地产
A445: 444 | B445: 2013 | C445: 44 | D445: 张力 | E445: 155.6 | F445: 男 | G445: =INT(RC[1]/10)*10 -> 60 | H445: 60 | I445: 富力集团 | J445: 广东 | K445: 广州 | L445: 房地产、投资
A446: 445 | B446: 2013 | C446: 45 | D446: 王长田夫妇 | E446: 152.5 | F446: 男 | G446: =INT(RC[1]/10)*10 -> 40 | H446: 48 | I446: 光线传媒 | J446: 北京 | K446: 北京 | L446: 文化娱乐
A447: 446 | B447: 2013 | C447: 46 | D447: 邱光和家族 | E447: 149.5 | F447: 男 | G447: =INT(RC[1]/10)*10 -> 60 | H447: 61 | I447: 森马服饰 | J447: 浙江 | K447: 温州 | L447: 服装服饰
A448: 447 | B448: 2013 | C448: 47 | D448: 陈发树 | E448: 146.4 | F448: 男 | G448: =INT(RC[1]/10)*10 -> 50 | H448: 52 | I448: 新华都实业集团 | J448: 福建 | K448: 福州 | L448: 零售、投资、房地产
A449: 448 | B449: 2013 | C449: 48 | D449: 杨凯 | E449: 143.4 | F449: 男 | G449: =INT(RC[1]/10)*10 -> 50 | H449: 55 | I449: 辉山乳业 | J449: 辽宁 | K449: 沈阳 | L449: 乳制品
A450: 449 | B450: 2013 | C450: 49 | D450: 徐镜人 | E450: 140.30000000000001 | F450: 男 | G450: =INT(RC[1]/10)*10 -> 60 | H450: 69 | I450: 扬子江药业 | J450: 江苏 | K450: 泰州 | L450: 医药
A451: 450 | B451: 2013 | C451: 49 | D451: 马建荣 | E451: 140.30000000000001 | F451: 男 | G451: =INT(RC[1]/10)*10 -> 40 | H451: 49 | I451: 申洲国际集团 | J451: 浙江 | K451: 宁波 | L451: 纺织、服装
A452: 451 | B452: 2013 | C452: 51 | D452: 蒋仁生父子 | E452: 139.69999999999999 | F452: 男 | G452: =INT(RC[1]/10)*10 -> 60 | H452: 60 | I452: 智飞生物 | J452: 重庆 | K452: 重庆 | L452: 生物医药
A453: 452 | B453: 2013 | C453: 52 | D453: 李锂夫妇 | E453: 137.30000000000001 | F453: 男 | G453: =INT(RC[1]/10)*10 -> 40 | H453: 49 | I453: 海普瑞 | J453: 广东 | K453: 深圳 | L453: 医药
A454: 453 | B454: 2013 | C454: 53 | D454: 刘忠田 | E454: 131.19999999999999 | F454: 男 | G454: =INT(RC[1]/10)*10 -> 40 | H454: 49 | I454: 忠旺集团 | J454: 辽宁 | K454: 辽阳 | L454: 工业铝型材
A455: 454 | B455: 2013 | C455: 54 | D455: 李书福 | E455: 125.1 | F455: 男 | G455: =INT(RC[1]/10)*10 -> 50 | H455: 50 | I455: 吉利集团 | J455: 浙江 | K455: 杭州 | L455: 汽车制造
A456: 455 | B456: 2013 | C456: 55 | D456: 朱兴良 | E456: 124.4 | F456: 男 | G456: =INT(RC[1]/10)*10 -> 50 | H456: 54 | I456: 金螳螂 | J456: 江苏 | K456: 苏州 | L456: 装修装饰
A457: 456 | B457: 2013 | C457: 56 | D457: 沈国军 | E457: 122 | F457: 男 | G457: =INT(RC[1]/10)*10 -> 50 | H457: 51 | I457: 银泰集团 | J457: 北京 | K457: 北京 | L457: 零售、房地产
A458: 457 | B458: 2013 | C458: 56 | D458: 傅梅城家族 | E458: 122 | F458: 男 | G458: =INT(RC[1]/10)*10 -> 50 | H458: 56 | I458: 华策影视 | J458: 浙江 | K458: 杭州 | L458: 文化娱乐
A459: 458 | B459: 2013 | C459: 58 | D459: 梁允超 | E459: 120.8 | F459: 男 | G459: =INT(RC[1]/10)*10 -> 40 | H459: 44 | I459: 汤臣倍健 | J459: 广东 | K459: 珠海 | L459: 保健品
A460: 459 | B460: 2013 | C460: 59 | D460: 宋作文 | E460: 120.2 | F460: 男 | G460: =INT(RC[1]/10)*10 -> 60 | H460: 66 | I460: 山东南山集团 | J460: 山东 | K460: 龙口 | L460: 铝业、建筑、纺织
A461: 460 | B461: 2013 | C461: 60 | D461: 姚巨货家族 | E461: 119.6 | F461: 男 | G461: =INT(RC[1]/10)*10 -> 80 | H461: 82 | I461: 美锦集团 | J461: 山西 | K461: 太原 | L461: 能源、房地产
A462: 461 | B462: 2013 | C462: 61 | D462: 黄伟夫妇 | E462: 119 | F462: 男 | G462: =INT(RC[1]/10)*10 -> 50 | H462: 54 | I462: 新湖集团 | J462: 浙江 | K462: 杭州 | L462: 房地产、金融、矿业、生物医药
A463: 462 | B463: 2013 | C463: 62 | D463: 周鸿祎 | E463: 112.9 | F463: 男 | G463: =INT(RC[1]/10)*10 -> 40 | H463: 43 | I463: 奇虎360 | J463: 北京 | K463: 北京 | L463: 互联网及软件
A464: 463 | B464: 2013 | C464: 63 | D464: 严彬 | E464: 109.8 | F464: 男 | G464: =INT(RC[1]/10)*10 -> 50 | H464: 59 | I464: 华彬国际集团 | J464: 北京 | K464: 北京 | L464: 房地产、体育产业、饮料、旅游、贸易
A465: 464 | B465: 2013 | C465: 63 | D465: 孙伟杰 | E465: 109.8 | F465: 男 | G465: =INT(RC[1]/10)*10 -> 50 | H465: 50 | I465: 杰瑞股份 | J465: 山东 | K465: 烟台 | L465: 油田矿山设备制造
A466: 465 | B466: 2013 | C466: 65 | D466: 朱共山 | E466: 108 | F466: 男 | G466: =INT(RC[1]/10)*10 -> 50 | H466: 55 | I466: 协鑫控股 | J466: 江苏 | K466: 徐州 | L466: 太阳能
A467: 466 | B467: 2013 | C467: 66 | D467: 陈宁宁家族 | E467: 107.4 | F467: 女 | G467: =INT(RC[1]/10)*10 -> 40 | H467: 42 | I467: 香港嘉鑫控股集团 | J467: 香港 | K467: 香港 | L467: 投资
A468: 467 | B468: 2013 | C468: 67 | D468: 谢炳 | E468: 106.8 | F468: 男 | G468: =INT(RC[1]/10)*10 -> 60 | H468: 61 | I468: 中国生物制药 | J468: 香港 | K468: 香港 | L468: 医药
A469: 468 | B469: 2013 | C469: 68 | D469: 王俊民 | E469: 105.5 | F469: 男 | G469: =INT(RC[1]/10)*10 -> 40 | H469: 44 | I469: 西藏海思科药业 | J469: 四川 | K469: 成都 | L469: 医药
A470: 469 | B470: 2013 | C470: 69 | D470: 王文学 | E470: 104.9 | F470: 男 | G470: =INT(RC[1]/10)*10 -> 40 | H470: 46 | I470: 华夏幸福 | J470: 河北 | K470: 廊坊 | L470: 房地产
A471: 470 | B471: 2013 | C471: 69 | D471: 吴以岭家族 | E471: 104.9 | F471: 男 | G471: =INT(RC[1]/10)*10 -> 60 | H471: 63 | I471: 以岭药业 | J471: 河北 | K471: 石家庄 | L471: 医药
A472: 471 | B472: 2013 | C472: 69 | D472: 杨爱华 | E472: 104.9 | F472: 男 | G472: =INT(RC[1]/10)*10 -> 50 | H472: 52 | I472: 宝信汽车集团 | J472: 上海 | K472: 上海 | L472: 汽车销售
A473: 472 | B473: 2013 | C473: 72 | D473: 何巧女夫妇 | E473: 103.7 | F473: 女 | G473: =INT(RC[1]/10)*10 -> 40 | H473: 47 | I473: 东方园林 | J473: 北京 | K473: 北京 | L473: 园艺
A474: 473 | B474: 2013 | C474: 72 | D474: 高德康家族 | E474: 103.7 | F474: 男 | G474: =INT(RC[1]/10)*10 -> 60 | H474: 61 | I474: 波司登 | J474: 江苏 | K474: 常熟 | L474: 服装服饰
A475: 474 | B475: 2013 | C475: 72 | D475: 朱林瑶 | E475: 103.7 | F475: 女 | G475: =INT(RC[1]/10)*10 -> 40 | H475: 43 | I475: 华宝国际 | J475: 香港 | K475: 香港 | L475: 香料香精
A476: 475 | B476: 2013 | C476: 75 | D476: 魏少军 | E476: 103.1 | F476: 男 | G476: =INT(RC[1]/10)*10 -> 50 | H476: 50 | I476: 隆基泰和 | J476: 河北 | K476: 保定 | L476: 房地产
A477: 476 | B477: 2013 | C477: 76 | D477: 薛向东家族 | E477: 101.9 | F477: 男 | G477: =INT(RC[1]/10)*10 -> 50 | H477: 54 | I477: 东华软件 | J477: 北京 | K477: 北京 | L477: 软件
A478: 477 | B478: 2013 | C478: 77 | D478: 孙飘扬 | E478: 100.7 | F478: 男 | G478: =INT(RC[1]/10)*10 -> 50 | H478: 55 | I478: 恒瑞医药 | J478: 江苏 | K478: 连云港 | L478: 医药
A479: 478 | B479: 2013 | C479: 78 | D479: 张宏伟 | E479: 98.8 | F479: 男 | G479: =INT(RC[1]/10)*10 -> 50 | H479: 58 | I479: 北京东方集团 | J479: 北京 | K479: 北京 | L479: 多元化
A480: 479 | B480: 2013 | C480: 79 | D480: 朱孟依父子 | E480: 97.6 | F480: 男 | G480: =INT(RC[1]/10)*10 -> 50 | H480: 53 | I480: 合生创展 | J480: 广东 | K480: 广州 | L480: 房地产
A481: 480 | B481: 2013 | C481: 79 | D481: 张志熔 | E481: 97.6 | F481: 男 | G481: =INT(RC[1]/10)*10 -> 40 | H481: 44 | I481: 恒盛地产、熔盛重工 | J481: 香港 | K481: 香港 | L481: 房地产、造船
A482: 481 | B482: 2013 | C482: 81 | D482: 黄联禧 | E482: 96.4 | F482: 男 | G482: =INT(RC[1]/10)*10 -> 50 | H482: 51 | I482: 中国联塑集团 | J482: 香港 | K482: 香港 | L482: 化工
A483: 482 | B483: 2013 | C483: 82 | D483: 丁欣欣夫妇 | E483: 95.8 | F483: 男 | G483: =INT(RC[1]/10)*10 -> 50 | H483: 55 | I483: 亚厦控股 | J483: 浙江 | K483: 杭州 | L483: 装修装饰
A484: 483 | B484: 2013 | C484: 83 | D484: 陈天桥夫妇 | E484: 94.6 | F484: 男 | G484: =INT(RC[1]/10)*10 -> 40 | H484: 40 | I484: 盛大网络 | J484: 上海 | K484: 上海 | L484: 网络游戏
A485: 484 | B485: 2013 | C485: 84 | D485: 周成建 | E485: 93.9 | F485: 男 | G485: =INT(RC[1]/10)*10 -> 40 | H485: 48 | I485: 美邦服饰 | J485: 上海 | K485: 上海 | L485: 服装服饰
A486: 485 | B486: 2013 | C486: 85 | D486: 马兴田家族 | E486: 91.5 | F486: 男 | G486: =INT(RC[1]/10)*10 -> 40 | H486: 44 | I486: 康美药业 | J486: 广东 | K486: 普宁 | L486: 医药
A487: 486 | B487: 2013 | C487: 85 | D487: 陈建华夫妇 | E487: 91.5 | F487: 男 | G487: =INT(RC[1]/10)*10 -> 40 | H487: 42 | I487: 恒力集团 | J487: 江苏 | K487: 吴江 | L487: 化工
A488: 487 | B488: 2013 | C488: 87 | D488: 黄世再 | E488: 90.9 | F488: 男 | G488: =INT(RC[1]/10)*10 -> 60 | H488: 62 | I488: 大中华国际 | J488: 广东 | K488: 深圳 | L488: 房地产
A489: 488 | B489: 2013 | C489: 88 | D489: 刘志强夫妇 | E489: 90.3 | F489: 男 | G489: =INT(RC[1]/10)*10 -> 40 | H489: 48 | I489: 广东香江集团 | J489: 广东 | K489: 广州 | L489: 房地产、家居流通、能源、金融
A490: 489 | B490: 2013 | C490: 89 | D490: 文剑平 | E490: 89.7 | F490: 男 | G490: =INT(RC[1]/10)*10 -> 50 | H490: 51 | I490: 碧水源 | J490: 北京 | K490: 北京 | L490: 环保
A491: 490 | B491: 2013 | C491: 90 | D491: 邵根伙 | E491: 88.5 | F491: 男 | G491: =INT(RC[1]/10)*10 -> 40 | H491: 48 | I491: 大北农 | J491: 北京 | K491: 北京 | L491: 饲料、农业、食品加工
A492: 491 | B492: 2013 | C492: 91 | D492: 刘学景家族 | E492: 87.8 | F492: 男 | G492: =INT(RC[1]/10)*10 -> 60 | H492: 62 | I492: 新凤祥控股 | J492: 山东 | K492: 聊城 | L492: 有色金属、饲养加工
A493: 492 | B493: 2013 | C493: 92 | D493: 蔡东青 | E493: 86.6 | F493: 男 | G493: =INT(RC[1]/10)*10 -> 40 | H493: 44 | I493: 奥飞动漫 | J493: 广东 | K493: 汕头 | L493: 文化娱乐
A494: 493 | B494: 2013 | C494: 92 | D494: 张桂平父子 | E494: 86.6 | F494: 男 | G494: =INT(RC[1]/10)*10 -> 60 | H494: 62 | I494: 苏宁环球集团 | J494: 江苏 | K494: 南京 | L494: 房地产
A495: 494 | B495: 2013 | C495: 94 | D495: 王靖 | E495: 85.4 | F495: 男 | G495: =INT(RC[1]/10)*10 -> 40 | H495: 40 | I495: 信威通信 | J495: 北京 | K495: 北京 | L495: 通信
A496: 495 | B496: 2013 | C496: 95 | D496: 黄绍武 | E496: 84.2 | F496: 男 | G496: =INT(RC[1]/10)*10 -> 40 | H496: 42 | I496: 爱施德 | J496: 广东 | K496: 深圳 | L496: 电子产品销售
A497: 496 | B497: 2013 | C497: 95 | D497: 曹克坚 | E497: 84.2 | F497: 男 | G497: =INT(RC[1]/10)*10 -> 50 | H497: 51 | I497: 开山集团 | J497: 浙江 | K497: 衢州 | L497: 机械装备制造
A498: 497 | B498: 2013 | C498: 97 | D498: 阎志 | E498: 83 | F498: 男 | G498: =INT(RC[1]/10)*10 -> 40 | H498: 40 | I498: 卓尔发展 | J498: 湖北 | K498: 武汉 | L498: 房地产
A499: 498 | B499: 2013 | C499: 98 | D499: 刘强东 | E499: 82.4 | F499: 男 | G499: =INT(RC[1]/10)*10 -> 30 | H499: 39 | I499: 京东商城 | J499: 北京 | K499: 北京 | L499: 电子商务
A500: 499 | B500: 2013 | C500: 98 | D500: 黄毅 | E500: 82.4 | F500: 男 | G500: =INT(RC[1]/10)*10 -> 50 | H500: 51 | I500: 中升集团 | J500: 辽宁 | K500: 大连 | L500: 汽车销售
A501: 500 | B501: 2013 | C501: 100 | D501: 顾伟 | E501: 81.099999999999994 | F501: 男 | G501: =INT(RC[1]/10)*10 -> 40 | H501: 48 | I501: 兆驰股份 | J501: 广东 | K501: 深圳 | L501: 家用电器制造
A502: 501 | B502: 2013 | C502: 101 | D502: 熊续强夫妇 | E502: 80.5 | F502: 男 | G502: =INT(RC[1]/10)*10 -> 50 | H502: 57 | I502: 宁波银亿集团 | J502: 浙江 | K502: 宁波 | L502: 房地产、能源
A503: 502 | B503: 2013 | C503: 102 | D503: 方威 | E503: 79.3 | F503: 男 | G503: =INT(RC[1]/10)*10 -> 40 | H503: 40 | I503: 辽宁方大集团 | J503: 北京 | K503: 北京 | L503: 化工、钢铁
A504: 503 | B504: 2013 | C504: 102 | D504: 黄文仔 | E504: 79.3 | F504: 男 | G504: =INT(RC[1]/10)*10 -> 60 | H504: 60 | I504: 星河湾 | J504: 广东 | K504: 广州 | L504: 房地产
A505: 504 | B505: 2013 | C505: 102 | D505: 林立 | E505: 79.3 | F505: 男 | G505: =INT(RC[1]/10)*10 -> 50 | H505: 50 | I505: 深圳立业集团 | J505: 广东 | K505: 深圳 | L505: 金融、投资
A506: 505 | B506: 2013 | C506: 102 | D506: 倪召兴家族 | E506: 79.3 | F506: 男 | G506: =INT(RC[1]/10)*10 -> 50 | H506: 57 | I506: 中融集团 | J506: 上海 | K506: 上海 | L506: 房地产、能源
A507: 506 | B507: 2013 | C507: 102 | D507: 张长虹 | E507: 79.3 | F507: 男 | G507: =INT(RC[1]/10)*10 -> 50 | H507: 55 | I507: 大智慧 | J507: 上海 | K507: 上海 | L507: 互联网金融服务
A508: 507 | B508: 2013 | C508: 107 | D508: 黄晞家族 | E508: 78.099999999999994 | F508: 女 | G508: =INT(RC[1]/10)*10 -> 50 | H508: 51 | I508: 福信集团 | J508: 福建 | K508: 厦门 | L508: 房地产、投资
A509: 508 | B509: 2013 | C509: 108 | D509: 刘宝林 | E509: 77.5 | F509: 男 | G509: =INT(RC[1]/10)*10 -> 60 | H509: 60 | I509: 九州通 | J509: 湖北 | K509: 武汉 | L509: 医药零售
A510: 509 | B510: 2013 | C510: 109 | D510: 黄光裕夫妇 | E510: 76.3 | F510: 男 | G510: =INT(RC[1]/10)*10 -> 40 | H510: 44 | I510: 鹏润投资 | J510: 北京 | K510: 北京 | L510: 家电零售、房地产
A511: 510 | B511: 2013 | C511: 110 | D511: 吴光明父子 | E511: 75.599999999999994 | F511: 男 | G511: =INT(RC[1]/10)*10 -> 50 | H511: 51 | I511: 鱼跃医疗 | J511: 江苏 | K511: 丹阳 | L511: 医疗设备
A512: 511 | B512: 2013 | C512: 111 | D512: 李仲初家族 | E512: 75 | F512: 男 | G512: =INT(RC[1]/10)*10 -> 50 | H512: 50 | I512: 石基信息 | J512: 北京 | K512: 北京 | L512: 软件
A513: 512 | B513: 2013 | C513: 111 | D513: 刘晓萌 | E513: 75 | F513: 女 | G513: =INT(RC[1]/10)*10 -> 50 | H513: 58 | I513: 苏宁云商集团 | J513: 江苏 | K513: 南京 | L513: 家电零售
A514: 513 | B514: 2013 | C514: 111 | D514: 王坤晓 | E514: 75 | F514: 男 | G514: =INT(RC[1]/10)*10 -> 40 | H514: 44 | I514: 杰瑞股份 | J514: 山东 | K514: 烟台 | L514: 油田矿山设备制造
A515: 514 | B515: 2013 | C515: 111 | D515: 陈金霞 | E515: 75 | F515: 女 | G515: =INT(RC[1]/10)*10 -> 40 | H515: 45 | I515: 涌金集团 | J515: 上海 | K515: 上海 | L515: 投资、医药
A516: 515 | B516: 2013 | C516: 115 | D516: 莫天全 | E516: 73.2 | F516: 男 | G516: =INT(RC[1]/10)*10 -> 40 | H516: 49 | I516: 搜房 | J516: 北京 | K516: 北京 | L516: 房地产服务
A517: 516 | B517: 2013 | C517: 115 | D517: 曹德旺夫妇 | E517: 73.2 | F517: 男 | G517: =INT(RC[1]/10)*10 -> 60 | H517: 67 | I517: 福耀集团 | J517: 福建 | K517: 福清 | L517: 玻璃制造
A518: 517 | B518: 2013 | C518: 115 | D518: 黄振达家族 | E518: 73.2 | F518: 男 | G518: =INT(RC[1]/10)*10 -> 60 | H518: 66 | I518: 广东联泰集团 | J518: 广东 | K518: 汕头 | L518: 基础设施建设、房地产
A519: 518 | B519: 2013 | C519: 115 | D519: 徐宇 | E519: 73.2 | F519: 男 | G519: / | H519: / | I519: 赫基国际集团 | J519: 广东 | K519: 广州 | L519: 服装服饰
A520: 519 | B520: 2013 | C520: 115 | D520: 周奕丰家族 | E520: 73.2 | F520: 男 | G520: =INT(RC[1]/10)*10 -> 40 | H520: 44 | I520: 鸿达兴业集团 | J520: 广东 | K520: 广州 | L520: 化工
A521: 520 | B521: 2013 | C521: 115 | D521: 梁信军 | E521: 73.2 | F521: 男 | G521: =INT(RC[1]/10)*10 -> 40 | H521: 45 | I521: 复星国际 | J521: 上海 | K521: 上海 | L521: 钢铁、房地产、医药、金融
A522: 521 | B522: 2013 | C522: 121 | D522: 姜照柏 | E522: 72.599999999999994 | F522: 男 | G522: =INT(RC[1]/10)*10 -> 50 | H522: 50 | I522: 鹏欣集团 | J522: 上海 | K522: 上海 | L522: 房地产、投资
A523: 522 | B523: 2013 | C523: 122 | D523: 贾跃亭 | E523: 72 | F523: 男 | G523: =INT(RC[1]/10)*10 -> 40 | H523: 40 | I523: 乐视网 | J523: 北京 | K523: 北京 | L523: 互联网及软件
A524: 523 | B524: 2013 | C524: 122 | D524: 沈文荣 | E524: 72 | F524: 男 | G524: =INT(RC[1]/10)*10 -> 60 | H524: 67 | I524: 江苏沙钢集团 | J524: 江苏 | K524: 张家港 | L524: 钢铁
A525: 524 | B525: 2013 | C525: 122 | D525: 涂建华 | E525: 72 | F525: 男 | G525: =INT(RC[1]/10)*10 -> 50 | H525: 50 | I525: 隆鑫控股 | J525: 重庆 | K525: 重庆 | L525: 房地产、摩托车制造
A526: 525 | B526: 2013 | C526: 125 | D526: 陈卓林夫妇 | E526: 71.400000000000006 | F526: 男 | G526: =INT(RC[1]/10)*10 -> 50 | H526: 51 | I526: 雅居乐地产 | J526: 广东 | K526: 中山 | L526: 房地产
A527: 526 | B527: 2013 | C527: 125 | D527: 耿建明 | E527: 71.400000000000006 | F527: 男 | G527: =INT(RC[1]/10)*10 -> 50 | H527: 51 | I527: 荣盛控股 | J527: 河北 | K527: 廊坊 | L527: 房地产
A528: 527 | B528: 2013 | C528: 127 | D528: 叶成 | E528: 70.8 | F528: 男 | G528: =INT(RC[1]/10)*10 -> 50 | H528: 51 | I528: 山东岚桥集团 | J528: 山东 | K528: 日照 | L528: 能源、基础设施建设
A529: 528 | B529: 2013 | C529: 127 | D529: 阙文彬夫妇 | E529: 70.8 | F529: 男 | G529: =INT(RC[1]/10)*10 -> 50 | H529: 50 | I529: 独一味 、西部资源 | J529: 四川 | K529: 成都 | L529: 医药、矿业
A530: 529 | B530: 2013 | C530: 127 | D530: 薛光林 | E530: 70.8 | F530: 男 | G530: =INT(RC[1]/10)*10 -> 40 | H530: 45 | I530: 光汇石油 | J530: 香港 | K530: 香港 | L530: 化工
A531: 530 | B531: 2013 | C531: 130 | D531: 周晓光夫妇 | E531: 70.2 | F531: 女 | G531: =INT(RC[1]/10)*10 -> 50 | H531: 51 | I531: 新光控股集团 | J531: 浙江 | K531: 义乌 | L531: 流行饰品、投资、商贸、地产
A532: 531 | B532: 2013 | C532: 131 | D532: 文一波夫妇 | E532: 69.5 | F532: 男 | G532: =INT(RC[1]/10)*10 -> 40 | H532: 48 | I532: 桑德集团 | J532: 北京 | K532: 北京 | L532: 环保
A533: 532 | B533: 2013 | C533: 131 | D533: 杨铿夫妇 | E533: 69.5 | F533: 男 | G533: =INT(RC[1]/10)*10 -> 50 | H533: 52 | I533: 四川蓝光 | J533: 四川 | K533: 成都 | L533: 房地产
A534: 533 | B534: 2013 | C534: 133 | D534: 雷菊芳 | E534: 68.900000000000006 | F534: 女 | G534: =INT(RC[1]/10)*10 -> 60 | H534: 60 | I534: 奇正藏药 | J534: 甘肃 | K534: 兰州 | L534: 医药
A535: 534 | B535: 2013 | C535: 133 | D535: 刘革新 | E535: 68.900000000000006 | F535: 男 | G535: =INT(RC[1]/10)*10 -> 60 | H535: 62 | I535: 科伦药业 | J535: 四川 | K535: 成都 | L535: 医药
A536: 535 | B536: 2013 | C536: 135 | D536: 霍庆华 | E536: 68.3 | F536: 男 | G536: =INT(RC[1]/10)*10 -> 50 | H536: 52 | I536: 中国庆华集团 | J536: 北京 | K536: 北京 | L536: 能源、化工
A537: 536 | B537: 2013 | C537: 135 | D537: 柯希平夫妇 | E537: 68.3 | F537: 男 | G537: =INT(RC[1]/10)*10 -> 50 | H537: 53 | I537: 恒兴实业 | J537: 福建 | K537: 厦门 | L537: 房地产、投资
A538: 537 | B538: 2013 | C538: 135 | D538: 林秀成家族 | E538: 68.3 | F538: 男 | G538: =INT(RC[1]/10)*10 -> 50 | H538: 58 | I538: 福建三安集团 | J538: 福建 | K538: 厦门 | L538: 电子元器件制造、钢铁
A539: 538 | B539: 2013 | C539: 138 | D539: 刘振国 | E539: 67.099999999999994 | F539: 男 | G539: =INT(RC[1]/10)*10 -> 40 | H539: 48 | I539: 碧水源 | J539: 北京 | K539: 北京 | L539: 环保
A540: 539 | B540: 2013 | C540: 138 | D540: 缪寿良 | E540: 67.099999999999994 | F540: 男 | G540: =INT(RC[1]/10)*10 -> 50 | H540: 58 | I540: 富源集团 | J540: 广东 | K540: 深圳 | L540: 房地产
A541: 540 | B541: 2013 | C541: 138 | D541: 闫希军家族 | E541: 67.099999999999994 | F541: 男 | G541: =INT(RC[1]/10)*10 -> 60 | H541: 60 | I541: 天士力 | J541: 天津 | K541: 天津 | L541: 医药
A542: 541 | B542: 2013 | C542: 138 | D542: 谢宏夫妇 | E542: 67.099999999999994 | F542: 男 | G542: =INT(RC[1]/10)*10 -> 40 | H542: 48 | I542: 贝因美 | J542: 浙江 | K542: 杭州 | L542: 食品
A543: 542 | B543: 2013 | C543: 142 | D543: 王忠军 | E543: 65.900000000000006 | F543: 男 | G543: =INT(RC[1]/10)*10 -> 50 | H543: 53 | I543: 华谊兄弟 | J543: 北京 | K543: 北京 | L543: 文化娱乐
A544: 543 | B544: 2013 | C544: 142 | D544: 黄炳文家族 | E544: 65.900000000000006 | F544: 男 | G544: =INT(RC[1]/10)*10 -> 50 | H544: 59 | I544: 东风股份 | J544: 广东 | K544: 汕头 | L544: 印刷业
A545: 544 | B545: 2013 | C545: 142 | D545: 张中能夫妇 | E545: 65.900000000000006 | F545: 男 | G545: =INT(RC[1]/10)*10 -> 50 | H545: 50 | I545: 东阳光集团 | J545: 广东 | K545: 深圳 | L545: 金属制品、医药、酒店
A546: 545 | B546: 2013 | C546: 142 | D546: 黄泽兰夫妇 | E546: 65.900000000000006 | F546: 男 | G546: =INT(RC[1]/10)*10 -> 50 | H546: 58 | I546: 章源钨业 | J546: 江西 | K546: 赣州 | L546: 有色金属
A547: 546 | B547: 2013 | C547: 146 | D547: 俞敏洪 | E547: 64.7 | F547: 男 | G547: =INT(RC[1]/10)*10 -> 50 | H547: 51 | I547: 新东方教育 | J547: 北京 | K547: 北京 | L547: 教育
A548: 547 | B548: 2013 | C548: 146 | D548: 李新炎夫妇 | E548: 64.7 | F548: 男 | G548: =INT(RC[1]/10)*10 -> 60 | H548: 63 | I548: 中国龙工集团 | J548: 上海 | K548: 上海 | L548: 机械装备制造
A549: 548 | B549: 2013 | C549: 146 | D549: 王木清 | E549: 64.7 | F549: 男 | G549: =INT(RC[1]/10)*10 -> 60 | H549: 62 | I549: 正通汽车 | J549: 上海 | K549: 上海 | L549: 汽车销售
A550: 549 | B550: 2013 | C550: 146 | D550: 陈妙林 | E550: 64.7 | F550: 男 | G550: =INT(RC[1]/10)*10 -> 60 | H550: 61 | I550: 开元旅业集团 | J550: 浙江 | K550: 杭州 | L550: 酒店
A551: 550 | B551: 2013 | C551: 146 | D551: 罗韶宇夫妇 | E551: 64.7 | F551: 男 | G551: =INT(RC[1]/10)*10 -> 40 | H551: 43 | I551: 重庆东银集团 | J551: 重庆 | K551: 重庆 | L551: 房地产、汽车制造、能源
A552: 551 | B552: 2013 | C552: 151 | D552: 傅光明家族 | E552: 64.099999999999994 | F552: 男 | G552: =INT(RC[1]/10)*10 -> 60 | H552: 60 | I552: 圣农实业 | J552: 福建 | K552: 南平 | L552: 饲养加工
A553: 552 | B553: 2013 | C553: 151 | D553: 黄红云家族 | E553: 64.099999999999994 | F553: 男 | G553: =INT(RC[1]/10)*10 -> 40 | H553: 47 | I553: 金科实业 | J553: 重庆 | K553: 重庆 | L553: 房地产
A554: 553 | B554: 2013 | C554: 153 | D554: 叶远西父子 | E554: 63.4 | F554: 男 | G554: =INT(RC[1]/10)*10 -> 50 | H554: 50 | I554: 广田股份 | J554: 广东 | K554: 深圳 | L554: 装修装饰
A555: 554 | B555: 2013 | C555: 154 | D555: 南存辉 | E555: 62.8 | F555: 男 | G555: =INT(RC[1]/10)*10 -> 50 | H555: 50 | I555: 正泰集团 | J555: 浙江 | K555: 温州 | L555: 电器设备制造
A556: 555 | B556: 2013 | C556: 155 | D556: 陈泽民家族 | E556: 62.2 | F556: 男 | G556: =INT(RC[1]/10)*10 -> 70 | H556: 70 | I556: 三全食品 | J556: 河南 | K556: 郑州 | L556: 速冻食品、餐饮连锁
A557: 556 | B557: 2013 | C557: 156 | D557: 杜江涛夫妇 | E557: 61 | F557: 男 | G557: =INT(RC[1]/10)*10 -> 40 | H557: 43 | I557: 内蒙君正、博晖创新 | J557: 北京 | K557: 北京 | L557: 能源
A558: 557 | B558: 2013 | C558: 156 | D558: 齐向东 | E558: 61 | F558: 男 | G558: =INT(RC[1]/10)*10 -> 40 | H558: 43 | I558: 奇虎360 | J558: 北京 | K558: 北京 | L558: 互联网及软件
A559: 558 | B559: 2013 | C559: 156 | D559: 黄其森 | E559: 61 | F559: 男 | G559: =INT(RC[1]/10)*10 -> 40 | H559: 48 | I559: 泰禾集团 | J559: 福建 | K559: 福州 | L559: 房地产、投资
A560: 559 | B560: 2013 | C560: 156 | D560: 周泽荣 | E560: 61 | F560: 男 | G560: =INT(RC[1]/10)*10 -> 50 | H560: 59 | I560: 侨鑫集团 | J560: 广东 | K560: 广州 | L560: 房地产、餐饮、媒体
A561: 560 | B561: 2013 | C561: 156 | D561: 车冯升 | E561: 61 | F561: 男 | G561: =INT(RC[1]/10)*10 -> 50 | H561: 50 | I561: 四环医药控股集团 | J561: 海南 | K561: 海口 | L561: 医药
A562: 561 | B562: 2013 | C562: 156 | D562: 朱文臣 | E562: 61 | F562: 男 | G562: =INT(RC[1]/10)*10 -> 40 | H562: 47 | I562: 辅仁药业集团 | J562: 河南 | K562: 郑州 | L562: 医药、酒精饮料
A563: 562 | B563: 2013 | C563: 156 | D563: 高振东 | E563: 61 | F563: 男 | G563: =INT(RC[1]/10)*10 -> 40 | H563: 48 | I563: 苏州宝时得电动工具 | J563: 江苏 | K563: 苏州 | L563: 工具制造
A564: 563 | B564: 2013 | C564: 156 | D564: 牛宜顺家族 | E564: 61 | F564: 男 | G564: =INT(RC[1]/10)*10 -> 50 | H564: 58 | I564: 华勤橡胶工业集团 | J564: 山东 | K564: 兖州 | L564: 橡胶制造
A565: 564 | B565: 2013 | C565: 156 | D565: 王清涛 | E565: 61 | F565: 男 | G565: =INT(RC[1]/10)*10 -> 50 | H565: 51 | I565: 山东焦化集团 | J565: 山东 | K565: 济南 | L565: 能源
A566: 565 | B566: 2013 | C566: 156 | D566: 王勇家族 | E566: 61 | F566: 男 | G566: =INT(RC[1]/10)*10 -> 60 | H566: 63 | I566: 西王集团 | J566: 山东 | K566: 滨州 | L566: 糖业、钢铁
A567: 566 | B567: 2013 | C567: 156 | D567: 何俊明夫妇 | E567: 61 | F567: 男 | G567: =INT(RC[1]/10)*10 -> 50 | H567: 55 | I567: 四川科创集团 | J567: 四川 | K567: 成都 | L567: 医药
A568: 567 | B568: 2013 | C568: 156 | D568: 林刚 | E568: 61 | F568: 男 | G568: =INT(RC[1]/10)*10 -> 40 | H568: 49 | I568: 康哲药业控股 | J568: 香港 | K568: 香港 | L568: 医药
A569: 568 | B569: 2013 | C569: 156 | D569: 李水荣 | E569: 61 | F569: 男 | G569: =INT(RC[1]/10)*10 -> 50 | H569: 57 | I569: 浙江荣盛控股集团 | J569: 浙江 | K569: 杭州 | L569: 化工
A570: 569 | B570: 2013 | C570: 169 | D570: 黄怒波 | E570: 60.4 | F570: 男 | G570: =INT(RC[1]/10)*10 -> 50 | H570: 57 | I570: 中坤集团 | J570: 北京 | K570: 北京 | L570: 房地产、旅游
A571: 570 | B571: 2013 | C571: 170 | D571: 安康 | E571: 59.8 | F571: 男 | G571: =INT(RC[1]/10)*10 -> 60 | H571: 64 | I571: 华兰生物 | J571: 河南 | K571: 新乡 | L571: 生物医药
A572: 571 | B572: 2013 | C572: 170 | D572: 周建平家族 | E572: 59.8 | F572: 男 | G572: =INT(RC[1]/10)*10 -> 50 | H572: 53 | I572: 海澜集团 | J572: 江苏 | K572: 江阴 | L572: 服装服饰
A573: 572 | B573: 2013 | C573: 172 | D573: 戚金兴父子 | E573: 59.5 | F573: 男 | G573: =INT(RC[1]/10)*10 -> 50 | H573: 51 | I573: 滨江集团 | J573: 浙江 | K573: 杭州 | L573: 房地产
A574: 573 | B574: 2013 | C574: 173 | D574: 李留法家族 | E574: 59.2 | F574: 男 | G574: =INT(RC[1]/10)*10 -> 50 | H574: 56 | I574: 天瑞集团 | J574: 河南 | K574: 汝州 | L574: 多元化
A575: 574 | B575: 2013 | C575: 173 | D575: 刘贞峰 | E575: 59.2 | F575: 男 | G575: =INT(RC[1]/10)*10 -> 50 | H575: 52 | I575: 杰瑞股份 | J575: 山东 | K575: 烟台 | L575: 油田矿山设备制造
A576: 575 | B576: 2013 | C576: 175 | D576: 陆克平家族 | E576: 58.9 | F576: 男 | G576: =INT(RC[1]/10)*10 -> 60 | H576: 69 | I576: 江苏阳光集团 | J576: 江苏 | K576: 江阴 | L576: 纺织、太阳能
A577: 576 | B577: 2013 | C577: 175 | D577: 仇建平夫妇 | E577: 58.9 | F577: 男 | G577: =INT(RC[1]/10)*10 -> 50 | H577: 51 | I577: 巨星科技 | J577: 浙江 | K577: 杭州 | L577: 工具制造
A578: 577 | B578: 2013 | C578: 177 | D578: 张克强 | E578: 58.6 | F578: 男 | G578: =INT(RC[1]/10)*10 -> 50 | H578: 53 | I578: 广东华美国际投资集团 | J578: 广东 | K578: 广州 | L578: 教育、投资
A579: 578 | B579: 2013 | C579: 177 | D579: 姜伟 | E579: 58.6 | F579: 男 | G579: =INT(RC[1]/10)*10 -> 50 | H579: 51 | I579: 贵州百灵 | J579: 贵州 | K579: 安顺 | L579: 医药、房地产
A580: 579 | B580: 2013 | C580: 177 | D580: 黄立家族 | E580: 58.6 | F580: 男 | G580: =INT(RC[1]/10)*10 -> 50 | H580: 50 | I580: 高德红外 | J580: 湖北 | K580: 武汉 | L580: 电子元器件制造
A581: 580 | B581: 2013 | C581: 177 | D581: 陈邦 | E581: 58.6 | F581: 男 | G581: =INT(RC[1]/10)*10 -> 40 | H581: 48 | I581: 爱尔眼科 | J581: 湖南 | K581: 长沙 | L581: 专科医院
A582: 581 | B582: 2013 | C582: 181 | D582: 丁世忠 | E582: 58 | F582: 男 | G582: =INT(RC[1]/10)*10 -> 40 | H582: 42 | I582: 安踏体育 | J582: 福建 | K582: 泉州 | L582: 运动服饰及体育用品
A583: 582 | B583: 2013 | C583: 181 | D583: 孔健岷 | E583: 58 | F583: 男 | G583: =INT(RC[1]/10)*10 -> 40 | H583: 45 | I583: 合景泰富地产 | J583: 广东 | K583: 广州 | L583: 房地产
A584: 583 | B584: 2013 | C584: 181 | D584: 罗飞 | E584: 58 | F584: 男 | G584: / | H584: / | I584: 合生元 | J584: 广东 | K584: 广州 | L584: 乳制品
A585: 584 | B585: 2013 | C585: 181 | D585: 阮水龙家族 | E585: 58 | F585: 男 | G585: =INT(RC[1]/10)*10 -> 70 | H585: 77 | I585: 浙江龙盛 | J585: 浙江 | K585: 上虞 | L585: 化工
A586: 585 | B586: 2013 | C586: 185 | D586: 张茵 | E586: 57.6 | F586: 女 | G586: =INT(RC[1]/10)*10 -> 50 | H586: 56 | I586: 玖龙纸业 | J586: 广东 | K586: 东莞 | L586: 造纸
A587: 586 | B587: 2013 | C587: 186 | D587: 胡柏藩 | E587: 57.3 | F587: 男 | G587: =INT(RC[1]/10)*10 -> 50 | H587: 51 | I587: 新和成控股集团 | J587: 浙江 | K587: 绍兴 | L587: 医药
A588: 587 | B588: 2013 | C588: 187 | D588: 刘载望家族 | E588: 56.7 | F588: 男 | G588: =INT(RC[1]/10)*10 -> 40 | H588: 41 | I588: 江河幕墙 | J588: 北京 | K588: 北京 | L588: 装修装饰
A589: 588 | B589: 2013 | C589: 187 | D589: 刘建民夫妇 | E589: 56.7 | F589: 男 | G589: =INT(RC[1]/10)*10 -> 60 | H589: 60 | I589: 甘肃建新实业集团 | J589: 甘肃 | K589: 兰州 | L589: 有色金属
A590: 589 | B590: 2013 | C590: 187 | D590: 黄茂如夫妇 | E590: 56.7 | F590: 男 | G590: =INT(RC[1]/10)*10 -> 40 | H590: 48 | I590: 茂业集团 | J590: 广东 | K590: 深圳 | L590: 房地产、百货、零售
A591: 590 | B591: 2013 | C591: 187 | D591: 李银会 | E591: 56.7 | F591: 男 | G591: =INT(RC[1]/10)*10 -> 40 | H591: 47 | I591: 青青稞酒 | J591: 青海 | K591: 西宁 | L591: 酒精饮料
A592: 591 | B592: 2013 | C592: 187 | D592: 尹明善家族 | E592: 56.7 | F592: 男 | G592: =INT(RC[1]/10)*10 -> 70 | H592: 75 | I592: 力帆集团 | J592: 重庆 | K592: 重庆 | L592: 摩托车制造、汽车制造
A593: 592 | B593: 2013 | C593: 192 | D593: 范秀莲 | E593: 56.4 | F593: 女 | G593: =INT(RC[1]/10)*10 -> 40 | H593: 49 | I593: 西藏海思科药业 | J593: 辽宁 | K593: 沈阳 | L593: 医药
A594: 593 | B594: 2013 | C594: 193 | D594: 任正非 | E594: 56.1 | F594: 男 | G594: =INT(RC[1]/10)*10 -> 60 | H594: 69 | I594: 华为技术 | J594: 广东 | K594: 深圳 | L594: 通信
A595: 594 | B595: 2013 | C595: 194 | D595: 徐明波 | E595: 55.8 | F595: 男 | G595: =INT(RC[1]/10)*10 -> 40 | H595: 49 | I595: 双鹭药业 | J595: 北京 | K595: 北京 | L595: 医药
A596: 595 | B596: 2013 | C596: 194 | D596: 丁世家 | E596: 55.8 | F596: 男 | G596: =INT(RC[1]/10)*10 -> 40 | H596: 49 | I596: 安踏体育 | J596: 福建 | K596: 泉州 | L596: 运动服饰及体育用品
A597: 596 | B597: 2013 | C597: 194 | D597: 徐其明 | E597: 55.8 | F597: 男 | G597: =INT(RC[1]/10)*10 -> 50 | H597: 50 | I597: 徐龙集团 | J597: 浙江 | K597: 宁波 | L597: 养殖加工、收藏
A598: 597 | B598: 2013 | C598: 197 | D598: 胡凯军 | E598: 55.5 | F598: 男 | G598: / | H598: / | I598: 中国远大集团 | J598: 北京 | K598: 北京 | L598: 投资
A599: 598 | B599: 2013 | C599: 197 | D599: 尤小平父子 | E599: 55.5 | F599: 男 | G599: =INT(RC[1]/10)*10 -> 50 | H599: 55 | I599: 华峰集团 | J599: 浙江 | K599: 温州 | L599: 化工
A600: 599 | B600: 2013 | C600: 199 | D600: 俞培俤家族 | E600: 55.2 | F600: 男 | G600: =INT(RC[1]/10)*10 -> 50 | H600: 53 | I600: 大名城 | J600: 福建 | K600: 福州 | L600: 房地产
A601: 600 | B601: 2013 | C601: 200 | D601: 李华 | E601: 54.9 | F601: 男 | G601: =INT(RC[1]/10)*10 -> 40 | H601: 47 | I601: 卓越集团 | J601: 广东 | K601: 深圳 | L601: 房地产
A602: 601 | B602: 2013 | C602: 200 | D602: 张跃 | E602: 54.9 | F602: 男 | G602: =INT(RC[1]/10)*10 -> 50 | H602: 53 | I602: 远大空调 | J602: 湖南 | K602: 长沙 | L602: 家电制造
A603: 602 | B603: 2013 | C603: 200 | D603: 修涞贵 | E603: 54.9 | F603: 男 | G603: =INT(RC[1]/10)*10 -> 50 | H603: 59 | I603: 修正药业集团 | J603: 吉林 | K603: 通化 | L603: 医药
A604: 603 | B604: 2013 | C604: 200 | D604: 赵步长父子 | E604: 54.9 | F604: 男 | G604: =INT(RC[1]/10)*10 -> 70 | H604: 70 | I604: 步长集团 | J604: 陕西 | K604: 西安 | L604: 医药
A605: 604 | B605: 2013 | C605: 200 | D605: 江南春 | E605: 54.9 | F605: 男 | G605: =INT(RC[1]/10)*10 -> 40 | H605: 40 | I605: 分众传媒 | J605: 上海 | K605: 上海 | L605: 数字户外传媒
A606: 605 | B606: 2013 | C606: 200 | D606: 刘益谦 | E606: 54.9 | F606: 男 | G606: =INT(RC[1]/10)*10 -> 40 | H606: 49 | I606: 新理益集团 | J606: 上海 | K606: 上海 | L606: 投资
A607: 606 | B607: 2013 | C607: 200 | D607: 刘沧龙 | E607: 54.9 | F607: 男 | G607: =INT(RC[1]/10)*10 -> 50 | H607: 58 | I607: 四川宏达集团 | J607: 四川 | K607: 成都 | L607: 冶金、矿业、化工
A608: 607 | B608: 2013 | C608: 200 | D608: 荣智健 | E608: 54.9 | F608: 男 | G608: =INT(RC[1]/10)*10 -> 70 | H608: 71 | I608: 中信泰富 | J608: 香港 | K608: 香港 | L608: 投资
A609: 608 | B609: 2013 | C609: 208 | D609: 董现君家族 | E609: 54.3 | F609: 男 | G609: =INT(RC[1]/10)*10 -> 50 | H609: 50 | I609: 江苏华厦融创置地集团 | J609: 江苏 | K609: 徐州 | L609: 房地产
A610: 609 | B610: 2013 | C610: 208 | D610: 陈金凤 | E610: 54.3 | F610: 女 | G610: =INT(RC[1]/10)*10 -> 50 | H610: 50 | I610: 苏宁云商集团 | J610: 江苏 | K610: 南京 | L610: 家电零售
A611: 610 | B611: 2013 | C611: 208 | D611: 冯海良 | E611: 54.3 | F611: 男 | G611: =INT(RC[1]/10)*10 -> 50 | H611: 53 | I611: 海亮集团 | J611: 浙江 | K611: 诸暨 | L611: 有色金属、房地产
A612: 611 | B612: 2013 | C612: 211 | D612: 吴雄 | E612: 53.7 | F612: 男 | G612: / | H612: / | I612: 合生元 | J612: 广东 | K612: 广州 | L612: 乳制品
A613: 612 | B613: 2013 | C613: 211 | D613: 韩国龙家族 | E613: 53.7 | F613: 男 | G613: =INT(RC[1]/10)*10 -> 50 | H613: 58 | I613: 香港冠城集团 | J613: 香港 | K613: 香港 | L613: 房地产
A614: 613 | B614: 2013 | C614: 211 | D614: 郑元豹 | E614: 53.7 | F614: 男 | G614: =INT(RC[1]/10)*10 -> 50 | H614: 55 | I614: 人民电器集团 | J614: 浙江 | K614: 温州 | L614: 电器设备制造
A615: 614 | B615: 2013 | C615: 214 | D615: 曹龙祥家族 | E615: 53.4 | F615: 男 | G615: =INT(RC[1]/10)*10 -> 50 | H615: 56 | I615: 济川药业集团 | J615: 江苏 | K615: 泰兴 | L615: 医药
A616: 615 | B616: 2013 | C616: 214 | D616: 王金书 | E616: 53.4 | F616: 男 | G616: =INT(RC[1]/10)*10 -> 50 | H616: 56 | I616: 山东玉皇化工集团 | J616: 山东 | K616: 菏泽 | L616: 化工
A617: 616 | B617: 2013 | C617: 214 | D617: 姚新义 | E617: 53.4 | F617: 男 | G617: =INT(RC[1]/10)*10 -> 40 | H617: 48 | I617: 盾安集团 | J617: 浙江 | K617: 杭州 | L617: 装备制造、化工、房地产、能源
A618: 617 | B618: 2013 | C618: 217 | D618: 杨贰珠 | E618: 53.1 | F618: 男 | G618: =INT(RC[1]/10)*10 -> 60 | H618: 62 | I618: 碧桂园 | J618: 广东 | K618: 佛山 | L618: 房地产
A619: 618 | B619: 2013 | C619: 217 | D619: 贺正刚 | E619: 53.1 | F619: 男 | G619: =INT(RC[1]/10)*10 -> 50 | H619: 59 | I619: 和邦股份 | J619: 四川 | K619: 乐山 | L619: 化工
A620: 619 | B620: 2013 | C620: 217 | D620: 苏增福父子 | E620: 53.1 | F620: 男 | G620: =INT(RC[1]/10)*10 -> 70 | H620: 72 | I620: 苏泊尔集团 | J620: 浙江 | K620: 杭州 | L620: 家用电器制造
A621: 620 | B621: 2013 | C621: 220 | D621: 王来胜 | E621: 52.5 | F621: 男 | G621: =INT(RC[1]/10)*10 -> 40 | H621: 48 | I621: 立讯精密 | J621: 广东 | K621: 深圳 | L621: 电子元器件制造
A622: 621 | B622: 2013 | C622: 220 | D622: 袁志敏家族 | E622: 52.5 | F622: 男 | G622: =INT(RC[1]/10)*10 -> 50 | H622: 52 | I622: 金发科技 | J622: 广东 | K622: 广州 | L622: 化工、投资
A623: 622 | B623: 2013 | C623: 220 | D623: 王来春 | E623: 52.5 | F623: 女 | G623: =INT(RC[1]/10)*10 -> 40 | H623: 46 | I623: 立讯精密 | J623: 广东 | K623: 深圳 | L623: 电子元器件制造
A624: 623 | B624: 2013 | C624: 220 | D624: 于泳 | E624: 52.5 | F624: 男 | G624: =INT(RC[1]/10)*10 -> 50 | H624: 52 | I624: 上海鸿商产业控股集团 | J624: 上海 | K624: 上海 | L624: 投资
A625: 624 | B625: 2013 | C625: 224 | D625: 姚新泉 | E625: 52.2 | F625: 男 | G625: =INT(RC[1]/10)*10 -> 40 | H625: 46 | I625: 盾安集团 | J625: 浙江 | K625: 杭州 | L625: 装备制造、化工、房地产、能源
A626: 625 | B626: 2013 | C626: 225 | D626: 张志祥 | E626: 51.9 | F626: 男 | G626: =INT(RC[1]/10)*10 -> 40 | H626: 46 | I626: 北京建龙重工集团 | J626: 北京 | K626: 北京 | L626: 钢铁、造船、矿业
A627: 626 | B627: 2013 | C627: 225 | D627: 陈建强 | E627: 51.9 | F627: 男 | G627: =INT(RC[1]/10)*10 -> 50 | H627: 55 | I627: 华地国际 | J627: 香港 | K627: 香港 | L627: 商业地产、零售
A628: 627 | B628: 2013 | C628: 225 | D628: 杨卫东家族 | E628: 51.9 | F628: 男 | G628: =INT(RC[1]/10)*10 -> 40 | H628: 45 | I628: 浙江卫星石化 | J628: 浙江 | K628: 嘉兴 | L628: 医药
A629: 628 | B629: 2013 | C629: 228 | D629: 吕莉家族 | E629: 51.5 | F629: 女 | G629: =INT(RC[1]/10)*10 -> 30 | H629: 37 | I629: 安洁科技 | J629: 江苏 | K629: 苏州 | L629: 电子元器件制造
A630: 629 | B630: 2013 | C630: 228 | D630: 宋卫平夫妇 | E630: 51.5 | F630: 男 | G630: =INT(RC[1]/10)*10 -> 50 | H630: 55 | I630: 绿城集团 | J630: 浙江 | K630: 杭州 | L630: 房地产
A631: 630 | B631: 2013 | C631: 230 | D631: 周耀庭家族 | E631: 51.2 | F631: 男 | G631: =INT(RC[1]/10)*10 -> 70 | H631: 70 | I631: 红豆集团 | J631: 江苏 | K631: 无锡 | L631: 房地产、服装
A632: 631 | B632: 2013 | C632: 230 | D632: 刘满世家族 | E632: 51.2 | F632: 男 | G632: =INT(RC[1]/10)*10 -> 60 | H632: 64 | I632: 内蒙古满世煤炭集团 | J632: 内蒙古 | K632: 鄂尔多斯 | L632: 能源、化工、房地产
A633: 632 | B633: 2013 | C633: 230 | D633: 孙平范 | E633: 51.2 | F633: 男 | G633: =INT(RC[1]/10)*10 -> 40 | H633: 43 | I633: 慈星股份 | J633: 浙江 | K633: 宁波 | L633: 专用设备制造
A634: 633 | B634: 2013 | C634: 233 | D634: 阮加根家族 | E634: 50.9 | F634: 男 | G634: =INT(RC[1]/10)*10 -> 50 | H634: 53 | I634: 浙江闰土 | J634: 浙江 | K634: 上虞 | L634: 化工
A635: 634 | B635: 2013 | C635: 234 | D635: 欧宗荣 | E635: 50.3 | F635: 男 | G635: =INT(RC[1]/10)*10 -> 40 | H635: 49 | I635: 正荣集团 | J635: 福建 | K635: 福州 | L635: 房地产
A636: 635 | B636: 2013 | C636: 234 | D636: 洪天祝 | E636: 50.3 | F636: 男 | G636: =INT(RC[1]/10)*10 -> 40 | H636: 45 | I636: 天虹纺织 | J636: 上海 | K636: 上海 | L636: 纺织
A637: 636 | B637: 2013 | C637: 236 | D637: 黄楚龙 | E637: 50 | F637: 男 | G637: / | H637: / | I637: 星河集团 | J637: 广东 | K637: 深圳 | L637: 房地产
A638: 637 | B638: 2013 | C638: 236 | D638: 李国强 | E638: 50 | F638: 男 | G638: =INT(RC[1]/10)*10 -> 40 | H638: 49 | I638: 中升集团 | J638: 辽宁 | K638: 大连 | L638: 汽车销售
A639: 638 | B639: 2013 | C639: 236 | D639: 王文良 | E639: 50 | F639: 男 | G639: =INT(RC[1]/10)*10 -> 50 | H639: 58 | I639: 日林实业集团 | J639: 辽宁 | K639: 丹东 | L639: 港口经营、造纸、建筑装饰
A640: 639 | B640: 2013 | C640: 236 | D640: 崔志祥 | E640: 50 | F640: 男 | G640: =INT(RC[1]/10)*10 -> 50 | H640: 50 | I640: 东营方圆有色金属 | J640: 山东 | K640: 东营 | L640: 有色金属
A641: 640 | B641: 2013 | C641: 236 | D641: 车建新 | E641: 50 | F641: 男 | G641: =INT(RC[1]/10)*10 -> 40 | H641: 47 | I641: 红星美凯龙 | J641: 上海 | K641: 上海 | L641: 商业地产、家居流通
A642: 641 | B642: 2013 | C642: 236 | D642: 其实家族 | E642: 50 | F642: 男 | G642: =INT(RC[1]/10)*10 -> 40 | H642: 43 | I642: 东方财富 | J642: 上海 | K642: 上海 | L642: 互联网金融服务
A643: 642 | B643: 2013 | C643: 236 | D643: 陈鸿道家族 | E643: 50 | F643: 男 | G643: / | H643: / | I643: 加多宝集团 | J643: 香港 | K643: 香港 | L643: 饮料
A644: 643 | B644: 2013 | C644: 236 | D644: 牟金香 | E644: 50 | F644: 女 | G644: =INT(RC[1]/10)*10 -> 50 | H644: 59 | I644: 联化科技 | J644: 浙江 | K644: 台州 | L644: 化工
A645: 644 | B645: 2013 | C645: 244 | D645: 李振江 | E645: 49.7 | F645: 男 | G645: =INT(RC[1]/10)*10 -> 50 | H645: 57 | I645: 神威药业 | J645: 河北 | K645: 石家庄 | L645: 医药
A646: 645 | B646: 2013 | C646: 244 | D646: 林聪颖 | E646: 49.7 | F646: 男 | G646: =INT(RC[1]/10)*10 -> 50 | H646: 52 | I646: 九牧王 | J646: 香港 | K646: 香港 | L646: 服装服饰
A647: 646 | B647: 2013 | C647: 246 | D647: 田明 | E647: 49.4 | F647: 男 | G647: =INT(RC[1]/10)*10 -> 50 | H647: 59 | I647: 美亚光电 | J647: 安徽 | K647: 合肥 | L647: 专业设备制造
A648: 647 | B648: 2013 | C648: 246 | D648: 王文京 | E648: 49.4 | F648: 男 | G648: =INT(RC[1]/10)*10 -> 40 | H648: 48 | I648: 用友软件 | J648: 北京 | K648: 北京 | L648: 软件
A649: 648 | B649: 2013 | C649: 246 | D649: 缪汉根家族 | E649: 49.4 | F649: 男 | G649: =INT(RC[1]/10)*10 -> 40 | H649: 48 | I649: 盛虹集团 | J649: 江苏 | K649: 苏州 | L649: 化工、热点、房地产
A650: 649 | B650: 2013 | C650: 246 | D650: 孙喜双 | E650: 49.4 | F650: 男 | G650: =INT(RC[1]/10)*10 -> 60 | H650: 60 | I650: 大连一方集团 | J650: 辽宁 | K650: 大连 | L650: 房地产
A651: 650 | B651: 2013 | C651: 250 | D651: 吴征 | E651: 48.8 | F651: 男 | G651: =INT(RC[1]/10)*10 -> 40 | H651: 47 | I651: 阳光媒体集团 | J651: 北京 | K651: 北京 | L651: 文化娱乐
A652: 651 | B652: 2013 | C652: 250 | D652: 杨元庆 | E652: 48.8 | F652: 男 | G652: =INT(RC[1]/10)*10 -> 40 | H652: 49 | I652: 联想集团 | J652: 北京 | K652: 北京 | L652: 电子设备制造
A653: 652 | B653: 2013 | C653: 250 | D653: 易小迪 | E653: 48.8 | F653: 男 | G653: =INT(RC[1]/10)*10 -> 40 | H653: 49 | I653: 阳光100 | J653: 北京 | K653: 北京 | L653: 房地产
A654: 653 | B654: 2013 | C654: 250 | D654: 朱新礼 | E654: 48.8 | F654: 男 | G654: =INT(RC[1]/10)*10 -> 60 | H654: 61 | I654: 汇源果汁 | J654: 北京 | K654: 北京 | L654: 饮料
A655: 654 | B655: 2013 | C655: 250 | D655: 梁昭贤 | E655: 48.8 | F655: 男 | G655: =INT(RC[1]/10)*10 -> 40 | H655: 48 | I655: 格兰仕 | J655: 广东 | K655: 佛山 | L655: 家用电器制造
A656: 655 | B656: 2013 | C656: 250 | D656: 高彦明 | E656: 48.8 | F656: 男 | G656: =INT(RC[1]/10)*10 -> 50 | H656: 56 | I656: 河北远洋运输集团 | J656: 河北 | K656: 秦皇岛 | L656: 海运
A657: 656 | B657: 2013 | C657: 250 | D657: 王超斌 | E657: 48.8 | F657: 男 | G657: =INT(RC[1]/10)*10 -> 50 | H657: 57 | I657: 中陆物流 | J657: 河南 | K657: 郑州 | L657: 房地产、物流
A658: 657 | B658: 2013 | C658: 250 | D658: 曲乃杰 | E658: 48.8 | F658: 男 | G658: =INT(RC[1]/10)*10 -> 50 | H658: 53 | I658: 海昌集团 | J658: 辽宁 | K658: 大连 | L658: 旅游、海运、石化
A659: 658 | B659: 2013 | C659: 250 | D659: 李登海 | E659: 48.8 | F659: 男 | G659: =INT(RC[1]/10)*10 -> 60 | H659: 64 | I659: 登海种业 | J659: 山东 | K659: 莱州 | L659: 农业
A660: 659 | B660: 2013 | C660: 250 | D660: 沈南鹏 | E660: 48.8 | F660: 男 | G660: =INT(RC[1]/10)*10 -> 40 | H660: 44 | I660: 红杉资本 | J660: 上海 | K660: 上海 | L660: 投资
A661: 660 | B661: 2013 | C661: 250 | D661: 叶立培家族 | E661: 48.8 | F661: 男 | G661: =INT(RC[1]/10)*10 -> 60 | H661: 69 | I661: 仲盛集团 | J661: 上海 | K661: 上海 | L661: 房地产
A662: 661 | B662: 2013 | C662: 250 | D662: 赵长甲 | E662: 48.8 | F662: 男 | G662: =INT(RC[1]/10)*10 -> 50 | H662: 55 | I662: 长甲集团 | J662: 上海 | K662: 上海 | L662: 房地产
A663: 662 | B663: 2013 | C663: 250 | D663: 蒋业华 | E663: 48.8 | F663: 男 | G663: =INT(RC[1]/10)*10 -> 50 | H663: 50 | I663: 重庆华宇集团 | J663: 重庆 | K663: 重庆 | L663: 房地产
A664: 663 | B664: 2013 | C664: 263 | D664: 朱保国家族 | E664: 48.5 | F664: 男 | G664: =INT(RC[1]/10)*10 -> 50 | H664: 51 | I664: 健康元药业 | J664: 广东 | K664: 深圳 | L664: 医药
A665: 664 | B665: 2013 | C665: 264 | D665: 傅军 | E665: 48.2 | F665: 男 | G665: =INT(RC[1]/10)*10 -> 50 | H665: 56 | I665: 新华联集团 | J665: 北京 | K665: 北京 | L665: 房地产、陶瓷、投资
A666: 665 | B666: 2013 | C666: 264 | D666: 李喜朋夫妇 | E666: 48.2 | F666: 男 | G666: =INT(RC[1]/10)*10 -> 40 | H666: 49 | I666: 盛润控股 | J666: 河南 | K666: 郑州 | L666: 基础设施建设、能源
A667: 666 | B667: 2013 | C667: 264 | D667: 许晓明 | E667: 48.2 | F667: 男 | G667: =INT(RC[1]/10)*10 -> 50 | H667: 50 | I667: 南国置业 | J667: 湖北 | K667: 武汉 | L667: 房地产
A668: 667 | B668: 2013 | C668: 264 | D668: 昝圣达 | E668: 48.2 | F668: 男 | G668: =INT(RC[1]/10)*10 -> 50 | H668: 50 | I668: 综艺集团 | J668: 江苏 | K668: 南通 | L668: 太阳能、投资、计算机应用服务
A669: 668 | B669: 2013 | C669: 264 | D669: 柳长庆家族 | E669: 48.2 | F669: 男 | G669: =INT(RC[1]/10)*10 -> 60 | H669: 60 | I669: 聚龙股份 | J669: 辽宁 | K669: 鞍山 | L669: 专用设备制造
A670: 669 | B670: 2013 | C670: 264 | D670: 王建沂 | E670: 48.2 | F670: 男 | G670: =INT(RC[1]/10)*10 -> 50 | H670: 50 | I670: 富通集团 | J670: 浙江 | K670: 杭州 | L670: 通信、金属线缆产业
A671: 670 | B671: 2013 | C671: 270 | D671: 盛百椒 | E671: 47.6 | F671: 男 | G671: =INT(RC[1]/10)*10 -> 60 | H671: 61 | I671: 百丽 | J671: 广东 | K671: 深圳 | L671: 制鞋
A672: 671 | B672: 2013 | C672: 270 | D672: 唐修国 | E672: 47.6 | F672: 男 | G672: =INT(RC[1]/10)*10 -> 50 | H672: 50 | I672: 三一集团 | J672: 湖南 | K672: 长沙 | L672: 机械装备制造
A673: 672 | B673: 2013 | C673: 270 | D673: 张道才家族 | E673: 47.6 | F673: 男 | G673: =INT(RC[1]/10)*10 -> 60 | H673: 63 | I673: 三花集团 | J673: 浙江 | K673: 绍兴 | L673: 房地产、制冷、汽车零部件
A674: 673 | B674: 2013 | C674: 273 | D674: 徐子泉夫妇 | E674: 47.3 | F674: 男 | G674: =INT(RC[1]/10)*10 -> 50 | H674: 55 | I674: 捷成世纪科技 | J674: 北京 | K674: 北京 | L674: 数字媒体解决方案
A675: 674 | B675: 2013 | C675: 273 | D675: 吴冠江 | E675: 47.3 | F675: 男 | G675: =INT(RC[1]/10)*10 -> 40 | H675: 44 | I675: 智飞生物 | J675: 重庆 | K675: 重庆 | L675: 生物医药
A676: 675 | B676: 2013 | C676: 275 | D676: 杨卓舒 | E676: 47 | F676: 男 | G676: =INT(RC[1]/10)*10 -> 60 | H676: 60 | I676: 卓达集团 | J676: 河北 | K676: 石家庄 | L676: 房地产
A677: 676 | B677: 2013 | C677: 275 | D677: 汪立平家族 | E677: 47 | F677: 男 | G677: =INT(RC[1]/10)*10 -> 40 | H677: 47 | I677: 恒立油缸 | J677: 江苏 | K677: 常州 | L677: 通用设备制造业
A678: 677 | B678: 2013 | C678: 275 | D678: 李兆会 | E678: 47 | F678: 男 | G678: =INT(RC[1]/10)*10 -> 30 | H678: 32 | I678: 海鑫实业 | J678: 山西 | K678: 运城 | L678: 钢铁、金融
A679: 678 | B679: 2013 | C679: 278 | D679: 陈奇星 | E679: 46.7 | F679: 男 | G679: =INT(RC[1]/10)*10 -> 50 | H679: 53 | I679: 长盈精密 | J679: 广东 | K679: 深圳 | L679: 电子元器件制造
A680: 679 | B680: 2013 | C680: 278 | D680: 寿柏年 | E680: 46.7 | F680: 男 | G680: =INT(RC[1]/10)*10 -> 50 | H680: 59 | I680: 绿城集团 | J680: 浙江 | K680: 杭州 | L680: 房地产
A681: 680 | B681: 2013 | C681: 280 | D681: 朱吉满夫妇 | E681: 46.4 | F681: 男 | G681: =INT(RC[1]/10)*10 -> 40 | H681: 49 | I681: 誉衡药业 | J681: 黑龙江 | K681: 哈尔滨 | L681: 医药
A682: 681 | B682: 2013 | C682: 281 | D682: 张秀根家族 | E682: 45.8 | F682: 男 | G682: / | H682: / | I682: 华泰汽车 | J682: 北京 | K682: 北京 | L682: 汽车制造
A683: 682 | B683: 2013 | C683: 281 | D683: 洪肇明家族 | E683: 45.8 | F683: 男 | G683: =INT(RC[1]/10)*10 -> 70 | H683: 78 | I683: 劲霸男装 | J683: 福建 | K683: 晋江 | L683: 服装服饰
A684: 683 | B684: 2013 | C684: 281 | D684: 岑钊雄 | E684: 45.8 | F684: 男 | G684: =INT(RC[1]/10)*10 -> 40 | H684: 43 | I684: 时代地产 | J684: 广东 | K684: 广州 | L684: 房地产
A685: 684 | B685: 2013 | C685: 281 | D685: 杨休 | E685: 45.8 | F685: 男 | G685: =INT(RC[1]/10)*10 -> 50 | H685: 52 | I685: 江苏天地集团 | J685: 江苏 | K685: 徐州 | L685: 房地产、博物馆
A686: 685 | B686: 2013 | C686: 281 | D686: 陈大年 | E686: 45.8 | F686: 男 | G686: =INT(RC[1]/10)*10 -> 30 | H686: 35 | I686: 盛大网络 | J686: 上海 | K686: 上海 | L686: 网络游戏
A687: 686 | B687: 2013 | C687: 281 | D687: 陈荣 | E687: 45.8 | F687: 男 | G687: =INT(RC[1]/10)*10 -> 50 | H687: 55 | I687: 中路集团 | J687: 上海 | K687: 上海 | L687: 投资、文化娱乐
A688: 687 | B688: 2013 | C688: 281 | D688: 金惠明家族 | E688: 45.8 | F688: 男 | G688: =INT(RC[1]/10)*10 -> 60 | H688: 60 | I688: 上海大华集团 | J688: 上海 | K688: 上海 | L688: 房地产
A689: 688 | B689: 2013 | C689: 281 | D689: 蒋卫平夫妇 | E689: 45.8 | F689: 男 | G689: =INT(RC[1]/10)*10 -> 50 | H689: 58 | I689: 天齐锂业 | J689: 四川 | K689: 成都 | L689: 锂电池
A690: 689 | B690: 2013 | C690: 281 | D690: 李贤义 | E690: 45.8 | F690: 男 | G690: =INT(RC[1]/10)*10 -> 60 | H690: 61 | I690: 信义玻璃 | J690: 香港 | K690: 香港 | L690: 玻璃制造
A691: 690 | B691: 2013 | C691: 290 | D691: 郝镇熙夫妇 | E691: 45.1 | F691: 男 | G691: =INT(RC[1]/10)*10 -> 40 | H691: 45 | I691: 和佳股份 | J691: 广东 | K691: 珠海 | L691: 医疗设备
A692: 691 | B692: 2013 | C692: 290 | D692: 孙寿宽 | E692: 45.1 | F692: 男 | G692: =INT(RC[1]/10)*10 -> 60 | H692: 64 | I692: 嘉晨集团 | J692: 辽宁 | K692: 营口 | L692: 耐火材料、化工
A693: 692 | B693: 2013 | C693: 290 | D693: 刘长乐 | E693: 45.1 | F693: 男 | G693: =INT(RC[1]/10)*10 -> 60 | H693: 62 | I693: 凤凰卫视 | J693: 香港 | K693: 香港 | L693: 文化娱乐
A694: 693 | B694: 2013 | C694: 293 | D694: 徐传化父子 | E694: 44.8 | F694: 男 | G694: =INT(RC[1]/10)*10 -> 70 | H694: 78 | I694: 传化集团 | J694: 浙江 | K694: 杭州 | L694: 化工、物流、农业、投资
A695: 694 | B695: 2013 | C695: 294 | D695: 张文中 | E695: 44.5 | F695: 男 | G695: =INT(RC[1]/10)*10 -> 50 | H695: 51 | I695: 物美集团 | J695: 北京 | K695: 北京 | L695: 零售、投资
A696: 695 | B696: 2013 | C696: 295 | D696: 蔡荣军 | E696: 44.2 | F696: 男 | G696: =INT(RC[1]/10)*10 -> 40 | H696: 40 | I696: 欧菲光科技 | J696: 广东 | K696: 深圳 | L696: 电子元器件制造
A697: 696 | B697: 2013 | C697: 296 | D697: 周亚仙夫妇 | E697: 43.9 | F697: 女 | G697: =INT(RC[1]/10)*10 -> 50 | H697: 54 | I697: 神冠控股 | J697: 广西 | K697: 梧州 | L697: 食品
A698: 697 | B698: 2013 | C698: 296 | D698: 王以廷 | E698: 43.9 | F698: 男 | G698: =INT(RC[1]/10)*10 -> 60 | H698: 63 | I698: 内蒙古太西煤集团 | J698: 内蒙古 | K698: 阿拉善 | L698: 能源
A699: 698 | B699: 2013 | C699: 296 | D699: 姜龙 | E699: 43.9 | F699: 男 | G699: =INT(RC[1]/10)*10 -> 30 | H699: 39 | I699: 歌尔声学 | J699: 山东 | K699: 潍坊 | L699: 电子元器件制造
A700: 699 | B700: 2013 | C700: 296 | D700: 徐万茂 | E700: 43.9 | F700: 男 | G700: =INT(RC[1]/10)*10 -> 60 | H700: 68 | I700: 宁波华茂 | J700: 浙江 | K700: 宁波 | L700: 教育、金融
A701: 700 | B701: 2013 | C701: 300 | D701: 朱志平 | E701: 43.6 | F701: 男 | G701: =INT(RC[1]/10)*10 -> 50 | H701: 51 | I701: 同方联合控股 | J701: 浙江 | K701: 杭州 | L701: 房地产
A702: 701 | B702: 2013 | C702: 301 | D702: 王伟林夫妇 | E702: 43.3 | F702: 男 | G702: =INT(RC[1]/10)*10 -> 50 | H702: 51 | I702: 华丽家族 | J702: 上海 | K702: 上海 | L702: 房地产
A703: 702 | B703: 2013 | C703: 301 | D703: 陈建成家族 | E703: 43.3 | F703: 男 | G703: =INT(RC[1]/10)*10 -> 50 | H703: 54 | I703: 卧龙电气集团 | J703: 浙江 | K703: 上虞 | L703: 电气设备制造
A704: 703 | B704: 2013 | C704: 303 | D704: 成清波 | E704: 43 | F704: 男 | G704: =INT(RC[1]/10)*10 -> 50 | H704: 51 | I704: 深圳中技实业 | J704: 广东 | K704: 深圳 | L704: 房地产、基础建设、高速公路、商贸
A705: 704 | B705: 2013 | C705: 303 | D705: 黄俊康夫妇 | E705: 43 | F705: 男 | G705: =INT(RC[1]/10)*10 -> 50 | H705: 58 | I705: 莱蒙国际 | J705: 广东 | K705: 深圳 | L705: 房地产、零售
A706: 705 | B706: 2013 | C706: 305 | D706: 陈义红夫妇 | E706: 42.7 | F706: 男 | G706: =INT(RC[1]/10)*10 -> 50 | H706: 55 | I706: 中国动向 | J706: 北京 | K706: 北京 | L706: 运动服饰及体育用品
A707: 706 | B707: 2013 | C707: 305 | D707: 邓伟 | E707: 42.7 | F707: 男 | G707: =INT(RC[1]/10)*10 -> 50 | H707: 50 | I707: 亿阳集团 | J707: 北京 | K707: 北京 | L707: 软件、交通、能源、投资
A708: 707 | B708: 2013 | C708: 305 | D708: 张朝阳 | E708: 42.7 | F708: 男 | G708: =INT(RC[1]/10)*10 -> 40 | H708: 49 | I708: 搜狐 | J708: 北京 | K708: 北京 | L708: 互联网及软件
A709: 708 | B709: 2013 | C709: 305 | D709: 李德文 | E709: 42.7 | F709: 男 | G709: =INT(RC[1]/10)*10 -> 60 | H709: 63 | I709: 金帝集团 | J709: 福建 | K709: 泉州 | L709: 房地产、教育
A710: 709 | B710: 2013 | C710: 305 | D710: 虞阿五父子 | E710: 42.7 | F710: 男 | G710: =INT(RC[1]/10)*10 -> 70 | H710: 71 | I710: 日月首饰 | J710: 福建 | K710: 福清 | L710: 珠宝连锁、房地产、投资
A711: 710 | B711: 2013 | C711: 305 | D711: 李西廷 | E711: 42.7 | F711: 男 | G711: =INT(RC[1]/10)*10 -> 60 | H711: 62 | I711: 迈瑞医疗国际 | J711: 广东 | K711: 深圳 | L711: 医疗设备
A712: 711 | B712: 2013 | C712: 305 | D712: 毛中吾 | E712: 42.7 | F712: 男 | G712: =INT(RC[1]/10)*10 -> 50 | H712: 51 | I712: 三一集团 | J712: 湖南 | K712: 长沙 | L712: 机械装备制造
A713: 712 | B713: 2013 | C713: 305 | D713: 向文波 | E713: 42.7 | F713: 男 | G713: =INT(RC[1]/10)*10 -> 50 | H713: 51 | I713: 三一集团 | J713: 湖南 | K713: 长沙 | L713: 机械装备制造
A714: 713 | B714: 2013 | C714: 305 | D714: 孙荫环 | E714: 42.7 | F714: 男 | G714: =INT(RC[1]/10)*10 -> 60 | H714: 64 | I714: 亿达集团 | J714: 辽宁 | K714: 大连 | L714: 房地产
A715: 714 | B715: 2013 | C715: 305 | D715: 丁佐宏 | E715: 42.7 | F715: 男 | G715: =INT(RC[1]/10)*10 -> 50 | H715: 51 | I715: 月星集团 | J715: 上海 | K715: 上海 | L715: 房地产、商业地产、能源、投资
A716: 715 | B716: 2013 | C716: 305 | D716: 林中 | E716: 42.7 | F716: 男 | G716: =INT(RC[1]/10)*10 -> 40 | H716: 45 | I716: 旭辉集团 | J716: 上海 | K716: 上海 | L716: 房地产
A717: 716 | B717: 2013 | C717: 305 | D717: 郑永刚 | E717: 42.7 | F717: 男 | G717: =INT(RC[1]/10)*10 -> 50 | H717: 54 | I717: 杉杉集团 | J717: 上海 | K717: 上海 | L717: 服装、新能源、投资
A718: 717 | B718: 2013 | C718: 305 | D718: 杜厦 | E718: 42.7 | F718: 男 | G718: =INT(RC[1]/10)*10 -> 60 | H718: 66 | I718: 天津家世界集团 | J718: 天津 | K718: 天津 | L718: 投资
A719: 718 | B719: 2013 | C719: 305 | D719: 楼忠福家族 | E719: 42.7 | F719: 男 | G719: =INT(RC[1]/10)*10 -> 50 | H719: 59 | I719: 广厦集团 | J719: 浙江 | K719: 杭州 | L719: 房地产、建筑施工
A720: 719 | B720: 2013 | C720: 305 | D720: 王振滔父子 | E720: 42.7 | F720: 男 | G720: =INT(RC[1]/10)*10 -> 40 | H720: 48 | I720: 奥康国际 | J720: 浙江 | K720: 温州 | L720: 制鞋
A721: 720 | B721: 2013 | C721: 320 | D721: 王永红 | E721: 42.1 | F721: 男 | G721: =INT(RC[1]/10)*10 -> 40 | H721: 41 | I721: 中弘集团 | J721: 北京 | K721: 北京 | L721: 房地产
A722: 721 | B722: 2013 | C722: 320 | D722: 刘德建家族 | E722: 42.1 | F722: 男 | G722: =INT(RC[1]/10)*10 -> 40 | H722: 42 | I722: 网龙网络 | J722: 福建 | K722: 福州 | L722: 网络游戏
A723: 722 | B723: 2013 | C723: 320 | D723: 高仕军家族 | E723: 42.1 | F723: 男 | G723: =INT(RC[1]/10)*10 -> 40 | H723: 46 | I723: 高力集团 | J723: 江苏 | K723: 南京 | L723: 房地产
A724: 723 | B724: 2013 | C724: 320 | D724: 陆永华夫妇 | E724: 42.1 | F724: 男 | G724: =INT(RC[1]/10)*10 -> 50 | H724: 50 | I724: 林洋电子 | J724: 上海 | K724: 上海 | L724: 仪器仪表
A725: 724 | B725: 2013 | C725: 320 | D725: 张祥青夫妇 | E725: 42.1 | F725: 男 | G725: =INT(RC[1]/10)*10 -> 40 | H725: 44 | I725: 荣程联合钢铁 | J725: 天津 | K725: 天津 | L725: 钢铁
A726: 725 | B726: 2013 | C726: 325 | D726: 姚文彬 | E726: 41.5 | F726: 男 | G726: =INT(RC[1]/10)*10 -> 40 | H726: 43 | I726: 掌趣科技 | J726: 北京 | K726: 北京 | L726: 互联网及软件
A727: 726 | B727: 2013 | C727: 325 | D727: 范朝霞夫妇 | E727: 41.5 | F727: 女 | G727: =INT(RC[1]/10)*10 -> 40 | H727: 46 | I727: 京运通 | J727: 北京 | K727: 北京 | L727: 太阳能
A728: 727 | B728: 2013 | C728: 325 | D728: 陈学利 | E728: 41.5 | F728: 男 | G728: =INT(RC[1]/10)*10 -> 60 | H728: 62 | I728: 威高集团 | J728: 山东 | K728: 威海 | L728: 医疗设备、医药、房地产、投资
A729: 728 | B729: 2013 | C729: 325 | D729: 潘慰 | E729: 41.5 | F729: 女 | G729: =INT(RC[1]/10)*10 -> 50 | H729: 58 | I729: 味千(中国) | J729: 上海 | K729: 上海 | L729: 餐饮连锁
A730: 729 | B730: 2013 | C730: 325 | D730: 陈隆基 | E730: 41.5 | F730: 男 | G730: =INT(RC[1]/10)*10 -> 50 | H730: 57 | I730: 利嘉国际 | J730: 香港 | K730: 香港 | L730: 投资
A731: 730 | B731: 2013 | C731: 325 | D731: 胡成中 | E731: 41.5 | F731: 男 | G731: =INT(RC[1]/10)*10 -> 50 | H731: 52 | I731: 中国德力西集团 | J731: 浙江 | K731: 温州 | L731: 电器设备制造
A732: 731 | B732: 2013 | C732: 331 | D732: 刘绍喜父子 | E732: 41.2 | F732: 男 | G732: =INT(RC[1]/10)*10 -> 40 | H732: 49 | I732: 宜华企业集团 | J732: 广东 | K732: 汕头 | L732: 木业、房地产、投资
A733: 732 | B733: 2013 | C733: 331 | D733: 王义政 | E733: 41.2 | F733: 男 | G733: =INT(RC[1]/10)*10 -> 40 | H733: 45 | I733: 福佳集团 | J733: 辽宁 | K733: 大连 | L733: 化工
A734: 733 | B734: 2013 | C734: 333 | D734: 徐航 | E734: 40.9 | F734: 男 | G734: =INT(RC[1]/10)*10 -> 50 | H734: 51 | I734: 迈瑞医疗国际 | J734: 广东 | K734: 深圳 | L734: 医疗设备
A735: 734 | B735: 2013 | C735: 333 | D735: 孟庆南家族 | E735: 40.9 | F735: 男 | G735: =INT(RC[1]/10)*10 -> 50 | H735: 55 | I735: 凡谷电子 | J735: 湖北 | K735: 武汉 | L735: 电子元器件制造
A736: 735 | B736: 2013 | C736: 333 | D736: 何亚民家族 | E736: 40.9 | F736: 男 | G736: =INT(RC[1]/10)*10 -> 50 | H736: 56 | I736: 利君股份 | J736: 四川 | K736: 成都 | L736: 矿业机械
A737: 736 | B737: 2013 | C737: 336 | D737: 涂国身 | E737: 40.6 | F737: 男 | G737: =INT(RC[1]/10)*10 -> 40 | H737: 48 | I737: 安防技术 | J737: 广东 | K737: 深圳 | L737: 安防
A738: 737 | B738: 2013 | C738: 336 | D738: 杨志茂家族 | E738: 40.6 | F738: 男 | G738: =INT(RC[1]/10)*10 -> 50 | H738: 50 | I738: 锦龙发展 | J738: 广东 | K738: 东莞 | L738: 教育、房地产
A739: 738 | B739: 2013 | C739: 336 | D739: 任元林 | E739: 40.6 | F739: 男 | G739: =INT(RC[1]/10)*10 -> 60 | H739: 60 | I739: 扬子江造船 | J739: 江苏 | K739: 江阴 | L739: 造船
A740: 739 | B740: 2013 | C740: 336 | D740: 邢利斌 | E740: 40.6 | F740: 男 | G740: =INT(RC[1]/10)*10 -> 40 | H740: 46 | I740: 联盛能源 | J740: 山西 | K740: 吕梁 | L740: 能源
A741: 740 | B741: 2013 | C741: 336 | D741: 戴志康 | E741: 40.6 | F741: 男 | G741: =INT(RC[1]/10)*10 -> 40 | H741: 49 | I741: 证大集团 | J741: 上海 | K741: 上海 | L741: 房地产、金融、能源
A742: 741 | B742: 2013 | C742: 336 | D742: 黄巧灵 | E742: 40.6 | F742: 男 | G742: =INT(RC[1]/10)*10 -> 50 | H742: 54 | I742: 宋城集团 | J742: 浙江 | K742: 杭州 | L742: 旅游
A743: 742 | B743: 2013 | C743: 342 | D743: 梁社增家族 | E743: 40.299999999999997 | F743: 男 | G743: =INT(RC[1]/10)*10 -> 80 | H743: 81 | I743: 世荣兆业 | J743: 广东 | K743: 珠海 | L743: 房地产
A744: 743 | B744: 2013 | C744: 342 | D744: 罗云 | E744: 40.299999999999997 | F744: 男 | G744: / | H744: / | I744: 合生元 | J744: 广东 | K744: 广州 | L744: 乳制品
A745: 744 | B745: 2013 | C745: 342 | D745: 邹节明家族 | E745: 40.299999999999997 | F745: 男 | G745: =INT(RC[1]/10)*10 -> 70 | H745: 70 | I745: 桂林三金 | J745: 广西 | K745: 桂林 | L745: 医药
A746: 745 | B746: 2013 | C746: 342 | D746: 王填夫妇 | E746: 40.299999999999997 | F746: 男 | G746: =INT(RC[1]/10)*10 -> 40 | H746: 45 | I746: 步步高商业连锁 | J746: 湖南 | K746: 湘潭 | L746: 零售
A747: 746 | B747: 2013 | C747: 342 | D747: 吕中楼 | E747: 40.299999999999997 | F747: 男 | G747: =INT(RC[1]/10)*10 -> 40 | H747: 47 | I747: 沁和能源 | J747: 山西 | K747: 晋城 | L747: 能源
A748: 747 | B748: 2013 | C748: 347 | D748: 敖小强 | E748: 39.700000000000003 | F748: 男 | G748: =INT(RC[1]/10)*10 -> 40 | H748: 49 | I748: 雪迪龙 | J748: 北京 | K748: 北京 | L748: 仪器仪表
A749: 748 | B749: 2013 | C749: 347 | D749: 杨雪岗家族 | E749: 39.700000000000003 | F749: 男 | G749: =INT(RC[1]/10)*10 -> 40 | H749: 48 | I749: 旭阳煤化工集团 | J749: 北京 | K749: 北京 | L749: 能源
A750: 749 | B750: 2013 | C750: 347 | D750: 张开元 | E750: 39.700000000000003 | F750: 男 | G750: =INT(RC[1]/10)*10 -> 50 | H750: 59 | I750: 国电清新 | J750: 北京 | K750: 北京 | L750: 环保
A751: 750 | B751: 2013 | C751: 347 | D751: 林龙安夫妇 | E751: 39.700000000000003 | F751: 男 | G751: =INT(RC[1]/10)*10 -> 40 | H751: 49 | I751: 禹洲地产 | J751: 福建 | K751: 厦门 | L751: 房地产
A752: 751 | B752: 2013 | C752: 347 | D752: 许健康家族 | E752: 39.700000000000003 | F752: 男 | G752: =INT(RC[1]/10)*10 -> 60 | H752: 61 | I752: 宝龙集团 | J752: 福建 | K752: 厦门 | L752: 房地产
A753: 752 | B753: 2013 | C753: 347 | D753: 张轩松 | E753: 39.700000000000003 | F753: 男 | G753: =INT(RC[1]/10)*10 -> 40 | H753: 42 | I753: 永辉超市 | J753: 福建 | K753: 福州 | L753: 零售
A754: 753 | B754: 2013 | C754: 347 | D754: 刘金成家族 | E754: 39.700000000000003 | F754: 男 | G754: =INT(RC[1]/10)*10 -> 40 | H754: 49 | I754: 亿纬锂能 | J754: 广东 | K754: 惠州 | L754: 锂电池
A755: 754 | B755: 2013 | C755: 347 | D755: 刘水 | E755: 39.700000000000003 | F755: 男 | G755: =INT(RC[1]/10)*10 -> 40 | H755: 44 | I755: 铁汉生态 | J755: 广东 | K755: 深圳 | L755: 园艺
A756: 755 | B756: 2013 | C756: 347 | D756: 张小明夫妇 | E756: 39.700000000000003 | F756: 男 | G756: / | H756: / | I756: 爱施德 | J756: 广东 | K756: 深圳 | L756: 电子产品销售
A757: 756 | B757: 2013 | C757: 347 | D757: 张剑 | E757: 39.700000000000003 | F757: 男 | G757: / | H757: / | I757: 远大住工 | J757: 湖南 | K757: 长沙 | L757: 住宅工业
A758: 757 | B758: 2013 | C758: 347 | D758: 杨绍鹏 | E758: 39.700000000000003 | F758: 男 | G758: =INT(RC[1]/10)*10 -> 50 | H758: 55 | I758: 海丰国际 | J758: 山东 | K758: 青岛 | L758: 造船
A759: 758 | B759: 2013 | C759: 347 | D759: 华勇 | E759: 39.700000000000003 | F759: 男 | G759: =INT(RC[1]/10)*10 -> 40 | H759: 49 | I759: 顺网科技 | J759: 浙江 | K759: 杭州 | L759: 互联网相关服务
A760: 759 | B760: 2013 | C760: 347 | D760: 任建华 | E760: 39.700000000000003 | F760: 男 | G760: =INT(RC[1]/10)*10 -> 50 | H760: 57 | I760: 老板电器 | J760: 浙江 | K760: 杭州 | L760: 家用电器制造
A761: 760 | B761: 2013 | C761: 347 | D761: 左宗申家族 | E761: 39.700000000000003 | F761: 男 | G761: =INT(RC[1]/10)*10 -> 60 | H761: 61 | I761: 宗申产业集团 | J761: 重庆 | K761: 重庆 | L761: 摩托车制造、房地产
A762: 761 | B762: 2013 | C762: 361 | D762: 刘国本 | E762: 39 | F762: 男 | G762: =INT(RC[1]/10)*10 -> 60 | H762: 69 | I762: 骆驼集团 | J762: 湖北 | K762: 襄樊 | L762: 蓄电池
A763: 762 | B763: 2013 | C763: 361 | D763: 陈锦石家族 | E763: 39 | F763: 男 | G763: =INT(RC[1]/10)*10 -> 50 | H763: 50 | I763: 中南控股集团 | J763: 江苏 | K763: 南通 | L763: 房地产、建筑施工
A764: 763 | B764: 2013 | C764: 361 | D764: 陈丽芬 | E764: 39 | F764: 女 | G764: =INT(RC[1]/10)*10 -> 50 | H764: 54 | I764: 江苏阳光 | J764: 江苏 | K764: 江阴 | L764: 纺织、太阳能
A765: 764 | B765: 2013 | C765: 361 | D765: 康宝华 | E765: 39 | F765: 男 | G765: =INT(RC[1]/10)*10 -> 60 | H765: 60 | I765: 远大中国控股、博林特 | J765: 辽宁 | K765: 沈阳 | L765: 幕墙、专用设备制造
A766: 765 | B766: 2013 | C766: 361 | D766: 郑伟 | E766: 39 | F766: 男 | G766: =INT(RC[1]/10)*10 -> 40 | H766: 43 | I766: 西藏海思科药业 | J766: 四川 | K766: 成都 | L766: 医药
A767: 766 | B767: 2013 | C767: 366 | D767: 钟玉 | E767: 38.700000000000003 | F767: 男 | G767: =INT(RC[1]/10)*10 -> 60 | H767: 63 | I767: 康得新 | J767: 北京 | K767: 北京 | L767: 新材料
A768: 767 | B768: 2013 | C768: 367 | D768: 沈锦华 | E768: 38.4 | F768: 男 | G768: =INT(RC[1]/10)*10 -> 40 | H768: 46 | I768: 焦点科技 | J768: 江苏 | K768: 南京 | L768: 互联网相关服务
A769: 768 | B769: 2013 | C769: 367 | D769: 万连步 | E769: 38.4 | F769: 男 | G769: =INT(RC[1]/10)*10 -> 40 | H769: 48 | I769: 金正大 | J769: 山东 | K769: 临沂 | L769: 化工
A770: 769 | B770: 2013 | C770: 367 | D770: 徐建刚夫妇 | E770: 38.4 | F770: 男 | G770: =INT(RC[1]/10)*10 -> 40 | H770: 44 | I770: 刚泰集团 | J770: 上海 | K770: 上海 | L770: 贵金属、房地产
A771: 770 | B771: 2013 | C771: 367 | D771: 陈夏鑫夫妇 | E771: 38.4 | F771: 男 | G771: =INT(RC[1]/10)*10 -> 50 | H771: 51 | I771: 西子电梯集团 | J771: 浙江 | K771: 杭州 | L771: 专用设备制造、房地产、百货
A772: 771 | B772: 2013 | C772: 371 | D772: 张宝全夫妇 | E772: 38.1 | F772: 男 | G772: =INT(RC[1]/10)*10 -> 50 | H772: 56 | I772: 今典集团 | J772: 北京 | K772: 北京 | L772: 房地产、文化
A773: 772 | B773: 2013 | C773: 371 | D773: 黄焕明 | E773: 38.1 | F773: 男 | G773: =INT(RC[1]/10)*10 -> 50 | H773: 50 | I773: 厦门明发集团 | J773: 福建 | K773: 厦门 | L773: 房地产
A774: 773 | B774: 2013 | C774: 371 | D774: 苏汝波 | E774: 38.1 | F774: 男 | G774: =INT(RC[1]/10)*10 -> 50 | H774: 58 | I774: 碧桂园 | J774: 广东 | K774: 佛山 | L774: 房地产
A775: 774 | B775: 2013 | C775: 371 | D775: 庞庆华 | E775: 38.1 | F775: 男 | G775: =INT(RC[1]/10)*10 -> 50 | H775: 58 | I775: 庞大集团 | J775: 河北 | K775: 唐山 | L775: 汽车销售
A776: 775 | B776: 2013 | C776: 371 | D776: 叶仙玉家族 | E776: 38.1 | F776: 男 | G776: =INT(RC[1]/10)*10 -> 50 | H776: 55 | I776: 中国星星集团 | J776: 浙江 | K776: 台州 | L776: 专用设备制造
A777: 776 | B777: 2013 | C777: 376 | D777: 马鸿 | E777: 37.799999999999997 | F777: 男 | G777: =INT(RC[1]/10)*10 -> 40 | H777: 45 | I777: 搜于特 | J777: 广东 | K777: 东莞 | L777: 服装服饰
A778: 777 | B778: 2013 | C778: 376 | D778: 李彬兰 | E778: 37.799999999999997 | F778: 女 | G778: / | H778: / | I778: 新一佳超市 | J778: 广东 | K778: 深圳 | L778: 零售
A779: 778 | B779: 2013 | C779: 376 | D779: 侯建芳 | E779: 37.799999999999997 | F779: 男 | G779: =INT(RC[1]/10)*10 -> 40 | H779: 46 | I779: 雏鹰农牧 | J779: 河南 | K779: 郑州 | L779: 饲养加工
A780: 779 | B780: 2013 | C780: 376 | D780: 梁亮胜 | E780: 37.799999999999997 | F780: 男 | G780: =INT(RC[1]/10)*10 -> 60 | H780: 62 | I780: 丝宝集团 | J780: 湖北 | K780: 武汉 | L780: 日化、医药、房地产
A781: 780 | B781: 2013 | C781: 376 | D781: 徐新建家族 | E781: 37.799999999999997 | F781: 男 | G781: =INT(RC[1]/10)*10 -> 40 | H781: 49 | I781: 日出东方 | J781: 江苏 | K781: 连云港 | L781: 太阳能热水器
A782: 781 | B782: 2013 | C782: 376 | D782: 胡杨忠 | E782: 37.799999999999997 | F782: 男 | G782: =INT(RC[1]/10)*10 -> 40 | H782: 48 | I782: 海康威视 | J782: 浙江 | K782: 杭州 | L782: 电子设备制造
A783: 782 | B783: 2013 | C783: 382 | D783: 缪双大家族 | E783: 37.200000000000003 | F783: 男 | G783: =INT(RC[1]/10)*10 -> 60 | H783: 62 | I783: 双良集团 | J783: 江苏 | K783: 江阴 | L783: 工业空调系统
A784: 783 | B784: 2013 | C784: 382 | D784: 袁富根家族 | E784: 37.200000000000003 | F784: 男 | G784: =INT(RC[1]/10)*10 -> 60 | H784: 62 | I784: 苏州东山精密 | J784: 江苏 | K784: 苏州 | L784: 金属制品
A785: 784 | B785: 2013 | C785: 382 | D785: 李勤夫 | E785: 37.200000000000003 | F785: 男 | G785: =INT(RC[1]/10)*10 -> 50 | H785: 51 | I785: 九龙山 | J785: 上海 | K785: 上海 | L785: 房地产
A786: 785 | B786: 2013 | C786: 385 | D786: 杨文龙夫妇 | E786: 36.9 | F786: 男 | G786: =INT(RC[1]/10)*10 -> 50 | H786: 51 | I786: 仁和集团 | J786: 江西 | K786: 樟树 | L786: 医药
A787: 786 | B787: 2013 | C787: 386 | D787: 张军 | E787: 36.6 | F787: 男 | G787: =INT(RC[1]/10)*10 -> 40 | H787: 45 | I787: 海隆石油 | J787: 北京 | K787: 北京 | L787: 化工
A788: 787 | B788: 2013 | C788: 386 | D788: 区学铭 | E788: 36.6 | F788: 男 | G788: =INT(RC[1]/10)*10 -> 60 | H788: 64 | I788: 碧桂园 | J788: 广东 | K788: 佛山 | L788: 房地产
A789: 788 | B789: 2013 | C789: 386 | D789: 夏佐全 | E789: 36.6 | F789: 男 | G789: =INT(RC[1]/10)*10 -> 50 | H789: 51 | I789: 比亚迪 | J789: 广东 | K789: 深圳 | L789: 汽车制造、新能源、电子设备制造
A790: 789 | B790: 2013 | C790: 386 | D790: 张成飞 | E790: 36.6 | F790: 男 | G790: =INT(RC[1]/10)*10 -> 40 | H790: 46 | I790: 玖龙纸业 | J790: 广东 | K790: 东莞 | L790: 造纸
A791: 790 | B791: 2013 | C791: 386 | D791: 张耀垣 | E791: 36.6 | F791: 男 | G791: =INT(RC[1]/10)*10 -> 60 | H791: 67 | I791: 碧桂园 | J791: 广东 | K791: 佛山 | L791: 房地产
A792: 791 | B792: 2013 | C792: 386 | D792: 周国辉 | E792: 36.6 | F792: 男 | G792: =INT(RC[1]/10)*10 -> 40 | H792: 48 | I792: 怡亚通 | J792: 广东 | K792: 深圳 | L792: 物流
A793: 792 | B793: 2013 | C793: 386 | D793: 冯小华 | E793: 36.6 | F793: 男 | G793: / | H793: / | I793: 广西洋浦南华糖业集团 | J793: 广西 | K793: 南宁 | L793: 制糖
A794: 793 | B794: 2013 | C794: 386 | D794: 孟庆山家族 | E794: 36.6 | F794: 男 | G794: =INT(RC[1]/10)*10 -> 60 | H794: 64 | I794: 梅花集团 | J794: 河北 | K794: 廊坊 | L794: 发酵制造
A795: 794 | B795: 2013 | C795: 386 | D795: 易大盛 | E795: 36.6 | F795: 男 | G795: =INT(RC[1]/10)*10 -> 50 | H795: 52 | I795: 湖南富兴集团 | J795: 湖南 | K795: 长沙 | L795: 房地产、汽车服务、商贸、殡葬
A796: 795 | B796: 2013 | C796: 386 | D796: 王柏兴父子 | E796: 36.6 | F796: 男 | G796: =INT(RC[1]/10)*10 -> 50 | H796: 57 | I796: 中利科技 | J796: 江苏 | K796: 常熟 | L796: 特种电缆制造
A797: 796 | B797: 2013 | C797: 386 | D797: 吴良定家族 | E797: 36.6 | F797: 男 | G797: =INT(RC[1]/10)*10 -> 60 | H797: 67 | I797: 万丰奥威 | J797: 上海 | K797: 上海 | L797: 汽车零部件、工业设备制造
A798: 797 | B798: 2013 | C798: 386 | D798: 郑效东 | E798: 36.6 | F798: 男 | G798: =INT(RC[1]/10)*10 -> 40 | H798: 49 | I798: 东富龙 | J798: 上海 | K798: 上海 | L798: 医疗设备
A799: 798 | B799: 2013 | C799: 386 | D799: 胡季强 | E799: 36.6 | F799: 男 | G799: =INT(RC[1]/10)*10 -> 50 | H799: 52 | I799: 康恩贝 | J799: 浙江 | K799: 杭州 | L799: 医药
A800: 799 | B800: 2013 | C800: 386 | D800: 周庆治 | E800: 36.6 | F800: 男 | G800: =INT(RC[1]/10)*10 -> 50 | H800: 58 | I800: 南都电源 | J800: 浙江 | K800: 杭州 | L800: 新能源、蓄电池
A801: 800 | B801: 2013 | C801: 386 | D801: 朱江明 | E801: 36.6 | F801: 男 | G801: =INT(RC[1]/10)*10 -> 40 | H801: 46 | I801: 大华股份 | J801: 浙江 | K801: 杭州 | L801: 电子元器件制造
A802: 801 | B802: 2012 | C802: 1 | D802: 宗庆后 | E802: 630 | F802: 男 | G802: =INT(RC[1]/10)*10 -> 60 | H802: 67 | I802: 娃哈哈集团 | J802: 浙江 | K802: 杭州 | L802: 饮料
A803: 802 | B803: 2012 | C803: 2 | D803: 李彦宏 | E803: 510.3 | F803: 男 | G803: =INT(RC[1]/10)*10 -> 40 | H803: 43 | I803: 百度 | J803: 北京 | K803: 北京 | L803: 搜索引擎
A804: 803 | B804: 2012 | C804: 3 | D804: 王健林 | E804: 504 | F804: 男 | G804: =INT(RC[1]/10)*10 -> 50 | H804: 58 | I804: 大连万达集团 | J804: 北京 | K804: 北京 | L804: 房地产
A805: 804 | B805: 2012 | C805: 4 | D805: 马化腾 | E805: 403.2 | F805: 男 | G805: =INT(RC[1]/10)*10 -> 40 | H805: 41 | I805: 腾讯 | J805: 广东 | K805: 深圳 | L805: 即时通讯、门户网站、网络游戏
A806: 805 | B806: 2012 | C806: 5 | D806: 吴亚军夫妇 | E806: 390.6 | F806: 女 | G806: =INT(RC[1]/10)*10 -> 40 | H806: 48 | I806: 龙湖地产 | J806: 北京 | K806: 北京 | L806: 房地产
A807: 806 | B807: 2012 | C807: 6 | D807: 梁稳根 | E807: 371.7 | F807: 男 | G807: =INT(RC[1]/10)*10 -> 50 | H807: 55 | I807: 三一集团 | J807: 湖南 | K807: 长沙 | L807: 机械装备制造
A808: 807 | B808: 2012 | C808: 7 | D808: 刘永行 | E808: 365.4 | F808: 男 | G808: =INT(RC[1]/10)*10 -> 60 | H808: 64 | I808: 东方希望集团 | J808: 上海 | K808: 上海 | L808: 饲料、重化工业、投资
A809: 808 | B809: 2012 | C809: 8 | D809: 许家印 | E809: 308.7 | F809: 男 | G809: =INT(RC[1]/10)*10 -> 50 | H809: 54 | I809: 恒大集团 | J809: 广东 | K809: 广州 | L809: 房地产
A810: 809 | B810: 2012 | C810: 9 | D810: 杨惠妍 | E810: 277.2 | F810: 女 | G810: =INT(RC[1]/10)*10 -> 30 | H810: 31 | I810: 碧桂园 | J810: 广东 | K810: 佛山 | L810: 房地产
A811: 810 | B811: 2012 | C811: 10 | D811: 许荣茂 | E811: 252 | F811: 男 | G811: =INT(RC[1]/10)*10 -> 60 | H811: 62 | I811: 世茂集团 | J811: 香港 | K811: 香港 | L811: 房地产
A812: 811 | B812: 2012 | C812: 11 | D812: 马云 | E812: 214.2 | F812: 男 | G812: =INT(RC[1]/10)*10 -> 40 | H812: 48 | I812: 阿里巴巴 | J812: 浙江 | K812: 杭州 | L812: 电子商务、网上零售及支付
A813: 812 | B813: 2012 | C813: 12 | D813: 何享健 | E813: 207.9 | F813: 男 | G813: =INT(RC[1]/10)*10 -> 70 | H813: 70 | I813: 美的集团 | J813: 广东 | K813: 佛山 | L813: 日用电器制造
A814: 813 | B814: 2012 | C814: 13 | D814: 张近东 | E814: 201.6 | F814: 男 | G814: =INT(RC[1]/10)*10 -> 40 | H814: 49 | I814: 苏宁电器 | J814: 江苏 | K814: 南京 | L814: 家电零售
A815: 814 | B815: 2012 | C815: 14 | D815: 孙广信 | E815: 195.3 | F815: 男 | G815: =INT(RC[1]/10)*10 -> 40 | H815: 49 | I815: 新疆广汇实业投资(集团) | J815: 新疆 | K815: 乌鲁木齐 | L815: 能源、汽车销售服务、房地产
A816: 815 | B816: 2012 | C816: 15 | D816: 丁磊 | E816: 185.9 | F816: 男 | G816: =INT(RC[1]/10)*10 -> 40 | H816: 41 | I816: 网易 | J816: 广东 | K816: 广州 | L816: 门户网站
A817: 816 | B817: 2012 | C817: 16 | D817: 魏建军 | E817: 182.7 | F817: 男 | G817: =INT(RC[1]/10)*10 -> 40 | H817: 48 | I817: 长城汽车 | J817: 河北 | K817: 保定 | L817: 汽车
A818: 817 | B818: 2012 | C818: 17 | D818: 陈丽华家族 | E818: 176.4 | F818: 女 | G818: =INT(RC[1]/10)*10 -> 70 | H818: 71 | I818: 富华国际集团 | J818: 北京 | K818: 北京 | L818: 房地产
A819: 818 | B819: 2012 | C819: 18 | D819: 刘永好家族 | E819: 173.3 | F819: 男 | G819: =INT(RC[1]/10)*10 -> 60 | H819: 61 | I819: 新希望集团 | J819: 四川 | K819: 成都 | L819: 饲料、房地产、金融、化工
A820: 819 | B820: 2012 | C820: 19 | D820: 卢志强 | E820: 170.1 | F820: 男 | G820: =INT(RC[1]/10)*10 -> 60 | H820: 60 | I820: 泛海集团 | J820: 北京 | K820: 北京 | L820: 金融、房地产、投资
A821: 820 | B821: 2012 | C821: 19 | D821: 周成建 | E821: 170.1 | F821: 男 | G821: =INT(RC[1]/10)*10 -> 40 | H821: 47 | I821: 美邦服饰 | J821: 上海 | K821: 上海 | L821: 服装连锁
A822: 821 | B822: 2012 | C822: 21 | D822: 张欣夫妇 | E822: 167 | F822: 女 | G822: =INT(RC[1]/10)*10 -> 40 | H822: 47 | I822: SOHO中国 | J822: 北京 | K822: 北京 | L822: 房地产
A823: 822 | B823: 2012 | C823: 22 | D823: 陈发树 | E823: 163.80000000000001 | F823: 男 | G823: =INT(RC[1]/10)*10 -> 50 | H823: 51 | I823: 新华都实业集团 | J823: 福建 | K823: 福州 | L823: 零售、投资、房地产
A824: 823 | B824: 2012 | C824: 22 | D824: 鲁冠球父子 | E824: 163.80000000000001 | F824: 男 | G824: =INT(RC[1]/10)*10 -> 60 | H824: 67 | I824: 万向集团 | J824: 浙江 | K824: 杭州 | L824: 汽车、有色金属、房地产、农业
A825: 824 | B825: 2012 | C825: 24 | D825: 黄如论 | E825: 157.5 | F825: 男 | G825: =INT(RC[1]/10)*10 -> 60 | H825: 61 | I825: 世纪金源集团 | J825: 北京 | K825: 北京 | L825: 房地产、投资
A826: 825 | B826: 2012 | C826: 25 | D826: 张士平家族 | E826: 155 | F826: 男 | G826: =INT(RC[1]/10)*10 -> 60 | H826: 65 | I826: 中国宏桥集团、山东魏桥创业集团 | J826: 山东 | K826: 滨州 | L826: 矿业、纺织
A827: 826 | B827: 2012 | C827: 26 | D827: 许连捷(许自连) | E827: 154.4 | F827: 男 | G827: =INT(RC[1]/10)*10 -> 50 | H827: 59 | I827: 恒安集团 | J827: 福建 | K827: 晋江 | L827: 个人护理用品
A828: 827 | B828: 2012 | C828: 26 | D828: 张志东 | E828: 154.4 | F828: 男 | G828: =INT(RC[1]/10)*10 -> 40 | H828: 40 | I828: 腾讯 | J828: 广东 | K828: 深圳 | L828: 即时通讯、门户网站、网络游戏
A829: 828 | B829: 2012 | C829: 28 | D829: 王玉锁夫妇 | E829: 153.1 | F829: 男 | G829: =INT(RC[1]/10)*10 -> 40 | H829: 48 | I829: 新奥集团 | J829: 河北 | K829: 廊坊 | L829: 能源、房地产
A830: 829 | B830: 2012 | C830: 29 | D830: 龚虹嘉夫妇 | E830: 151.19999999999999 | F830: 男 | G830: =INT(RC[1]/10)*10 -> 40 | H830: 47 | I830: 海康威视 | J830: 香港 | K830: 香港 | L830: 电子产品制造
A831: 830 | B831: 2012 | C831: 30 | D831: 施文博 | E831: 146.19999999999999 | F831: 男 | G831: =INT(RC[1]/10)*10 -> 60 | H831: 62 | I831: 恒安集团 | J831: 福建 | K831: 晋江 | L831: 个人护理用品
A832: 831 | B832: 2012 | C832: 31 | D832: 姜滨夫妇 | E832: 144.9 | F832: 男 | G832: =INT(RC[1]/10)*10 -> 40 | H832: 46 | I832: 歌尔声学 | J832: 山东 | K832: 潍坊 | L832: 电子元器件制造
A833: 832 | B833: 2012 | C833: 32 | D833: 黄伟夫妇 | E833: 138.6 | F833: 男 | G833: =INT(RC[1]/10)*10 -> 50 | H833: 53 | I833: 新湖集团 | J833: 浙江 | K833: 杭州 | L833: 房地产、金融、矿业、生物制药
A834: 833 | B834: 2012 | C834: 33 | D834: 张力 | E834: 136.69999999999999 | F834: 男 | G834: =INT(RC[1]/10)*10 -> 50 | H834: 59 | I834: 富力集团 | J834: 广东 | K834: 广州 | L834: 房地产、投资
A835: 834 | B835: 2012 | C835: 34 | D835: 郭广昌 | E835: 133.6 | F835: 男 | G835: =INT(RC[1]/10)*10 -> 40 | H835: 45 | I835: 复星国际 | J835: 上海 | K835: 上海 | L835: 钢铁、房地产、医药、金融
A836: 835 | B836: 2012 | C836: 35 | D836: 潘政民夫妇 | E836: 132.30000000000001 | F836: 男 | G836: =INT(RC[1]/10)*10 -> 40 | H836: 43 | I836: AAC声学科技 | J836: 广东 | K836: 深圳 | L836: 声学器材
A837: 836 | B837: 2012 | C837: 36 | D837: 朱兴良 | E837: 126 | F837: 男 | G837: =INT(RC[1]/10)*10 -> 50 | H837: 53 | I837: 金螳螂 | J837: 江苏 | K837: 苏州 | L837: 装修装饰
A838: 837 | B838: 2012 | C838: 37 | D838: 刘忠田 | E838: 122.9 | F838: 男 | G838: =INT(RC[1]/10)*10 -> 40 | H838: 48 | I838: 忠旺集团 | J838: 辽宁 | K838: 辽阳 | L838: 工业铝型材
A839: 838 | B839: 2012 | C839: 37 | D839: 邱光和家族 | E839: 122.9 | F839: 男 | G839: =INT(RC[1]/10)*10 -> 60 | H839: 60 | I839: 森马服饰 | J839: 浙江 | K839: 温州 | L839: 纺织品、服装、鞋帽零售
A840: 839 | B840: 2012 | C840: 39 | D840: 朱林瑶 | E840: 121.6 | F840: 女 | G840: =INT(RC[1]/10)*10 -> 40 | H840: 42 | I840: 华宝国际 | J840: 香港 | K840: 香港 | L840: 香料香精
A841: 840 | B841: 2012 | C841: 40 | D841: 陈宁宁家族 | E841: 119.7 | F841: 女 | G841: =INT(RC[1]/10)*10 -> 40 | H841: 41 | I841: 香港嘉鑫控股集团 | J841: 香港 | K841: 香港 | L841: 投资
A842: 841 | B842: 2012 | C842: 40 | D842: 李锂夫妇 | E842: 119.7 | F842: 男 | G842: =INT(RC[1]/10)*10 -> 40 | H842: 48 | I842: 海普瑞 | J842: 广东 | K842: 深圳 | L842: 医药
A843: 842 | B843: 2012 | C843: 42 | D843: 史玉柱 | E843: 118.4 | F843: 男 | G843: =INT(RC[1]/10)*10 -> 50 | H843: 50 | I843: 巨人集团 | J843: 上海 | K843: 上海 | L843: 保健品、网络游戏、投资
A844: 843 | B844: 2012 | C844: 43 | D844: 高德康家族 | E844: 116.6 | F844: 男 | G844: =INT(RC[1]/10)*10 -> 60 | H844: 60 | I844: 波司登 | J844: 江苏 | K844: 常熟 | L844: 服装
A845: 844 | B845: 2012 | C845: 44 | D845: 沈国军 | E845: 115.9 | F845: 男 | G845: =INT(RC[1]/10)*10 -> 50 | H845: 50 | I845: 银泰集团 | J845: 北京 | K845: 北京 | L845: 零售、房地产
A846: 845 | B846: 2012 | C846: 45 | D846: 马兴田家族 | E846: 113.4 | F846: 男 | G846: =INT(RC[1]/10)*10 -> 40 | H846: 43 | I846: 康美药业 | J846: 广东 | K846: 普宁 | L846: 医药
A847: 846 | B847: 2012 | C847: 45 | D847: 童锦泉 | E847: 113.4 | F847: 男 | G847: =INT(RC[1]/10)*10 -> 50 | H847: 57 | I847: 长峰房地产 | J847: 上海 | K847: 上海 | L847: 房地产
A848: 847 | B848: 2012 | C848: 47 | D848: 傅利泉夫妇 | E848: 107.1 | F848: 男 | G848: =INT(RC[1]/10)*10 -> 40 | H848: 45 | I848: 大华股份 | J848: 浙江 | K848: 杭州 | L848: 电子设备制造
A849: 848 | B849: 2012 | C849: 48 | D849: 张志熔 | E849: 106.5 | F849: 男 | G849: =INT(RC[1]/10)*10 -> 40 | H849: 43 | I849: 恒盛地产、熔盛重工 | J849: 香港 | K849: 香港 | L849: 房地产、造船
A850: 849 | B850: 2012 | C850: 49 | D850: 张宏伟 | E850: 104.6 | F850: 男 | G850: =INT(RC[1]/10)*10 -> 50 | H850: 57 | I850: 北京东方集团 | J850: 北京 | K850: 北京 | L850: 家居连锁、金融、矿业、港口
A851: 850 | B851: 2012 | C851: 50 | D851: 宋作文 | E851: 104 | F851: 男 | G851: =INT(RC[1]/10)*10 -> 60 | H851: 65 | I851: 山东南山集团 | J851: 山东 | K851: 龙口 | L851: 铝业、建筑、纺织
A852: 851 | B852: 2012 | C852: 51 | D852: 祝义材夫妇 | E852: 102.7 | F852: 男 | G852: =INT(RC[1]/10)*10 -> 40 | H852: 48 | I852: 雨润集团 | J852: 江苏 | K852: 南京 | L852: 食品、房地产
A853: 852 | B853: 2012 | C853: 52 | D853: 何巧女夫妇 | E853: 100.8 | F853: 女 | G853: =INT(RC[1]/10)*10 -> 40 | H853: 46 | I853: 东方园林 | J853: 北京 | K853: 北京 | L853: 园林设计
A854: 853 | B854: 2012 | C854: 52 | D854: 林秀成家族 | E854: 100.8 | F854: 男 | G854: =INT(RC[1]/10)*10 -> 50 | H854: 56 | I854: 福建三安集团 | J854: 福建 | K854: 厦门 | L854: 电子元器件制造、钢铁
A855: 854 | B855: 2012 | C855: 54 | D855: 徐宇 | E855: 100.2 | F855: 男 | G855: / | H855: / | I855: 赫基国际集团 | J855: 广东 | K855: 广州 | L855: 服装
A856: 855 | B856: 2012 | C856: 55 | D856: 雷军 | E856: 94.5 | F856: 男 | G856: =INT(RC[1]/10)*10 -> 40 | H856: 42 | I856: 金山软件、UCWEB | J856: 北京 | K856: 北京 | L856: 软件开发
A857: 856 | B857: 2012 | C857: 56 | D857: 吴以岭家族 | E857: 91.4 | F857: 男 | G857: =INT(RC[1]/10)*10 -> 60 | H857: 62 | I857: 以岭药业 | J857: 河北 | K857: 石家庄 | L857: 医药
A858: 857 | B858: 2012 | C858: 57 | D858: 魏少军 | E858: 90.7 | F858: 男 | G858: / | H858: / | I858: 隆基泰和 | J858: 河北 | K858: 保定 | L858: 房地产
A859: 858 | B859: 2012 | C859: 58 | D859: 林立 | E859: 89.5 | F859: 男 | G859: =INT(RC[1]/10)*10 -> 40 | H859: 49 | I859: 深圳立业集团 | J859: 广东 | K859: 深圳 | L859: 金融、投资
A860: 859 | B860: 2012 | C860: 59 | D860: 薛光林 | E860: 88.8 | F860: 男 | G860: =INT(RC[1]/10)*10 -> 40 | H860: 44 | I860: 光汇石油 | J860: 香港 | K860: 香港 | L860: 石油化工
A861: 860 | B861: 2012 | C861: 60 | D861: 李书福 | E861: 88.2 | F861: 男 | G861: =INT(RC[1]/10)*10 -> 40 | H861: 49 | I861: 吉利集团 | J861: 浙江 | K861: 杭州 | L861: 汽车制造
A862: 861 | B862: 2012 | C862: 60 | D862: 李水荣 | E862: 88.2 | F862: 男 | G862: =INT(RC[1]/10)*10 -> 50 | H862: 56 | I862: 浙江荣盛控股集团 | J862: 浙江 | K862: 杭州 | L862: 化纤、石化
A863: 862 | B863: 2012 | C863: 62 | D863: 叶澄海家族 | E863: 87.6 | F863: 男 | G863: =INT(RC[1]/10)*10 -> 60 | H863: 69 | I863: 信立泰 | J863: 香港 | K863: 香港 | L863: 医药
A864: 863 | B864: 2012 | C864: 63 | D864: 昝圣达 | E864: 85.1 | F864: 男 | G864: =INT(RC[1]/10)*10 -> 40 | H864: 49 | I864: 综艺集团 | J864: 江苏 | K864: 南通 | L864: 太阳能、投资、计算机应用服务
A865: 864 | B865: 2012 | C865: 64 | D865: 张志祥 | E865: 84.4 | F865: 男 | G865: =INT(RC[1]/10)*10 -> 40 | H865: 45 | I865: 北京建龙重工集团 | J865: 北京 | K865: 北京 | L865: 钢铁、造船、资源开采
A866: 865 | B866: 2012 | C866: 65 | D866: 陈建华夫妇 | E866: 83.8 | F866: 男 | G866: =INT(RC[1]/10)*10 -> 40 | H866: 41 | I866: 恒力集团 | J866: 江苏 | K866: 吴江 | L866: 化纤、石化
A867: 866 | B867: 2012 | C867: 66 | D867: 黄泽兰夫妇 | E867: 83.2 | F867: 男 | G867: =INT(RC[1]/10)*10 -> 50 | H867: 57 | I867: 章源钨业 | J867: 江西 | K867: 赣州 | L867: 有色金属
A868: 867 | B868: 2012 | C868: 67 | D868: 汪俊林 | E868: 81.900000000000006 | F868: 男 | G868: =INT(RC[1]/10)*10 -> 40 | H868: 45 | I868: 郎酒集团 | J868: 四川 | K868: 成都 | L868: 房地产、酿酒
A869: 868 | B869: 2012 | C869: 67 | D869: 熊续强夫妇 | E869: 81.900000000000006 | F869: 男 | G869: =INT(RC[1]/10)*10 -> 50 | H869: 56 | I869: 宁波银亿集团 | J869: 浙江 | K869: 宁波 | L869: 房地产、煤炭
A870: 869 | B870: 2012 | C870: 69 | D870: 姚巨货家族 | E870: 81.3 | F870: 男 | G870: =INT(RC[1]/10)*10 -> 80 | H870: 81 | I870: 美锦集团 | J870: 山西 | K870: 太原 | L870: 煤炭、房地产
A871: 870 | B871: 2012 | C871: 70 | D871: 阎志 | E871: 80.599999999999994 | F871: 男 | G871: =INT(RC[1]/10)*10 -> 30 | H871: 39 | I871: 卓尔发展 | J871: 湖北 | K871: 武汉 | L871: 房地产
A872: 871 | B872: 2012 | C872: 71 | D872: 孙飘扬 | E872: 80 | F872: 男 | G872: =INT(RC[1]/10)*10 -> 50 | H872: 54 | I872: 恒瑞医药 | J872: 江苏 | K872: 连云港 | L872: 医药制造
A873: 872 | B873: 2012 | C873: 72 | D873: 黄联禧 | E873: 78.8 | F873: 男 | G873: =INT(RC[1]/10)*10 -> 50 | H873: 50 | I873: 中国联塑集团 | J873: 香港 | K873: 香港 | L873: 塑料制造
A874: 873 | B874: 2012 | C874: 72 | D874: 马建荣 | E874: 78.8 | F874: 男 | G874: =INT(RC[1]/10)*10 -> 40 | H874: 48 | I874: 申洲国际集团 | J874: 浙江 | K874: 宁波 | L874: 纺织、服装
A875: 874 | B875: 2012 | C875: 72 | D875: 文一波夫妇 | E875: 78.8 | F875: 男 | G875: =INT(RC[1]/10)*10 -> 40 | H875: 47 | I875: 桑德集团 | J875: 北京 | K875: 北京 | L875: 环保产业
A876: 875 | B876: 2012 | C876: 75 | D876: 刘志强夫妇 | E876: 78.099999999999994 | F876: 男 | G876: =INT(RC[1]/10)*10 -> 40 | H876: 47 | I876: 广东香江集团 | J876: 广东 | K876: 广州 | L876: 房地产、家居流通、能源、金融
A877: 876 | B877: 2012 | C877: 76 | D877: 倪召兴家族 | E877: 77.5 | F877: 男 | G877: =INT(RC[1]/10)*10 -> 50 | H877: 56 | I877: 中融集团 | J877: 上海 | K877: 上海 | L877: 房地产、能源
A878: 877 | B878: 2012 | C878: 77 | D878: 王传福 | E878: 76.900000000000006 | F878: 男 | G878: =INT(RC[1]/10)*10 -> 40 | H878: 46 | I878: 比亚迪 | J878: 广东 | K878: 深圳 | L878: 电池、汽车、新能源
A879: 878 | B879: 2012 | C879: 78 | D879: 黄光裕夫妇 | E879: 76.2 | F879: 男 | G879: =INT(RC[1]/10)*10 -> 40 | H879: 43 | I879: 鹏润投资 | J879: 北京 | K879: 北京 | L879: 家电零售、房地产
A880: 879 | B880: 2012 | C880: 78 | D880: 朱共山 | E880: 76.2 | F880: 男 | G880: =INT(RC[1]/10)*10 -> 50 | H880: 54 | I880: 协鑫控股 | J880: 江苏 | K880: 徐州 | L880: 电力、太阳能
A881: 880 | B881: 2012 | C881: 80 | D881: 陈卓林夫妇 | E881: 75.599999999999994 | F881: 男 | G881: =INT(RC[1]/10)*10 -> 50 | H881: 50 | I881: 雅居乐地产 | J881: 广东 | K881: 中山 | L881: 房地产
A882: 881 | B882: 2012 | C882: 80 | D882: 刘宝林 | E882: 75.599999999999994 | F882: 男 | G882: =INT(RC[1]/10)*10 -> 50 | H882: 59 | I882: 九州通 | J882: 湖北 | K882: 武汉 | L882: 医药零售
A883: 882 | B883: 2012 | C883: 80 | D883: 沈文荣 | E883: 75.599999999999994 | F883: 男 | G883: =INT(RC[1]/10)*10 -> 60 | H883: 66 | I883: 江苏沙钢集团 | J883: 江苏 | K883: 张家港 | L883: 钢铁
A884: 883 | B884: 2012 | C884: 80 | D884: 王卫 | E884: 75.599999999999994 | F884: 男 | G884: / | H884: / | I884: 顺丰速运集团 | J884: 广东 | K884: 深圳 | L884: 物流
A885: 884 | B885: 2012 | C885: 84 | D885: 车建新 | E885: 75 | F885: 男 | G885: =INT(RC[1]/10)*10 -> 40 | H885: 46 | I885: 红星美凯龙 | J885: 上海 | K885: 上海 | L885: 商业地产、家居流通
A886: 885 | B886: 2012 | C886: 85 | D886: 邵根伙 | E886: 73.7 | F886: 男 | G886: =INT(RC[1]/10)*10 -> 40 | H886: 47 | I886: 大北农 | J886: 北京 | K886: 北京 | L886: 饲料及粮食、食品加工
A887: 886 | B887: 2012 | C887: 85 | D887: 周福仁家族 | E887: 73.7 | F887: 男 | G887: =INT(RC[1]/10)*10 -> 50 | H887: 55 | I887: 西洋集团 | J887: 辽宁 | K887: 海城 | L887: 化肥、耐火材料、铁矿
A888: 887 | B888: 2012 | C888: 87 | D888: 陈金霞 | E888: 71.8 | F888: 女 | G888: =INT(RC[1]/10)*10 -> 40 | H888: 44 | I888: 涌金集团 | J888: 上海 | K888: 上海 | L888: 投资、医药
A889: 888 | B889: 2012 | C889: 88 | D889: 丁欣欣夫妇 | E889: 71.2 | F889: 男 | G889: =INT(RC[1]/10)*10 -> 50 | H889: 54 | I889: 亚厦控股 | J889: 浙江 | K889: 杭州 | L889: 装修装饰
A890: 889 | B890: 2012 | C890: 88 | D890: 耿建明 | E890: 71.2 | F890: 男 | G890: =INT(RC[1]/10)*10 -> 50 | H890: 50 | I890: 荣盛控股 | J890: 河北 | K890: 廊坊 | L890: 房地产
A891: 890 | B891: 2012 | C891: 88 | D891: 杨爱华 | E891: 71.2 | F891: 男 | G891: =INT(RC[1]/10)*10 -> 50 | H891: 51 | I891: 宝信汽车集团 | J891: 上海 | K891: 上海 | L891: 汽车销售服务
A892: 891 | B892: 2012 | C892: 91 | D892: 陈天桥夫妇 | E892: 70.599999999999994 | F892: 男 | G892: =INT(RC[1]/10)*10 -> 30 | H892: 39 | I892: 盛大网络 | J892: 上海 | K892: 上海 | L892: 网络游戏等
A893: 892 | B893: 2012 | C893: 91 | D893: 黄毅 | E893: 70.599999999999994 | F893: 男 | G893: =INT(RC[1]/10)*10 -> 50 | H893: 50 | I893: 中升集团 | J893: 辽宁 | K893: 大连 | L893: 汽车销售服务
A894: 893 | B894: 2012 | C894: 91 | D894: 梁允超 | E894: 70.599999999999994 | F894: 男 | G894: =INT(RC[1]/10)*10 -> 40 | H894: 43 | I894: 汤臣倍健 | J894: 广东 | K894: 珠海 | L894: 保健品、食品制造
A895: 894 | B895: 2012 | C895: 91 | D895: 林聪颖 | E895: 70.599999999999994 | F895: 男 | G895: =INT(RC[1]/10)*10 -> 50 | H895: 51 | I895: 九牧王 | J895: 香港 | K895: 香港 | L895: 服装制造
A896: 895 | B896: 2012 | C896: 91 | D896: 徐镜人 | E896: 70.599999999999994 | F896: 男 | G896: =INT(RC[1]/10)*10 -> 60 | H896: 68 | I896: 扬子江药业 | J896: 江苏 | K896: 泰州 | L896: 医药
A897: 896 | B897: 2012 | C897: 91 | D897: 张中能夫妇 | E897: 70.599999999999994 | F897: 男 | G897: =INT(RC[1]/10)*10 -> 40 | H897: 49 | I897: 东阳光集团 | J897: 广东 | K897: 深圳 | L897: 金属制品、医药、酒店
A898: 897 | B898: 2012 | C898: 97 | D898: 蒋仁生父子 | E898: 69.3 | F898: 男 | G898: =INT(RC[1]/10)*10 -> 50 | H898: 59 | I898: 智飞生物 | J898: 重庆 | K898: 重庆 | L898: 生物药品制造
A899: 898 | B899: 2012 | C899: 97 | D899: 严彬 | E899: 69.3 | F899: 男 | G899: =INT(RC[1]/10)*10 -> 50 | H899: 58 | I899: 华彬国际集团 | J899: 北京 | K899: 北京 | L899: 房地产、体育产业、饮料、旅游、贸易
A900: 899 | B900: 2012 | C900: 99 | D900: 方威 | E900: 68.7 | F900: 男 | G900: =INT(RC[1]/10)*10 -> 30 | H900: 39 | I900: 辽宁方大集团 | J900: 北京 | K900: 北京 | L900: 石墨碳素、钢铁、化工
A901: 900 | B901: 2012 | C901: 100 | D901: 傅光明家族 | E901: 68 | F901: 男 | G901: =INT(RC[1]/10)*10 -> 50 | H901: 59 | I901: 圣农实业 | J901: 福建 | K901: 南平 | L901: 家禽饲养加工
A902: 901 | B902: 2012 | C902: 101 | D902: 柯希平夫妇 | E902: 67.400000000000006 | F902: 男 | G902: =INT(RC[1]/10)*10 -> 50 | H902: 52 | I902: 恒兴实业 | J902: 福建 | K902: 厦门 | L902: 房地产、投资
A903: 902 | B903: 2012 | C903: 102 | D903: 王文学 | E903: 66.8 | F903: 男 | G903: =INT(RC[1]/10)*10 -> 40 | H903: 45 | I903: 华夏幸福 | J903: 河北 | K903: 廊坊 | L903: 房地产
A904: 903 | B904: 2012 | C904: 103 | D904: 李银会 | E904: 66.2 | F904: 男 | G904: =INT(RC[1]/10)*10 -> 40 | H904: 46 | I904: 青青稞酒 | J904: 青海 | K904: 西宁 | L904: 饮料酒制造业
A905: 904 | B905: 2012 | C905: 104 | D905: 王木清 | E905: 65.5 | F905: 男 | G905: =INT(RC[1]/10)*10 -> 60 | H905: 61 | I905: 正通汽车 | J905: 上海 | K905: 上海 | L905: 汽车销售服务
A906: 905 | B906: 2012 | C906: 105 | D906: 曹德旺夫妇 | E906: 65.2 | F906: 男 | G906: =INT(RC[1]/10)*10 -> 60 | H906: 66 | I906: 福耀集团 | J906: 福建 | K906: 福清 | L906: 玻璃制造
A907: 906 | B907: 2012 | C907: 106 | D907: 黄世再 | E907: 64.900000000000006 | F907: 男 | G907: =INT(RC[1]/10)*10 -> 60 | H907: 61 | I907: 大中华国际 | J907: 广东 | K907: 深圳 | L907: 房地产
A908: 907 | B908: 2012 | C908: 106 | D908: 刘学景家族 | E908: 64.900000000000006 | F908: 男 | G908: =INT(RC[1]/10)*10 -> 60 | H908: 61 | I908: 新凤祥控股 | J908: 山东 | K908: 聊城 | L908: 铜加工、家禽饲养加工
A909: 908 | B909: 2012 | C909: 106 | D909: 谢炳 | E909: 64.900000000000006 | F909: 男 | G909: =INT(RC[1]/10)*10 -> 60 | H909: 60 | I909: 中国生物制药 | J909: 香港 | K909: 香港 | L909: 医药
A910: 909 | B910: 2012 | C910: 109 | D910: 黄晞家族 | E910: 64.3 | F910: 女 | G910: =INT(RC[1]/10)*10 -> 50 | H910: 50 | I910: 福信集团 | J910: 福建 | K910: 厦门 | L910: 房地产、投资
A911: 910 | B911: 2012 | C911: 109 | D911: 孙平范 | E911: 64.3 | F911: 男 | G911: =INT(RC[1]/10)*10 -> 40 | H911: 42 | I911: 慈星股份 | J911: 浙江 | K911: 宁波 | L911: 专用设备制造业
A912: 911 | B912: 2012 | C912: 111 | D912: 洪肇明家族 | E912: 63.9 | F912: 男 | G912: =INT(RC[1]/10)*10 -> 70 | H912: 77 | I912: 劲霸男装 | J912: 福建 | K912: 晋江 | L912: 服装
A913: 912 | B913: 2012 | C913: 112 | D913: 涂建华 | E913: 63.6 | F913: 男 | G913: =INT(RC[1]/10)*10 -> 40 | H913: 49 | I913: 隆鑫控股 | J913: 重庆 | K913: 重庆 | L913: 房地产、摩托车制造
A914: 913 | B914: 2012 | C914: 113 | D914: 牛宜顺家族 | E914: 63 | F914: 男 | G914: =INT(RC[1]/10)*10 -> 50 | H914: 57 | I914: 华勤橡胶工业集团 | J914: 山东 | K914: 兖州 | L914: 橡胶制造
A915: 914 | B915: 2012 | C915: 114 | D915: 张桂平父子 | E915: 62.1 | F915: 男 | G915: =INT(RC[1]/10)*10 -> 60 | H915: 61 | I915: 苏宁环球集团 | J915: 江苏 | K915: 南京 | L915: 房地产
A916: 915 | B916: 2012 | C916: 115 | D916: 董现君家族 | E916: 61.7 | F916: 男 | G916: =INT(RC[1]/10)*10 -> 40 | H916: 49 | I916: 江苏华厦融创置地集团 | J916: 江苏 | K916: 徐州 | L916: 房地产
A917: 916 | B917: 2012 | C917: 115 | D917: 黄怒波 | E917: 61.7 | F917: 男 | G917: =INT(RC[1]/10)*10 -> 50 | H917: 56 | I917: 中坤集团 | J917: 北京 | K917: 北京 | L917: 房地产、旅游
A918: 917 | B918: 2012 | C918: 115 | D918: 王振滔父子 | E918: 61.7 | F918: 男 | G918: =INT(RC[1]/10)*10 -> 40 | H918: 47 | I918: 奥康国际 | J918: 浙江 | K918: 温州 | L918: 制鞋业
A919: 918 | B919: 2012 | C919: 118 | D919: 刘革新 | E919: 60.2 | F919: 男 | G919: =INT(RC[1]/10)*10 -> 60 | H919: 61 | I919: 科伦药业 | J919: 四川 | K919: 成都 | L919: 化学药品制剂制造
A920: 919 | B920: 2012 | C920: 119 | D920: 何俊明夫妇 | E920: 59.9 | F920: 男 | G920: =INT(RC[1]/10)*10 -> 50 | H920: 54 | I920: 四川科创集团 | J920: 四川 | K920: 成都 | L920: 医药
A921: 920 | B921: 2012 | C921: 119 | D921: 周奕丰家族 | E921: 59.9 | F921: 男 | G921: =INT(RC[1]/10)*10 -> 40 | H921: 43 | I921: 鸿达兴业集团 | J921: 广东 | K921: 广州 | L921: 塑料、化工
A922: 921 | B922: 2012 | C922: 119 | D922: 周泽荣 | E922: 59.9 | F922: 男 | G922: =INT(RC[1]/10)*10 -> 50 | H922: 58 | I922: 侨鑫集团 | J922: 广东 | K922: 广州 | L922: 房地产、餐饮、媒体
A923: 922 | B923: 2012 | C923: 122 | D923: 李新炎夫妇 | E923: 59.2 | F923: 男 | G923: =INT(RC[1]/10)*10 -> 60 | H923: 62 | I923: 中国龙工集团 | J923: 上海 | K923: 上海 | L923: 机械装备制造
A924: 923 | B924: 2012 | C924: 123 | D924: 吕向阳 | E924: 58.9 | F924: 男 | G924: =INT(RC[1]/10)*10 -> 40 | H924: 49 | I924: 融捷投资、比亚迪股份 | J924: 广东 | K924: 广州 | L924: 投资
A925: 924 | B925: 2012 | C925: 124 | D925: 姜伟 | E925: 58.6 | F925: 男 | G925: =INT(RC[1]/10)*10 -> 50 | H925: 50 | I925: 贵州百灵 | J925: 贵州 | K925: 安顺 | L925: 医药、房地产
A926: 925 | B926: 2012 | C926: 124 | D926: 杨廷栋 | E926: 58.6 | F926: 男 | G926: =INT(RC[1]/10)*10 -> 50 | H926: 52 | I926: 洋河股份 | J926: 江苏 | K926: 宿迁 | L926: 饮料酒制造业
A927: 926 | B927: 2012 | C927: 126 | D927: 张克强 | E927: 58.3 | F927: 男 | G927: =INT(RC[1]/10)*10 -> 50 | H927: 52 | I927: 广东华美国际投资集团 | J927: 广东 | K927: 广州 | L927: 教育、投资
A928: 927 | B928: 2012 | C928: 127 | D928: 吴光明父子 | E928: 58 | F928: 男 | G928: =INT(RC[1]/10)*10 -> 50 | H928: 50 | I928: 鱼跃医疗 | J928: 江苏 | K928: 丹阳 | L928: 医疗器械
A929: 928 | B929: 2012 | C929: 128 | D929: 薛向东家族 | E929: 57.6 | F929: 男 | G929: =INT(RC[1]/10)*10 -> 50 | H929: 53 | I929: 东华软件 | J929: 北京 | K929: 北京 | L929: 计算机应用服务
A930: 929 | B930: 2012 | C930: 129 | D930: 阙文彬夫妇 | E930: 57.3 | F930: 男 | G930: =INT(RC[1]/10)*10 -> 40 | H930: 49 | I930: 独一味 、西部资源 | J930: 四川 | K930: 成都 | L930: 医药、矿业
A931: 930 | B931: 2012 | C931: 130 | D931: 盛百椒 | E931: 57 | F931: 男 | G931: =INT(RC[1]/10)*10 -> 60 | H931: 60 | I931: 百丽 | J931: 广东 | K931: 深圳 | L931: 鞋业、零售
A932: 931 | B932: 2012 | C932: 131 | D932: 高彦明 | E932: 56.7 | F932: 男 | G932: =INT(RC[1]/10)*10 -> 50 | H932: 55 | I932: 河北远洋运输集团 | J932: 河北 | K932: 秦皇岛 | L932: 海运
A933: 932 | B933: 2012 | C933: 131 | D933: 李金元 | E933: 56.7 | F933: 男 | G933: =INT(RC[1]/10)*10 -> 50 | H933: 54 | I933: 天狮集团 | J933: 天津 | K933: 天津 | L933: 保健品
A934: 933 | B934: 2012 | C934: 131 | D934: 赵步长父子 | E934: 56.7 | F934: 男 | G934: =INT(RC[1]/10)*10 -> 60 | H934: 69 | I934: 步长集团 | J934: 陕西 | K934: 西安 | L934: 医药
A935: 934 | B935: 2012 | C935: 134 | D935: 黄炳文家族 | E935: 56.4 | F935: 男 | G935: =INT(RC[1]/10)*10 -> 50 | H935: 58 | I935: 东风股份 | J935: 广东 | K935: 汕头 | L935: 印刷业
A936: 935 | B936: 2012 | C936: 134 | D936: 荣智健 | E936: 56.4 | F936: 男 | G936: =INT(RC[1]/10)*10 -> 70 | H936: 70 | I936: 中信泰富 | J936: 香港 | K936: 香港 | L936: 投资
A937: 936 | B937: 2012 | C937: 136 | D937: 王文京 | E937: 56.1 | F937: 男 | G937: =INT(RC[1]/10)*10 -> 40 | H937: 47 | I937: 用友软件 | J937: 北京 | K937: 北京 | L937: 软件开发
A938: 937 | B938: 2012 | C938: 136 | D938: 徐其明 | E938: 56.1 | F938: 男 | G938: =INT(RC[1]/10)*10 -> 40 | H938: 49 | I938: 徐龙集团 | J938: 浙江 | K938: 宁波 | L938: 水产养殖加工、收藏
A939: 938 | B939: 2012 | C939: 136 | D939: 周亚仙夫妇 | E939: 56.1 | F939: 女 | G939: =INT(RC[1]/10)*10 -> 50 | H939: 53 | I939: 神冠控股 | J939: 广西 | K939: 梧州 | L939: 食品
A940: 939 | B940: 2012 | C940: 139 | D940: 黄茂如夫妇 | E940: 55.8 | F940: 男 | G940: =INT(RC[1]/10)*10 -> 40 | H940: 47 | I940: 茂业集团 | J940: 广东 | K940: 深圳 | L940: 房地产、百货、零售
A941: 940 | B941: 2012 | C941: 139 | D941: 雷菊芳 | E941: 55.8 | F941: 女 | G941: =INT(RC[1]/10)*10 -> 50 | H941: 59 | I941: 奇正藏药 | J941: 甘肃 | K941: 兰州 | L941: 医药
A942: 941 | B942: 2012 | C942: 141 | D942: 唐修国 | E942: 55.4 | F942: 男 | G942: =INT(RC[1]/10)*10 -> 40 | H942: 49 | I942: 三一集团 | J942: 湖南 | K942: 长沙 | L942: 机械装备制造
A943: 942 | B943: 2012 | C943: 142 | D943: 刘沧龙 | E943: 55.1 | F943: 男 | G943: =INT(RC[1]/10)*10 -> 50 | H943: 57 | I943: 四川宏达集团 | J943: 四川 | K943: 成都 | L943: 冶金、矿业、化工、房地产、金融
A944: 943 | B944: 2012 | C944: 143 | D944: 戚金兴父子 | E944: 54.8 | F944: 男 | G944: =INT(RC[1]/10)*10 -> 50 | H944: 50 | I944: 滨江集团 | J944: 浙江 | K944: 杭州 | L944: 房地产
A945: 944 | B945: 2012 | C945: 143 | D945: 孙伟杰 | E945: 54.8 | F945: 男 | G945: =INT(RC[1]/10)*10 -> 40 | H945: 49 | I945: 杰瑞股份 | J945: 山东 | K945: 烟台 | L945: 油田矿山设备制造
A946: 945 | B946: 2012 | C946: 145 | D946: 欧宗荣 | E946: 54.2 | F946: 男 | G946: =INT(RC[1]/10)*10 -> 40 | H946: 48 | I946: 正荣集团 | J946: 福建 | K946: 福州 | L946: 房地产
A947: 946 | B947: 2012 | C947: 145 | D947: 张雨柏 | E947: 54.2 | F947: 男 | G947: =INT(RC[1]/10)*10 -> 40 | H947: 48 | I947: 洋河股份 | J947: 江苏 | K947: 宿迁 | L947: 饮料酒制造业
A948: 947 | B948: 2012 | C948: 145 | D948: 张跃 | E948: 54.2 | F948: 男 | G948: =INT(RC[1]/10)*10 -> 50 | H948: 52 | I948: 远大空调 | J948: 湖南 | K948: 长沙 | L948: 家电
A949: 948 | B949: 2012 | C949: 148 | D949: 冯海良 | E949: 53.9 | F949: 男 | G949: =INT(RC[1]/10)*10 -> 50 | H949: 52 | I949: 海亮集团 | J949: 浙江 | K949: 诸暨 | L949: 铜加工、房地产
A950: 949 | B950: 2012 | C950: 148 | D950: 刘汉家族 | E950: 53.9 | F950: 男 | G950: =INT(RC[1]/10)*10 -> 40 | H950: 47 | I950: 四川汉龙集团 | J950: 四川 | K950: 成都 | L950: 矿业、太阳能、基础设施、电力、房地产
A951: 950 | B951: 2012 | C951: 148 | D951: 尹明善家族 | E951: 53.9 | F951: 男 | G951: =INT(RC[1]/10)*10 -> 70 | H951: 74 | I951: 力帆集团 | J951: 重庆 | K951: 重庆 | L951: 摩托车、汽车制造
A952: 951 | B952: 2012 | C952: 151 | D952: 安康 | E952: 53.6 | F952: 男 | G952: =INT(RC[1]/10)*10 -> 60 | H952: 63 | I952: 华兰生物 | J952: 河南 | K952: 新乡 | L952: 生物医药
A953: 952 | B953: 2012 | C953: 151 | D953: 韩国龙家族 | E953: 53.6 | F953: 男 | G953: =INT(RC[1]/10)*10 -> 50 | H953: 57 | I953: 香港冠城集团 | J953: 香港 | K953: 香港 | L953: 房地产
A954: 953 | B954: 2012 | C954: 151 | D954: 黄文仔 | E954: 53.6 | F954: 男 | G954: =INT(RC[1]/10)*10 -> 50 | H954: 59 | I954: 星河湾 | J954: 广东 | K954: 广州 | L954: 房地产
A955: 954 | B955: 2012 | C955: 151 | D955: 黄振达家族 | E955: 53.6 | F955: 男 | G955: =INT(RC[1]/10)*10 -> 60 | H955: 65 | I955: 广东联泰集团 | J955: 广东 | K955: 汕头 | L955: 基础设施建设、房地产
A956: 955 | B956: 2012 | C956: 155 | D956: 陈学利 | E956: 52.9 | F956: 男 | G956: =INT(RC[1]/10)*10 -> 60 | H956: 61 | I956: 威高集团 | J956: 山东 | K956: 威海 | L956: 医疗器械、药品、房地产、投资
A957: 956 | B957: 2012 | C957: 155 | D957: 孔健岷 | E957: 52.9 | F957: 男 | G957: =INT(RC[1]/10)*10 -> 40 | H957: 44 | I957: 合景泰富地产 | J957: 广东 | K957: 广州 | L957: 房地产
A958: 957 | B958: 2012 | C958: 157 | D958: 顾伟 | E958: 52.3 | F958: 男 | G958: =INT(RC[1]/10)*10 -> 40 | H958: 47 | I958: 兆驰股份 | J958: 广东 | K958: 深圳 | L958: 日用电子器具制造
A959: 958 | B959: 2012 | C959: 158 | D959: 王义政 | E959: 52 | F959: 男 | G959: / | H959: / | I959: 福佳集团 | J959: 辽宁 | K959: 大连 | L959: 石油化工
A960: 959 | B960: 2012 | C960: 159 | D960: 朱孟依父子 | E960: 51.7 | F960: 男 | G960: =INT(RC[1]/10)*10 -> 50 | H960: 52 | I960: 合生创展 | J960: 广东 | K960: 广州 | L960: 房地产
A961: 960 | B961: 2012 | C961: 160 | D961: 黄红云家族 | E961: 51 | F961: 男 | G961: =INT(RC[1]/10)*10 -> 40 | H961: 46 | I961: 金科实业 | J961: 重庆 | K961: 重庆 | L961: 房地产
A962: 961 | B962: 2012 | C962: 160 | D962: 刘载望家族 | E962: 51 | F962: 男 | G962: =INT(RC[1]/10)*10 -> 40 | H962: 40 | I962: 江河幕墙 | J962: 北京 | K962: 北京 | L962: 装修装饰
A963: 962 | B963: 2012 | C963: 160 | D963: 孙喜双 | E963: 51 | F963: 男 | G963: =INT(RC[1]/10)*10 -> 50 | H963: 59 | I963: 大连一方集团 | J963: 辽宁 | K963: 大连 | L963: 房地产
A964: 963 | B964: 2012 | C964: 163 | D964: 罗韶宇夫妇 | E964: 50.7 | F964: 男 | G964: =INT(RC[1]/10)*10 -> 40 | H964: 42 | I964: 重庆东银集团 | J964: 重庆 | K964: 重庆 | L964: 房地产、汽车、能源
A965: 964 | B965: 2012 | C965: 163 | D965: 毛中吾 | E965: 50.7 | F965: 男 | G965: =INT(RC[1]/10)*10 -> 50 | H965: 50 | I965: 三一集团 | J965: 湖南 | K965: 长沙 | L965: 机械装备制造
A966: 965 | B966: 2012 | C966: 163 | D966: 苏增福父子 | E966: 50.7 | F966: 男 | G966: =INT(RC[1]/10)*10 -> 70 | H966: 71 | I966: 苏泊尔集团 | J966: 浙江 | K966: 杭州 | L966: 厨具、小家电
A967: 966 | B967: 2012 | C967: 163 | D967: 向文波 | E967: 50.7 | F967: 男 | G967: =INT(RC[1]/10)*10 -> 50 | H967: 50 | I967: 三一集团 | J967: 湖南 | K967: 长沙 | L967: 机械装备制造
A968: 967 | B968: 2012 | C968: 167 | D968: 李华 | E968: 50.4 | F968: 男 | G968: =INT(RC[1]/10)*10 -> 40 | H968: 46 | I968: 卓越集团 | J968: 广东 | K968: 深圳 | L968: 房地产
A969: 968 | B969: 2012 | C969: 168 | D969: 陈鸿道家族 | E969: 50.1 | F969: 男 | G969: / | H969: / | I969: 加多宝集团 | J969: 香港 | K969: 香港 | L969: 饮料
A970: 969 | B970: 2012 | C970: 168 | D970: 杜江涛夫妇 | E970: 50.1 | F970: 男 | G970: =INT(RC[1]/10)*10 -> 40 | H970: 42 | I970: 内蒙君正、博晖创新 | J970: 北京 | K970: 北京 | L970: 电力生产
A971: 970 | B971: 2012 | C971: 168 | D971: 姜照柏 | E971: 50.1 | F971: 男 | G971: =INT(RC[1]/10)*10 -> 40 | H971: 49 | I971: 鹏欣集团 | J971: 上海 | K971: 上海 | L971: 房地产、投资
A972: 971 | B972: 2012 | C972: 171 | D972: 江南春 | E972: 49.8 | F972: 男 | G972: =INT(RC[1]/10)*10 -> 30 | H972: 39 | I972: 分众传媒 | J972: 上海 | K972: 上海 | L972: 数字户外传媒
A973: 972 | B973: 2012 | C973: 171 | D973: 蒋业华 | E973: 49.8 | F973: 男 | G973: =INT(RC[1]/10)*10 -> 40 | H973: 49 | I973: 重庆华宇集团 | J973: 重庆 | K973: 重庆 | L973: 房地产
A974: 973 | B974: 2012 | C974: 171 | D974: 刘益谦 | E974: 49.8 | F974: 男 | G974: =INT(RC[1]/10)*10 -> 40 | H974: 48 | I974: 新理益集团 | J974: 上海 | K974: 上海 | L974: 投资
A975: 974 | B975: 2012 | C975: 171 | D975: 苏萌 | E975: 49.8 | F975: 男 | G975: / | H975: / | I975: 高德置地 | J975: 广东 | K975: 广州 | L975: 房地产
A976: 975 | B976: 2012 | C976: 171 | D976: 许世辉家族 | E976: 49.8 | F976: 男 | G976: / | H976: / | I976: 福建达利食品集团 | J976: 福建 | K976: 泉州 | L976: 食品饮料
A977: 976 | B977: 2012 | C977: 171 | D977: 叶远西父子 | E977: 49.8 | F977: 男 | G977: =INT(RC[1]/10)*10 -> 40 | H977: 49 | I977: 广田股份 | J977: 广东 | K977: 深圳 | L977: 装修装饰
A978: 977 | B978: 2012 | C978: 171 | D978: 朱文臣 | E978: 49.8 | F978: 男 | G978: =INT(RC[1]/10)*10 -> 40 | H978: 46 | I978: 辅仁药业集团 | J978: 河南 | K978: 郑州 | L978: 医药、饮料酒制造
A979: 978 | B979: 2012 | C979: 178 | D979: 缪汉根家族 | E979: 49.5 | F979: 男 | G979: =INT(RC[1]/10)*10 -> 40 | H979: 47 | I979: 盛虹集团 | J979: 江苏 | K979: 吴江 | L979: 化纤、印染、热电、房地产
A980: 979 | B980: 2012 | C980: 179 | D980: 梁信军 | E980: 49.1 | F980: 男 | G980: =INT(RC[1]/10)*10 -> 40 | H980: 44 | I980: 复星国际 | J980: 上海 | K980: 上海 | L980: 钢铁、房地产、医药、零售、金融
A981: 980 | B981: 2012 | C981: 179 | D981: 虞阿五父子 | E981: 49.1 | F981: 男 | G981: =INT(RC[1]/10)*10 -> 70 | H981: 70 | I981: 日月首饰 | J981: 浙江 | K981: 绍兴 | L981: 珠宝连锁、房地产、投资
A982: 981 | B982: 2012 | C982: 179 | D982: 赵满堂 | E982: 49.1 | F982: 男 | G982: =INT(RC[1]/10)*10 -> 50 | H982: 51 | I982: 盛达矿业 | J982: 甘肃 | K982: 兰州 | L982: 有色金属矿采选业
A983: 982 | B983: 2012 | C983: 182 | D983: 文剑平 | E983: 48.8 | F983: 男 | G983: =INT(RC[1]/10)*10 -> 50 | H983: 50 | I983: 碧水源 | J983: 北京 | K983: 北京 | L983: 污水处理
A984: 983 | B984: 2012 | C984: 183 | D984: 曲乃杰 | E984: 48.5 | F984: 男 | G984: =INT(RC[1]/10)*10 -> 50 | H984: 52 | I984: 海昌集团 | J984: 辽宁 | K984: 大连 | L984: 旅游、海运、石化
A985: 984 | B985: 2012 | C985: 184 | D985: 俞敏洪 | E985: 48.2 | F985: 男 | G985: =INT(RC[1]/10)*10 -> 50 | H985: 50 | I985: 新东方教育 | J985: 北京 | K985: 北京 | L985: 教育
A986: 985 | B986: 2012 | C986: 185 | D986: 霍庆华 | E986: 47.9 | F986: 男 | G986: =INT(RC[1]/10)*10 -> 50 | H986: 51 | I986: 中国庆华集团 | J986: 北京 | K986: 北京 | L986: 煤炭、化工
A987: 986 | B987: 2012 | C987: 185 | D987: 孙宏斌 | E987: 47.9 | F987: 男 | G987: =INT(RC[1]/10)*10 -> 40 | H987: 49 | I987: 融创中国 | J987: 天津 | K987: 天津 | L987: 房地产
A988: 987 | B988: 2012 | C988: 185 | D988: 易小迪 | E988: 47.9 | F988: 男 | G988: =INT(RC[1]/10)*10 -> 40 | H988: 48 | I988: 阳光100 | J988: 北京 | K988: 北京 | L988: 房地产
A989: 988 | B989: 2012 | C989: 188 | D989: 汪立平家族 | E989: 47.6 | F989: 男 | G989: =INT(RC[1]/10)*10 -> 40 | H989: 46 | I989: 恒立油缸 | J989: 江苏 | K989: 常州 | L989: 通用设备制造业
A990: 989 | B990: 2012 | C990: 188 | D990: 杨铿夫妇 | E990: 47.6 | F990: 男 | G990: =INT(RC[1]/10)*10 -> 50 | H990: 51 | I990: 四川蓝光 | J990: 四川 | K990: 成都 | L990: 房地产
A991: 990 | B991: 2012 | C991: 190 | D991: 陈建强 | E991: 47.3 | F991: 男 | G991: =INT(RC[1]/10)*10 -> 50 | H991: 54 | I991: 华地国际 | J991: 香港 | K991: 香港 | L991: 商业地产、零售
A992: 991 | B992: 2012 | C992: 190 | D992: 李振江 | E992: 47.3 | F992: 男 | G992: =INT(RC[1]/10)*10 -> 50 | H992: 56 | I992: 神威药业 | J992: 河北 | K992: 石家庄 | L992: 医药
A993: 992 | B993: 2012 | C993: 190 | D993: 王久芳父子 | E993: 47.3 | F993: 男 | G993: =INT(RC[1]/10)*10 -> 40 | H993: 48 | I993: 荣安地产 | J993: 浙江 | K993: 宁波 | L993: 房地产
A994: 993 | B994: 2012 | C994: 190 | D994: 王文良 | E994: 47.3 | F994: 男 | G994: =INT(RC[1]/10)*10 -> 50 | H994: 58 | I994: 日林实业集团 | J994: 辽宁 | K994: 丹东 | L994: 港口经营、造纸、建筑装饰
A995: 994 | B995: 2012 | C995: 190 | D995: 杨休 | E995: 47.3 | F995: 男 | G995: =INT(RC[1]/10)*10 -> 50 | H995: 51 | I995: 江苏天地集团 | J995: 江苏 | K995: 徐州 | L995: 房地产、博物馆
A996: 995 | B996: 2012 | C996: 195 | D996: 黄焕明 | E996: 46.9 | F996: 男 | G996: =INT(RC[1]/10)*10 -> 40 | H996: 49 | I996: 厦门明发集团 | J996: 福建 | K996: 厦门 | L996: 房地产
A997: 996 | B997: 2012 | C997: 195 | D997: 陆克平 | E997: 46.9 | F997: 男 | G997: =INT(RC[1]/10)*10 -> 60 | H997: 68 | I997: 江苏阳光集团 | J997: 江苏 | K997: 江阴 | L997: 纺织、太阳能
A998: 997 | B998: 2012 | C998: 195 | D998: 马鸿 | E998: 46.9 | F998: 男 | G998: =INT(RC[1]/10)*10 -> 40 | H998: 44 | I998: 搜于特 | J998: 广东 | K998: 东莞 | L998: 纺织品、服装、鞋帽零售
A999: 998 | B999: 2012 | C999: 198 | D999: 梁昭贤 | E999: 46.6 | F999: 男 | G999: =INT(RC[1]/10)*10 -> 40 | H999: 47 | I999: 格兰仕 | J999: 广东 | K999: 佛山 | L999: 日用电器制造
A1000: 999 | B1000: 2012 | C1000: 199 | D1000: 崔根良父子 | E1000: 46.3 | F1000: 男 | G1000: =INT(RC[1]/10)*10 -> 50 | H1000: 54 | I1000: 亨通集团 | J1000: 江苏 | K1000: 吴江 | L1000: 通信设备制造、金融、投资
A1001: 1000 | B1001: 2012 | C1001: 199 | D1001: 黄其森 | E1001: 46.3 | F1001: 男 | G1001: =INT(RC[1]/10)*10 -> 40 | H1001: 47 | I1001: 泰禾集团 | J1001: 福建 | K1001: 福州 | L1001: 房地产、投资
A1002: 1001 | B1002: 2012 | C1002: 199 | D1002: 孟庆山家族 | E1002: 46.3 | F1002: 男 | G1002: =INT(RC[1]/10)*10 -> 60 | H1002: 63 | I1002: 梅花集团 | J1002: 河北 | K1002: 廊坊 | L1002: 发酵制造
A1003: 1002 | B1003: 2012 | C1003: 202 | D1003: 胡柏藩 | E1003: 46 | F1003: 男 | G1003: =INT(RC[1]/10)*10 -> 50 | H1003: 50 | I1003: 新和成控股集团 | J1003: 浙江 | K1003: 绍兴 | L1003: 医药
A1004: 1003 | B1004: 2012 | C1004: 203 | D1004: 袁志敏家族 | E1004: 45.7 | F1004: 男 | G1004: =INT(RC[1]/10)*10 -> 50 | H1004: 51 | I1004: 金发科技 | J1004: 广东 | K1004: 广州 | L1004: 塑料、投资
A1005: 1004 | B1005: 2012 | C1005: 203 | D1005: 张双旺夫妇 | E1005: 45.7 | F1005: 男 | G1005: / | H1005: / | I1005: 内蒙古伊泰煤炭 | J1005: 内蒙古 | K1005: 鄂尔多斯 | L1005: 煤炭
A1006: 1005 | B1006: 2012 | C1006: 205 | D1006: 陈锦石家族 | E1006: 45.4 | F1006: 男 | G1006: =INT(RC[1]/10)*10 -> 40 | H1006: 49 | I1006: 中南控股集团 | J1006: 江苏 | K1006: 南通 | L1006: 房地产、建筑施工
A1007: 1006 | B1007: 2012 | C1007: 205 | D1007: 赵长甲 | E1007: 45.4 | F1007: 男 | G1007: =INT(RC[1]/10)*10 -> 50 | H1007: 54 | I1007: 长甲集团 | J1007: 上海 | K1007: 上海 | L1007: 房地产
A1008: 1007 | B1008: 2012 | C1008: 207 | D1008: 陈隆基 | E1008: 45 | F1008: 男 | G1008: =INT(RC[1]/10)*10 -> 50 | H1008: 56 | I1008: 利嘉国际 | J1008: 香港 | K1008: 香港 | L1008: 投资
A1009: 1008 | B1009: 2012 | C1009: 208 | D1009: 刘满世家族 | E1009: 44.7 | F1009: 男 | G1009: =INT(RC[1]/10)*10 -> 60 | H1009: 63 | I1009: 内蒙古满世煤炭集团 | J1009: 内蒙古 | K1009: 鄂尔多斯 | L1009: 煤炭、化工、房地产
A1010: 1009 | B1010: 2012 | C1010: 208 | D1010: 孙寿宽 | E1010: 44.7 | F1010: 男 | G1010: =INT(RC[1]/10)*10 -> 60 | H1010: 63 | I1010: 嘉晨集团 | J1010: 辽宁 | K1010: 营口 | L1010: 耐火材料、煤化工
A1011: 1010 | B1011: 2012 | C1011: 208 | D1011: 于泳 | E1011: 44.7 | F1011: 男 | G1011: / | H1011: / | I1011: 上海鸿商产业控股集团 | J1011: 上海 | K1011: 上海 | L1011: 投资
A1012: 1011 | B1012: 2012 | C1012: 211 | D1012: 朱志平 | E1012: 44.4 | F1012: 男 | G1012: =INT(RC[1]/10)*10 -> 50 | H1012: 50 | I1012: 同方联合控股 | J1012: 浙江 | K1012: 杭州 | L1012: 房地产
A1013: 1012 | B1013: 2012 | C1013: 212 | D1013: 李德文 | E1013: 44.1 | F1013: 男 | G1013: =INT(RC[1]/10)*10 -> 60 | H1013: 62 | I1013: 金帝集团 | J1013: 福建 | K1013: 泉州 | L1013: 房地产、教育
A1014: 1013 | B1014: 2012 | C1014: 212 | D1014: 刘强东 | E1014: 44.1 | F1014: 男 | G1014: =INT(RC[1]/10)*10 -> 30 | H1014: 38 | I1014: 京东商城 | J1014: 北京 | K1014: 北京 | L1014: 电子商务
A1015: 1014 | B1015: 2012 | C1015: 212 | D1015: 缪寿良 | E1015: 44.1 | F1015: 男 | G1015: =INT(RC[1]/10)*10 -> 50 | H1015: 57 | I1015: 富源集团 | J1015: 广东 | K1015: 深圳 | L1015: 房地产
A1016: 1015 | B1016: 2012 | C1016: 212 | D1016: 孙荫环 | E1016: 44.1 | F1016: 男 | G1016: / | H1016: / | I1016: 亿达集团 | J1016: 辽宁 | K1016: 大连 | L1016: 房地产
A1017: 1016 | B1017: 2012 | C1017: 212 | D1017: 俞培俤家族 | E1017: 44.1 | F1017: 男 | G1017: =INT(RC[1]/10)*10 -> 50 | H1017: 52 | I1017: 大名城 | J1017: 福建 | K1017: 福州 | L1017: 房地产
A1018: 1017 | B1018: 2012 | C1018: 212 | D1018: 张华威 | E1018: 44.1 | F1018: 男 | G1018: =INT(RC[1]/10)*10 -> 40 | H1018: 49 | I1018: 威高集团 | J1018: 山东 | K1018: 威海 | L1018: 医疗器械、药品、房地产、投资
A1019: 1018 | B1019: 2012 | C1019: 218 | D1019: 王伟林夫妇 | E1019: 43.8 | F1019: 男 | G1019: =INT(RC[1]/10)*10 -> 50 | H1019: 50 | I1019: 华丽家族 | J1019: 上海 | K1019: 上海 | L1019: 房地产
A1020: 1019 | B1020: 2012 | C1020: 218 | D1020: 周耀庭家族 | E1020: 43.8 | F1020: 男 | G1020: =INT(RC[1]/10)*10 -> 60 | H1020: 69 | I1020: 红豆集团 | J1020: 江苏 | K1020: 无锡 | L1020: 房地产、服装
A1021: 1020 | B1021: 2012 | C1021: 220 | D1021: 岑钊雄 | E1021: 43.5 | F1021: 男 | G1021: / | H1021: / | I1021: 时代地产 | J1021: 广东 | K1021: 广州 | L1021: 房地产
A1022: 1021 | B1022: 2012 | C1022: 220 | D1022: 李兆会 | E1022: 43.5 | F1022: 男 | G1022: =INT(RC[1]/10)*10 -> 30 | H1022: 31 | I1022: 海鑫实业 | J1022: 山西 | K1022: 运城 | L1022: 钢铁、金融
A1023: 1022 | B1023: 2012 | C1023: 222 | D1023: 蔡东青 | E1023: 43.2 | F1023: 男 | G1023: =INT(RC[1]/10)*10 -> 40 | H1023: 43 | I1023: 奥飞动漫 | J1023: 广东 | K1023: 汕头 | L1023: 动漫
A1024: 1023 | B1024: 2012 | C1024: 222 | D1024: 王以廷 | E1024: 43.2 | F1024: 男 | G1024: =INT(RC[1]/10)*10 -> 60 | H1024: 62 | I1024: 内蒙古太西煤集团 | J1024: 内蒙古 | K1024: 阿拉善 | L1024: 煤炭
A1025: 1024 | B1025: 2012 | C1025: 222 | D1025: 徐万茂 | E1025: 43.2 | F1025: 男 | G1025: =INT(RC[1]/10)*10 -> 60 | H1025: 67 | I1025: 宁波华茂 | J1025: 浙江 | K1025: 宁波 | L1025: 教育、金融
A1026: 1025 | B1026: 2012 | C1026: 225 | D1026: 侯建芳 | E1026: 42.8 | F1026: 男 | G1026: =INT(RC[1]/10)*10 -> 40 | H1026: 45 | I1026: 雏鹰农牧 | J1026: 河南 | K1026: 郑州 | L1026: 家禽饲养
A1027: 1026 | B1027: 2012 | C1027: 225 | D1027: 李仲初 | E1027: 42.8 | F1027: 男 | G1027: =INT(RC[1]/10)*10 -> 40 | H1027: 49 | I1027: 石基信息 | J1027: 北京 | K1027: 北京 | L1027: 计算机应用服务
A1028: 1027 | B1028: 2012 | C1028: 225 | D1028: 南存辉 | E1028: 42.8 | F1028: 男 | G1028: =INT(RC[1]/10)*10 -> 40 | H1028: 49 | I1028: 正泰集团 | J1028: 浙江 | K1028: 温州 | L1028: 电器机械及器材制造
A1029: 1028 | B1029: 2012 | C1029: 228 | D1029: 李国强 | E1029: 42.5 | F1029: 男 | G1029: =INT(RC[1]/10)*10 -> 40 | H1029: 48 | I1029: 中升集团 | J1029: 辽宁 | K1029: 大连 | L1029: 汽车销售服务
A1030: 1029 | B1030: 2012 | C1030: 228 | D1030: 张茵 | E1030: 42.5 | F1030: 女 | G1030: =INT(RC[1]/10)*10 -> 50 | H1030: 55 | I1030: 玖龙纸业 | J1030: 广东 | K1030: 东莞 | L1030: 造纸及纸制品
A1031: 1030 | B1031: 2012 | C1031: 230 | D1031: 刘汉元夫妇 | E1031: 42.2 | F1031: 男 | G1031: =INT(RC[1]/10)*10 -> 40 | H1031: 48 | I1031: 通威集团 | J1031: 四川 | K1031: 成都 | L1031: 饲料、房地产、太阳能
A1032: 1031 | B1032: 2012 | C1032: 231 | D1032: 杜厦 | E1032: 41.9 | F1032: 男 | G1032: =INT(RC[1]/10)*10 -> 60 | H1032: 65 | J1032: 天津 | K1032: 天津 | L1032: 投资
A1033: 1032 | B1033: 2012 | C1033: 231 | D1033: 邢利斌 | E1033: 41.9 | F1033: 男 | G1033: =INT(RC[1]/10)*10 -> 40 | H1033: 45 | I1033: 联盛能源 | J1033: 山西 | K1033: 吕梁 | L1033: 煤炭
A1034: 1033 | B1034: 2012 | C1034: 231 | D1034: 张祥青夫妇 | E1034: 41.9 | F1034: 男 | G1034: =INT(RC[1]/10)*10 -> 40 | H1034: 43 | I1034: 荣程联合钢铁 | J1034: 天津 | K1034: 天津 | L1034: 钢铁
A1035: 1034 | B1035: 2012 | C1035: 234 | D1035: 邓伟 | E1035: 41.6 | F1035: 男 | G1035: =INT(RC[1]/10)*10 -> 40 | H1035: 49 | I1035: 亿阳集团 | J1035: 北京 | K1035: 北京 | L1035: 计算机应用服务、交通、能源、投资
A1036: 1035 | B1036: 2012 | C1036: 234 | D1036: 周晓光夫妇 | E1036: 41.6 | F1036: 女 | G1036: =INT(RC[1]/10)*10 -> 50 | H1036: 50 | I1036: 新光控股集团 | J1036: 浙江 | K1036: 义乌 | L1036: 流行饰品、投资、商贸、地产
A1037: 1036 | B1037: 2012 | C1037: 236 | D1037: 王春生夫妇 | E1037: 41.3 | F1037: 男 | G1037: =INT(RC[1]/10)*10 -> 30 | H1037: 37 | I1037: 安杰科技 | J1037: 江苏 | K1037: 苏州 | L1037: 计算机相关设备制造业
A1038: 1037 | B1038: 2012 | C1038: 236 | D1038: 姚新义 | E1038: 41.3 | F1038: 男 | G1038: =INT(RC[1]/10)*10 -> 40 | H1038: 47 | I1038: 盾安集团 | J1038: 浙江 | K1038: 杭州 | L1038: 装备制造、民爆化工、房地产、能源
A1039: 1038 | B1039: 2012 | C1039: 238 | D1039: 陈金凤 | E1039: 41 | F1039: 女 | G1039: =INT(RC[1]/10)*10 -> 40 | H1039: 49 | I1039: 苏宁电器 | J1039: 江苏 | K1039: 南京 | L1039: 家电零售
A1040: 1039 | B1040: 2012 | C1040: 238 | D1040: 刘长乐 | E1040: 41 | F1040: 男 | G1040: =INT(RC[1]/10)*10 -> 60 | H1040: 61 | I1040: 凤凰卫视 | J1040: 香港 | K1040: 香港 | L1040: 传媒
A1041: 1040 | B1041: 2012 | C1041: 238 | D1041: 楼忠福家族 | E1041: 41 | F1041: 男 | G1041: =INT(RC[1]/10)*10 -> 50 | H1041: 58 | I1041: 广厦集团 | J1041: 浙江 | K1041: 杭州 | L1041: 房地产、建筑施工
A1042: 1041 | B1042: 2012 | C1042: 241 | D1042: 刘绍喜父子 | E1042: 40.6 | F1042: 男 | G1042: =INT(RC[1]/10)*10 -> 40 | H1042: 48 | I1042: 宜华企业集团 | J1042: 广东 | K1042: 汕头 | L1042: 木业、房地产、投资
A1043: 1042 | B1043: 2012 | C1043: 241 | D1043: 吴海军 | E1043: 40.6 | F1043: 男 | G1043: =INT(RC[1]/10)*10 -> 40 | H1043: 46 | I1043: 神舟电脑 | J1043: 广东 | K1043: 深圳 | L1043: 计算机
A1044: 1043 | B1044: 2012 | C1044: 243 | D1044: 车冯升 | E1044: 40.299999999999997 | F1044: 男 | G1044: =INT(RC[1]/10)*10 -> 40 | H1044: 49 | I1044: 四环医药控股集团 | J1044: 海南 | K1044: 海口 | L1044: 医药
A1045: 1044 | B1045: 2012 | C1045: 243 | D1045: 何亚民父女 | E1045: 40.299999999999997 | F1045: 男 | G1045: =INT(RC[1]/10)*10 -> 50 | H1045: 55 | I1045: 利君股份 | J1045: 四川 | K1045: 成都 | L1045: 冶金、矿山、机电工业专用设备制造业
A1046: 1045 | B1046: 2012 | C1046: 243 | D1046: 刘晓萌 | E1046: 40.299999999999997 | F1046: 女 | G1046: =INT(RC[1]/10)*10 -> 50 | H1046: 57 | I1046: 苏宁电器 | J1046: 江苏 | K1046: 南京 | L1046: 家电零售
A1047: 1046 | B1047: 2012 | C1047: 246 | D1047: 冯小华 | E1047: 40 | F1047: 男 | G1047: / | H1047: / | I1047: 广西洋浦南华糖业集团 | J1047: 广西 | K1047: 南宁 | L1047: 制糖业
A1048: 1047 | B1048: 2012 | C1048: 246 | D1048: 刘建民夫妇 | E1048: 40 | F1048: 男 | G1048: =INT(RC[1]/10)*10 -> 50 | H1048: 59 | I1048: 甘肃建新实业集团 | J1048: 甘肃 | K1048: 兰州 | L1048: 有色金属
A1049: 1048 | B1049: 2012 | C1049: 246 | D1049: 叶立培家族 | E1049: 40 | F1049: 男 | G1049: =INT(RC[1]/10)*10 -> 60 | H1049: 68 | I1049: 仲盛集团 | J1049: 上海 | K1049: 上海 | L1049: 房地产
A1050: 1049 | B1050: 2012 | C1050: 249 | D1050: 戴志康 | E1050: 39.700000000000003 | F1050: 男 | G1050: =INT(RC[1]/10)*10 -> 40 | H1050: 48 | I1050: 证大集团 | J1050: 上海 | K1050: 上海 | L1050: 房地产、金融、能源
A1051: 1050 | B1051: 2012 | C1051: 249 | D1051: 傅军 | E1051: 39.700000000000003 | F1051: 男 | G1051: =INT(RC[1]/10)*10 -> 50 | H1051: 55 | I1051: 新华联集团 | J1051: 北京 | K1051: 北京 | L1051: 房地产、陶瓷、投资
A1052: 1051 | B1052: 2012 | C1052: 249 | D1052: 贾廷亮夫妇 | E1052: 39.700000000000003 | F1052: 男 | G1052: =INT(RC[1]/10)*10 -> 50 | H1052: 56 | I1052: 大土河焦化 | J1052: 山西 | K1052: 吕梁 | L1052: 炼焦、煤炭
A1053: 1052 | B1053: 2012 | C1053: 249 | D1053: 贾跃亭 | E1053: 39.700000000000003 | F1053: 男 | G1053: =INT(RC[1]/10)*10 -> 30 | H1053: 39 | I1053: 乐视网 | J1053: 北京 | K1053: 北京 | L1053: 信息传播服务业
A1054: 1053 | B1054: 2012 | C1054: 249 | D1054: 牟金香 | E1054: 39.700000000000003 | F1054: 女 | G1054: =INT(RC[1]/10)*10 -> 50 | H1054: 58 | I1054: 联化科技 | J1054: 浙江 | K1054: 台州 | L1054: 精细化工
A1055: 1054 | B1055: 2012 | C1055: 249 | D1055: 张长虹 | E1055: 39.700000000000003 | F1055: 男 | G1055: =INT(RC[1]/10)*10 -> 50 | H1055: 54 | I1055: 大智慧 | J1055: 上海 | K1055: 上海 | L1055: 金融软件服务
A1056: 1055 | B1056: 2012 | C1056: 255 | D1056: 高振东 | E1056: 39.4 | F1056: 男 | G1056: =INT(RC[1]/10)*10 -> 40 | H1056: 47 | I1056: 苏州宝时得电动工具 | J1056: 江苏 | K1056: 苏州 | L1056: 工具制造
A1057: 1056 | B1057: 2012 | C1057: 255 | D1057: 林刚 | E1057: 39.4 | F1057: 男 | G1057: =INT(RC[1]/10)*10 -> 40 | H1057: 48 | I1057: 康哲药业控股 | J1057: 香港 | K1057: 香港 | L1057: 医药
A1058: 1057 | B1058: 2012 | C1058: 255 | D1058: 徐新建家族 | E1058: 39.4 | F1058: 男 | G1058: =INT(RC[1]/10)*10 -> 40 | H1058: 48 | I1058: 日出东方 | J1058: 江苏 | K1058: 连云港 | L1058: 电器机械及器材（太阳能热水器）制造业
A1059: 1058 | B1059: 2012 | C1059: 255 | D1059: 姚新泉 | E1059: 39.4 | F1059: 男 | G1059: =INT(RC[1]/10)*10 -> 40 | H1059: 45 | I1059: 盾安集团 | J1059: 浙江 | K1059: 杭州 | L1059: 装备制造、民爆化工、房地产、能源
A1060: 1059 | B1060: 2012 | C1060: 259 | D1060: 吴惠娣 | E1060: 39.1 | F1060: 女 | G1060: / | H1060: / | I1060: 江苏丰立集团 | J1060: 江苏 | K1060: 张家港 | L1060: 钢铁、制造、煤炭、物流
A1061: 1060 | B1061: 2012 | C1061: 259 | D1061: 徐传化父子 | E1061: 39.1 | F1061: 男 | G1061: =INT(RC[1]/10)*10 -> 70 | H1061: 77 | I1061: 传化集团 | J1061: 浙江 | K1061: 杭州 | L1061: 化工、物流、农业、投资
A1062: 1061 | B1062: 2012 | C1062: 261 | D1062: 任元林 | E1062: 38.700000000000003 | F1062: 男 | G1062: =INT(RC[1]/10)*10 -> 50 | H1062: 59 | I1062: 扬子江造船 | J1062: 江苏 | K1062: 江阴 | L1062: 造船
A1063: 1062 | B1063: 2012 | C1063: 261 | D1063: 郑效东 | E1063: 38.700000000000003 | F1063: 男 | G1063: =INT(RC[1]/10)*10 -> 40 | H1063: 48 | I1063: 东富龙 | J1063: 上海 | K1063: 上海 | L1063: 医疗器械制造
A1064: 1063 | B1064: 2012 | C1064: 261 | D1064: 朱保国家族 | E1064: 38.700000000000003 | F1064: 男 | G1064: =INT(RC[1]/10)*10 -> 50 | H1064: 50 | I1064: 健康元药业 | J1064: 广东 | K1064: 深圳 | L1064: 医药制造、保健品
A1065: 1064 | B1065: 2012 | C1065: 264 | D1065: 杨敏 | E1065: 38.4 | F1065: 女 | G1065: =INT(RC[1]/10)*10 -> 50 | H1065: 58 | I1065: 罕王集团 | J1065: 辽宁 | K1065: 沈阳 | L1065: 钢铁、矿业、零售
A1066: 1065 | B1066: 2012 | C1066: 265 | D1066: 王超斌 | E1066: 38.1 | F1066: 男 | G1066: =INT(RC[1]/10)*10 -> 50 | H1066: 56 | I1066: 中陆物流 | J1066: 河南 | K1066: 郑州 | L1066: 房地产、物流
A1067: 1066 | B1067: 2012 | C1067: 265 | D1067: 张宝全夫妇 | E1067: 38.1 | F1067: 男 | G1067: =INT(RC[1]/10)*10 -> 50 | H1067: 55 | I1067: 今典集团 | J1067: 北京 | K1067: 北京 | L1067: 房地产、文化
A1068: 1067 | B1068: 2012 | C1068: 267 | D1068: 曹克坚 | E1068: 37.799999999999997 | F1068: 男 | G1068: =INT(RC[1]/10)*10 -> 50 | H1068: 50 | I1068: 开山集团 | J1068: 浙江 | K1068: 衢州 | L1068: 机械制造
A1069: 1068 | B1069: 2012 | C1069: 267 | D1069: 黄俊康夫妇 | E1069: 37.799999999999997 | F1069: 男 | G1069: =INT(RC[1]/10)*10 -> 50 | H1069: 57 | I1069: 莱蒙国际 | J1069: 广东 | K1069: 深圳 | L1069: 房地产、零售投资
A1070: 1069 | B1070: 2012 | C1070: 267 | D1070: 黄立 | E1070: 37.799999999999997 | F1070: 男 | G1070: =INT(RC[1]/10)*10 -> 40 | H1070: 49 | I1070: 高德红外 | J1070: 湖北 | K1070: 武汉 | L1070: 电子设备制造
A1071: 1070 | B1071: 2012 | C1071: 267 | D1071: 金福音家族 | E1071: 37.799999999999997 | F1071: 男 | G1071: =INT(RC[1]/10)*10 -> 60 | H1071: 62 | I1071: 上海人民企业集团 | J1071: 上海 | K1071: 上海 | L1071: 输配电及控制设备制造
A1072: 1071 | B1072: 2012 | C1072: 267 | D1072: 李彬兰 | E1072: 37.799999999999997 | F1072: 女 | G1072: =INT(RC[1]/10)*10 -> 50 | H1072: 50 | I1072: 新一佳超市 | J1072: 广东 | K1072: 深圳 | L1072: 零售
A1073: 1072 | B1073: 2012 | C1073: 267 | D1073: 李勤夫 | E1073: 37.799999999999997 | F1073: 男 | G1073: =INT(RC[1]/10)*10 -> 50 | H1073: 50 | I1073: 九龙山 | J1073: 上海 | K1073: 上海 | L1073: 房地产
A1074: 1073 | B1074: 2012 | C1074: 267 | D1074: 林来嵘家族 | E1074: 37.799999999999997 | F1074: 男 | G1074: =INT(RC[1]/10)*10 -> 40 | H1074: 44 | I1074: 众兴集团 | J1074: 内蒙古 | K1074: 巴彦淖尔 | L1074: 铁矿、煤炭
A1075: 1074 | B1075: 2012 | C1075: 267 | D1075: 陆风 | E1075: 37.799999999999997 | F1075: 男 | G1075: / | H1075: / | I1075: wind 资讯 | J1075: 上海 | K1075: 上海 | L1075: 金融软件服务
A1076: 1075 | B1076: 2012 | C1076: 267 | D1076: 王清涛 | E1076: 37.799999999999997 | F1076: 男 | G1076: =INT(RC[1]/10)*10 -> 50 | H1076: 50 | I1076: 山东焦化集团 | J1076: 山东 | K1076: 济南 | L1076: 能源
A1077: 1076 | B1077: 2012 | C1077: 267 | D1077: 王永红 | E1077: 37.799999999999997 | F1077: 男 | G1077: =INT(RC[1]/10)*10 -> 40 | H1077: 40 | I1077: 中弘集团 | J1077: 北京 | K1077: 北京 | L1077: 房地产
A1078: 1077 | B1078: 2012 | C1078: 267 | D1078: 武世荣 | E1078: 37.799999999999997 | F1078: 男 | G1078: =INT(RC[1]/10)*10 -> 50 | H1078: 52 | I1078: 万正投资集团 | J1078: 内蒙古 | K1078: 鄂尔多斯 | L1078: 饮料酒制造、房地产、基础设施建设
A1079: 1078 | B1079: 2012 | C1079: 267 | D1079: 张文中 | E1079: 37.799999999999997 | F1079: 男 | G1079: =INT(RC[1]/10)*10 -> 50 | H1079: 50 | I1079: 物美集团 | J1079: 北京 | K1079: 北京 | L1079: 零售、投资
A1080: 1079 | B1080: 2012 | C1080: 267 | D1080: 张轩松 | E1080: 37.799999999999997 | F1080: 男 | G1080: =INT(RC[1]/10)*10 -> 40 | H1080: 41 | I1080: 永辉超市 | J1080: 福建 | K1080: 福州 | L1080: 零售
A1081: 1080 | B1081: 2012 | C1081: 267 | D1081: 郑元豹 | E1081: 37.799999999999997 | F1081: 男 | G1081: =INT(RC[1]/10)*10 -> 50 | H1081: 54 | I1081: 人民电器集团 | J1081: 浙江 | K1081: 温州 | L1081: 电器机械及器材制造
A1082: 1081 | B1082: 2012 | C1082: 267 | D1082: 朱庆伊 | E1082: 37.799999999999997 | F1082: 男 | G1082: =INT(RC[1]/10)*10 -> 40 | H1082: 43 | I1082: 珠江投资 | J1082: 广东 | K1082: 广州 | L1082: 房地产、投资
A1083: 1082 | B1083: 2012 | C1083: 282 | D1083: 丁世忠 | E1083: 37.5 | F1083: 男 | G1083: =INT(RC[1]/10)*10 -> 40 | H1083: 41 | I1083: 安踏体育 | J1083: 福建 | K1083: 泉州 | L1083: 运动服饰及体育用品
A1084: 1083 | B1084: 2012 | C1084: 282 | D1084: 范朝霞夫妇 | E1084: 37.5 | F1084: 女 | G1084: =INT(RC[1]/10)*10 -> 40 | H1084: 45 | I1084: 京运通 | J1084: 北京 | K1084: 北京 | L1084: 太阳能
A1085: 1084 | B1085: 2012 | C1085: 282 | D1085: 李西廷 | E1085: 37.5 | F1085: 男 | G1085: =INT(RC[1]/10)*10 -> 60 | H1085: 61 | I1085: 迈瑞医疗国际 | J1085: 广东 | K1085: 深圳 | L1085: 医疗设备
A1086: 1085 | B1086: 2012 | C1086: 282 | D1086: 梁亮胜 | E1086: 37.5 | F1086: 男 | G1086: =INT(RC[1]/10)*10 -> 60 | H1086: 61 | I1086: 丝宝集团 | J1086: 香港 | K1086: 香港 | L1086: 日化用品、药业、房地产
A1087: 1086 | B1087: 2012 | C1087: 282 | D1087: 徐航 | E1087: 37.5 | F1087: 男 | G1087: =INT(RC[1]/10)*10 -> 50 | H1087: 50 | I1087: 迈瑞医疗国际 | J1087: 广东 | K1087: 深圳 | L1087: 医疗设备
A1088: 1087 | B1088: 2012 | C1088: 282 | D1088: 杨文龙夫妇 | E1088: 37.5 | F1088: 男 | G1088: =INT(RC[1]/10)*10 -> 50 | H1088: 50 | I1088: 仁和集团 | J1088: 江西 | K1088: 樟树 | L1088: 医药
A1089: 1088 | B1089: 2012 | C1089: 288 | D1089: 莫天全 | E1089: 37.200000000000003 | F1089: 男 | G1089: =INT(RC[1]/10)*10 -> 40 | H1089: 48 | I1089: 搜房 | J1089: 北京 | K1089: 北京 | L1089: 房地产服务
A1090: 1089 | B1090: 2012 | C1090: 288 | D1090: 王坤晓 | E1090: 37.200000000000003 | F1090: 男 | G1090: =INT(RC[1]/10)*10 -> 40 | H1090: 43 | I1090: 杰瑞股份 | J1090: 山东 | K1090: 烟台 | L1090: 油田矿山设备制造
A1091: 1090 | B1091: 2012 | C1091: 288 | D1091: 杨贰珠 | E1091: 37.200000000000003 | F1091: 男 | G1091: =INT(RC[1]/10)*10 -> 60 | H1091: 61 | I1091: 碧桂园 | J1091: 广东 | K1091: 佛山 | L1091: 房地产
A1092: 1091 | B1092: 2012 | C1092: 291 | D1092: 王来春 | E1092: 36.9 | F1092: 女 | G1092: =INT(RC[1]/10)*10 -> 40 | H1092: 45 | I1092: 立讯精密 | J1092: 广东 | K1092: 深圳 | L1092: 电子元件制造
A1093: 1092 | B1093: 2012 | C1093: 291 | D1093: 王来胜 | E1093: 36.9 | F1093: 男 | G1093: =INT(RC[1]/10)*10 -> 40 | H1093: 47 | I1093: 立讯精密 | J1093: 广东 | K1093: 深圳 | L1093: 电子元件制造
A1094: 1093 | B1094: 2012 | C1094: 293 | D1094: 陈义红夫妇 | E1094: 36.5 | F1094: 男 | G1094: =INT(RC[1]/10)*10 -> 50 | H1094: 54 | I1094: 中国动向 | J1094: 北京 | K1094: 北京 | L1094: 运动服饰及体育用品
A1095: 1094 | B1095: 2012 | C1095: 293 | D1095: 刘福海家族 | E1095: 36.5 | F1095: 男 | G1095: =INT(RC[1]/10)*10 -> 50 | H1095: 58 | I1095: 山东大海集团 | J1095: 山东 | K1095: 东营 | L1095: 纺织、新能源、新材料、国际贸易
A1096: 1095 | B1096: 2012 | C1096: 293 | D1096: 刘振国 | E1096: 36.5 | F1096: 男 | G1096: =INT(RC[1]/10)*10 -> 40 | H1096: 47 | I1096: 碧水源 | J1096: 北京 | K1096: 北京 | L1096: 污水处理
A1097: 1096 | B1097: 2012 | C1097: 293 | D1097: 张秀根家族 | E1097: 36.5 | F1097: 男 | G1097: / | H1097: / | I1097: 华泰汽车 | J1097: 北京 | K1097: 北京 | L1097: 汽车制造
A1098: 1097 | B1098: 2012 | C1098: 297 | D1098: 庞庆华 | E1098: 36.200000000000003 | F1098: 男 | G1098: =INT(RC[1]/10)*10 -> 50 | H1098: 57 | I1098: 庞大集团 | J1098: 河北 | K1098: 唐山 | L1098: 汽车销售服务
A1099: 1098 | B1099: 2012 | C1099: 298 | D1099: 黄楚龙 | E1099: 35.9 | F1099: 男 | G1099: / | H1099: / | I1099: 星河集团 | J1099: 广东 | K1099: 深圳 | L1099: 房地产
A1100: 1099 | B1100: 2012 | C1100: 298 | D1100: 林国芳夫妇 | E1100: 35.9 | F1100: 男 | G1100: =INT(RC[1]/10)*10 -> 50 | H1100: 58 | I1100: 富安娜 | J1100: 广东 | K1100: 深圳 | L1100: 纺织
A1101: 1100 | B1101: 2012 | C1101: 300 | D1101: 陈邦 | E1101: 35.6 | F1101: 男 | G1101: =INT(RC[1]/10)*10 -> 40 | H1101: 47 | I1101: 爱尔眼科 | J1101: 湖南 | K1101: 长沙 | L1101: 卫生、保健、护理服务
A1102: 1101 | B1102: 2012 | C1102: 300 | D1102: 陈大年 | E1102: 35.6 | F1102: 男 | G1102: =INT(RC[1]/10)*10 -> 30 | H1102: 34 | I1102: 盛大网络 | J1102: 上海 | K1102: 上海 | L1102: 网络游戏等
A1103: 1102 | B1103: 2012 | C1103: 300 | D1103: 俞淇纲 | E1103: 35.6 | F1103: 男 | G1103: / | H1103: / | I1103: 深圳影儿时尚集团 | J1103: 广东 | K1103: 深圳 | L1103: 服装制造业
A1104: 1103 | B1104: 2012 | C1104: 303 | D1104: 仇建平夫妇 | E1104: 35.299999999999997 | F1104: 男 | G1104: =INT(RC[1]/10)*10 -> 50 | H1104: 50 | I1104: 巨星科技 | J1104: 浙江 | K1104: 杭州 | L1104: 工具制造
A1105: 1104 | B1105: 2012 | C1105: 303 | D1105: 高仕军家族 | E1105: 35.299999999999997 | F1105: 男 | G1105: =INT(RC[1]/10)*10 -> 40 | H1105: 45 | I1105: 高力集团 | J1105: 江苏 | K1105: 南京 | L1105: 房地产
A1106: 1105 | B1106: 2012 | C1106: 303 | D1106: 贺正刚 | E1106: 35.299999999999997 | F1106: 男 | G1106: =INT(RC[1]/10)*10 -> 50 | H1106: 58 | I1106: 和邦股份 | J1106: 四川 | K1106: 乐山 | L1106: 基本化学原料制造业
A1107: 1106 | B1107: 2012 | C1107: 303 | D1107: 黄绍武 | E1107: 35.299999999999997 | F1107: 男 | G1107: =INT(RC[1]/10)*10 -> 40 | H1107: 41 | I1107: 爱施德 | J1107: 广东 | K1107: 深圳 | L1107: 移动通讯产品销售服务
A1108: 1107 | B1108: 2012 | C1108: 303 | D1108: 王树生 | E1108: 35.299999999999997 | F1108: 男 | G1108: =INT(RC[1]/10)*10 -> 50 | H1108: 58 | I1108: 大田集团 | J1108: 天津 | K1108: 天津 | L1108: 物流
A1109: 1108 | B1109: 2012 | C1109: 308 | D1109: 丁世家 | E1109: 35 | F1109: 男 | G1109: =INT(RC[1]/10)*10 -> 40 | H1109: 48 | I1109: 安踏体育 | J1109: 福建 | K1109: 泉州 | L1109: 运动服饰及体育用品
A1110: 1109 | B1110: 2012 | C1110: 308 | D1110: 何著胜家族 | E1110: 35 | F1110: 男 | G1110: =INT(RC[1]/10)*10 -> 60 | H1110: 65 | I1110: 海城后英经贸集团 | J1110: 辽宁 | K1110: 海城 | L1110: 耐火材料、钢铁、大豆加工
A1111: 1110 | B1111: 2012 | C1111: 308 | D1111: 解直锟家族 | E1111: 35 | F1111: 男 | G1111: / | H1111: / | I1111: 中植企业集团 | J1111: 北京 | K1111: 北京 | L1111: 金融、投资、矿业能源
A1112: 1111 | B1112: 2012 | C1112: 308 | D1112: 金惠明家族 | E1112: 35 | F1112: 男 | G1112: =INT(RC[1]/10)*10 -> 50 | H1112: 59 | I1112: 上海大华集团 | J1112: 上海 | K1112: 上海 | L1112: 房地产
A1113: 1112 | B1113: 2012 | C1113: 308 | D1113: 林龙安夫妇 | E1113: 35 | F1113: 男 | G1113: =INT(RC[1]/10)*10 -> 40 | H1113: 48 | I1113: 禹洲地产 | J1113: 福建 | K1113: 厦门 | L1113: 房地产
A1114: 1113 | B1114: 2012 | C1114: 308 | D1114: 米恩华 | E1114: 35 | F1114: 男 | G1114: =INT(RC[1]/10)*10 -> 50 | H1114: 52 | I1114: 新疆华凌工贸集团 | J1114: 新疆 | K1114: 乌鲁木齐 | L1114: 批发零售
A1115: 1114 | B1115: 2012 | C1115: 308 | D1115: 张大中家族 | E1115: 35 | F1115: 男 | G1115: =INT(RC[1]/10)*10 -> 60 | H1115: 64 | I1115: 北京大中投资 | J1115: 北京 | K1115: 北京 | L1115: 投资
A1116: 1115 | B1116: 2012 | C1116: 315 | D1116: 崔志祥 | E1116: 34.700000000000003 | F1116: 男 | G1116: =INT(RC[1]/10)*10 -> 40 | H1116: 49 | I1116: 东营方圆有色金属 | J1116: 山东 | K1116: 东营 | L1116: 铜制品加工
A1117: 1116 | B1117: 2012 | C1117: 315 | D1117: 高雪峰 | E1117: 34.700000000000003 | F1117: 男 | G1117: =INT(RC[1]/10)*10 -> 50 | H1117: 54 | I1117: 内蒙古金诚泰化工 | J1117: 内蒙古 | K1117: 鄂尔多斯 | L1117: 化工
A1118: 1117 | B1118: 2012 | C1118: 315 | D1118: 李登海 | E1118: 34.700000000000003 | F1118: 男 | G1118: =INT(RC[1]/10)*10 -> 60 | H1118: 63 | I1118: 登海种业 | J1118: 山东 | K1118: 莱州 | L1118: 农业
A1119: 1118 | B1119: 2012 | C1119: 315 | D1119: 刘德群父女 | E1119: 34.700000000000003 | F1119: 男 | G1119: =INT(RC[1]/10)*10 -> 40 | H1119: 47 | I1119: 壹桥苗业 | J1119: 辽宁 | K1119: 大连 | L1119: 海洋渔业
A1120: 1119 | B1120: 2012 | C1120: 315 | D1120: 秦志威 | E1120: 34.700000000000003 | F1120: 男 | G1120: =INT(RC[1]/10)*10 -> 40 | H1120: 47 | I1120: 中国金属再生资源控股 | J1120: 香港 | K1120: 香港 | L1120: 金属回收
A1121: 1120 | B1121: 2012 | C1121: 315 | D1121: 万连步 | E1121: 34.700000000000003 | F1121: 男 | G1121: =INT(RC[1]/10)*10 -> 40 | H1121: 47 | I1121: 金正大 | J1121: 山东 | K1121: 临沂 | L1121: 化学肥料制造
A1122: 1121 | B1122: 2012 | C1122: 315 | D1122: 修涞贵 | E1122: 34.700000000000003 | F1122: 男 | G1122: =INT(RC[1]/10)*10 -> 50 | H1122: 58 | I1122: 修正药业集团 | J1122: 吉林 | K1122: 通化 | L1122: 医药
A1123: 1122 | B1123: 2012 | C1123: 315 | D1123: 姚振华 | E1123: 34.700000000000003 | F1123: 男 | G1123: =INT(RC[1]/10)*10 -> 40 | H1123: 42 | I1123: 宝能集团 | J1123: 广东 | K1123: 深圳 | L1123: 物流、百货、房地产
A1124: 1123 | B1124: 2012 | C1124: 315 | D1124: 张恩荣父子 | E1124: 34.700000000000003 | F1124: 男 | G1124: =INT(RC[1]/10)*10 -> 70 | H1124: 72 | I1124: 山东墨龙 | J1124: 山东 | K1124: 寿光 | L1124: 石化及其他工业专用设备制造业
A1125: 1124 | B1125: 2012 | C1125: 315 | D1125: 邹节明家族 | E1125: 34.700000000000003 | F1125: 男 | G1125: =INT(RC[1]/10)*10 -> 60 | H1125: 69 | I1125: 桂林三金 | J1125: 广西 | K1125: 桂林 | L1125: 医药
A1126: 1125 | B1126: 2012 | C1126: 325 | D1126: 陈泽民家族 | E1126: 34.299999999999997 | F1126: 男 | G1126: =INT(RC[1]/10)*10 -> 60 | H1126: 69 | I1126: 三全食品 | J1126: 河南 | K1126: 郑州 | L1126: 速冻食品、餐饮连锁
A1127: 1126 | B1127: 2012 | C1127: 325 | D1127: 何金明家族 | E1127: 34.299999999999997 | F1127: 男 | G1127: =INT(RC[1]/10)*10 -> 60 | H1127: 60 | I1127: 人人乐 | J1127: 广东 | K1127: 深圳 | L1127: 零售
A1128: 1127 | B1128: 2012 | C1128: 325 | D1128: 叶仙玉家族 | E1128: 34.299999999999997 | F1128: 男 | G1128: =INT(RC[1]/10)*10 -> 50 | H1128: 54 | I1128: 中国星星集团 | J1128: 浙江 | K1128: 台州 | L1128: 专用设备制造
A1129: 1128 | B1129: 2012 | C1129: 325 | D1129: 周建平 | E1129: 34.299999999999997 | F1129: 男 | G1129: =INT(RC[1]/10)*10 -> 50 | H1129: 52 | I1129: 海澜集团 | J1129: 江苏 | K1129: 江阴 | L1129: 服装连锁、纺织
A1130: 1129 | B1130: 2012 | C1130: 329 | D1130: 蒋卫平夫妇 | E1130: 34 | F1130: 男 | G1130: =INT(RC[1]/10)*10 -> 50 | H1130: 57 | I1130: 天齐锂业 | J1130: 四川 | K1130: 成都 | L1130: 化学原料及化学制品制造
A1131: 1130 | B1131: 2012 | C1131: 329 | D1131: 刘水 | E1131: 34 | F1131: 男 | G1131: =INT(RC[1]/10)*10 -> 40 | H1131: 43 | I1131: 铁汉生态 | J1131: 广东 | K1131: 深圳 | L1131: 土木工程建筑
A1132: 1131 | B1132: 2012 | C1132: 329 | D1132: 茹伯兴家族 | E1132: 34 | F1132: 男 | G1132: =INT(RC[1]/10)*10 -> 60 | H1132: 65 | I1132: 百兴集团 | J1132: 江苏 | K1132: 常州 | L1132: 工业制造、商贸、房地产、物流
A1133: 1132 | B1133: 2012 | C1133: 329 | D1133: 盛静生 | E1133: 34 | F1133: 男 | G1133: =INT(RC[1]/10)*10 -> 40 | H1133: 41 | I1133: 罗蒙集团 | J1133: 浙江 | K1133: 宁波 | L1133: 服饰连锁、房地产
A1134: 1133 | B1134: 2012 | C1134: 329 | D1134: 俞其兵 | E1134: 34 | F1134: 男 | G1134: =INT(RC[1]/10)*10 -> 40 | H1134: 46 | I1134: 旗滨集团 | J1134: 浙江 | K1134: 宁波 | L1134: 玻璃制造
A1135: 1134 | B1135: 2012 | C1135: 334 | D1135: 丁国雄家族 | E1135: 33.700000000000003 | F1135: 男 | G1135: =INT(RC[1]/10)*10 -> 40 | H1135: 45 | I1135: 乔丹体育 | J1135: 福建 | K1135: 晋江 | L1135: 运动服饰及体育用品
A1136: 1135 | B1136: 2012 | C1136: 334 | D1136: 康宝华 | E1136: 33.700000000000003 | F1136: 男 | G1136: =INT(RC[1]/10)*10 -> 50 | H1136: 59 | I1136: 远大中国控股、博林特 | J1136: 辽宁 | K1136: 沈阳 | L1136: 幕墙、专用设备(电梯)制造业
A1137: 1136 | B1137: 2012 | C1137: 334 | D1137: 李赶坡 | E1137: 33.700000000000003 | F1137: 男 | G1137: =INT(RC[1]/10)*10 -> 60 | H1137: 63 | I1137: 河北敬业集团 | J1137: 河北 | K1137: 石家庄 | L1137: 钢铁
A1138: 1137 | B1138: 2012 | C1138: 337 | D1138: 申东日 | E1138: 33.4 | F1138: 男 | G1138: =INT(RC[1]/10)*10 -> 40 | H1138: 40 | I1138: 朗姿股份 | J1138: 北京 | K1138: 北京 | L1138: 服装
A1139: 1138 | B1139: 2012 | C1139: 337 | D1139: 王勇 | E1139: 33.4 | F1139: 男 | G1139: =INT(RC[1]/10)*10 -> 60 | H1139: 62 | I1139: 西王集团 | J1139: 山东 | K1139: 滨州 | L1139: 糖业、钢铁
A1140: 1139 | B1140: 2012 | C1140: 337 | D1140: 张德生 | E1140: 33.4 | F1140: 男 | G1140: =INT(RC[1]/10)*10 -> 60 | H1140: 62 | I1140: 浙江万马电气电缆集团 | J1140: 浙江 | K1140: 杭州 | L1140: 电缆
A1141: 1140 | B1141: 2012 | C1141: 340 | D1141: 蒋锡培 | E1141: 33.1 | F1141: 男 | G1141: =INT(RC[1]/10)*10 -> 40 | H1141: 49 | I1141: 江苏远东集团 | J1141: 江苏 | K1141: 无锡 | L1141: 电缆、医药、房地产
A1142: 1141 | B1142: 2012 | C1142: 340 | D1142: 梁国兴 | E1142: 33.1 | F1142: 男 | G1142: =INT(RC[1]/10)*10 -> 40 | H1142: 46 | I1142: 银基集团 | J1142: 香港 | K1142: 香港 | L1142: 酒销售
A1143: 1142 | B1143: 2012 | C1143: 342 | D1143: 梁光夫父子 | E1143: 32.799999999999997 | F1143: 男 | G1143: =INT(RC[1]/10)*10 -> 80 | H1143: 80 | I1143: 春和集团 | J1143: 浙江 | K1143: 宁波 | L1143: 造船
A1144: 1143 | B1144: 2012 | C1144: 342 | D1144: 梁社增家族 | E1144: 32.799999999999997 | F1144: 男 | G1144: =INT(RC[1]/10)*10 -> 80 | H1144: 80 | I1144: 世荣兆业 | J1144: 广东 | K1144: 珠海 | L1144: 房地产
A1145: 1144 | B1145: 2012 | C1145: 342 | D1145: 宋卫平夫妇 | E1145: 32.799999999999997 | F1145: 男 | G1145: =INT(RC[1]/10)*10 -> 50 | H1145: 54 | I1145: 绿城集团 | J1145: 浙江 | K1145: 杭州 | L1145: 房地产
A1146: 1145 | B1146: 2012 | C1146: 342 | D1146: 许健康家族 | E1146: 32.799999999999997 | F1146: 男 | G1146: =INT(RC[1]/10)*10 -> 60 | H1146: 60 | I1146: 宝龙集团 | J1146: 福建 | K1146: 厦门 | L1146: 房地产
A1147: 1146 | B1147: 2012 | C1147: 346 | D1147: 黄巧灵 | E1147: 32.4 | F1147: 男 | G1147: =INT(RC[1]/10)*10 -> 50 | H1147: 53 | I1147: 宋城集团 | J1147: 浙江 | K1147: 杭州 | L1147: 旅游
A1148: 1147 | B1148: 2012 | C1148: 346 | D1148: 李兴 | E1148: 32.4 | F1148: 男 | G1148: =INT(RC[1]/10)*10 -> 50 | H1148: 59 | I1148: 江阴澄星集团 | J1148: 江苏 | K1148: 江阴 | L1148: 化工(精细磷化工)
A1149: 1148 | B1149: 2012 | C1149: 346 | D1149: 周庆治 | E1149: 32.4 | F1149: 男 | G1149: =INT(RC[1]/10)*10 -> 50 | H1149: 57 | I1149: 南都电源 | J1149: 浙江 | K1149: 杭州 | L1149: 电器机械及器材制造业
A1150: 1149 | B1150: 2012 | C1150: 349 | D1150: 陈卓贤 | E1150: 32.1 | F1150: 男 | G1150: =INT(RC[1]/10)*10 -> 40 | H1150: 45 | I1150: 雅居乐地产 | J1150: 广东 | K1150: 中山 | L1150: 房地产
A1151: 1150 | B1151: 2012 | C1151: 349 | D1151: 胡成中 | E1151: 32.1 | F1151: 男 | G1151: =INT(RC[1]/10)*10 -> 50 | H1151: 51 | I1151: 中国德力西集团 | J1151: 浙江 | K1151: 温州 | L1151: 电器机械及器材制造
A1152: 1151 | B1152: 2012 | C1152: 349 | D1152: 秦英林夫妇 | E1152: 32.1 | F1152: 男 | G1152: =INT(RC[1]/10)*10 -> 40 | H1152: 47 | I1152: 牧原食品 | J1152: 河南 | K1152: 南阳 | L1152: 畜牧饲养
A1153: 1152 | B1153: 2012 | C1153: 349 | D1153: 万永兴 | E1153: 32.1 | F1153: 男 | G1153: =INT(RC[1]/10)*10 -> 40 | H1153: 41 | I1153: 瑞茂通、和昌置业 | J1153: 河南 | K1153: 郑州 | L1153: 物流、房地产
A1154: 1153 | B1154: 2012 | C1154: 349 | D1154: 王填夫妇 | E1154: 32.1 | F1154: 男 | G1154: =INT(RC[1]/10)*10 -> 40 | H1154: 44 | I1154: 步步高商业连锁 | J1154: 湖南 | K1154: 湘潭 | L1154: 零售
A1155: 1154 | B1155: 2012 | C1155: 349 | D1155: 郑跃文 | E1155: 32.1 | F1155: 男 | G1155: =INT(RC[1]/10)*10 -> 50 | H1155: 50 | I1155: 科瑞集团 | J1155: 北京 | K1155: 北京 | L1155: 金融、房地产、制造、矿业
A1156: 1155 | B1156: 2012 | C1156: 349 | D1156: 朱崇恽夫妇 | E1156: 32.1 | F1156: 女 | G1156: / | H1156: / | I1156: 深圳玛丝菲尔时装 | J1156: 广东 | K1156: 深圳 | L1156: 服饰连锁
A1157: 1156 | B1157: 2012 | C1157: 349 | D1157: 左宗申家族 | E1157: 32.1 | F1157: 男 | G1157: =INT(RC[1]/10)*10 -> 60 | H1157: 60 | I1157: 宗申产业集团 | J1157: 重庆 | K1157: 重庆 | L1157: 交通运输设备制造业、房地产
A1158: 1157 | B1158: 2012 | C1158: 357 | D1158: 陈生 | E1158: 31.8 | F1158: 男 | G1158: / | H1158: / | I1158: 天地壹号饮料 | J1158: 广东 | K1158: 广州 | L1158: 饮料
A1159: 1158 | B1159: 2012 | C1159: 357 | D1159: 陈夏鑫夫妇 | E1159: 31.8 | F1159: 男 | G1159: =INT(RC[1]/10)*10 -> 50 | H1159: 50 | I1159: 西子电梯集团 | J1159: 浙江 | K1159: 杭州 | L1159: 工业及电梯制造、房地产、百货
A1160: 1159 | B1160: 2012 | C1160: 357 | D1160: 陈奕熙 | E1160: 31.8 | F1160: 男 | G1160: =INT(RC[1]/10)*10 -> 40 | H1160: 46 | I1160: 千百度国际 | J1160: 江苏 | K1160: 南京 | L1160: 鞋业连锁
A1161: 1160 | B1161: 2012 | C1161: 357 | D1161: 段连文 | E1161: 31.8 | F1161: 男 | G1161: =INT(RC[1]/10)*10 -> 60 | H1161: 62 | I1161: 南金兆集团 | J1161: 山东 | K1161: 淄博 | L1161: 钢铁、矿业
A1162: 1161 | B1162: 2012 | C1162: 357 | D1162: 马韵升 | E1162: 31.8 | F1162: 男 | G1162: =INT(RC[1]/10)*10 -> 40 | H1162: 49 | I1162: 京博控股 | J1162: 山东 | K1162: 滨州 | L1162: 石油化工
A1163: 1162 | B1163: 2012 | C1163: 357 | D1163: 邵仲毅 | E1163: 31.8 | F1163: 男 | G1163: =INT(RC[1]/10)*10 -> 40 | H1163: 44 | I1163: 山东晨曦集团 | J1163: 山东 | K1163: 日照 | L1163: 化学原料及化学制品制造
A1164: 1163 | B1164: 2012 | C1164: 357 | D1164: 徐锦鑫 | E1164: 31.8 | F1164: 男 | G1164: =INT(RC[1]/10)*10 -> 50 | H1164: 57 | I1164: 置信电气 | J1164: 上海 | K1164: 上海 | L1164: 电器机械及器材制造
A1165: 1164 | B1165: 2012 | C1165: 357 | D1165: 周鸿祎 | E1165: 31.8 | F1165: 男 | G1165: =INT(RC[1]/10)*10 -> 40 | H1165: 42 | I1165: 奇虎360 | J1165: 北京 | K1165: 北京 | L1165: 软件开发
A1166: 1165 | B1166: 2012 | C1166: 365 | D1166: 陈华 | E1166: 31.5 | F1166: 男 | G1166: =INT(RC[1]/10)*10 -> 40 | H1166: 46 | I1166: 京基集团 | J1166: 广东 | K1166: 深圳 | L1166: 房地产
A1167: 1166 | B1167: 2012 | C1167: 365 | D1167: 陈妙林 | E1167: 31.5 | F1167: 男 | G1167: =INT(RC[1]/10)*10 -> 60 | H1167: 60 | I1167: 开元旅业集团 | J1167: 浙江 | K1167: 杭州 | L1167: 酒店开发及管理
A1168: 1167 | B1168: 2012 | C1168: 365 | D1168: 钭正刚 | E1168: 31.5 | F1168: 男 | G1168: =INT(RC[1]/10)*10 -> 50 | H1168: 59 | I1168: 锦江集团 | J1168: 浙江 | K1168: 杭州 | L1168: 环保能源、有色金属、化工
A1169: 1168 | B1169: 2012 | C1169: 365 | D1169: 李琳 | E1169: 31.5 | F1169: 女 | G1169: / | H1169: / | I1169: 杭州江南布衣服饰 | J1169: 浙江 | K1169: 杭州 | L1169: 服饰连锁
A1170: 1169 | B1170: 2012 | C1170: 365 | D1170: 梁衍锋家族 | E1170: 31.5 | F1170: 男 | G1170: =INT(RC[1]/10)*10 -> 40 | H1170: 47 | I1170: 中庚集团 | J1170: 福建 | K1170: 福州 | L1170: 房地产
A1171: 1170 | B1171: 2012 | C1171: 365 | D1171: 潘超文 | E1171: 31.5 | F1171: 男 | G1171: =INT(RC[1]/10)*10 -> 40 | H1171: 49 | I1171: 福晟集团 | J1171: 福建 | K1171: 福州 | L1171: 房地产基础建设
A1172: 1171 | B1172: 2012 | C1172: 365 | D1172: 潘伟明 | E1172: 31.5 | F1172: 男 | H1172: / | I1172: 福晟集团 | J1172: 福建 | K1172: 福州 | L1172: 房地产基础建设
A1173: 1172 | B1173: 2012 | C1173: 365 | D1173: 潘慰 | E1173: 31.5 | F1173: 女 | G1173: =INT(RC[1]/10)*10 -> 50 | H1173: 57 | I1173: 味千(中国) | J1173: 上海 | K1173: 上海 | L1173: 餐饮连锁
A1174: 1173 | B1174: 2012 | C1174: 365 | D1174: 苏庭宝 | E1174: 31.5 | F1174: 男 | G1174: / | H1174: / | I1174: 荣达矿业 | J1174: 内蒙古 | K1174: 满洲里 | L1174: 矿业
A1175: 1174 | B1175: 2012 | C1175: 365 | D1175: 张华明 | E1175: 31.5 | F1175: 男 | G1175: / | H1175: / | I1175: 浙江雅莹 | J1175: 浙江 | K1175: 嘉兴 | L1175: 服装
A1176: 1175 | B1176: 2012 | C1176: 365 | D1176: 郑永刚 | E1176: 31.5 | F1176: 男 | G1176: =INT(RC[1]/10)*10 -> 50 | H1176: 53 | I1176: 杉杉集团 | J1176: 上海 | K1176: 上海 | L1176: 服装、新能源新材料、投资
A1177: 1176 | B1177: 2012 | C1177: 376 | D1177: 李洪信家族 | E1177: 31.2 | F1177: 男 | G1177: =INT(RC[1]/10)*10 -> 50 | H1177: 59 | I1177: 太阳纸业 | J1177: 山东 | K1177: 兖州 | L1177: 造纸及纸制品
A1178: 1177 | B1178: 2012 | C1178: 377 | D1178: 李德福 | E1178: 30.9 | F1178: 男 | G1178: =INT(RC[1]/10)*10 -> 50 | H1178: 54 | I1178: 永泰红磡控股集团 | J1178: 天津 | K1178: 天津 | L1178: 投资
A1179: 1178 | B1179: 2012 | C1179: 377 | D1179: 邵建明 | E1179: 30.9 | F1179: 男 | G1179: =INT(RC[1]/10)*10 -> 40 | H1179: 49 | I1179: 广东海印集团 | J1179: 广东 | K1179: 广州 | L1179: 零售、房地产、高岭土
A1180: 1179 | B1180: 2012 | C1180: 377 | D1180: 张雷 | E1180: 30.9 | F1180: 男 | G1180: =INT(RC[1]/10)*10 -> 50 | H1180: 50 | I1180: 当代集团 | J1180: 北京 | K1180: 北京 | L1180: 房地产
A1181: 1180 | B1181: 2012 | C1181: 377 | D1181: 周传有 | E1181: 30.9 | F1181: 男 | G1181: =INT(RC[1]/10)*10 -> 40 | H1181: 48 | I1181: 中金投资集团 | J1181: 上海 | K1181: 上海 | L1181: 金融贸易
A1182: 1181 | B1182: 2012 | C1182: 381 | D1182: 邱建林 | E1182: 30.6 | F1182: 男 | G1182: =INT(RC[1]/10)*10 -> 40 | H1182: 49 | I1182: 浙江恒逸集团 | J1182: 浙江 | K1182: 杭州 | L1182: 化学纤维制造
A1183: 1182 | B1183: 2012 | C1183: 381 | D1183: 邱奕博 | E1183: 30.6 | F1183: 男 | G1183: / | H1183: / | I1183: 浙江恒逸集团 | J1183: 浙江 | K1183: 杭州 | L1183: 化学纤维制造
A1184: 1183 | B1184: 2012 | C1184: 381 | D1184: 薛华 | E1184: 30.6 | F1184: 男 | G1184: =INT(RC[1]/10)*10 -> 40 | H1184: 42 | I1184: 海大集团 | J1184: 广东 | K1184: 广州 | L1184: 粮食及饲料加工业
A1185: 1184 | B1185: 2012 | C1185: 381 | D1185: 杨卫新 | E1185: 30.6 | F1185: 男 | G1185: =INT(RC[1]/10)*10 -> 50 | H1185: 50 | I1185: 百隆东方 | J1185: 浙江 | K1185: 宁波 | L1185: 棉纺织业
A1186: 1185 | B1186: 2012 | C1186: 381 | D1186: 俞建午 | E1186: 30.6 | F1186: 男 | G1186: =INT(RC[1]/10)*10 -> 40 | H1186: 46 | I1186: 宋都股份 | J1186: 浙江 | K1186: 杭州 | L1186: 房地产
A1187: 1186 | B1187: 2012 | C1187: 381 | D1187: 袁亚非 | E1187: 30.6 | F1187: 男 | G1187: =INT(RC[1]/10)*10 -> 40 | H1187: 48 | I1187: 三胞集团 | J1187: 江苏 | K1187: 南京 | L1187: 零售连锁、房地产、制造
A1188: 1187 | B1188: 2012 | C1188: 387 | D1188: 刘年新 | E1188: 30.2 | F1188: 男 | G1188: =INT(RC[1]/10)*10 -> 50 | H1188: 56 | I1188: 洪涛股份 | J1188: 广东 | K1188: 深圳 | L1188: 装修装饰业
A1189: 1188 | B1189: 2012 | C1189: 387 | D1189: 沈雯 | E1189: 30.2 | F1189: 男 | G1189: =INT(RC[1]/10)*10 -> 50 | H1189: 54 | I1189: 紫江集团 | J1189: 上海 | K1189: 上海 | L1189: 塑料制造、房地产
A1190: 1189 | B1190: 2012 | C1190: 387 | D1190: 王柏兴父子 | E1190: 30.2 | F1190: 男 | G1190: =INT(RC[1]/10)*10 -> 50 | H1190: 55 | I1190: 中利科技 | J1190: 江苏 | K1190: 常熟 | L1190: 特种电缆制造
A1191: 1190 | B1191: 2012 | C1191: 387 | D1191: 徐明波 | E1191: 30.2 | F1191: 男 | G1191: =INT(RC[1]/10)*10 -> 40 | H1191: 48 | I1191: 双鹭药业 | J1191: 北京 | K1191: 北京 | L1191: 医药
A1192: 1191 | B1192: 2012 | C1192: 387 | D1192: 尤小平父子 | E1192: 30.2 | F1192: 男 | G1192: =INT(RC[1]/10)*10 -> 50 | H1192: 54 | I1192: 华峰集团 | J1192: 浙江 | K1192: 温州 | L1192: 化学纤维制造
A1193: 1192 | B1193: 2012 | C1193: 387 | D1193: 张瑜平 | E1193: 30.2 | F1193: 男 | G1193: =INT(RC[1]/10)*10 -> 50 | H1193: 52 | I1193: 新宇亨得利 | J1193: 广东 | K1193: 东莞 | L1193: 钟表零售
A1194: 1193 | B1194: 2012 | C1194: 393 | D1194: 黄宏生 | E1194: 29.9 | F1194: 男 | G1194: =INT(RC[1]/10)*10 -> 50 | H1194: 55 | I1194: 创维数码 | J1194: 香港 | K1194: 香港 | L1194: 日用电器制造
A1195: 1194 | B1195: 2012 | C1195: 393 | D1195: 邱祥娟 | E1195: 29.9 | F1195: 女 | G1195: / | H1195: / | I1195: 浙江恒逸集团 | J1195: 浙江 | K1195: 杭州 | L1195: 化学纤维制造
A1196: 1195 | B1196: 2012 | C1196: 393 | D1196: 任正非 | E1196: 29.9 | F1196: 男 | G1196: =INT(RC[1]/10)*10 -> 60 | H1196: 68 | I1196: 华为技术 | J1196: 广东 | K1196: 深圳 | L1196: 通信
A1197: 1196 | B1197: 2012 | C1197: 393 | D1197: 王长田夫妇 | E1197: 29.9 | F1197: 男 | G1197: =INT(RC[1]/10)*10 -> 40 | H1197: 47 | I1197: 光线传媒 | J1197: 北京 | K1197: 北京 | L1197: 传媒
A1198: 1197 | B1198: 2012 | C1198: 393 | D1198: 王广西夫妇 | E1198: 29.9 | F1198: 男 | G1198: =INT(RC[1]/10)*10 -> 40 | H1198: 43 | I1198: 永泰控股 | J1198: 江苏 | K1198: 南京 | L1198: 能源、煤炭
A1199: 1198 | B1199: 2012 | C1199: 393 | D1199: 袁金华 | E1199: 29.9 | F1199: 男 | G1199: =INT(RC[1]/10)*10 -> 50 | H1199: 53 | I1199: 三一集团 | J1199: 湖南 | K1199: 长沙 | L1199: 机械装备制造
A1200: 1199 | B1200: 2012 | C1200: 399 | D1200: 陈念慈家族 | E1200: 29.6 | F1200: 男 | G1200: =INT(RC[1]/10)*10 -> 60 | H1200: 60 | I1200: 三江购物 | J1200: 浙江 | K1200: 宁波 | L1200: 零售业
A1201: 1200 | B1201: 2012 | C1201: 399 | D1201: 钟玉 | E1201: 29.6 | F1201: 男 | G1201: =INT(RC[1]/10)*10 -> 60 | H1201: 62 | I1201: 康得新 | J1201: 北京 | K1201: 北京 | L1201: 合成材料制造业
A1202: 1201 | B1202: 2011 | C1202: 1 | D1202: 梁稳根 | E1202: 594.5 | F1202: 男 | G1202: =INT(RC[1]/10)*10 -> 50 | H1202: 54 | I1202: 三一集团 | J1202: 湖南 | K1202: 长沙 | L1202: 机械装备制造
A1203: 1202 | B1203: 2011 | C1203: 2 | D1203: 李彦宏 | E1203: 588.20000000000005 | F1203: 男 | G1203: =INT(RC[1]/10)*10 -> 40 | H1203: 42 | I1203: 百度 | J1203: 北京 | K1203: 北京 | L1203: 搜索引擎
A1204: 1203 | B1204: 2011 | C1204: 3 | D1204: 刘永行 | E1204: 434.7 | F1204: 男 | G1204: =INT(RC[1]/10)*10 -> 60 | H1204: 63 | I1204: 东方希望集团 | J1204: 上海 | K1204: 上海 | L1204: 饲料、重化工业、投资
A1205: 1204 | B1205: 2011 | C1205: 4 | D1205: 刘永好 家族 | E1205: 421.9 | F1205: 男 | G1205: =INT(RC[1]/10)*10 -> 60 | H1205: 60 | I1205: 新希望集团 | J1205: 四川 | K1205: 成都 | L1205: 饲料、房地产、金融、化工
A1206: 1205 | B1206: 2011 | C1206: 5 | D1206: 宗庆后 | E1206: 415.5 | F1206: 男 | G1206: =INT(RC[1]/10)*10 -> 60 | H1206: 66 | I1206: 娃哈哈集团 | J1206: 浙江 | K1206: 杭州 | L1206: 饮料
A1207: 1206 | B1207: 2011 | C1207: 6 | D1207: 许家印 | E1207: 396.4 | F1207: 男 | G1207: =INT(RC[1]/10)*10 -> 50 | H1207: 52 | I1207: 恒大集团 | J1207: 广东 | K1207: 广州 | L1207: 房地产
A1208: 1207 | B1208: 2011 | C1208: 7 | D1208: 吴亚军夫妇 | E1208: 377.2 | F1208: 女 | G1208: =INT(RC[1]/10)*10 -> 40 | H1208: 47 | I1208: 龙湖地产 | J1208: 北京 | K1208: 北京 | L1208: 房地产
A1209: 1208 | B1209: 2011 | C1209: 8 | D1209: 张近东 | E1209: 358 | F1209: 男 | G1209: =INT(RC[1]/10)*10 -> 40 | H1209: 48 | I1209: 苏宁电器 | J1209: 江苏 | K1209: 南京 | L1209: 家电零售
A1210: 1209 | B1210: 2011 | C1210: 9 | D1210: 何享健 | E1210: 351.6 | F1210: 男 | G1210: =INT(RC[1]/10)*10 -> 60 | H1210: 69 | I1210: 美的集团 | J1210: 广东 | K1210: 佛山 | L1210: 日用电器制造
A1211: 1210 | B1211: 2011 | C1211: 10 | D1211: 邱光和家族 | E1211: 306.89999999999998 | F1211: 男 | G1211: =INT(RC[1]/10)*10 -> 50 | H1211: 59 | I1211: 森马服饰 | J1211: 浙江 | K1211: 温州 | L1211: 纺织品、服装、鞋帽零售
A1212: 1211 | B1212: 2011 | C1212: 11 | D1212: 杨惠妍 | E1212: 287.7 | F1212: 女 | G1212: =INT(RC[1]/10)*10 -> 20 | H1212: 29 | I1212: 碧桂园 | J1212: 广东 | K1212: 佛山 | L1212: 房地产
A1213: 1212 | B1213: 2011 | C1213: 12 | D1213: 周成建 | E1213: 281.3 | F1213: 男 | G1213: =INT(RC[1]/10)*10 -> 40 | H1213: 46 | I1213: 美邦服饰 | J1213: 上海 | K1213: 上海 | L1213: 服装连锁
A1214: 1213 | B1214: 2011 | C1214: 13 | D1214: 马化腾 | E1214: 274.89999999999998 | F1214: 男 | G1214: =INT(RC[1]/10)*10 -> 30 | H1214: 39 | I1214: 腾讯 | J1214: 广东 | K1214: 深圳 | L1214: 即时通讯、门户网站、网络游戏
A1215: 1214 | B1215: 2011 | C1215: 14 | D1215: 张士平家族 | E1215: 268.5 | F1215: 男 | G1215: =INT(RC[1]/10)*10 -> 60 | H1215: 64 | I1215: 中国宏桥集团、山东魏桥创业集团 | J1215: 山东 | K1215: 滨州 | L1215: 矿业、纺织
A1216: 1215 | B1216: 2011 | C1216: 15 | D1216: 王健林 | E1216: 255.7 | F1216: 男 | G1216: =INT(RC[1]/10)*10 -> 50 | H1216: 57 | I1216: 大连万达集团 | J1216: 辽宁 | K1216: 大连 | L1216: 房地产
A1217: 1216 | B1217: 2011 | C1217: 16 | D1217: 张欣夫妇 | E1217: 211 | F1217: 女 | G1217: =INT(RC[1]/10)*10 -> 40 | H1217: 45 | I1217: SOHO中国 | J1217: 北京 | K1217: 北京 | L1217: 房地产
A1218: 1217 | B1218: 2011 | C1218: 17 | D1218: 黄光裕夫妇 | E1218: 207.8 | F1218: 男 | G1218: =INT(RC[1]/10)*10 -> 40 | H1218: 42 | I1218: 鹏润投资 | J1218: 北京 | K1218: 北京 | L1218: 家电零售、房地产
A1219: 1218 | B1219: 2011 | C1219: 18 | D1219: 陈发树 | E1219: 204.6 | F1219: 男 | G1219: =INT(RC[1]/10)*10 -> 50 | H1219: 50 | I1219: 新华都实业集团 | J1219: 福建 | K1219: 福州 | L1219: 零售、投资、房地产
A1220: 1219 | B1220: 2011 | C1220: 19 | D1220: 卢志强 | E1220: 198.2 | F1220: 男 | G1220: =INT(RC[1]/10)*10 -> 50 | H1220: 59 | I1220: 泛海集团 | J1220: 北京 | K1220: 北京 | L1220: 金融、房地产、投资
A1221: 1220 | B1221: 2011 | C1221: 20 | D1221: 李水荣 | E1221: 196.9 | F1221: 男 | G1221: =INT(RC[1]/10)*10 -> 50 | H1221: 55 | I1221: 浙江荣盛控股集团 | J1221: 浙江 | K1221: 杭州 | L1221: 化纤、石化
A1222: 1221 | B1222: 2011 | C1222: 21 | D1222: 鲁冠球 父子 | E1222: 195.6 | F1222: 男 | G1222: =INT(RC[1]/10)*10 -> 60 | H1222: 66 | I1222: 万向集团 | J1222: 浙江 | K1222: 杭州 | L1222: 汽车、有色金属、房地产、农业
A1223: 1222 | B1223: 2011 | C1223: 22 | D1223: 张志熔 | E1223: 191.8 | F1223: 男 | G1223: =INT(RC[1]/10)*10 -> 40 | H1223: 42 | I1223: 恒盛地产、熔盛重工 | J1223: 香港 | K1223: 香港 | L1223: 房地产、造船
A1224: 1223 | B1224: 2011 | C1224: 23 | D1224: 李锂夫妇 | E1224: 185.4 | F1224: 男 | G1224: =INT(RC[1]/10)*10 -> 40 | H1224: 47 | I1224: 海普瑞 | J1224: 广东 | K1224: 深圳 | L1224: 医药
A1225: 1224 | B1225: 2011 | C1225: 24 | D1225: 孙广信 | E1225: 179 | F1225: 男 | G1225: =INT(RC[1]/10)*10 -> 40 | H1225: 48 | I1225: 新疆广汇实业投资(集团) | J1225: 新疆 | K1225: 乌鲁木齐 | L1225: 能源、汽车销售服务、房地产
A1226: 1225 | B1226: 2011 | C1226: 25 | D1226: 丁磊 | E1226: 176.4 | F1226: 男 | G1226: =INT(RC[1]/10)*10 -> 30 | H1226: 39 | I1226: 网易 | J1226: 广东 | K1226: 广州 | L1226: 门户网站
A1227: 1226 | B1227: 2011 | C1227: 26 | D1227: 黄伟夫妇 | E1227: 175.8 | F1227: 男 | G1227: =INT(RC[1]/10)*10 -> 50 | H1227: 52 | I1227: 新湖集团 | J1227: 浙江 | K1227: 杭州 | L1227: 房地产、金融、矿业、生物制药
A1228: 1227 | B1228: 2011 | C1228: 27 | D1228: 郭广昌 | E1228: 175.2 | F1228: 男 | G1228: =INT(RC[1]/10)*10 -> 40 | H1228: 44 | I1228: 复星国际 | J1228: 上海 | K1228: 上海 | L1228: 钢铁、房地产、医药、金融
A1229: 1228 | B1229: 2011 | C1229: 28 | D1229: 陈建华 夫妇 | E1229: 159.80000000000001 | F1229: 男 | G1229: =INT(RC[1]/10)*10 -> 40 | H1229: 40 | I1229: 恒力集团 | J1229: 江苏 | K1229: 吴江 | L1229: 化纤、石化
A1230: 1229 | B1230: 2011 | C1230: 29 | D1230: 许荣茂 | E1230: 153.4 | F1230: 男 | G1230: =INT(RC[1]/10)*10 -> 60 | H1230: 61 | I1230: 世茂集团 | J1230: 香港 | K1230: 香港 | L1230: 房地产
A1231: 1230 | B1231: 2011 | C1231: 30 | D1231: 朱共山 | E1231: 147 | F1231: 男 | G1231: =INT(RC[1]/10)*10 -> 50 | H1231: 53 | I1231: 协鑫控股 | J1231: 江苏 | K1231: 徐州 | L1231: 电力、太阳能
A1232: 1231 | B1232: 2011 | C1232: 31 | D1232: 祝义材夫妇 | E1232: 144.5 | F1232: 男 | G1232: =INT(RC[1]/10)*10 -> 40 | H1232: 47 | I1232: 雨润集团 | J1232: 江苏 | K1232: 南京 | L1232: 食品、房地产
A1233: 1232 | B1233: 2011 | C1233: 32 | D1233: 陈丽华家族 | E1233: 142.6 | F1233: 女 | G1233: =INT(RC[1]/10)*10 -> 70 | H1233: 70 | I1233: 富华集团 | J1233: 北京 | K1233: 北京 | L1233: 房地产
A1234: 1233 | B1234: 2011 | C1234: 33 | D1234: 朱林瑶 | E1234: 140.6 | F1234: 女 | G1234: =INT(RC[1]/10)*10 -> 40 | H1234: 41 | I1234: 华宝国际 | J1234: 香港 | K1234: 香港 | L1234: 香料香精
A1235: 1234 | B1235: 2011 | C1235: 34 | D1235: 刘忠田 | E1235: 128.5 | F1235: 男 | G1235: =INT(RC[1]/10)*10 -> 40 | H1235: 47 | I1235: 忠旺集团 | J1235: 辽宁 | K1235: 辽阳 | L1235: 工业铝型材
A1236: 1235 | B1236: 2011 | C1236: 35 | D1236: 沈国军 | E1236: 127.9 | F1236: 男 | G1236: =INT(RC[1]/10)*10 -> 40 | H1236: 49 | I1236: 银泰集团 | J1236: 北京 | K1236: 北京 | L1236: 零售、房地产
A1237: 1236 | B1237: 2011 | C1237: 36 | D1237: 施文博 | E1237: 126.6 | F1237: 男 | G1237: =INT(RC[1]/10)*10 -> 60 | H1237: 61 | I1237: 恒安集团 | J1237: 福建 | K1237: 晋江 | L1237: 个人护理用品
A1238: 1237 | B1238: 2011 | C1238: 37 | D1238: 许连捷（许自连） | E1238: 124 | F1238: 男 | G1238: =INT(RC[1]/10)*10 -> 50 | H1238: 58 | I1238: 恒安集团 | J1238: 福建 | K1238: 晋江 | L1238: 个人护理用品
A1239: 1238 | B1239: 2011 | C1239: 38 | D1239: 龚虹嘉夫妇 | E1239: 123.4 | F1239: 男 | G1239: =INT(RC[1]/10)*10 -> 40 | H1239: 46 | I1239: 海康威视 | J1239: 香港 | K1239: 香港 | L1239: 电子产品制造
A1240: 1239 | B1240: 2011 | C1240: 39 | D1240: 马云 | E1240: 121.5 | F1240: 男 | G1240: =INT(RC[1]/10)*10 -> 40 | H1240: 46 | I1240: 阿里巴巴 | J1240: 浙江 | K1240: 杭州 | L1240: 电子商务、网上零售及支付
A1241: 1240 | B1241: 2011 | C1241: 40 | D1241: 王木清 | E1241: 118.9 | F1241: 男 | G1241: =INT(RC[1]/10)*10 -> 60 | H1241: 60 | I1241: 正通汽车 | J1241: 上海 | K1241: 上海 | L1241: 汽车销售服务
A1242: 1241 | B1242: 2011 | C1242: 41 | D1242: 孟庆山家族 | E1242: 118.3 | F1242: 男 | G1242: =INT(RC[1]/10)*10 -> 60 | H1242: 62 | I1242: 梅花集团 | J1242: 河北 | K1242: 廊坊 | L1242: 发酵制造
A1243: 1242 | B1243: 2011 | C1243: 42 | D1243: 史玉柱 | E1243: 117 | F1243: 男 | G1243: =INT(RC[1]/10)*10 -> 40 | H1243: 48 | I1243: 巨人集团 | J1243: 上海 | K1243: 上海 | L1243: 保健品、网络游戏、投资
A1244: 1243 | B1244: 2011 | C1244: 43 | D1244: 陈宁宁家族 | E1244: 115.1 | F1244: 女 | G1244: =INT(RC[1]/10)*10 -> 40 | H1244: 40 | I1244: 香港嘉鑫控股集团 | J1244: 香港 | K1244: 香港 | L1244: 投资
A1245: 1244 | B1245: 2011 | C1245: 44 | D1245: 沈文荣 | E1245: 114.4 | F1245: 男 | G1245: =INT(RC[1]/10)*10 -> 60 | H1245: 65 | I1245: 江苏沙钢集团 | J1245: 江苏 | K1245: 张家港 | L1245: 钢铁
A1246: 1245 | B1246: 2011 | C1246: 45 | D1246: 吴以岭家族 | E1246: 110.6 | F1246: 男 | G1246: =INT(RC[1]/10)*10 -> 60 | H1246: 61 | I1246: 以岭药业 | J1246: 河北 | K1246: 石家庄 | L1246: 医药
A1247: 1246 | B1247: 2011 | C1247: 46 | D1247: 张志东 | E1247: 110 | F1247: 男 | G1247: =INT(RC[1]/10)*10 -> 30 | H1247: 39 | I1247: 腾讯 | J1247: 广东 | K1247: 深圳 | L1247: 即时通讯、门户网站、网络游戏
A1248: 1247 | B1248: 2011 | C1248: 47 | D1248: 姜滨夫妇 | E1248: 109.3 | F1248: 男 | G1248: =INT(RC[1]/10)*10 -> 40 | H1248: 44 | I1248: 歌尔声学 | J1248: 山东 | K1248: 潍坊 | L1248: 电子元器件制造
A1249: 1248 | B1249: 2011 | C1249: 48 | D1249: 高德康家族 | E1249: 108.7 | F1249: 男 | G1249: =INT(RC[1]/10)*10 -> 50 | H1249: 59 | I1249: 波司登 | J1249: 江苏 | K1249: 常熟 | L1249: 服装
A1250: 1249 | B1250: 2011 | C1250: 49 | D1250: 梁庆德父子 | E1250: 108 | F1250: 男 | G1250: =INT(RC[1]/10)*10 -> 70 | H1250: 74 | I1250: 格兰仕 | J1250: 广东 | K1250: 佛山 | L1250: 日用电器制造
A1251: 1250 | B1251: 2011 | C1251: 50 | D1251: 何巧女夫妇 | E1251: 107.4 | F1251: 女 | G1251: =INT(RC[1]/10)*10 -> 40 | H1251: 45 | I1251: 东方园林 | J1251: 北京 | K1251: 北京 | L1251: 园林设计
A1252: 1251 | B1252: 2011 | C1252: 51 | D1252: 周福仁家族 | E1252: 106.8 | F1252: 男 | G1252: =INT(RC[1]/10)*10 -> 50 | H1252: 54 | I1252: 西洋集团 | J1252: 辽宁 | K1252: 海城 | L1252: 化肥、耐火材料、铁矿
A1253: 1252 | B1253: 2011 | C1253: 52 | D1253: 马兴田家族 | E1253: 102.9 | F1253: 男 | G1253: =INT(RC[1]/10)*10 -> 40 | H1253: 42 | I1253: 康美药业 | J1253: 广东 | K1253: 普宁 | L1253: 医药
A1254: 1253 | B1254: 2011 | C1254: 53 | D1254: 薛光林 | E1254: 102.3 | F1254: 男 | G1254: =INT(RC[1]/10)*10 -> 40 | H1254: 43 | I1254: 光汇石油 | J1254: 香港 | K1254: 香港 | L1254: 石油化工
A1255: 1254 | B1255: 2011 | C1255: 54 | D1255: 张桂平父子 | E1255: 98.5 | F1255: 男 | G1255: =INT(RC[1]/10)*10 -> 60 | H1255: 60 | I1255: 苏宁环球集团 | J1255: 江苏 | K1255: 南京 | L1255: 房地产
A1256: 1255 | B1256: 2011 | C1256: 55 | D1256: 黄泽兰夫妇 | E1256: 97.8 | F1256: 男 | G1256: =INT(RC[1]/10)*10 -> 50 | H1256: 56 | I1256: 章源钨业 | J1256: 江西 | K1256: 赣州 | L1256: 有色金属
A1257: 1256 | B1257: 2011 | C1257: 56 | D1257: 王传福 | E1257: 97.2 | F1257: 男 | G1257: =INT(RC[1]/10)*10 -> 40 | H1257: 45 | I1257: 比亚迪 | J1257: 广东 | K1257: 深圳 | L1257: 电池、汽车、新能源
A1258: 1257 | B1258: 2011 | C1258: 57 | D1258: 宋作文 | E1258: 96.5 | F1258: 男 | G1258: =INT(RC[1]/10)*10 -> 60 | H1258: 64 | I1258: 山东南山集团 | J1258: 山东 | K1258: 龙口 | L1258: 铝业、建筑、纺织
A1259: 1258 | B1259: 2011 | C1259: 57 | D1259: 王玉锁夫妇 | E1259: 96.5 | F1259: 男 | G1259: =INT(RC[1]/10)*10 -> 40 | H1259: 47 | I1259: 新奥集团 | J1259: 河北 | K1259: 廊坊 | L1259: 能源、房地产
A1260: 1259 | B1260: 2011 | C1260: 59 | D1260: 张力 | E1260: 95.9 | F1260: 男 | G1260: =INT(RC[1]/10)*10 -> 50 | H1260: 58 | I1260: 富力集团 | J1260: 广东 | K1260: 广州 | L1260: 房地产、投资
A1261: 1260 | B1261: 2011 | C1261: 60 | D1261: 李新炎夫妇 | E1261: 95.3 | F1261: 男 | G1261: =INT(RC[1]/10)*10 -> 60 | H1261: 61 | I1261: 中国龙工集团 | J1261: 上海 | K1261: 上海 | L1261: 机械装备制造
A1262: 1261 | B1262: 2011 | C1262: 61 | D1262: 张宏伟 | E1262: 94.6 | F1262: 男 | G1262: =INT(RC[1]/10)*10 -> 50 | H1262: 56 | I1262: 北京东方集团 | J1262: 北京 | K1262: 北京 | L1262: 家居连锁、金融、矿业、港口
A1263: 1262 | B1263: 2011 | C1263: 61 | D1263: 庞庆华 | E1263: 94.6 | F1263: 男 | G1263: =INT(RC[1]/10)*10 -> 50 | H1263: 55 | I1263: 庞大集团 | J1263: 河北 | K1263: 唐山 | L1263: 汽车销售服务
A1264: 1263 | B1264: 2011 | C1264: 63 | D1264: 叶澄海家族 | E1264: 94 | F1264: 男 | G1264: =INT(RC[1]/10)*10 -> 60 | H1264: 68 | I1264: 信立泰 | J1264: 香港 | K1264: 香港 | L1264: 医药
A1265: 1264 | B1265: 2011 | C1265: 64 | D1265: 黄茂如夫妇 | E1265: 93.3 | F1265: 男 | G1265: =INT(RC[1]/10)*10 -> 40 | H1265: 46 | I1265: 茂业集团 | J1265: 广东 | K1265: 深圳 | L1265: 房地产、百货、零售
A1266: 1265 | B1266: 2011 | C1266: 65 | D1266: 朱兴良 | E1266: 92.7 | F1266: 男 | G1266: =INT(RC[1]/10)*10 -> 50 | H1266: 52 | I1266: 金螳螂 | J1266: 江苏 | K1266: 苏州 | L1266: 装修装饰
A1267: 1266 | B1267: 2011 | C1267: 65 | D1267: 傅光明家族 | E1267: 92.7 | F1267: 男 | G1267: =INT(RC[1]/10)*10 -> 50 | H1267: 57 | I1267: 圣农实业 | J1267: 福建 | K1267: 南平 | L1267: 家禽饲养加工
A1268: 1267 | B1268: 2011 | C1268: 67 | D1268: 林秀成家族 | E1268: 92.1 | F1268: 男 | G1268: =INT(RC[1]/10)*10 -> 50 | H1268: 55 | I1268: 福建三安集团 | J1268: 福建 | K1268: 厦门 | L1268: 电子元器件制造、钢铁
A1269: 1268 | B1269: 2011 | C1269: 68 | D1269: 唐修国 | E1269: 91.4 | F1269: 男 | G1269: =INT(RC[1]/10)*10 -> 40 | H1269: 48 | I1269: 三一集团 | J1269: 湖南 | K1269: 长沙 | L1269: 机械装备制造
A1270: 1269 | B1270: 2011 | C1270: 69 | D1270: 黄如论 | E1270: 90.1 | F1270: 男 | G1270: =INT(RC[1]/10)*10 -> 60 | H1270: 60 | I1270: 世纪金源集团 | J1270: 北京 | K1270: 北京 | L1270: 房地产、投资
A1271: 1270 | B1271: 2011 | C1271: 70 | D1271: 童锦泉 | E1271: 89.5 | F1271: 男 | G1271: =INT(RC[1]/10)*10 -> 50 | H1271: 56 | I1271: 长峰房地产 | J1271: 上海 | K1271: 上海 | L1271: 房地产
A1272: 1271 | B1272: 2011 | C1272: 71 | D1272: 黄联禧 | E1272: 88.2 | F1272: 男 | G1272: =INT(RC[1]/10)*10 -> 40 | H1272: 49 | I1272: 中国联塑集团 | J1272: 香港 | K1272: 香港 | L1272: 塑料制造
A1273: 1272 | B1273: 2011 | C1273: 72 | D1273: 林聪颖 | E1273: 87.6 | F1273: 男 | G1273: =INT(RC[1]/10)*10 -> 50 | H1273: 50 | I1273: 九牧王 | J1273: 香港 | K1273: 香港 | L1273: 服装制造
A1274: 1273 | B1274: 2011 | C1274: 73 | D1274: 黄毅 | E1274: 86.9 | F1274: 男 | G1274: =INT(RC[1]/10)*10 -> 40 | H1274: 49 | I1274: 中升集团 | J1274: 辽宁 | K1274: 大连 | L1274: 汽车销售服务
A1275: 1274 | B1275: 2011 | C1275: 74 | D1275: 林立 | E1275: 86.3 | F1275: 男 | G1275: =INT(RC[1]/10)*10 -> 40 | H1275: 48 | I1275: 深圳立业集团 | J1275: 广东 | K1275: 深圳 | L1275: 金融、投资
A1276: 1275 | B1276: 2011 | C1276: 75 | D1276: 陈卓林夫妇 | E1276: 85.7 | F1276: 男 | G1276: =INT(RC[1]/10)*10 -> 40 | H1276: 49 | I1276: 雅居乐地产 | J1276: 广东 | K1276: 中山 | L1276: 房地产
A1277: 1276 | B1277: 2011 | C1277: 76 | D1277: 昝圣达 | E1277: 84.4 | F1277: 男 | G1277: =INT(RC[1]/10)*10 -> 40 | H1277: 48 | I1277: 综艺集团 | J1277: 江苏 | K1277: 南通 | L1277: 太阳能、投资、计算机应用服务
A1278: 1277 | B1278: 2011 | C1278: 77 | D1278: 丁欣欣夫妇 | E1278: 83.7 | F1278: 男 | G1278: =INT(RC[1]/10)*10 -> 50 | H1278: 53 | I1278: 亚厦控股 | J1278: 浙江 | K1278: 杭州 | L1278: 装修装饰
A1279: 1278 | B1279: 2011 | C1279: 77 | D1279: 刘革新 | E1279: 83.7 | F1279: 男 | G1279: =INT(RC[1]/10)*10 -> 60 | H1279: 60 | I1279: 科伦药业 | J1279: 四川 | K1279: 成都 | L1279: 化学药品制剂制造
A1280: 1279 | B1280: 2011 | C1280: 79 | D1280: 向文波 | E1280: 82.5 | F1280: 男 | G1280: =INT(RC[1]/10)*10 -> 40 | H1280: 49 | I1280: 三一集团 | J1280: 湖南 | K1280: 长沙 | L1280: 机械装备制造
A1281: 1280 | B1281: 2011 | C1281: 79 | D1281: 毛中吾 | E1281: 82.5 | F1281: 男 | G1281: =INT(RC[1]/10)*10 -> 40 | H1281: 49 | I1281: 三一集团 | J1281: 湖南 | K1281: 长沙 | L1281: 机械装备制造
A1282: 1281 | B1282: 2011 | C1282: 81 | D1282: 袁志敏 家族 | E1282: 81.8 | F1282: 男 | G1282: =INT(RC[1]/10)*10 -> 50 | H1282: 50 | I1282: 金发科技 | J1282: 广东 | K1282: 广州 | L1282: 塑料、投资
A1283: 1282 | B1283: 2011 | C1283: 82 | D1283: 吴光明父子 | E1283: 81.2 | F1283: 男 | G1283: =INT(RC[1]/10)*10 -> 40 | H1283: 49 | I1283: 鱼跃医疗 | J1283: 江苏 | K1283: 丹阳 | L1283: 医疗器械
A1284: 1283 | B1284: 2011 | C1284: 83 | D1284: 徐镜人父子 | E1284: 80.599999999999994 | F1284: 男 | G1284: =INT(RC[1]/10)*10 -> 60 | H1284: 67 | I1284: 扬子江药业 | J1284: 江苏 | K1284: 泰州 | L1284: 医药
A1285: 1284 | B1285: 2011 | C1285: 84 | D1285: 黄绍武 | E1285: 79.900000000000006 | F1285: 男 | G1285: =INT(RC[1]/10)*10 -> 40 | H1285: 40 | I1285: 爱施德 | J1285: 广东 | K1285: 深圳 | L1285: 移动通讯产品销售服务
A1286: 1285 | B1286: 2011 | C1286: 84 | D1286: 方威 | E1286: 79.900000000000006 | F1286: 男 | G1286: =INT(RC[1]/10)*10 -> 30 | H1286: 37 | I1286: 辽宁方大集团 | J1286: 北京 | K1286: 北京 | L1286: 石墨碳素、钢铁、化工
A1287: 1286 | B1287: 2011 | C1287: 86 | D1287: 刘志强夫妇 | E1287: 79.3 | F1287: 男 | G1287: =INT(RC[1]/10)*10 -> 40 | H1287: 46 | I1287: 广东香江集团 | J1287: 广东 | K1287: 广州 | L1287: 房地产、家居流通、能源、金融
A1288: 1287 | B1288: 2011 | C1288: 87 | D1288: 李书福 | E1288: 78.599999999999994 | F1288: 男 | G1288: =INT(RC[1]/10)*10 -> 40 | H1288: 48 | I1288: 吉利集团 | J1288: 浙江 | K1288: 杭州 | L1288: 汽车制造
A1289: 1288 | B1289: 2011 | C1289: 87 | D1289: 车建新 | E1289: 78.599999999999994 | F1289: 男 | G1289: =INT(RC[1]/10)*10 -> 40 | H1289: 45 | I1289: 红星美凯龙 | J1289: 上海 | K1289: 上海 | L1289: 商业地产、家居流通
A1290: 1289 | B1290: 2011 | C1290: 89 | D1290: 黄世再 | E1290: 78 | F1290: 男 | G1290: =INT(RC[1]/10)*10 -> 60 | H1290: 60 | I1290: 大中华国际 | J1290: 广东 | K1290: 深圳 | L1290: 房地产
A1291: 1290 | B1291: 2011 | C1291: 90 | D1291: 王文京 | E1291: 77.400000000000006 | F1291: 男 | G1291: =INT(RC[1]/10)*10 -> 40 | H1291: 46 | I1291: 用友软件 | J1291: 北京 | K1291: 北京 | L1291: 软件开发
A1292: 1291 | B1292: 2011 | C1292: 90 | D1292: 霍庆华 | E1292: 77.400000000000006 | F1292: 男 | G1292: =INT(RC[1]/10)*10 -> 50 | H1292: 50 | I1292: 中国庆华集团 | J1292: 北京 | K1292: 北京 | L1292: 煤炭、化工
A1293: 1292 | B1293: 2011 | C1293: 90 | D1293: 蒋仁生父子 | E1293: 77.400000000000006 | F1293: 男 | G1293: =INT(RC[1]/10)*10 -> 50 | H1293: 57 | I1293: 智飞生物 | J1293: 重庆 | K1293: 重庆 | L1293: 生物药品制造
A1294: 1293 | B1294: 2011 | C1294: 93 | D1294: 孙飘扬 | E1294: 76.7 | F1294: 男 | G1294: =INT(RC[1]/10)*10 -> 50 | H1294: 53 | I1294: 恒瑞医药 | J1294: 江苏 | K1294: 连云港 | L1294: 医药制造
A1295: 1294 | B1295: 2011 | C1295: 93 | D1295: 刘强东(微博) | E1295: 76.7 | F1295: 男 | G1295: =INT(RC[1]/10)*10 -> 30 | H1295: 37 | I1295: 京东商城 | J1295: 北京 | K1295: 北京 | L1295: 电子商务
A1296: 1295 | B1296: 2011 | C1296: 95 | D1296: 刘载望家族 | E1296: 76.099999999999994 | F1296: 男 | G1296: =INT(RC[1]/10)*10 -> 30 | H1296: 39 | I1296: 江河幕墙 | J1296: 北京 | K1296: 北京 | L1296: 装修装饰
A1297: 1296 | B1297: 2011 | C1297: 96 | D1297: 刘沧龙 | E1297: 75.400000000000006 | F1297: 男 | G1297: =INT(RC[1]/10)*10 -> 50 | H1297: 56 | I1297: 四川宏达集团 | J1297: 四川 | K1297: 成都 | L1297: 冶金、矿业、化工、房地产、金融
A1298: 1297 | B1298: 2011 | C1298: 96 | D1298: 杜江涛夫妇 | E1298: 75.400000000000006 | F1298: 男 | G1298: =INT(RC[1]/10)*10 -> 40 | H1298: 41 | I1298: 内蒙君正 | J1298: 北京 | K1298: 北京 | L1298: 电力生产
A1299: 1298 | B1299: 2011 | C1299: 96 | D1299: 阎志 | E1299: 75.400000000000006 | F1299: 男 | G1299: =INT(RC[1]/10)*10 -> 30 | H1299: 38 | I1299: 卓尔发展 | J1299: 湖北 | K1299: 武汉 | L1299: 房地产
A1300: 1299 | B1300: 2011 | C1300: 99 | D1300: 虞阿五父子 | E1300: 74.8 | F1300: 男 | G1300: =INT(RC[1]/10)*10 -> 60 | H1300: 69 | I1300: 日月首饰 | J1300: 浙江 | K1300: 绍兴 | L1300: 珠宝连锁、房地产、投资
A1301: 1300 | B1301: 2011 | C1301: 99 | D1301: 曹德旺夫妇 | E1301: 74.8 | F1301: 男 | G1301: =INT(RC[1]/10)*10 -> 60 | H1301: 65 | I1301: 福耀集团 | J1301: 福建 | K1301: 福清 | L1301: 玻璃制造
A1302: 1301 | B1302: 2011 | C1302: 101 | D1302: 严彬 | E1302: 74.2 | F1302: 男 | G1302: =INT(RC[1]/10)*10 -> 50 | H1302: 57 | I1302: 华彬国际集团 | J1302: 北京 | K1302: 北京 | L1302: 房地产、体育产业、饮料、旅游、贸易
A1303: 1302 | B1303: 2011 | C1303: 101 | D1303: 李金元 | E1303: 74.2 | F1303: 男 | G1303: =INT(RC[1]/10)*10 -> 50 | H1303: 53 | I1303: 天狮集团 | J1303: 天津 | K1303: 天津 | L1303: 保健品
A1304: 1303 | B1304: 2011 | C1304: 101 | D1304: 陈建强 | E1304: 74.2 | F1304: 男 | G1304: =INT(RC[1]/10)*10 -> 50 | H1304: 53 | I1304: 华地国际 | J1304: 香港 | K1304: 香港 | L1304: 商业地产、零售
A1305: 1304 | B1305: 2011 | C1305: 101 | D1305: 荣智健 | E1305: 74.2 | F1305: 男 | G1305: =INT(RC[1]/10)*10 -> 60 | H1305: 69 | I1305: 中信泰富 | J1305: 香港 | K1305: 香港 | L1305: 投资
A1306: 1305 | B1306: 2011 | C1306: 101 | D1306: 姚巨货家族 | E1306: 74.2 | F1306: 男 | G1306: =INT(RC[1]/10)*10 -> 80 | H1306: 80 | I1306: 美锦集团 | J1306: 山西 | K1306: 太原 | L1306: 煤炭、房地产
A1307: 1306 | B1307: 2011 | C1307: 101 | D1307: 张志祥 | E1307: 74.2 | F1307: 男 | G1307: =INT(RC[1]/10)*10 -> 40 | H1307: 44 | I1307: 北京建龙重工集团 | J1307: 北京 | K1307: 北京 | L1307: 钢铁、造船、资源开采
A1308: 1307 | B1308: 2011 | C1308: 107 | D1308: 徐传化父子 | E1308: 73.5 | F1308: 男 | G1308: =INT(RC[1]/10)*10 -> 70 | H1308: 76 | I1308: 传化集团 | J1308: 浙江 | K1308: 杭州 | L1308: 化工、物流、农业、投资
A1309: 1308 | B1309: 2011 | C1309: 108 | D1309: 吕向阳 | E1309: 72.900000000000006 | F1309: 男 | G1309: =INT(RC[1]/10)*10 -> 40 | H1309: 48 | I1309: 融捷投资、比亚迪股份 | J1309: 广东 | K1309: 广州 | L1309: 投资
A1310: 1309 | B1310: 2011 | C1310: 109 | D1310: 牛宜顺家族 | E1310: 72.2 | F1310: 男 | G1310: =INT(RC[1]/10)*10 -> 50 | H1310: 56 | I1310: 华勤橡胶工业集团 | J1310: 山东 | K1310: 兖州 | L1310: 橡胶制造
A1311: 1310 | B1311: 2011 | C1311: 110 | D1311: 张中能夫妇 | E1311: 71.599999999999994 | F1311: 男 | G1311: =INT(RC[1]/10)*10 -> 40 | H1311: 48 | I1311: 东阳光集团 | J1311: 广东 | K1311: 深圳 | L1311: 金属制品、医药、酒店
A1312: 1311 | B1312: 2011 | C1312: 111 | D1312: 戚金兴父子 | E1312: 71 | F1312: 男 | G1312: =INT(RC[1]/10)*10 -> 40 | H1312: 49 | I1312: 滨江集团 | J1312: 浙江 | K1312: 杭州 | L1312: 房地产
A1313: 1312 | B1313: 2011 | C1313: 112 | D1313: 徐宇 | E1313: 70.3 | F1313: 男 | G1313: / | H1313: / | I1313: 赫基国际集团 | J1313: 广东 | K1313: 广州 | L1313: 服装
A1314: 1313 | B1314: 2011 | C1314: 112 | D1314: 俞敏洪 | E1314: 70.3 | F1314: 男 | G1314: =INT(RC[1]/10)*10 -> 40 | H1314: 49 | I1314: 新东方教育 | J1314: 北京 | K1314: 北京 | L1314: 教育
A1315: 1314 | B1315: 2011 | C1315: 114 | D1315: 柯希平夫妇 | E1315: 69.7 | F1315: 男 | G1315: =INT(RC[1]/10)*10 -> 50 | H1315: 51 | I1315: 恒兴实业 | J1315: 福建 | K1315: 厦门 | L1315: 房地产、投资
A1316: 1315 | B1316: 2011 | C1316: 114 | D1316: 修涞贵 | E1316: 69.7 | F1316: 男 | G1316: =INT(RC[1]/10)*10 -> 50 | H1316: 57 | I1316: 修正药业集团 | J1316: 吉林 | K1316: 通化 | L1316: 医药
A1317: 1316 | B1317: 2011 | C1317: 116 | D1317: 潘政民夫妇 | E1317: 69 | F1317: 男 | G1317: =INT(RC[1]/10)*10 -> 40 | H1317: 42 | I1317: AAC声学科技 | J1317: 广东 | K1317: 深圳 | L1317: 声学器材
A1318: 1317 | B1318: 2011 | C1318: 117 | D1318: 冯海良 | E1318: 68.400000000000006 | F1318: 男 | G1318: =INT(RC[1]/10)*10 -> 50 | H1318: 51 | I1318: 海亮集团 | J1318: 浙江 | K1318: 诸暨 | L1318: 铜加工、房地产
A1319: 1318 | B1319: 2011 | C1319: 117 | D1319: 俞其兵 | E1319: 68.400000000000006 | F1319: 男 | G1319: =INT(RC[1]/10)*10 -> 40 | H1319: 45 | I1319: 旗滨集团 | J1319: 浙江 | K1319: 宁波 | L1319: 玻璃制造
A1320: 1319 | B1320: 2011 | C1320: 119 | D1320: 黄红云家族 | E1320: 67.8 | F1320: 男 | G1320: =INT(RC[1]/10)*10 -> 40 | H1320: 45 | I1320: 金科实业 | J1320: 重庆 | K1320: 重庆 | L1320: 房地产
A1321: 1320 | B1321: 2011 | C1321: 120 | D1321: 黄俊康夫妇 | E1321: 67.099999999999994 | F1321: 男 | G1321: =INT(RC[1]/10)*10 -> 50 | H1321: 56 | I1321: 莱蒙国际 | J1321: 广东 | K1321: 深圳 | L1321: 房地产
A1322: 1321 | B1322: 2011 | C1322: 120 | D1322: 雷菊芳 | E1322: 67.099999999999994 | F1322: 女 | G1322: =INT(RC[1]/10)*10 -> 50 | H1322: 58 | I1322: 奇正藏药 | J1322: 甘肃 | K1322: 兰州 | L1322: 医药
A1323: 1322 | B1323: 2011 | C1323: 120 | D1323: 刘汉元夫妇 | E1323: 67.099999999999994 | F1323: 男 | G1323: =INT(RC[1]/10)*10 -> 40 | H1323: 47 | I1323: 通威集团 | J1323: 四川 | K1323: 成都 | L1323: 饲料、房地产、太阳能
A1324: 1323 | B1324: 2011 | C1324: 120 | D1324: 倪召兴家族 | E1324: 67.099999999999994 | F1324: 男 | G1324: =INT(RC[1]/10)*10 -> 50 | H1324: 55 | I1324: 中融集团 | J1324: 上海 | K1324: 上海 | L1324: 房地产、能源
A1325: 1324 | B1325: 2011 | C1325: 120 | D1325: 傅利泉夫妇 | E1325: 67.099999999999994 | F1325: 男 | G1325: =INT(RC[1]/10)*10 -> 40 | H1325: 44 | I1325: 大华股份 | J1325: 浙江 | K1325: 杭州 | L1325: 电子设备制造
A1326: 1325 | B1326: 2011 | C1326: 120 | D1326: 朱保国家族 | E1326: 67.099999999999994 | F1326: 男 | G1326: =INT(RC[1]/10)*10 -> 40 | H1326: 49 | I1326: 健康元药业 | J1326: 广东 | K1326: 深圳 | L1326: 医药制造、保健品
A1327: 1326 | B1327: 2011 | C1327: 126 | D1327: 张文中 | E1327: 66.5 | F1327: 男 | G1327: =INT(RC[1]/10)*10 -> 40 | H1327: 49 | I1327: 物美集团 | J1327: 北京 | K1327: 北京 | L1327: 零售、投资
A1328: 1327 | B1328: 2011 | C1328: 126 | D1328: 邵根伙 | E1328: 66.5 | F1328: 男 | G1328: =INT(RC[1]/10)*10 -> 40 | H1328: 46 | I1328: 大北农 | J1328: 北京 | K1328: 北京 | L1328: 饲料及粮食、食品加工
A1329: 1328 | B1329: 2011 | C1329: 128 | D1329: 李仲初 | E1329: 65.8 | F1329: 男 | G1329: =INT(RC[1]/10)*10 -> 40 | H1329: 48 | I1329: 石基信息 | J1329: 北京 | K1329: 北京 | L1329: 计算机应用服务
A1330: 1329 | B1330: 2011 | C1330: 129 | D1330: 陈隆基 | E1330: 65.2 | F1330: 男 | G1330: =INT(RC[1]/10)*10 -> 50 | H1330: 55 | I1330: 利嘉国际 | J1330: 香港 | K1330: 香港 | L1330: 投资
A1331: 1330 | B1331: 2011 | C1331: 129 | D1331: 陈金霞 | E1331: 65.2 | F1331: 女 | G1331: =INT(RC[1]/10)*10 -> 40 | H1331: 43 | I1331: 涌金集团 | J1331: 上海 | K1331: 上海 | L1331: 投资、医药
A1332: 1331 | B1332: 2011 | C1332: 129 | D1332: 黄怒波 | E1332: 65.2 | F1332: 男 | G1332: =INT(RC[1]/10)*10 -> 50 | H1332: 55 | I1332: 中坤集团 | J1332: 北京 | K1332: 北京 | L1332: 房地产、旅游
A1333: 1332 | B1333: 2011 | C1333: 132 | D1333: 梁信军 | E1333: 64.599999999999994 | F1333: 男 | G1333: =INT(RC[1]/10)*10 -> 40 | H1333: 43 | I1333: 复星国际 | J1333: 上海 | K1333: 上海 | L1333: 钢铁、房地产、医药、零售、金融
A1334: 1333 | B1334: 2011 | C1334: 132 | D1334: 韩俊良 | E1334: 64.599999999999994 | F1334: 男 | G1334: =INT(RC[1]/10)*10 -> 40 | H1334: 47 | I1334: 华锐风电 | J1334: 北京 | K1334: 北京 | L1334: 电器机械及器材制造/风电设备制造
A1335: 1334 | B1335: 2011 | C1335: 132 | D1335: 耿建明 | E1335: 64.599999999999994 | F1335: 男 | G1335: =INT(RC[1]/10)*10 -> 40 | H1335: 49 | I1335: 荣盛控股 | J1335: 河北 | K1335: 廊坊 | L1335: 房地产
A1336: 1335 | B1336: 2011 | C1336: 135 | D1336: 尹明善家族 | E1336: 63.9 | F1336: 男 | G1336: =INT(RC[1]/10)*10 -> 70 | H1336: 73 | I1336: 力帆集团 | J1336: 重庆 | K1336: 重庆 | L1336: 摩托车、汽车制造
A1337: 1336 | B1337: 2011 | C1337: 135 | D1337: 文一波夫妇 | E1337: 63.9 | F1337: 男 | G1337: =INT(RC[1]/10)*10 -> 40 | H1337: 46 | I1337: 桑德集团 | J1337: 北京 | K1337: 北京 | L1337: 环保产业
A1338: 1337 | B1338: 2011 | C1338: 135 | D1338: 黄晞家族 | E1338: 63.9 | F1338: 女 | G1338: =INT(RC[1]/10)*10 -> 40 | H1338: 49 | I1338: 福信集团 | J1338: 福建 | K1338: 厦门 | L1338: 房地产、投资
A1339: 1338 | B1339: 2011 | C1339: 135 | D1339: 贺学初 | E1339: 63.9 | F1339: 男 | G1339: =INT(RC[1]/10)*10 -> 40 | H1339: 48 | I1339: 洪桥集团 | J1339: 香港 | K1339: 香港 | L1339: 矿业、太阳能
A1340: 1339 | B1340: 2011 | C1340: 135 | D1340: 高彦明 | E1340: 63.9 | F1340: 男 | G1340: =INT(RC[1]/10)*10 -> 50 | H1340: 54 | I1340: 河北远洋运输集团 | J1340: 河北 | K1340: 秦皇岛 | L1340: 海运
A1341: 1340 | B1341: 2011 | C1341: 135 | D1341: 洪肇明家族 | E1341: 63.9 | F1341: 男 | G1341: =INT(RC[1]/10)*10 -> 70 | H1341: 76 | I1341: 劲霸男装 | J1341: 福建 | K1341: 晋江 | L1341: 服装
A1342: 1341 | B1342: 2011 | C1342: 135 | D1342: 黄文仔 | E1342: 63.9 | F1342: 男 | G1342: =INT(RC[1]/10)*10 -> 50 | H1342: 58 | I1342: 星河湾 | J1342: 广东 | K1342: 广州 | L1342: 房地产
A1343: 1342 | B1343: 2011 | C1343: 135 | D1343: 李彬兰 | E1343: 63.9 | F1343: 女 | G1343: / | H1343: / | I1343: 新一佳超市 | J1343: 广东 | K1343: 深圳 | L1343: 零售
A1344: 1343 | B1344: 2011 | C1344: 135 | D1344: 熊续强夫妇 | E1344: 63.9 | F1344: 男 | G1344: =INT(RC[1]/10)*10 -> 50 | H1344: 55 | I1344: 宁波银亿集团 | J1344: 浙江 | K1344: 宁波 | L1344: 房地产、煤炭
A1345: 1344 | B1345: 2011 | C1345: 135 | D1345: 刘晓萌 | E1345: 63.9 | F1345: 女 | G1345: =INT(RC[1]/10)*10 -> 50 | H1345: 56 | I1345: 苏宁电器 | J1345: 江苏 | K1345: 南京 | L1345: 家电零售
A1346: 1345 | B1346: 2011 | C1346: 135 | D1346: 胡柏藩 | E1346: 63.9 | F1346: 男 | G1346: =INT(RC[1]/10)*10 -> 40 | H1346: 49 | I1346: 新和成控股集团 | J1346: 浙江 | K1346: 绍兴 | L1346: 医药
A1347: 1346 | B1347: 2011 | C1347: 135 | D1347: 阙文彬夫妇 | E1347: 63.9 | F1347: 男 | G1347: =INT(RC[1]/10)*10 -> 40 | H1347: 48 | I1347: 独一味 /西部资源 | J1347: 四川 | K1347: 成都 | L1347: 医药、矿业
A1348: 1347 | B1348: 2011 | C1348: 147 | D1348: 刘宝林 | E1348: 63 | F1348: 男 | G1348: =INT(RC[1]/10)*10 -> 50 | H1348: 58 | I1348: 九州通 | J1348: 湖北 | K1348: 武汉 | L1348: 医药零售
A1349: 1348 | B1349: 2011 | C1349: 147 | D1349: 吴建龙 | E1349: 63 | F1349: 男 | G1349: =INT(RC[1]/10)*10 -> 40 | H1349: 44 | I1349: 向日葵 | J1349: 浙江 | K1349: 绍兴 | L1349: 太阳能
A1350: 1349 | B1350: 2011 | C1350: 147 | D1350: 叶远西父子 | E1350: 63 | F1350: 男 | G1350: =INT(RC[1]/10)*10 -> 40 | H1350: 48 | I1350: 广田股份 | J1350: 广东 | K1350: 深圳 | L1350: 装修装饰
A1351: 1350 | B1351: 2011 | C1351: 150 | D1351: 吴培服父子 | E1351: 62.7 | F1351: 男 | G1351: =INT(RC[1]/10)*10 -> 40 | H1351: 49 | I1351: 双星新材 | J1351: 江苏 | K1351: 宿迁 | L1351: 塑料薄膜制造
A1352: 1351 | B1352: 2011 | C1352: 151 | D1352: 王伟 林夫妇 | E1352: 62.3 | F1352: 男 | G1352: =INT(RC[1]/10)*10 -> 40 | H1352: 49 | I1352: 华丽家族 | J1352: 上海 | K1352: 上海 | L1352: 房地产
A1353: 1352 | B1353: 2011 | C1353: 152 | D1353: 马建荣 | E1353: 62 | F1353: 男 | G1353: =INT(RC[1]/10)*10 -> 40 | H1353: 47 | I1353: 申洲国际集团 | J1353: 浙江 | K1353: 宁波 | L1353: 纺织、服装
A1354: 1353 | B1354: 2011 | C1354: 152 | D1354: 朱志平 | E1354: 62 | F1354: 男 | G1354: =INT(RC[1]/10)*10 -> 40 | H1354: 49 | I1354: 同方联合控股 | J1354: 浙江 | K1354: 杭州 | L1354: 房地产
A1355: 1354 | B1355: 2011 | C1355: 154 | D1355: 盛百椒 | E1355: 61.7 | F1355: 男 | G1355: =INT(RC[1]/10)*10 -> 50 | H1355: 59 | I1355: 百丽 | J1355: 广东 | K1355: 深圳 | L1355: 鞋业、零售
A1356: 1355 | B1356: 2011 | C1356: 155 | D1356: 杨文龙夫妇 | E1356: 61.4 | F1356: 男 | G1356: =INT(RC[1]/10)*10 -> 40 | H1356: 49 | I1356: 仁和集团 | J1356: 江西 | K1356: 樟树 | L1356: 医药
A1357: 1356 | B1357: 2011 | C1357: 155 | D1357: 叶仙玉家族 | E1357: 61.4 | F1357: 男 | G1357: =INT(RC[1]/10)*10 -> 50 | H1357: 53 | I1357: 中国星星集团 | J1357: 浙江 | K1357: 台州 | L1357: 专用设备制造
A1358: 1357 | B1358: 2011 | C1358: 157 | D1358: 李洪信家族 | E1358: 61.1 | F1358: 男 | G1358: =INT(RC[1]/10)*10 -> 50 | H1358: 58 | I1358: 太阳纸业 | J1358: 山东 | K1358: 兖州 | L1358: 造纸及纸制品
A1359: 1358 | B1359: 2011 | C1359: 158 | D1359: 孙尚传夫妇 | E1359: 60.7 | F1359: 男 | G1359: =INT(RC[1]/10)*10 -> 40 | H1359: 48 | I1359: 大富科技 | J1359: 广东 | K1359: 深圳 | L1359: 通信设备制造
A1360: 1359 | B1360: 2011 | C1360: 159 | D1360: 于泳 | E1360: 60.1 | F1360: 男 | G1360: / | H1360: / | I1360: 上海鸿商产业控股集团 | J1360: 上海 | K1360: 上海 | L1360: 投资
A1361: 1360 | B1361: 2011 | C1361: 159 | D1361: 周泽荣 | E1361: 60.1 | F1361: 男 | G1361: =INT(RC[1]/10)*10 -> 50 | H1361: 57 | I1361: 侨鑫集团 | J1361: 广东 | K1361: 广州 | L1361: 房地产、餐饮、媒体
A1362: 1361 | B1362: 2011 | C1362: 159 | D1362: 何著胜家族 | E1362: 60.1 | F1362: 男 | G1362: =INT(RC[1]/10)*10 -> 60 | H1362: 64 | I1362: 海城后英经贸集团 | J1362: 辽宁 | K1362: 海城 | L1362: 耐火材料、钢铁、大豆加工
A1363: 1362 | B1363: 2011 | C1363: 162 | D1363: 任正非 | E1363: 59.8 | F1363: 男 | G1363: =INT(RC[1]/10)*10 -> 60 | H1363: 67 | I1363: 华为技术 | J1363: 广东 | K1363: 深圳 | L1363: 通信
A1364: 1363 | B1364: 2011 | C1364: 163 | D1364: 黄其森 | E1364: 59.5 | F1364: 男 | G1364: =INT(RC[1]/10)*10 -> 40 | H1364: 46 | I1364: 泰禾集团 | J1364: 福建 | K1364: 福州 | L1364: 房地产、投资
A1365: 1364 | B1365: 2011 | C1365: 163 | D1365: 张祥青夫妇 | E1365: 59.5 | F1365: 男 | G1365: =INT(RC[1]/10)*10 -> 40 | H1365: 42 | I1365: 荣程联合钢铁 | J1365: 天津 | K1365: 天津 | L1365: 钢铁
A1366: 1365 | B1366: 2011 | C1366: 165 | D1366: 张克强 | E1366: 59.1 | F1366: 男 | G1366: =INT(RC[1]/10)*10 -> 50 | H1366: 51 | I1366: 广东华美国际投资集团 | J1366: 广东 | K1366: 广州 | L1366: 教育、投资
A1367: 1366 | B1367: 2011 | C1367: 165 | D1367: 陈金凤 | E1367: 59.1 | F1367: 女 | G1367: =INT(RC[1]/10)*10 -> 40 | H1367: 48 | I1367: 苏宁电器 | J1367: 江苏 | K1367: 南京 | L1367: 家电零售
A1368: 1367 | B1368: 2011 | C1368: 165 | D1368: 陈士良 | E1368: 59.1 | F1368: 男 | G1368: =INT(RC[1]/10)*10 -> 40 | H1368: 47 | I1368: 桐昆集团 | J1368: 浙江 | K1368: 桐乡 | L1368: 合成纤维制造
A1369: 1368 | B1369: 2011 | C1369: 168 | D1369: 曹克坚 | E1369: 58.8 | F1369: 男 | G1369: =INT(RC[1]/10)*10 -> 40 | H1369: 49 | I1369: 开山集团 | J1369: 浙江 | K1369: 衢州 | L1369: 机械制造
A1370: 1369 | B1370: 2011 | C1370: 168 | D1370: 傅军 | E1370: 58.8 | F1370: 男 | G1370: =INT(RC[1]/10)*10 -> 50 | H1370: 53 | I1370: 新华联集团 | J1370: 北京 | K1370: 北京 | L1370: 房地产、陶瓷、投资
A1371: 1370 | B1371: 2011 | C1371: 168 | D1371: 陈义红夫妇 | E1371: 58.8 | F1371: 男 | G1371: =INT(RC[1]/10)*10 -> 50 | H1371: 53 | I1371: 中国动向 | J1371: 北京 | K1371: 北京 | L1371: 运动服饰及体育用品
A1372: 1371 | B1372: 2011 | C1372: 171 | D1372: 何金明家族 | E1372: 58.2 | F1372: 男 | G1372: =INT(RC[1]/10)*10 -> 50 | H1372: 59 | I1372: 人人乐 | J1372: 广东 | K1372: 深圳 | L1372: 零售
A1373: 1372 | B1373: 2011 | C1373: 172 | D1373: 李兆会 | E1373: 57.5 | F1373: 男 | G1373: =INT(RC[1]/10)*10 -> 30 | H1373: 30 | I1373: 海鑫实业 | J1373: 山西 | K1373: 运城 | L1373: 钢铁、金融
A1374: 1373 | B1374: 2011 | C1374: 172 | D1374: 张茵 | E1374: 57.5 | F1374: 女 | G1374: =INT(RC[1]/10)*10 -> 50 | H1374: 54 | I1374: 玖龙纸业 | J1374: 广东 | K1374: 东莞 | L1374: 造纸及纸制品
A1375: 1374 | B1375: 2011 | C1375: 172 | D1375: 茹伯兴家族 | E1375: 57.5 | F1375: 男 | G1375: =INT(RC[1]/10)*10 -> 60 | H1375: 64 | I1375: 百兴集团 | J1375: 江苏 | K1375: 常州 | L1375: 工业制造、商贸、房地产、物流
A1376: 1375 | B1376: 2011 | C1376: 172 | D1376: 赵步长父子 | E1376: 57.5 | F1376: 男 | G1376: =INT(RC[1]/10)*10 -> 60 | H1376: 68 | I1376: 步长集团 | J1376: 陕西 | K1376: 西安 | L1376: 医药
A1377: 1376 | B1377: 2011 | C1377: 172 | D1377: 罗韶宇夫妇 | E1377: 57.5 | F1377: 男 | G1377: =INT(RC[1]/10)*10 -> 40 | H1377: 41 | I1377: 重庆东银集团 | J1377: 重庆 | K1377: 重庆 | L1377: 房地产、汽车、能源
A1378: 1377 | B1378: 2011 | C1378: 172 | D1378: 刘益谦 | E1378: 57.5 | F1378: 男 | G1378: =INT(RC[1]/10)*10 -> 40 | H1378: 47 | I1378: 新理益集团 | J1378: 上海 | K1378: 上海 | L1378: 投资
A1379: 1378 | B1379: 2011 | C1379: 178 | D1379: 黄焕明 | E1379: 56.9 | F1379: 男 | G1379: =INT(RC[1]/10)*10 -> 40 | H1379: 48 | I1379: 厦门明发集团 | J1379: 福建 | K1379: 厦门 | L1379: 房地产
A1380: 1379 | B1380: 2011 | C1380: 179 | D1380: 黄立 | E1380: 56.6 | F1380: 男 | G1380: =INT(RC[1]/10)*10 -> 40 | H1380: 48 | I1380: 高德红外 | J1380: 湖北 | K1380: 武汉 | L1380: 电子设备制造
A1381: 1380 | B1381: 2011 | C1381: 179 | D1381: 丁世忠家族 | E1381: 56.6 | F1381: 男 | G1381: =INT(RC[1]/10)*10 -> 40 | H1381: 40 | I1381: 安踏体育 | J1381: 福建 | K1381: 泉州 | L1381: 运动服饰及体育用品
A1382: 1381 | B1382: 2011 | C1382: 181 | D1382: 梁国兴 | E1382: 56.3 | F1382: 男 | G1382: =INT(RC[1]/10)*10 -> 40 | H1382: 45 | I1382: 银基集团 | J1382: 香港 | K1382: 香港 | L1382: 酒销售
A1383: 1382 | B1383: 2011 | C1383: 182 | D1383: 朱庆伊 | E1383: 55.9 | F1383: 男 | G1383: =INT(RC[1]/10)*10 -> 40 | H1383: 42 | I1383: 珠江投资 | J1383: 广东 | K1383: 广州 | L1383: 房地产、投资
A1384: 1383 | B1384: 2011 | C1384: 183 | D1384: 韩国龙家族 | E1384: 55.6 | F1384: 男 | G1384: =INT(RC[1]/10)*10 -> 50 | H1384: 56 | I1384: 香港冠城集团 | J1384: 香港 | K1384: 香港 | L1384: 房地产
A1385: 1384 | B1385: 2011 | C1385: 183 | D1385: 朱孟依父子 | E1385: 55.6 | F1385: 男 | G1385: =INT(RC[1]/10)*10 -> 50 | H1385: 51 | I1385: 合生创展 | J1385: 广东 | K1385: 广州 | L1385: 房地产
A1386: 1385 | B1386: 2011 | C1386: 183 | D1386: 江南春 | E1386: 55.6 | F1386: 男 | G1386: =INT(RC[1]/10)*10 -> 30 | H1386: 38 | I1386: 分众传媒 | J1386: 上海 | K1386: 上海 | L1386: 数字户外传媒
A1387: 1386 | B1387: 2011 | C1387: 186 | D1387: 陈夏鑫夫妇 | E1387: 55.3 | F1387: 男 | G1387: =INT(RC[1]/10)*10 -> 40 | H1387: 49 | I1387: 西子电梯集团 | J1387: 浙江 | K1387: 杭州 | L1387: 工业及电梯制造、房地产、百货
A1388: 1387 | B1388: 2011 | C1388: 186 | D1388: 谢炳 | E1388: 55.3 | F1388: 男 | G1388: =INT(RC[1]/10)*10 -> 50 | H1388: 59 | I1388: 中国生物制药 | J1388: 香港 | K1388: 香港 | L1388: 医药
A1389: 1388 | B1389: 2011 | C1389: 188 | D1389: 张长虹 | E1389: 55 | F1389: 男 | G1389: =INT(RC[1]/10)*10 -> 50 | H1389: 53 | I1389: 大智慧 | J1389: 上海 | K1389: 上海 | L1389: 金融软件服务
A1390: 1389 | B1390: 2011 | C1390: 188 | D1390: 薛向东家族 | E1390: 55 | F1390: 男 | G1390: =INT(RC[1]/10)*10 -> 50 | H1390: 52 | I1390: 东华软件 | J1390: 北京 | K1390: 北京 | L1390: 计算机应用服务
A1391: 1390 | B1391: 2011 | C1391: 190 | D1391: 陈天桥夫妇 | E1391: 54.3 | F1391: 男 | G1391: =INT(RC[1]/10)*10 -> 30 | H1391: 38 | I1391: 盛大网络 | J1391: 上海 | K1391: 上海 | L1391: 网络游戏等
A1392: 1391 | B1392: 2011 | C1392: 190 | D1392: 周亚仙夫妇 | E1392: 54.3 | F1392: 女 | G1392: =INT(RC[1]/10)*10 -> 50 | H1392: 51 | I1392: 神冠控股 | J1392: 广西 | K1392: 梧州 | L1392: 食品
A1393: 1392 | B1393: 2011 | C1393: 192 | D1393: 陈泽民家族 | E1393: 54 | F1393: 男 | G1393: =INT(RC[1]/10)*10 -> 60 | H1393: 68 | I1393: 三全食品 | J1393: 河南 | K1393: 郑州 | L1393: 速冻食品、餐饮连锁
A1394: 1393 | B1394: 2011 | C1394: 193 | D1394: 欧宗荣 | E1394: 53.7 | F1394: 男 | G1394: =INT(RC[1]/10)*10 -> 40 | H1394: 47 | I1394: 正荣集团 | J1394: 福建 | K1394: 福州 | L1394: 房地产
A1395: 1394 | B1395: 2011 | C1395: 193 | D1395: 苏萌 | E1395: 53.7 | F1395: 男 | G1395: / | H1395: / | I1395: 高德置地 | J1395: 广东 | K1395: 广州 | L1395: 房地产
A1396: 1395 | B1396: 2011 | C1396: 195 | D1396: 丁世家 | E1396: 53.1 | F1396: 男 | G1396: =INT(RC[1]/10)*10 -> 40 | H1396: 47 | I1396: 安踏体育 | J1396: 福建 | K1396: 泉州 | L1396: 运动服饰及体育用品
A1397: 1396 | B1397: 2011 | C1397: 196 | D1397: 李国强 | E1397: 52.1 | F1397: 男 | G1397: =INT(RC[1]/10)*10 -> 40 | H1397: 47 | I1397: 中升集团 | J1397: 辽宁 | K1397: 大连 | L1397: 汽车销售服务
A1398: 1397 | B1398: 2011 | C1398: 197 | D1398: 潘慰 | E1398: 51.8 | F1398: 女 | G1398: =INT(RC[1]/10)*10 -> 50 | H1398: 56 | I1398: 味千(中国) | J1398: 上海 | K1398: 上海 | L1398: 餐饮连锁
A1399: 1398 | B1399: 2011 | C1399: 198 | D1399: 安康 | E1399: 51.5 | F1399: 男 | G1399: =INT(RC[1]/10)*10 -> 60 | H1399: 62 | I1399: 华兰生物 | J1399: 河南 | K1399: 新乡 | L1399: 生物医药
A1400: 1399 | B1400: 2011 | C1400: 198 | D1400: 高乃则 | E1400: 51.5 | F1400: 男 | G1400: =INT(RC[1]/10)*10 -> 40 | H1400: 49 | I1400: 陕西兴茂集团 | J1400: 陕西 | K1400: 榆林 | L1400: 煤炭
A1401: 1400 | B1401: 2011 | C1401: 198 | D1401: 郑永刚 | E1401: 51.5 | F1401: 男 | G1401: =INT(RC[1]/10)*10 -> 50 | H1401: 52 | I1401: 杉杉集团 | J1401: 上海 | K1401: 上海 | L1401: 服装、新能源新材料、投资
A1402: 1401 | B1402: 2011 | C1402: 201 | D1402: 孔健岷 | E1402: 51.1 | F1402: 男 | G1402: =INT(RC[1]/10)*10 -> 40 | H1402: 43 | I1402: 合景泰富地产 | J1402: 广东 | K1402: 广州 | L1402: 房地产
A1403: 1402 | B1403: 2011 | C1403: 201 | D1403: 李华 | E1403: 51.1 | F1403: 男 | G1403: =INT(RC[1]/10)*10 -> 40 | H1403: 45 | I1403: 卓越集团 | J1403: 广东 | K1403: 深圳 | L1403: 房地产
A1404: 1403 | B1404: 2011 | C1404: 201 | D1404: 汪俊林 | E1404: 51.1 | F1404: 男 | G1404: / | H1404: / | I1404: 宝光集团 | J1404: 四川 | K1404: 成都 | L1404: 房地产、酿酒
A1405: 1404 | B1405: 2011 | C1405: 201 | D1405: 易小迪 | E1405: 51.1 | F1405: 男 | G1405: =INT(RC[1]/10)*10 -> 40 | H1405: 47 | I1405: 阳光100 | J1405: 北京 | K1405: 北京 | L1405: 房地产
A1406: 1405 | B1406: 2011 | C1406: 201 | D1406: 雷军 | E1406: 51.1 | F1406: 男 | G1406: =INT(RC[1]/10)*10 -> 40 | H1406: 41 | I1406: 金山软件、UCWEB | J1406: 北京 | K1406: 北京 | L1406: 软件开发
A1407: 1406 | B1407: 2011 | C1407: 206 | D1407: 李登海 | E1407: 50.8 | F1407: 男 | G1407: =INT(RC[1]/10)*10 -> 60 | H1407: 62 | I1407: 登海种业 | J1407: 山东 | K1407: 莱州 | L1407: 农业
A1408: 1407 | B1408: 2011 | C1408: 207 | D1408: 朱丹凤 | E1408: 50.5 | F1408: 女 | G1408: / | H1408: / | I1408: 浙江恒逸集团 | J1408: 浙江 | K1408: 杭州 | L1408: 化学纤维制造
A1409: 1408 | B1409: 2011 | C1409: 207 | D1409: 邱建林 | E1409: 50.5 | F1409: 男 | G1409: =INT(RC[1]/10)*10 -> 40 | H1409: 48 | I1409: 浙江恒逸集团 | J1409: 浙江 | K1409: 杭州 | L1409: 化学纤维制造
A1410: 1409 | B1410: 2011 | C1410: 207 | D1410: 姚新义 | E1410: 50.5 | F1410: 男 | G1410: =INT(RC[1]/10)*10 -> 40 | H1410: 46 | I1410: 盾安集团 | J1410: 浙江 | K1410: 杭州 | L1410: 装备制造、民爆化工、房地产、能源
A1411: 1410 | B1411: 2011 | C1411: 210 | D1411: 刘满世家族 | E1411: 49.9 | F1411: 男 | G1411: =INT(RC[1]/10)*10 -> 60 | H1411: 62 | I1411: 内蒙古满世煤炭集团 | J1411: 内蒙古 | K1411: 鄂尔多斯 | L1411: 煤炭、化工、房地产
A1412: 1411 | B1412: 2011 | C1412: 210 | D1412: 袁凯飞 | E1412: 49.9 | F1412: 男 | G1412: =INT(RC[1]/10)*10 -> 50 | H1412: 58 | I1412: 江苏新世纪造船 | J1412: 江苏 | K1412: 靖江 | L1412: 造船
A1413: 1412 | B1413: 2011 | C1413: 210 | D1413: 张跃 | E1413: 49.9 | F1413: 男 | G1413: =INT(RC[1]/10)*10 -> 50 | H1413: 51 | I1413: 远大空调 | J1413: 湖南 | K1413: 长沙 | L1413: 家电
A1414: 1413 | B1414: 2011 | C1414: 210 | D1414: 陈邦 | E1414: 49.9 | F1414: 男 | G1414: =INT(RC[1]/10)*10 -> 40 | H1414: 46 | I1414: 爱尔眼科 | J1414: 湖南 | K1414: 长沙 | L1414: 卫生、保健、护理服务
A1415: 1414 | B1415: 2011 | C1415: 214 | D1415: 邱祥娟 | E1415: 49.5 | F1415: 女 | G1415: / | H1415: / | I1415: 浙江恒逸集团 | J1415: 浙江 | K1415: 杭州 | L1415: 化学纤维制造
A1416: 1415 | B1416: 2011 | C1416: 214 | D1416: 缪汉根家族 | E1416: 49.5 | F1416: 男 | G1416: =INT(RC[1]/10)*10 -> 40 | H1416: 46 | I1416: 盛虹集团 | J1416: 江苏 | K1416: 吴江 | L1416: 化纤、印染、热电、房地产
A1417: 1416 | B1417: 2011 | C1417: 216 | D1417: 曲乃杰 | E1417: 49.2 | F1417: 男 | G1417: =INT(RC[1]/10)*10 -> 50 | H1417: 51 | I1417: 海昌集团 | J1417: 辽宁 | K1417: 大连 | L1417: 旅游、海运、石化
A1418: 1417 | B1418: 2011 | C1418: 216 | D1418: 袁金华 | E1418: 49.2 | F1418: 男 | G1418: =INT(RC[1]/10)*10 -> 50 | H1418: 52 | I1418: 三一集团 | J1418: 湖南 | K1418: 长沙 | L1418: 机械装备制造
A1419: 1418 | B1419: 2011 | C1419: 218 | D1419: 郑效东 | E1419: 48.9 | F1419: 男 | G1419: =INT(RC[1]/10)*10 -> 40 | H1419: 47 | I1419: 东富龙 | J1419: 上海 | K1419: 上海 | L1419: 医疗器械制造
A1420: 1419 | B1420: 2011 | C1420: 219 | D1420: 张轩松 | E1420: 48.6 | F1420: 男 | G1420: =INT(RC[1]/10)*10 -> 30 | H1420: 39 | I1420: 永辉超市 | J1420: 福建 | K1420: 福州 | L1420: 零售
A1421: 1420 | B1421: 2011 | C1421: 219 | D1421: 姚新泉 | E1421: 48.6 | F1421: 男 | G1421: =INT(RC[1]/10)*10 -> 40 | H1421: 44 | I1421: 盾安集团 | J1421: 浙江 | K1421: 杭州 | L1421: 装备制造、民爆化工、房地产、能源
A1422: 1421 | B1422: 2011 | C1422: 221 | D1422: 尉文渊 | E1422: 48.3 | F1422: 男 | G1422: =INT(RC[1]/10)*10 -> 50 | H1422: 56 | I1422: 新盟集团 | J1422: 上海 | K1422: 上海 | L1422: 投资
A1423: 1422 | B1423: 2011 | C1423: 222 | D1423: 尤小平父子 | E1423: 47.9 | F1423: 男 | G1423: =INT(RC[1]/10)*10 -> 50 | H1423: 53 | I1423: 华峰集团 | J1423: 浙江 | K1423: 温州 | L1423: 化学纤维制造
A1424: 1423 | B1424: 2011 | C1424: 222 | D1424: 徐其明 | E1424: 47.9 | F1424: 男 | G1424: =INT(RC[1]/10)*10 -> 40 | H1424: 48 | I1424: 徐龙集团 | J1424: 浙江 | K1424: 宁波 | L1424: 水产养殖加工
A1425: 1424 | B1425: 2011 | C1425: 222 | D1425: 杨休 | E1425: 47.9 | F1425: 男 | G1425: =INT(RC[1]/10)*10 -> 50 | H1425: 50 | I1425: 江苏天地集团 | J1425: 江苏 | K1425: 徐州 | L1425: 房地产、博物馆
A1426: 1425 | B1426: 2011 | C1426: 222 | D1426: 许健康家族 | E1426: 47.9 | F1426: 男 | G1426: =INT(RC[1]/10)*10 -> 50 | H1426: 59 | I1426: 宝龙集团 | J1426: 福建 | K1426: 厦门 | L1426: 房地产
A1427: 1426 | B1427: 2011 | C1427: 226 | D1427: 杨铿夫妇 | E1427: 47.6 | F1427: 男 | G1427: =INT(RC[1]/10)*10 -> 40 | H1427: 49 | I1427: 四川蓝光 | J1427: 四川 | K1427: 成都 | L1427: 房地产
A1428: 1427 | B1428: 2011 | C1428: 227 | D1428: 陈光标 | E1428: 47.3 | F1428: 男 | G1428: =INT(RC[1]/10)*10 -> 40 | H1428: 43 | I1428: 江苏黄埔投资集团 | J1428: 江苏 | K1428: 南京 | L1428: 材料制造、再生资源利用
A1429: 1428 | B1429: 2011 | C1429: 227 | D1429: 南存辉 | E1429: 47.3 | F1429: 男 | G1429: =INT(RC[1]/10)*10 -> 40 | H1429: 48 | I1429: 正泰集团 | J1429: 浙江 | K1429: 温州 | L1429: 电器机械及器材制造/输配电及控制设备制造
A1430: 1429 | B1430: 2011 | C1430: 227 | D1430: 张德生 | E1430: 47.3 | F1430: 男 | G1430: =INT(RC[1]/10)*10 -> 60 | H1430: 61 | I1430: 浙江万马电气电缆集团 | J1430: 浙江 | K1430: 杭州 | L1430: 电缆
A1431: 1430 | B1431: 2011 | C1431: 230 | D1431: 陈锦石家族 | E1431: 47 | F1431: 男 | G1431: =INT(RC[1]/10)*10 -> 40 | H1431: 48 | I1431: 中南控股集团 | J1431: 江苏 | K1431: 南通 | L1431: 房地产、建筑施工
A1432: 1431 | B1432: 2011 | C1432: 230 | D1432: 鲜扬 | E1432: 47 | F1432: 男 | G1432: =INT(RC[1]/10)*10 -> 30 | H1432: 37 | I1432: 恒鼎实业 | J1432: 四川 | K1432: 攀枝花 | L1432: 煤炭
A1433: 1432 | B1433: 2011 | C1433: 230 | D1433: 薛伟成父子 | E1433: 47 | F1433: 男 | G1433: =INT(RC[1]/10)*10 -> 50 | H1433: 53 | I1433: 罗莱家纺 | J1433: 江苏 | K1433: 南通 | L1433: 纺织
A1434: 1433 | B1434: 2011 | C1434: 233 | D1434: 王久芳父子 | E1434: 46.7 | F1434: 男 | G1434: =INT(RC[1]/10)*10 -> 40 | H1434: 47 | I1434: 荣安地产 | J1434: 浙江 | K1434: 宁波 | L1434: 房地产
A1435: 1434 | B1435: 2011 | C1435: 234 | D1435: 王长田夫妇 | E1435: 46.3 | F1435: 男 | G1435: =INT(RC[1]/10)*10 -> 40 | H1435: 46 | I1435: 光线传媒 | J1435: 北京 | K1435: 北京 | L1435: 传媒
A1436: 1435 | B1436: 2011 | C1436: 234 | D1436: 徐万茂 | E1436: 46.3 | F1436: 男 | G1436: =INT(RC[1]/10)*10 -> 60 | H1436: 66 | I1436: 宁波华茂 | J1436: 浙江 | K1436: 宁波 | L1436: 教育、金融
A1437: 1436 | B1437: 2011 | C1437: 236 | D1437: 赵长甲 | E1437: 46 | F1437: 男 | G1437: =INT(RC[1]/10)*10 -> 50 | H1437: 53 | I1437: 长甲集团 | J1437: 上海 | K1437: 上海 | L1437: 房地产
A1438: 1437 | B1438: 2011 | C1438: 236 | D1438: 崔根良父子 | E1438: 46 | F1438: 男 | G1438: =INT(RC[1]/10)*10 -> 50 | H1438: 53 | I1438: 亨通集团 | J1438: 江苏 | K1438: 吴江 | L1438: 通信设备制造、金融、投资
A1439: 1438 | B1439: 2011 | C1439: 238 | D1439: 胡继军 | E1439: 45.7 | F1439: 男 | G1439: =INT(RC[1]/10)*10 -> 40 | H1439: 48 | I1439: 梅花集团 | J1439: 河北 | K1439: 廊坊 | L1439: 发酵制造
A1440: 1439 | B1440: 2011 | C1440: 238 | D1440: 蔡东青 | E1440: 45.7 | F1440: 男 | G1440: =INT(RC[1]/10)*10 -> 40 | H1440: 42 | I1440: 奥飞动漫 | J1440: 广东 | K1440: 汕头 | L1440: 动漫
A1441: 1440 | B1441: 2011 | C1441: 240 | D1441: 蒋锡培(微博) | E1441: 45.4 | F1441: 男 | G1441: =INT(RC[1]/10)*10 -> 40 | H1441: 48 | I1441: 江苏远东集团 | J1441: 江苏 | K1441: 无锡 | L1441: 电缆、医药、房地产
A1442: 1441 | B1442: 2011 | C1442: 240 | D1442: 孙伟挺夫妇 | E1442: 45.4 | F1442: 男 | G1442: =INT(RC[1]/10)*10 -> 40 | H1442: 48 | I1442: 华孚色纺 | J1442: 广东 | K1442: 深圳 | L1442: 纺织
A1443: 1442 | B1443: 2011 | C1443: 242 | D1443: 高雪峰 | E1443: 45.1 | F1443: 男 | G1443: =INT(RC[1]/10)*10 -> 50 | H1443: 53 | I1443: 内蒙古金诚泰化工 | J1443: 内蒙古 | K1443: 鄂尔多斯 | L1443: 化工
A1444: 1443 | B1444: 2011 | C1444: 242 | D1444: 张宝全夫妇 | E1444: 45.1 | F1444: 男 | G1444: =INT(RC[1]/10)*10 -> 50 | H1444: 54 | I1444: 今典集团 | J1444: 北京 | K1444: 北京 | L1444: 房地产、文化
A1445: 1444 | B1445: 2011 | C1445: 244 | D1445: 邢利斌 | E1445: 44.8 | F1445: 男 | G1445: =INT(RC[1]/10)*10 -> 40 | H1445: 44 | I1445: 联盛能源 | J1445: 山西 | K1445: 吕梁 | L1445: 煤炭
A1446: 1445 | B1446: 2011 | C1446: 244 | D1446: 李德文 | E1446: 44.8 | F1446: 男 | G1446: =INT(RC[1]/10)*10 -> 60 | H1446: 61 | I1446: 金帝集团 | J1446: 福建 | K1446: 泉州 | L1446: 房地产、教育
A1447: 1446 | B1447: 2011 | C1447: 244 | D1447: 李兴 | E1447: 44.8 | F1447: 男 | G1447: =INT(RC[1]/10)*10 -> 50 | H1447: 58 | I1447: 江阴澄星集团 | J1447: 江苏 | K1447: 江阴 | L1447: 化工（精细磷化工）
A1448: 1447 | B1448: 2011 | C1448: 244 | D1448: 梁光夫父子 | E1448: 44.8 | F1448: 男 | G1448: =INT(RC[1]/10)*10 -> 70 | H1448: 79 | I1448: 春和集团 | J1448: 浙江 | K1448: 宁波 | L1448: 造船
A1449: 1448 | B1449: 2011 | C1449: 244 | D1449: 刘国本 | E1449: 44.8 | F1449: 男 | G1449: =INT(RC[1]/10)*10 -> 60 | H1449: 67 | I1449: 骆驼集团 | J1449: 湖北 | K1449: 襄樊 | L1449: 电器机械制造
A1450: 1449 | B1450: 2011 | C1450: 244 | D1450: 张瑜平 | E1450: 44.8 | F1450: 男 | G1450: =INT(RC[1]/10)*10 -> 50 | H1450: 51 | I1450: 新宇亨得利 | J1450: 广东 | K1450: 东莞 | L1450: 钟表零售
A1451: 1450 | B1451: 2011 | C1451: 244 | D1451: 秦志威 | E1451: 44.8 | F1451: 男 | G1451: =INT(RC[1]/10)*10 -> 40 | H1451: 46 | I1451: 中国金属再生资源控股 | J1451: 香港 | K1451: 香港 | L1451: 金属回收
A1452: 1451 | B1452: 2011 | C1452: 251 | D1452: 楼忠福家族 | E1452: 44.4 | F1452: 男 | G1452: =INT(RC[1]/10)*10 -> 50 | H1452: 57 | I1452: 广厦集团 | J1452: 浙江 | K1452: 杭州 | L1452: 房地产、建筑施工
A1453: 1452 | B1453: 2011 | C1453: 251 | D1453: 戴志康 | E1453: 44.4 | F1453: 男 | G1453: =INT(RC[1]/10)*10 -> 40 | H1453: 47 | I1453: 证大集团 | J1453: 上海 | K1453: 上海 | L1453: 房地产、金融、能源
A1454: 1453 | B1454: 2011 | C1454: 253 | D1454: 陈清州夫妇 | E1454: 44.1 | F1454: 男 | G1454: =INT(RC[1]/10)*10 -> 40 | H1454: 45 | I1454: 海能达 | J1454: 广东 | K1454: 深圳 | L1454: 通信设备制造
A1455: 1454 | B1455: 2011 | C1455: 253 | D1455: 顾伟 | E1455: 44.1 | F1455: 男 | G1455: =INT(RC[1]/10)*10 -> 40 | H1455: 46 | I1455: 兆驰股份 | J1455: 广东 | K1455: 深圳 | L1455: 日用电子器具制造
A1456: 1455 | B1456: 2011 | C1456: 253 | D1456: 徐明家族 | E1456: 44.1 | F1456: 男 | G1456: =INT(RC[1]/10)*10 -> 40 | H1456: 40 | I1456: 大连实德集团 | J1456: 辽宁 | K1456: 大连 | L1456: 化工、建材、金融
A1457: 1456 | B1457: 2011 | C1457: 256 | D1457: 林国芳夫妇 | E1457: 43.8 | F1457: 男 | G1457: =INT(RC[1]/10)*10 -> 50 | H1457: 57 | I1457: 富安娜 | J1457: 广东 | K1457: 深圳 | L1457: 纺织
A1458: 1457 | B1458: 2011 | C1458: 257 | D1458: 倪开禄 | E1458: 43.5 | F1458: 男 | G1458: =INT(RC[1]/10)*10 -> 50 | H1458: 55 | I1458: 超日太阳能 | J1458: 上海 | K1458: 上海 | L1458: 太阳能
A1459: 1458 | B1459: 2011 | C1459: 257 | D1459: 朱吉满夫妇 | E1459: 43.5 | F1459: 男 | G1459: =INT(RC[1]/10)*10 -> 40 | H1459: 47 | I1459: 誉衡药业 | J1459: 黑龙江 | K1459: 哈尔滨 | L1459: 化学药品制剂制造
A1460: 1459 | B1460: 2011 | C1460: 257 | D1460: 仇建平夫妇 | E1460: 43.5 | F1460: 男 | G1460: =INT(RC[1]/10)*10 -> 40 | H1460: 49 | I1460: 巨星科技 | J1460: 浙江 | K1460: 杭州 | L1460: 工具制造
A1461: 1460 | B1461: 2011 | C1461: 257 | D1461: 邓伟 | E1461: 43.5 | F1461: 男 | G1461: =INT(RC[1]/10)*10 -> 40 | H1461: 48 | I1461: 亿阳集团 | J1461: 北京 | K1461: 北京 | L1461: 计算机应用服务、交通、能源、投资
A1462: 1461 | B1462: 2011 | C1462: 261 | D1462: 邵建明 | E1462: 43.2 | F1462: 男 | G1462: =INT(RC[1]/10)*10 -> 40 | H1462: 48 | I1462: 广东海印集团 | J1462: 广东 | K1462: 广州 | L1462: 零售、房地产、高岭土
A1463: 1462 | B1463: 2011 | C1463: 261 | D1463: 成清波 | E1463: 43.2 | F1463: 男 | G1463: =INT(RC[1]/10)*10 -> 40 | H1463: 49 | I1463: 深圳中技实业 | J1463: 广东 | K1463: 深圳 | L1463: 房地产、公用事业投资
A1464: 1463 | B1464: 2011 | C1464: 263 | D1464: 万连步 | E1464: 42.8 | F1464: 男 | G1464: =INT(RC[1]/10)*10 -> 40 | H1464: 46 | I1464: 金正大 | J1464: 山东 | K1464: 临沂 | L1464: 化学肥料制造
A1465: 1464 | B1465: 2011 | C1465: 263 | D1465: 杜双华 | E1465: 42.8 | F1465: 男 | G1465: =INT(RC[1]/10)*10 -> 40 | H1465: 46 | I1465: 京华日钢控股集团 | J1465: 河北 | K1465: 衡水 | L1465: 钢铁
A1466: 1465 | B1466: 2011 | C1466: 263 | D1466: 李勤夫 | E1466: 42.8 | F1466: 男 | G1466: =INT(RC[1]/10)*10 -> 40 | H1466: 49 | I1466: 九龙山 | J1466: 上海 | K1466: 上海 | L1466: 房地产
A1467: 1466 | B1467: 2011 | C1467: 266 | D1467: 梁允超 | E1467: 42.5 | F1467: 男 | G1467: =INT(RC[1]/10)*10 -> 40 | H1467: 42 | I1467: 汤臣倍健 | J1467: 广东 | K1467: 珠海 | L1467: 保健品、食品制造
A1468: 1467 | B1468: 2011 | C1468: 267 | D1468: 马鸿 | E1468: 42.2 | F1468: 男 | G1468: =INT(RC[1]/10)*10 -> 40 | H1468: 43 | I1468: 搜于特 | J1468: 广东 | K1468: 东莞 | L1468: 纺织品、服装、鞋帽零售
A1469: 1468 | B1469: 2011 | C1469: 267 | D1469: 孙伟杰 | E1469: 42.2 | F1469: 男 | G1469: =INT(RC[1]/10)*10 -> 40 | H1469: 48 | I1469: 杰瑞股份 | J1469: 山东 | K1469: 烟台 | L1469: 油田矿山设备制造
A1470: 1469 | B1470: 2011 | C1470: 267 | D1470: 蒋卫平夫妇 | E1470: 42.2 | F1470: 男 | G1470: =INT(RC[1]/10)*10 -> 50 | H1470: 56 | I1470: 天齐锂业 | J1470: 四川 | K1470: 成都 | L1470: 化学原料及化学制品制造
A1471: 1470 | B1471: 2011 | C1471: 267 | D1471: 李振江 | E1471: 42.2 | F1471: 男 | G1471: =INT(RC[1]/10)*10 -> 50 | H1471: 55 | I1471: 神威药业 | J1471: 河北 | K1471: 石家庄 | L1471: 医药
A1472: 1471 | B1472: 2011 | C1472: 267 | D1472: 刘长乐 | E1472: 42.2 | F1472: 男 | G1472: =INT(RC[1]/10)*10 -> 60 | H1472: 60 | I1472: 凤凰卫视 | J1472: 香港 | K1472: 香港 | L1472: 传媒
A1473: 1472 | B1473: 2011 | C1473: 272 | D1473: 杜厦 | E1473: 41.9 | F1473: 男 | G1473: =INT(RC[1]/10)*10 -> 60 | H1473: 64 | J1473: 天津 | K1473: 天津 | L1473: 投资
A1474: 1473 | B1474: 2011 | C1474: 272 | D1474: 缪寿良 | E1474: 41.9 | F1474: 男 | G1474: =INT(RC[1]/10)*10 -> 50 | H1474: 56 | I1474: 富源集团 | J1474: 广东 | K1474: 深圳 | L1474: 房地产
A1475: 1474 | B1475: 2011 | C1475: 272 | D1475: 杨雪岗夫妇 | E1475: 41.9 | F1475: 男 | G1475: =INT(RC[1]/10)*10 -> 40 | H1475: 46 | I1475: 旭阳煤化工集团 | J1475: 北京 | K1475: 北京 | L1475: 煤化工
A1476: 1475 | B1476: 2011 | C1476: 272 | D1476: 王清涛 | E1476: 41.9 | F1476: 男 | G1476: =INT(RC[1]/10)*10 -> 40 | H1476: 49 | I1476: 山东焦化集团 | J1476: 山东 | K1476: 济南 | L1476: 能源
A1477: 1476 | B1477: 2011 | C1477: 272 | D1477: 孟庆南家族 | E1477: 41.9 | F1477: 男 | G1477: =INT(RC[1]/10)*10 -> 50 | H1477: 53 | I1477: 武汉凡谷 | J1477: 湖北 | K1477: 武汉 | L1477: 通信设备制造
A1478: 1477 | B1478: 2011 | C1478: 272 | D1478: 刘绍喜父子 | E1478: 41.9 | F1478: 男 | G1478: =INT(RC[1]/10)*10 -> 40 | H1478: 47 | I1478: 宜华企业集团 | J1478: 广东 | K1478: 汕头 | L1478: 木业、房地产、投资
A1479: 1478 | B1479: 2011 | C1479: 278 | D1479: 王水福 | E1479: 41.6 | F1479: 男 | G1479: =INT(RC[1]/10)*10 -> 50 | H1479: 56 | I1479: 西子联合控股 | J1479: 浙江 | K1479: 杭州 | L1479: 电梯、装备制造、房地产
A1480: 1479 | B1480: 2011 | C1480: 278 | D1480: 陈一舟 | E1480: 41.6 | F1480: 男 | G1480: =INT(RC[1]/10)*10 -> 40 | H1480: 41 | I1480: 人人网 | J1480: 北京 | K1480: 北京 | L1480: 互联网
A1481: 1480 | B1481: 2011 | C1481: 278 | D1481: 魏建军 | E1481: 41.6 | F1481: 男 | G1481: =INT(RC[1]/10)*10 -> 40 | H1481: 47 | I1481: 长城汽车 | J1481: 河北 | K1481: 保定 | L1481: 汽车
A1482: 1481 | B1482: 2011 | C1482: 281 | D1482: 阮水龙家族 | E1482: 40.9 | F1482: 男 | G1482: =INT(RC[1]/10)*10 -> 70 | H1482: 75 | I1482: 龙盛集团 | J1482: 浙江 | K1482: 上虞 | L1482: 纺织化学品
A1483: 1482 | B1483: 2011 | C1483: 282 | D1483: 姜伟 | E1483: 40.6 | F1483: 男 | G1483: =INT(RC[1]/10)*10 -> 40 | H1483: 49 | I1483: 贵州百灵 | J1483: 贵州 | K1483: 安顺 | L1483: 医药
A1484: 1483 | B1484: 2011 | C1484: 282 | D1484: 王莺妹夫妇 | E1484: 40.6 | F1484: 女 | G1484: =INT(RC[1]/10)*10 -> 40 | H1484: 46 | I1484: 永太科技 | J1484: 浙江 | K1484: 台州 | L1484: 化学
A1485: 1484 | B1485: 2011 | C1485: 284 | D1485: 苏增福父子 | E1485: 40.299999999999997 | F1485: 男 | G1485: =INT(RC[1]/10)*10 -> 70 | H1485: 70 | I1485: 苏泊尔集团 | J1485: 浙江 | K1485: 杭州 | L1485: 厨具、小家电
A1486: 1485 | B1486: 2011 | C1486: 284 | D1486: 姜照柏 | E1486: 40.299999999999997 | F1486: 男 | G1486: =INT(RC[1]/10)*10 -> 40 | H1486: 48 | I1486: 鹏欣集团 | J1486: 上海 | K1486: 上海 | L1486: 房地产、投资
A1487: 1486 | B1487: 2011 | C1487: 284 | D1487: 郑坚江夫妇 | E1487: 40.299999999999997 | F1487: 男 | G1487: =INT(RC[1]/10)*10 -> 40 | H1487: 49 | I1487: 奥克斯集团 | J1487: 浙江 | K1487: 宁波 | L1487: 日用电器、电子测量仪器制造、房地产
A1488: 1487 | B1488: 2011 | C1488: 284 | D1488: 陆克平 | E1488: 40.299999999999997 | F1488: 男 | G1488: =INT(RC[1]/10)*10 -> 60 | H1488: 67 | I1488: 江苏阳光集团 | J1488: 江苏 | K1488: 江阴 | L1488: 纺织、太阳能
A1489: 1488 | B1489: 2011 | C1489: 288 | D1489: 黄楚龙 | E1489: 40 | F1489: 男 | G1489: / | H1489: / | I1489: 星河集团 | J1489: 广东 | K1489: 深圳 | L1489: 房地产
A1490: 1489 | B1490: 2011 | C1490: 288 | D1490: 刘建民夫妇 | E1490: 40 | F1490: 男 | G1490: =INT(RC[1]/10)*10 -> 50 | H1490: 58 | I1490: 甘肃建新实业集团 | J1490: 甘肃 | K1490: 兰州 | L1490: 有色金属
A1491: 1490 | B1491: 2011 | C1491: 288 | D1491: 王文良 | E1491: 40 | F1491: 男 | G1491: =INT(RC[1]/10)*10 -> 50 | H1491: 57 | I1491: 日林实业集团 | J1491: 辽宁 | K1491: 丹东 | L1491: 港口经营、造纸、建筑装饰
A1492: 1491 | B1492: 2011 | C1492: 288 | D1492: 叶立培家族 | E1492: 40 | F1492: 男 | G1492: =INT(RC[1]/10)*10 -> 60 | H1492: 67 | I1492: 仲盛集团 | J1492: 上海 | K1492: 上海 | L1492: 房地产
A1493: 1492 | B1493: 2011 | C1493: 288 | D1493: 梁衍锋家族 | E1493: 40 | F1493: 男 | G1493: =INT(RC[1]/10)*10 -> 40 | H1493: 46 | I1493: 中庚集团 | J1493: 福建 | K1493: 福州 | L1493: 房地产
A1494: 1493 | B1494: 2011 | C1494: 288 | D1494: 王柏兴父子 | E1494: 40 | F1494: 男 | G1494: =INT(RC[1]/10)*10 -> 50 | H1494: 54 | I1494: 中利科技 | J1494: 江苏 | K1494: 常熟 | L1494: 特种电缆制造
A1495: 1494 | B1495: 2011 | C1495: 288 | D1495: 刘汉家族 | E1495: 40 | F1495: 男 | G1495: =INT(RC[1]/10)*10 -> 40 | H1495: 46 | I1495: 四川汉龙集团 | J1495: 四川 | K1495: 成都 | L1495: 矿业、太阳能、基础设施、电力、房地产
A1496: 1495 | B1496: 2011 | C1496: 295 | D1496: 王填夫妇 | E1496: 39.6 | F1496: 男 | G1496: =INT(RC[1]/10)*10 -> 40 | H1496: 43 | I1496: 步步高商业连锁 | J1496: 湖南 | K1496: 湘潭 | L1496: 零售
A1497: 1496 | B1497: 2011 | C1497: 295 | D1497: 陈五奎家族 | E1497: 39.6 | F1497: 男 | G1497: =INT(RC[1]/10)*10 -> 50 | H1497: 53 | I1497: 拓日新能 | J1497: 广东 | K1497: 深圳 | L1497: 太阳能
A1498: 1497 | B1498: 2011 | C1498: 295 | D1498: 张思夏 | E1498: 39.6 | F1498: 男 | G1498: =INT(RC[1]/10)*10 -> 50 | H1498: 58 | I1498: 青岛汉河集团 | J1498: 山东 | K1498: 青岛 | L1498: 电器机械及器材制造
A1499: 1498 | B1499: 2011 | C1499: 298 | D1499: 林来嵘 | E1499: 39.299999999999997 | F1499: 男 | G1499: =INT(RC[1]/10)*10 -> 40 | H1499: 43 | I1499: 内蒙古众兴集团 | J1499: 内蒙古 | K1499: 包头 | L1499: 铁矿、煤炭
A1500: 1499 | B1500: 2011 | C1500: 299 | D1500: 文剑平 | E1500: 39 | F1500: 男 | G1500: =INT(RC[1]/10)*10 -> 40 | H1500: 49 | I1500: 碧水源 | J1500: 北京 | K1500: 北京 | L1500: 污水处理
A1501: 1500 | B1501: 2011 | C1501: 299 | D1501: 车冯升 | E1501: 39 | F1501: 男 | G1501: =INT(RC[1]/10)*10 -> 40 | H1501: 48 | I1501: 四环医药控股集团 | J1501: 海南 | K1501: 海口 | L1501: 医药
A1502: 1501 | B1502: 2011 | C1502: 299 | D1502: 吴惠娣 | E1502: 39 | F1502: 女 | G1502: / | H1502: / | I1502: 江苏丰立集团 | J1502: 江苏 | K1502: 张家港 | L1502: 钢铁、制造、煤炭、物流
A1503: 1502 | B1503: 2011 | C1503: 299 | D1503: 杨敏 | E1503: 39 | F1503: 女 | G1503: =INT(RC[1]/10)*10 -> 50 | H1503: 56 | I1503: 罕王集团 | J1503: 辽宁 | K1503: 抚顺 | L1503: 钢铁、矿业、零售
A1504: 1503 | B1504: 2011 | C1504: 299 | D1504: 阮加根家族 | E1504: 39 | F1504: 男 | G1504: =INT(RC[1]/10)*10 -> 50 | H1504: 51 | I1504: 闰土股份 | J1504: 浙江 | K1504: 上虞 | L1504: 化学原料及化学制品制造
A1505: 1504 | B1505: 2011 | C1505: 299 | D1505: 任元林 | E1505: 39 | F1505: 男 | G1505: =INT(RC[1]/10)*10 -> 50 | H1505: 58 | I1505: 扬子江造船 | J1505: 江苏 | K1505: 江阴 | L1505: 造船
A1506: 1505 | B1506: 2011 | C1506: 299 | D1506: 黄巧灵 | E1506: 39 | F1506: 男 | G1506: =INT(RC[1]/10)*10 -> 50 | H1506: 52 | I1506: 宋城集团 | J1506: 浙江 | K1506: 杭州 | L1506: 旅游
A1507: 1506 | B1507: 2011 | C1507: 299 | D1507: 王勇 | E1507: 39 | F1507: 男 | G1507: =INT(RC[1]/10)*10 -> 60 | H1507: 61 | I1507: 西王集团 | J1507: 山东 | K1507: 滨州 | L1507: 糖业
A1508: 1507 | B1508: 2011 | C1508: 307 | D1508: 吴良定家族 | E1508: 38.700000000000003 | F1508: 男 | G1508: =INT(RC[1]/10)*10 -> 60 | H1508: 65 | I1508: 万丰集团 | J1508: 上海 | K1508: 上海 | L1508: 工业制造、投资、新能源
A1509: 1508 | B1509: 2011 | C1509: 307 | D1509: 黄建荣 | E1509: 38.700000000000003 | F1509: 男 | G1509: =INT(RC[1]/10)*10 -> 50 | H1509: 53 | I1509: 上海海成资源集团 | J1509: 上海 | K1509: 上海 | L1509: 投资
A1510: 1509 | B1510: 2011 | C1510: 307 | D1510: 施天佑 | E1510: 38.700000000000003 | F1510: 男 | G1510: =INT(RC[1]/10)*10 -> 40 | H1510: 41 | I1510: 百宏实业 | J1510: 香港 | K1510: 香港 | L1510: 纺织化学品
A1511: 1510 | B1511: 2011 | C1511: 307 | D1511: 吴金錶 | E1511: 38.700000000000003 | F1511: 男 | G1511: =INT(RC[1]/10)*10 -> 40 | H1511: 48 | I1511: 百宏实业 | J1511: 香港 | K1511: 香港 | L1511: 纺织化学品
A1512: 1511 | B1512: 2011 | C1512: 311 | D1512: 杨贰珠 | E1512: 38.4 | F1512: 男 | G1512: =INT(RC[1]/10)*10 -> 60 | H1512: 60 | I1512: 碧桂园 | J1512: 广东 | K1512: 佛山 | L1512: 房地产
A1513: 1512 | B1513: 2011 | C1513: 311 | D1513: 冯焕培夫妇 | E1513: 38.4 | F1513: 男 | G1513: =INT(RC[1]/10)*10 -> 40 | H1513: 45 | I1513: 京运通 | J1513: 北京 | K1513: 北京 | L1513: 太阳能
A1514: 1513 | B1514: 2011 | C1514: 311 | D1514: 贾廷亮 夫妇 | E1514: 38.4 | F1514: 男 | G1514: =INT(RC[1]/10)*10 -> 50 | H1514: 55 | I1514: 大土河焦化 | J1514: 山西 | K1514: 吕梁 | L1514: 炼焦、煤炭
A1515: 1514 | B1515: 2011 | C1515: 311 | D1515: 金福音家族 | E1515: 38.4 | F1515: 男 | G1515: =INT(RC[1]/10)*10 -> 60 | H1515: 61 | I1515: 上海人民企业集团 | J1515: 上海 | K1515: 上海 | L1515: 输配电及控制设备制造
A1516: 1515 | B1516: 2011 | C1516: 311 | D1516: 袁亚非 | E1516: 38.4 | F1516: 男 | G1516: =INT(RC[1]/10)*10 -> 40 | H1516: 47 | I1516: 三胞集团 | J1516: 江苏 | K1516: 南京 | L1516: 零售连锁、房地产、制造
A1517: 1516 | B1517: 2011 | C1517: 311 | D1517: 薛伟斌 | E1517: 38.4 | F1517: 男 | G1517: =INT(RC[1]/10)*10 -> 40 | H1517: 47 | I1517: 罗莱家纺 | J1517: 江苏 | K1517: 南通 | L1517: 纺织
A1518: 1517 | B1518: 2011 | C1518: 311 | D1518: 缪双大父子 | E1518: 38.4 | F1518: 男 | G1518: =INT(RC[1]/10)*10 -> 60 | H1518: 60 | I1518: 双良集团 | J1518: 江苏 | K1518: 江阴 | L1518: 家电、化工新材料、酒店
A1519: 1518 | B1519: 2011 | C1519: 318 | D1519: 郑有全 | E1519: 38 | F1519: 男 | G1519: =INT(RC[1]/10)*10 -> 50 | H1519: 57 | I1519: 瑞贝卡 | J1519: 河南 | K1519: 许昌 | L1519: 发制品
A1520: 1519 | B1520: 2011 | C1520: 318 | D1520: 陈卓贤 | E1520: 38 | F1520: 男 | G1520: =INT(RC[1]/10)*10 -> 40 | H1520: 44 | I1520: 雅居乐地产 | J1520: 广东 | K1520: 中山 | L1520: 房地产
A1521: 1520 | B1521: 2011 | C1521: 318 | D1521: 车成聚 | E1521: 38 | F1521: 男 | G1521: =INT(RC[1]/10)*10 -> 60 | H1521: 60 | I1521: 齐翔腾达 | J1521: 山东 | K1521: 淄博 | L1521: 化学原料及化学制品制造
A1522: 1521 | B1522: 2011 | C1522: 321 | D1522: 林刚 | E1522: 37.700000000000003 | F1522: 男 | G1522: =INT(RC[1]/10)*10 -> 40 | H1522: 47 | I1522: 康哲药业控股 | J1522: 香港 | K1522: 香港 | L1522: 医药
A1523: 1522 | B1523: 2011 | C1523: 321 | D1523: 鲁楚平 | E1523: 37.700000000000003 | F1523: 男 | G1523: =INT(RC[1]/10)*10 -> 40 | H1523: 45 | I1523: 中山大洋电机 | J1523: 广东 | K1523: 中山 | L1523: 微电机制造
A1524: 1523 | B1524: 2011 | C1524: 321 | D1524: 梁亮胜 | E1524: 37.700000000000003 | F1524: 男 | G1524: =INT(RC[1]/10)*10 -> 60 | H1524: 60 | I1524: 丝宝集团 | J1524: 湖北 | K1524: 武汉 | L1524: 日化用品、药业、房地产
A1525: 1524 | B1525: 2011 | C1525: 324 | D1525: 孙喜双 | E1525: 37.4 | F1525: 男 | G1525: =INT(RC[1]/10)*10 -> 50 | H1525: 58 | I1525: 大连一方集团 | J1525: 辽宁 | K1525: 大连 | L1525: 房地产
A1526: 1525 | B1526: 2011 | C1526: 324 | D1526: 张朝阳 | E1526: 37.4 | F1526: 男 | G1526: =INT(RC[1]/10)*10 -> 40 | H1526: 47 | I1526: 搜狐 | J1526: 北京 | K1526: 北京 | L1526: 门户网站、网络游戏
A1527: 1526 | B1527: 2011 | C1527: 324 | D1527: 许淑清 | E1527: 37.4 | F1527: 女 | G1527: =INT(RC[1]/10)*10 -> 50 | H1527: 53 | I1527: 中恒集团 | J1527: 广西 | K1527: 梧州 | L1527: 医药
A1528: 1527 | B1528: 2011 | C1528: 327 | D1528: 王来春 | E1528: 37.1 | F1528: 女 | G1528: =INT(RC[1]/10)*10 -> 40 | H1528: 44 | I1528: 立讯精密 | J1528: 广东 | K1528: 深圳 | L1528: 电子元件制造
A1529: 1528 | B1529: 2011 | C1529: 327 | D1529: 王来胜 | E1529: 37.1 | F1529: 男 | G1529: =INT(RC[1]/10)*10 -> 40 | H1529: 46 | I1529: 立讯精密 | J1529: 广东 | K1529: 深圳 | L1529: 电子元件制造
A1530: 1529 | B1530: 2011 | C1530: 327 | D1530: 郑峰文 | E1530: 37.1 | F1530: 男 | G1530: =INT(RC[1]/10)*10 -> 40 | H1530: 45 | I1530: 中润投资 | J1530: 山东 | K1530: 济南 | L1530: 房地产
A1531: 1530 | B1531: 2011 | C1531: 327 | D1531: 陆永华夫妇 | E1531: 37.1 | F1531: 男 | G1531: =INT(RC[1]/10)*10 -> 40 | H1531: 48 | I1531: 林洋电子 | J1531: 上海 | K1531: 上海 | L1531: 电子测量仪器制造
A1532: 1531 | B1532: 2011 | C1532: 327 | D1532: 张成飞 | E1532: 37.1 | F1532: 男 | G1532: =INT(RC[1]/10)*10 -> 40 | H1532: 43 | I1532: 玖龙纸业 | J1532: 广东 | K1532: 东莞 | L1532: 造纸及纸制品
A1533: 1532 | B1533: 2011 | C1533: 327 | D1533: 胡成中 | E1533: 37.1 | F1533: 男 | G1533: =INT(RC[1]/10)*10 -> 50 | H1533: 50 | I1533: 中国德力西集团 | J1533: 浙江 | K1533: 温州 | L1533: 电器机械及器材制造
A1534: 1533 | B1534: 2011 | C1534: 327 | D1534: 黄宏生 | E1534: 37.1 | F1534: 男 | G1534: =INT(RC[1]/10)*10 -> 50 | H1534: 54 | I1534: 创维数码 | J1534: 香港 | K1534: 香港 | L1534: 电器零售
A1535: 1534 | B1535: 2011 | C1535: 327 | D1535: 侯建芳 | E1535: 37.1 | F1535: 男 | G1535: =INT(RC[1]/10)*10 -> 40 | H1535: 44 | I1535: 雏鹰农牧 | J1535: 河南 | K1535: 新郑 | L1535: 家禽饲养
A1536: 1535 | B1536: 2011 | C1536: 327 | D1536: 易小刚 | E1536: 37.1 | F1536: 男 | G1536: =INT(RC[1]/10)*10 -> 40 | H1536: 47 | I1536: 三一集团 | J1536: 湖南 | K1536: 长沙 | L1536: 机械装备制造
A1537: 1536 | B1537: 2011 | C1537: 336 | D1537: 商晓波夫妇 | E1537: 36.799999999999997 | F1537: 男 | G1537: =INT(RC[1]/10)*10 -> 30 | H1537: 37 | I1537: 鸿路钢构 | J1537: 安徽 | K1537: 合肥 | L1537: 金属制品
A1538: 1537 | B1538: 2011 | C1538: 336 | D1538: 邹节明家族 | E1538: 36.799999999999997 | F1538: 男 | G1538: =INT(RC[1]/10)*10 -> 60 | H1538: 68 | I1538: 桂林三金 | J1538: 广西 | K1538: 桂林 | L1538: 医药
A1539: 1538 | B1539: 2011 | C1539: 338 | D1539: 张秀根家族 | E1539: 36.4 | F1539: 男 | G1539: / | H1539: / | I1539: 华泰汽车 | J1539: 北京 | K1539: 北京 | L1539: 汽车制造
A1540: 1539 | B1540: 2011 | C1540: 339 | D1540: 牟金香 | E1540: 36.1 | F1540: 女 | G1540: =INT(RC[1]/10)*10 -> 50 | H1540: 57 | I1540: 联化科技 | J1540: 浙江 | K1540: 台州 | L1540: 精细化工
A1541: 1540 | B1541: 2011 | C1541: 339 | D1541: 李非列家族 | E1541: 36.1 | F1541: 男 | G1541: =INT(RC[1]/10)*10 -> 40 | H1541: 45 | I1541: 深圳飞尚实业 | J1541: 广东 | K1541: 深圳 | L1541: 有色金属、钢铁、交通物流、煤炭矿产
A1542: 1541 | B1542: 2011 | C1542: 339 | D1542: 周福贵 | E1542: 36.1 | F1542: 男 | G1542: =INT(RC[1]/10)*10 -> 40 | H1542: 49 | I1542: 三一集团 | J1542: 湖南 | K1542: 长沙 | L1542: 机械装备制造
A1543: 1542 | B1543: 2011 | C1543: 342 | D1543: 王树生 | E1543: 35.799999999999997 | F1543: 男 | G1543: =INT(RC[1]/10)*10 -> 50 | H1543: 57 | I1543: 大田集团 | J1543: 天津 | K1543: 天津 | L1543: 物流
A1544: 1543 | B1544: 2011 | C1544: 343 | D1544: 林龙安夫妇 | E1544: 35.5 | F1544: 男 | G1544: =INT(RC[1]/10)*10 -> 40 | H1544: 46 | I1544: 禹洲地产 | J1544: 福建 | K1544: 厦门 | L1544: 房地产
A1545: 1544 | B1545: 2011 | C1545: 343 | D1545: 张大中家族 | E1545: 35.5 | F1545: 男 | G1545: =INT(RC[1]/10)*10 -> 60 | H1545: 62 | I1545: 北京大中投资 | J1545: 北京 | K1545: 北京 | L1545: 投资
A1546: 1545 | B1546: 2011 | C1546: 343 | D1546: 莫天全 | E1546: 35.5 | F1546: 男 | G1546: =INT(RC[1]/10)*10 -> 40 | H1546: 47 | I1546: 搜房 | J1546: 北京 | K1546: 北京 | L1546: 房地产服务
A1547: 1546 | B1547: 2011 | C1547: 346 | D1547: 杨绍鹏 | E1547: 35.200000000000003 | F1547: 男 | G1547: =INT(RC[1]/10)*10 -> 50 | H1547: 53 | I1547: SITC 海丰国际 | J1547: 山东 | K1547: 青岛 | L1547: 海运
A1548: 1547 | B1548: 2011 | C1548: 346 | D1548: 蒲忠杰夫妇 | E1548: 35.200000000000003 | F1548: 男 | G1548: =INT(RC[1]/10)*10 -> 40 | H1548: 48 | I1548: 乐普医疗 | J1548: 北京 | K1548: 北京 | L1548: 医疗器械制造
A1549: 1548 | B1549: 2011 | C1549: 346 | D1549: 王永红 | E1549: 35.200000000000003 | F1549: 男 | G1549: =INT(RC[1]/10)*10 -> 30 | H1549: 39 | I1549: 中弘集团 | J1549: 北京 | K1549: 北京 | L1549: 房地产
A1550: 1549 | B1550: 2011 | C1550: 349 | D1550: 申东日 | E1550: 34.799999999999997 | F1550: 男 | G1550: =INT(RC[1]/10)*10 -> 30 | H1550: 38 | I1550: 朗姿股份 | J1550: 北京 | K1550: 北京 | L1550: 服装
A1551: 1550 | B1551: 2011 | C1551: 349 | D1551: 米恩华 | E1551: 34.799999999999997 | F1551: 男 | G1551: =INT(RC[1]/10)*10 -> 50 | H1551: 51 | I1551: 新疆华凌工贸集团 | J1551: 新疆 | K1551: 乌鲁木齐 | L1551: 批发零售
A1552: 1551 | B1552: 2011 | C1552: 349 | D1552: 陈国鹰夫妇 | E1552: 34.799999999999997 | F1552: 男 | G1552: =INT(RC[1]/10)*10 -> 40 | H1552: 48 | I1552: 国脉科技 | J1552: 福建 | K1552: 福州 | L1552: 电信网络技术服务
A1553: 1552 | B1553: 2011 | C1553: 349 | D1553: 何伯权 | E1553: 34.799999999999997 | F1553: 男 | G1553: =INT(RC[1]/10)*10 -> 50 | H1553: 51 | I1553: 今日投资 | J1553: 广东 | K1553: 广州 | L1553: 投资
A1554: 1553 | B1554: 2011 | C1554: 353 | D1554: 谢宏 | E1554: 34.5 | F1554: 男 | G1554: =INT(RC[1]/10)*10 -> 40 | H1554: 46 | I1554: 贝因美 | J1554: 浙江 | K1554: 杭州 | L1554: 乳制品制造
A1555: 1554 | B1555: 2011 | C1555: 353 | D1555: 刘水 | E1555: 34.5 | F1555: 男 | G1555: =INT(RC[1]/10)*10 -> 40 | H1555: 42 | I1555: 铁汉生态 | J1555: 广东 | K1555: 深圳 | L1555: 土木工程建筑
A1556: 1555 | B1556: 2011 | C1556: 353 | D1556: 张轩宁 | E1556: 34.5 | F1556: 男 | G1556: =INT(RC[1]/10)*10 -> 40 | H1556: 41 | I1556: 永辉超市 | J1556: 福建 | K1556: 福州 | L1556: 零售
A1557: 1556 | B1557: 2011 | C1557: 353 | D1557: 郭金东 | E1557: 34.5 | F1557: 男 | G1557: =INT(RC[1]/10)*10 -> 40 | H1557: 45 | I1557: 江苏金浦集团 | J1557: 江苏 | K1557: 南京 | L1557: 石油化工、房地产
A1558: 1557 | B1558: 2011 | C1558: 357 | D1558: 高云峰 | E1558: 34.200000000000003 | F1558: 男 | G1558: =INT(RC[1]/10)*10 -> 40 | H1558: 44 | I1558: 大族激光 | J1558: 广东 | K1558: 深圳 | L1558: 专用设备制造
A1559: 1558 | B1559: 2011 | C1559: 357 | D1559: 袁富根父子 | E1559: 34.200000000000003 | F1559: 男 | G1559: =INT(RC[1]/10)*10 -> 60 | H1559: 60 | I1559: 东山精密 | J1559: 江苏 | K1559: 苏州 | L1559: 金属制品
A1560: 1559 | B1560: 2011 | C1560: 357 | D1560: 张毓强 | E1560: 34.200000000000003 | F1560: 男 | G1560: =INT(RC[1]/10)*10 -> 50 | H1560: 56 | I1560: 振石控股集团 | J1560: 浙江 | K1560: 桐乡 | L1560: 工业制造、玻纤、物流
A1561: 1560 | B1561: 2011 | C1561: 360 | D1561: 沈锦华 | E1561: 33.9 | F1561: 男 | G1561: =INT(RC[1]/10)*10 -> 40 | H1561: 44 | I1561: 焦点科技 | J1561: 江苏 | K1561: 南京 | L1561: 电子商务
A1562: 1561 | B1562: 2011 | C1562: 360 | D1562: 李莉 | E1562: 33.9 | F1562: 女 | G1562: =INT(RC[1]/10)*10 -> 40 | H1562: 40 | I1562: 长荣股份 | J1562: 天津 | K1562: 天津 | L1562: 专用设备制造
A1563: 1562 | B1563: 2011 | C1563: 360 | D1563: 潘慧 | E1563: 33.9 | F1563: 女 | G1563: =INT(RC[1]/10)*10 -> 40 | H1563: 49 | I1563: 科伦药业 | J1563: 四川 | K1563: 成都 | L1563: 医药
A1564: 1563 | B1564: 2011 | C1564: 360 | D1564: 包士金 | E1564: 33.9 | F1564: 男 | G1564: =INT(RC[1]/10)*10 -> 50 | H1564: 51 | I1564: 吉鑫科技 | J1564: 江苏 | K1564: 江阴 | L1564: 风电设备制造
A1565: 1564 | B1565: 2011 | C1565: 360 | D1565: 许景南家族 | E1565: 33.9 | F1565: 男 | G1565: =INT(RC[1]/10)*10 -> 50 | H1565: 56 | I1565: 匹克集团 | J1565: 福建 | K1565: 泉州 | L1565: 运动服饰及体育用品
A1566: 1565 | B1566: 2011 | C1566: 365 | D1566: 周鸿祎 | E1566: 33.6 | F1566: 男 | G1566: =INT(RC[1]/10)*10 -> 40 | H1566: 41 | I1566: 奇虎360 | J1566: 北京 | K1566: 北京 | L1566: 软件开发
A1567: 1566 | B1567: 2011 | C1567: 365 | D1567: 陈念慈家族 | E1567: 33.6 | F1567: 男 | G1567: =INT(RC[1]/10)*10 -> 50 | H1567: 59 | I1567: 三江购物 | J1567: 浙江 | K1567: 宁波 | L1567: 零售
A1568: 1567 | B1568: 2011 | C1568: 365 | D1568: 宋睿 | E1568: 33.6 | F1568: 男 | G1568: =INT(RC[1]/10)*10 -> 30 | H1568: 36 | I1568: 新都化工 | J1568: 四川 | K1568: 成都 | L1568: 化学肥料制造
A1569: 1568 | B1569: 2011 | C1569: 368 | D1569: 郭现生夫妇 | E1569: 33.200000000000003 | F1569: 男 | G1569: =INT(RC[1]/10)*10 -> 40 | H1569: 49 | I1569: 林州重机 | J1569: 河南 | K1569: 林州 | L1569: 冶金、矿山、机电工业专用设备制造
A1570: 1569 | B1570: 2011 | C1570: 368 | D1570: 周福海家族 | E1570: 33.200000000000003 | F1570: 男 | G1570: =INT(RC[1]/10)*10 -> 50 | H1570: 51 | I1570: 亚太科技 | J1570: 江苏 | K1570: 无锡 | L1570: 有色金属加工
A1571: 1570 | B1571: 2011 | C1571: 368 | D1571: 李贤义 | E1571: 33.200000000000003 | F1571: 男 | G1571: =INT(RC[1]/10)*10 -> 50 | H1571: 59 | I1571: 信义玻璃 | J1571: 香港 | K1571: 香港 | L1571: 玻璃制造
A1572: 1571 | B1572: 2011 | C1572: 368 | D1572: 马兴法家族 | E1572: 33.200000000000003 | F1572: 男 | G1572: =INT(RC[1]/10)*10 -> 40 | H1572: 48 | I1572: 天马控股集团 | J1572: 浙江 | K1572: 杭州 | L1572: 轴承制造
A1573: 1572 | B1573: 2011 | C1573: 368 | D1573: 陈玉忠夫妇 | E1573: 33.200000000000003 | F1573: 男 | G1573: =INT(RC[1]/10)*10 -> 40 | H1573: 45 | I1573: 张家港化工机械 | J1573: 江苏 | K1573: 张家港 | L1573: 专用设备制造
A1574: 1573 | B1574: 2011 | C1574: 368 | D1574: 施正荣 | E1574: 33.200000000000003 | F1574: 男 | G1574: =INT(RC[1]/10)*10 -> 40 | H1574: 48 | I1574: 尚德电力控股 | J1574: 江苏 | K1574: 无锡 | L1574: 太阳能
A1575: 1574 | B1575: 2011 | C1575: 374 | D1575: 张道才家族 | E1575: 32.9 | F1575: 男 | G1575: =INT(RC[1]/10)*10 -> 60 | H1575: 61 | I1575: 三花控股集团 | J1575: 浙江 | K1575: 绍兴 | L1575: 机械制造、房地产
A1576: 1575 | B1576: 2011 | C1576: 374 | D1576: 张军 | E1576: 32.9 | F1576: 男 | G1576: =INT(RC[1]/10)*10 -> 40 | H1576: 43 | I1576: 海隆石油工业集团 | J1576: 北京 | K1576: 北京 | L1576: 石油化工
A1577: 1576 | B1577: 2011 | C1577: 374 | D1577: 罗玉平 | E1577: 32.9 | F1577: 男 | G1577: =INT(RC[1]/10)*10 -> 40 | H1577: 45 | I1577: 中天城投 | J1577: 贵州 | K1577: 贵阳 | L1577: 房地产
A1578: 1577 | B1578: 2011 | C1578: 377 | D1578: 徐明波 | E1578: 32.6 | F1578: 男 | G1578: =INT(RC[1]/10)*10 -> 40 | H1578: 47 | I1578: 双鹭药业 | J1578: 北京 | K1578: 北京 | L1578: 医药
A1579: 1578 | B1579: 2011 | C1579: 377 | D1579: 吴冠江 | E1579: 32.6 | F1579: 男 | G1579: =INT(RC[1]/10)*10 -> 40 | H1579: 42 | I1579: 智飞生物 | J1579: 重庆 | K1579: 重庆 | L1579: 生物制药
A1580: 1579 | B1580: 2011 | C1580: 377 | D1580: 王坚 | E1580: 32.6 | F1580: 男 | G1580: =INT(RC[1]/10)*10 -> 40 | H1580: 48 | I1580: 西藏5100水资源 | J1580: 香港 | K1580: 香港 | L1580: 水资源
A1581: 1580 | B1581: 2011 | C1581: 377 | D1581: 王兴春 | E1581: 32.6 | F1581: 男 | G1581: =INT(RC[1]/10)*10 -> 40 | H1581: 47 | I1581: 永晖焦煤 | J1581: 新加坡 | K1581: 新加坡 | L1581: 炼焦、煤炭
A1582: 1581 | B1582: 2011 | C1582: 377 | D1582: 丁水波(微博) | E1582: 32.6 | F1582: 男 | G1582: =INT(RC[1]/10)*10 -> 40 | H1582: 40 | I1582: 特步 | J1582: 福建 | K1582: 泉州 | L1582: 运动服饰及体育用品
A1583: 1582 | B1583: 2011 | C1583: 377 | D1583: 沈南鹏(微博) | E1583: 32.6 | F1583: 男 | G1583: =INT(RC[1]/10)*10 -> 40 | H1583: 44 | I1583: 红杉资本（中国） | J1583: 上海 | K1583: 上海 | L1583: 投资
A1584: 1583 | B1584: 2011 | C1584: 377 | D1584: 刘海龙 | E1584: 32.6 | F1584: 男 | G1584: =INT(RC[1]/10)*10 -> 60 | H1584: 66 | I1584: 四川宏达集团 | J1584: 四川 | K1584: 成都 | L1584: 冶金、矿业、化工、房地产、金融
A1585: 1584 | B1585: 2011 | C1585: 377 | D1585: 金惠明家族 | E1585: 32.6 | F1585: 男 | G1585: =INT(RC[1]/10)*10 -> 50 | H1585: 58 | I1585: 上海大华集团 | J1585: 上海 | K1585: 上海 | L1585: 房地产
A1586: 1585 | B1586: 2011 | C1586: 385 | D1586: 郭春生家族 | E1586: 32.299999999999997 | F1586: 男 | G1586: =INT(RC[1]/10)*10 -> 40 | H1586: 40 | I1586: 吉林紫鑫药业 | J1586: 吉林 | K1586: 长春 | L1586: 医药
A1587: 1586 | B1587: 2011 | C1587: 385 | D1587: 陈福成 | E1587: 32.299999999999997 | F1587: 男 | G1587: =INT(RC[1]/10)*10 -> 30 | H1587: 39 | I1587: 松芝股份 | J1587: 上海 | K1587: 上海 | L1587: 交通运输设备制造
A1588: 1587 | B1588: 2011 | C1588: 385 | D1588: 王广西夫妇 | E1588: 32.299999999999997 | F1588: 男 | G1588: =INT(RC[1]/10)*10 -> 40 | H1588: 42 | I1588: 永泰控股 | J1588: 江苏 | K1588: 南京 | L1588: 能源、煤炭
A1589: 1588 | B1589: 2011 | C1589: 385 | D1589: 涂建华 | E1589: 32.299999999999997 | F1589: 男 | G1589: =INT(RC[1]/10)*10 -> 40 | H1589: 48 | I1589: 隆鑫控股 | J1589: 重庆 | K1589: 重庆 | L1589: 房地产、摩托车制造
A1590: 1589 | B1590: 2011 | C1590: 389 | D1590: 董才平 | E1590: 32 | F1590: 男 | G1590: =INT(RC[1]/10)*10 -> 40 | H1590: 48 | I1590: 中天钢铁 | J1590: 江苏 | K1590: 常州 | L1590: 钢铁
A1591: 1590 | B1591: 2011 | C1591: 389 | D1591: 程志山 | E1591: 32 | F1591: 男 | G1591: / | H1591: / | I1591: 富达海程 | J1591: 北京 | K1591: 北京 | L1591: 投资
A1592: 1591 | B1592: 2011 | C1592: 389 | D1592: 袁仲雪 | E1592: 32 | F1592: 男 | G1592: =INT(RC[1]/10)*10 -> 50 | H1592: 56 | I1592: 软控股份 | J1592: 山东 | K1592: 青岛 | L1592: 计算机应用服务
A1593: 1592 | B1593: 2011 | C1593: 389 | D1593: 宋卫平夫妇 | E1593: 32 | F1593: 男 | G1593: =INT(RC[1]/10)*10 -> 50 | H1593: 53 | I1593: 绿城集团 | J1593: 浙江 | K1593: 杭州 | L1593: 房地产
A1594: 1593 | B1594: 2011 | C1594: 389 | D1594: 洪肇设 | E1594: 32 | F1594: 男 | G1594: =INT(RC[1]/10)*10 -> 50 | H1594: 58 | I1594: 福建柒牌集团 | J1594: 福建 | K1594: 晋江 | L1594: 服装
A1595: 1594 | B1595: 2011 | C1595: 389 | D1595: 张华明 | E1595: 32 | F1595: 男 | G1595: / | H1595: / | I1595: 浙江雅莹 | J1595: 浙江 | K1595: 绍兴 | L1595: 服装
A1596: 1595 | B1596: 2011 | C1596: 389 | D1596: 张雷 | E1596: 32 | F1596: 男 | G1596: =INT(RC[1]/10)*10 -> 40 | H1596: 49 | I1596: 当代集团 | J1596: 北京 | K1596: 北京 | L1596: 房地产
A1597: 1596 | B1597: 2011 | C1597: 389 | D1597: 王海鹏 | E1597: 32 | F1597: 男 | G1597: =INT(RC[1]/10)*10 -> 40 | H1597: 40 | I1597: 美盈森 | J1597: 广东 | K1597: 深圳 | L1597: 造纸及纸制品
A1598: 1597 | B1598: 2011 | C1598: 389 | D1598: 周国辉 | E1598: 32 | F1598: 男 | G1598: =INT(RC[1]/10)*10 -> 40 | H1598: 46 | I1598: 怡亚通 | J1598: 广东 | K1598: 深圳 | L1598: 物流
A1599: 1598 | B1599: 2011 | C1599: 389 | D1599: 王飘扬 | E1599: 32 | F1599: 男 | G1599: =INT(RC[1]/10)*10 -> 40 | H1599: 46 | I1599: 万邦达 | J1599: 北京 | K1599: 北京 | L1599: 污水处理
A1600: 1599 | B1600: 2011 | C1600: 389 | D1600: 许晓明 | E1600: 32 | F1600: 男 | G1600: =INT(RC[1]/10)*10 -> 40 | H1600: 48 | I1600: 南国置业 | J1600: 湖北 | K1600: 武汉 | L1600: 房地产
A1601: 1600 | B1601: 2011 | C1601: 389 | D1601: 陈华 | E1601: 32 | F1601: 男 | G1601: =INT(RC[1]/10)*10 -> 40 | H1601: 45 | I1601: 京基集团 | J1601: 广东 | K1601: 深圳 | L1601: 房地产
A1602: 1601 | B1602: 2010 | C1602: 1 | D1602: 宗庆后 | E1602: 534 | F1602: 男 | G1602: =INT(RC[1]/10)*10 -> 60 | H1602: 65 | I1602: 娃哈哈集团 | J1602: 浙江 | K1602: 杭州 | L1602: 饮料
A1603: 1602 | B1603: 2010 | C1603: 2 | D1603: 李彦宏 | E1603: 480 | F1603: 男 | G1603: =INT(RC[1]/10)*10 -> 40 | H1603: 42 | I1603: 百度 | J1603: 北京 | K1603: 北京 | L1603: 搜索引擎
A1604: 1603 | B1604: 2010 | C1604: 3 | D1604: 梁稳根 | E1604: 394 | F1604: 男 | G1604: =INT(RC[1]/10)*10 -> 50 | H1604: 53 | I1604: 三一集团 | J1604: 湖南 | K1604: 长沙 | L1604: 机械装备制造
A1605: 1604 | B1605: 2010 | C1605: 4 | D1605: 张近东 | E1605: 380 | F1605: 男 | G1605: =INT(RC[1]/10)*10 -> 40 | H1605: 47 | I1605: 苏宁电器 | J1605: 江苏 | K1605: 南京 | L1605: 家电零售
A1606: 1605 | B1606: 2010 | C1606: 5 | D1606: 李锂夫妇 | E1606: 360 | F1606: 男 | G1606: =INT(RC[1]/10)*10 -> 40 | H1606: 46 | I1606: 海普瑞药业 | J1606: 广东 | K1606: 深圳 | L1606: 医药
A1607: 1606 | B1607: 2010 | C1607: 6 | D1607: 何享健 | E1607: 334 | F1607: 男 | G1607: =INT(RC[1]/10)*10 -> 60 | H1607: 68 | I1607: 美的集团 | J1607: 广东 | K1607: 佛山 | L1607: 日用电器制造
A1608: 1607 | B1608: 2010 | C1608: 7 | D1608: 刘永行 | E1608: 327 | F1608: 男 | G1608: =INT(RC[1]/10)*10 -> 60 | H1608: 62 | I1608: 东方希望集团 | J1608: 上海 | K1608: 上海 | L1608: 饲料、重化工业、投资
A1609: 1608 | B1609: 2010 | C1609: 8 | D1609: 吴亚军夫妇 | E1609: 314 | F1609: 女 | G1609: =INT(RC[1]/10)*10 -> 40 | H1609: 46 | I1609: 龙湖地产 | J1609: 北京 | K1609: 北京 | L1609: 房地产
A1610: 1609 | B1610: 2010 | C1610: 9 | D1610: 马化腾 | E1610: 294 | F1610: 男 | G1610: =INT(RC[1]/10)*10 -> 30 | H1610: 39 | I1610: 腾讯 | J1610: 广东 | K1610: 深圳 | L1610: 即时通讯、门户网站、网络游戏
A1611: 1610 | B1611: 2010 | C1611: 10 | D1611: 王传福 | E1611: 284 | F1611: 男 | G1611: =INT(RC[1]/10)*10 -> 40 | H1611: 44 | I1611: 比亚迪 | J1611: 广东 | K1611: 深圳 | L1611: 电池、汽车、新能源
A1612: 1611 | B1612: 2010 | C1612: 11 | D1612: 许家印 | E1612: 280 | F1612: 男 | G1612: =INT(RC[1]/10)*10 -> 50 | H1612: 52 | I1612: 恒大集团 | J1612: 广东 | K1612: 广州 | L1612: 房地产
A1613: 1612 | B1613: 2010 | C1613: 12 | D1613: 陈发树 | E1613: 274 | F1613: 男 | G1613: =INT(RC[1]/10)*10 -> 40 | H1613: 49 | I1613: 新华都实业集团 | J1613: 福建 | K1613: 福州 | L1613: 零售、投资、房地产
A1614: 1613 | B1614: 2010 | C1614: 13 | D1614: 王健林 | E1614: 260 | F1614: 男 | G1614: =INT(RC[1]/10)*10 -> 50 | H1614: 56 | I1614: 大连万达集团 | J1614: 辽宁 | K1614: 大连 | L1614: 房地产
A1615: 1614 | B1615: 2010 | C1615: 14 | D1615: 许荣茂 | E1615: 244 | F1615: 男 | G1615: =INT(RC[1]/10)*10 -> 60 | H1615: 60 | I1615: 世茂集团 | J1615: 香港 | K1615: 香港 | L1615: 房地产
A1616: 1615 | B1616: 2010 | C1616: 15 | D1616: 周成建 | E1616: 240 | F1616: 男 | G1616: =INT(RC[1]/10)*10 -> 40 | H1616: 45 | I1616: 美特斯邦威集团 | J1616: 上海 | K1616: 上海 | L1616: 服装连锁
A1617: 1616 | B1617: 2010 | C1617: 16 | D1617: 杨惠妍 | E1617: 234 | F1617: 女 | G1617: =INT(RC[1]/10)*10 -> 20 | H1617: 29 | I1617: 碧桂园 | J1617: 广东 | K1617: 佛山 | L1617: 房地产
A1618: 1617 | B1618: 2010 | C1618: 17 | D1618: 朱林瑶 | E1618: 224 | F1618: 女 | G1618: =INT(RC[1]/10)*10 -> 40 | H1618: 40 | I1618: 华宝国际 | J1618: 香港 | K1618: 香港 | L1618: 香料香精
A1619: 1618 | B1619: 2010 | C1619: 18 | D1619: 鲁冠球 | E1619: 220 | F1619: 男 | G1619: =INT(RC[1]/10)*10 -> 60 | H1619: 65 | I1619: 万向集团 | J1619: 浙江 | K1619: 杭州 | L1619: 汽车、有色金属、房地产、农业
A1620: 1619 | B1620: 2010 | C1620: 19 | D1620: 祝义材夫妇 | E1620: 210 | F1620: 男 | G1620: =INT(RC[1]/10)*10 -> 40 | H1620: 46 | I1620: 雨润集团 | J1620: 江苏 | K1620: 南京 | L1620: 食品、房地产
A1621: 1620 | B1621: 2010 | C1621: 20 | D1621: 张欣夫妇 | E1621: 207 | F1621: 女 | G1621: =INT(RC[1]/10)*10 -> 40 | H1621: 45 | I1621: SOHO中国 | J1621: 北京 | K1621: 北京 | L1621: 房地产
A1622: 1621 | B1622: 2010 | C1622: 21 | D1622: 刘永好家族 | E1622: 200 | F1622: 男 | G1622: =INT(RC[1]/10)*10 -> 50 | H1622: 59 | I1622: 新希望集团 | J1622: 四川 | K1622: 成都 | L1622: 饲料、房地产、金融、化工
A1623: 1622 | B1623: 2010 | C1623: 22 | D1623: 吕向阳 | E1623: 197 | F1623: 男 | G1623: =INT(RC[1]/10)*10 -> 40 | H1623: 47 | I1623: 融捷投资、比亚迪股份 | J1623: 广东 | K1623: 广州 | L1623: 投资
A1624: 1623 | B1624: 2010 | C1624: 23 | D1624: 郭广昌 | E1624: 187 | F1624: 男 | G1624: =INT(RC[1]/10)*10 -> 40 | H1624: 43 | I1624: 复星国际 | J1624: 上海 | K1624: 上海 | L1624: 钢铁、房地产、医药、金融
A1625: 1624 | B1625: 2010 | C1625: 24 | D1625: 刘忠田 | E1625: 180 | F1625: 男 | G1625: =INT(RC[1]/10)*10 -> 40 | H1625: 46 | I1625: 忠旺集团 | J1625: 辽宁 | K1625: 辽阳 | L1625: 工业铝型材
A1626: 1625 | B1626: 2010 | C1626: 25 | D1626: 高德康 | E1626: 174 | F1626: 男 | G1626: =INT(RC[1]/10)*10 -> 50 | H1626: 58 | I1626: 波司登 | J1626: 江苏 | K1626: 常熟 | L1626: 服装
A1627: 1626 | B1627: 2010 | C1627: 26 | D1627: 张志熔 | E1627: 153 | F1627: 男 | G1627: =INT(RC[1]/10)*10 -> 40 | H1627: 41 | I1627: 恒盛地产、熔盛重工 | J1627: 香港 | K1627: 香港 | L1627: 房地产、造船
A1628: 1627 | B1628: 2010 | C1628: 27 | D1628: 孙广信 | E1628: 151 | F1628: 男 | G1628: =INT(RC[1]/10)*10 -> 40 | H1628: 47 | I1628: 新疆广汇集团 | J1628: 新疆 | K1628: 乌鲁木齐 | L1628: 能源、汽车销售服务、房地产
A1629: 1628 | B1629: 2010 | C1629: 28 | D1629: 施文博 | E1629: 148 | F1629: 男 | G1629: =INT(RC[1]/10)*10 -> 60 | H1629: 60 | I1629: 恒安集团 | J1629: 福建 | K1629: 晋江 | L1629: 个人护理用品
A1630: 1629 | B1630: 2010 | C1630: 29 | D1630: 陈建华 | E1630: 147 | F1630: 男 | G1630: =INT(RC[1]/10)*10 -> 30 | H1630: 39 | I1630: 恒力集团 | J1630: 江苏 | K1630: 吴江 | L1630: 化纤、石化
A1631: 1630 | B1631: 2010 | C1631: 30 | D1631: 丁磊 | E1631: 146 | F1631: 男 | G1631: =INT(RC[1]/10)*10 -> 30 | H1631: 39 | I1631: 网易 | J1631: 广东 | K1631: 广州 | L1631: 门户网站
A1632: 1631 | B1632: 2010 | C1632: 31 | D1632: 卢志强 | E1632: 143 | F1632: 男 | G1632: =INT(RC[1]/10)*10 -> 50 | H1632: 58 | I1632: 泛海集团 | J1632: 北京 | K1632: 北京 | L1632: 金融、房地产、投资
A1633: 1632 | B1633: 2010 | C1633: 32 | D1633: 许连捷（许自连） | E1633: 141 | F1633: 男 | G1633: =INT(RC[1]/10)*10 -> 50 | H1633: 57 | I1633: 恒安集团 | J1633: 福建 | K1633: 晋江 | L1633: 个人护理用品
A1634: 1633 | B1634: 2010 | C1634: 33 | D1634: 张茵 | E1634: 140 | F1634: 女 | G1634: =INT(RC[1]/10)*10 -> 50 | H1634: 53 | I1634: 玖龙纸业 | J1634: 广东 | K1634: 东莞 | L1634: 造纸
A1635: 1634 | B1635: 2010 | C1635: 34 | D1635: 黄伟夫妇 | E1635: 137 | F1635: 男 | G1635: =INT(RC[1]/10)*10 -> 50 | H1635: 51 | I1635: 新湖集团 | J1635: 浙江 | K1635: 杭州 | L1635: 房地产、金融、矿业、生物制药
A1636: 1635 | B1636: 2010 | C1636: 35 | D1636: 沈国军 | E1636: 134 | F1636: 男 | G1636: =INT(RC[1]/10)*10 -> 40 | H1636: 48 | I1636: 银泰集团 | J1636: 北京 | K1636: 北京 | L1636: 零售、房地产
A1637: 1636 | B1637: 2010 | C1637: 36 | D1637: 沈文荣 | E1637: 133 | F1637: 男 | G1637: =INT(RC[1]/10)*10 -> 60 | H1637: 64 | I1637: 江苏沙钢集团 | J1637: 江苏 | K1637: 张家港 | L1637: 钢铁
A1638: 1637 | B1638: 2010 | C1638: 37 | D1638: 李水荣 | E1638: 131 | F1638: 男 | G1638: =INT(RC[1]/10)*10 -> 50 | H1638: 54 | I1638: 浙江荣盛控股集团 | J1638: 浙江 | K1638: 杭州 | L1638: 化纤、石化
A1639: 1638 | B1639: 2010 | C1639: 38 | D1639: 陈义红夫妇 | E1639: 130 | F1639: 男 | G1639: =INT(RC[1]/10)*10 -> 50 | H1639: 52 | I1639: 中国动向 | J1639: 北京 | K1639: 北京 | L1639: 运动服饰及体育用品
A1640: 1639 | B1640: 2010 | C1640: 39 | D1640: 黄茂如夫妇 | E1640: 129 | F1640: 男 | G1640: =INT(RC[1]/10)*10 -> 40 | H1640: 45 | I1640: 茂业集团 | J1640: 广东 | K1640: 深圳 | L1640: 房地产、百货、零售
A1641: 1640 | B1641: 2010 | C1641: 40 | D1641: 李书福 | E1641: 127 | F1641: 男 | G1641: =INT(RC[1]/10)*10 -> 40 | H1641: 47 | I1641: 吉利集团 | J1641: 浙江 | K1641: 杭州 | L1641: 汽车制造
A1642: 1641 | B1642: 2010 | C1642: 41 | D1642: 李新炎夫妇 | E1642: 125 | F1642: 男 | G1642: =INT(RC[1]/10)*10 -> 50 | H1642: 58 | I1642: 中国龙工集团 | J1642: 上海 | K1642: 上海 | L1642: 机械装备制造
A1643: 1642 | B1643: 2010 | C1643: 42 | D1643: 黄绍武 | E1643: 123 | F1643: 男 | G1643: =INT(RC[1]/10)*10 -> 40 | H1643: 40 | I1643: 深圳爱施德 | J1643: 广东 | K1643: 深圳 | L1643: 移动通讯产品销售服务
A1644: 1643 | B1644: 2010 | C1644: 43 | D1644: 曹德旺家族 | E1644: 122.5 | F1644: 男 | G1644: =INT(RC[1]/10)*10 -> 60 | H1644: 64 | I1644: 福耀集团 | J1644: 福建 | K1644: 福清 | L1644: 玻璃制造
A1645: 1644 | B1645: 2010 | C1645: 43 | D1645: 薛光林 | E1645: 122.5 | F1645: 男 | G1645: =INT(RC[1]/10)*10 -> 60 | H1645: 61 | I1645: 光汇石油集团 | J1645: 广东 | K1645: 深圳 | L1645: 石油化工
A1646: 1645 | B1646: 2010 | C1646: 45 | D1646: 黄泽兰 | E1646: 121 | F1646: 男 | G1646: =INT(RC[1]/10)*10 -> 50 | H1646: 55 | I1646: 崇义章源钨业 | J1646: 江西 | K1646: 赣州 | L1646: 有色金属
A1647: 1646 | B1647: 2010 | C1647: 45 | D1647: 张志东 | E1647: 121 | F1647: 男 | G1647: =INT(RC[1]/10)*10 -> 30 | H1647: 38 | I1647: 腾讯 | J1647: 广东 | K1647: 深圳 | L1647: 即时通讯、门户网站、网络游戏
A1648: 1647 | B1648: 2010 | C1648: 47 | D1648: 黄毅 | E1648: 120.5 | F1648: 男 | G1648: =INT(RC[1]/10)*10 -> 40 | H1648: 47 | I1648: 中升集团控股有限公司 | J1648: 辽宁 | K1648: 大连 | L1648: 汽车销售服务
A1649: 1648 | B1649: 2010 | C1649: 48 | D1649: 叶澄海家族 | E1649: 120 | F1649: 男 | G1649: =INT(RC[1]/10)*10 -> 60 | H1649: 67 | I1649: 深圳信立泰药业 | J1649: 广东 | K1649: 深圳 | L1649: 医药
A1650: 1649 | B1650: 2010 | C1650: 48 | D1650: 贺学初 | E1650: 120 | F1650: 男 | G1650: =INT(RC[1]/10)*10 -> 40 | H1650: 48 | I1650: 洪桥集团 | J1650: 香港 | K1650: 香港 | L1650: 矿业、太阳能
A1651: 1650 | B1651: 2010 | C1651: 50 | D1651: 周福仁家族 | E1651: 119 | F1651: 男 | G1651: =INT(RC[1]/10)*10 -> 50 | H1651: 53 | I1651: 西洋集团 | J1651: 辽宁 | K1651: 海城 | L1651: 化肥、耐火材料、铁矿
A1652: 1651 | B1652: 2010 | C1652: 51 | D1652: 林秀成家族 | E1652: 118 | F1652: 男 | G1652: =INT(RC[1]/10)*10 -> 50 | H1652: 55 | I1652: 福建三安集团 | J1652: 福建 | K1652: 厦门 | L1652: 电子元器件、钢铁
A1653: 1652 | B1653: 2010 | C1653: 52 | D1653: 朱共山 | E1653: 117.5 | F1653: 男 | G1653: =INT(RC[1]/10)*10 -> 50 | H1653: 53 | I1653: 协鑫控股 | J1653: 江苏 | K1653: 徐州 | L1653: 电力、太阳能
A1654: 1653 | B1654: 2010 | C1654: 53 | D1654: 张力 | E1654: 117 | F1654: 男 | G1654: =INT(RC[1]/10)*10 -> 50 | H1654: 57 | I1654: 富力集团 | J1654: 广东 | K1654: 广州 | L1654: 房地产、投资
A1655: 1654 | B1655: 2010 | C1655: 54 | D1655: 何巧女夫妇 | E1655: 113 | F1655: 女 | G1655: =INT(RC[1]/10)*10 -> 40 | H1655: 44 | I1655: 东方园林 | J1655: 北京 | K1655: 北京 | L1655: 园林设计
A1656: 1655 | B1656: 2010 | C1656: 55 | D1656: 张志祥 | E1656: 104 | F1656: 男 | G1656: =INT(RC[1]/10)*10 -> 40 | H1656: 43 | I1656: 北京建龙重工集团 | J1656: 北京 | K1656: 北京 | L1656: 钢铁、造船、资源开采
A1657: 1656 | B1657: 2010 | C1657: 56 | D1657: 雷菊芳 | E1657: 103.5 | F1657: 女 | G1657: =INT(RC[1]/10)*10 -> 50 | H1657: 57 | I1657: 奇正集团 | J1657: 甘肃 | K1657: 兰州 | L1657: 医药
A1658: 1657 | B1658: 2010 | C1658: 57 | D1658: 安康 | E1658: 103 | F1658: 男 | G1658: =INT(RC[1]/10)*10 -> 60 | H1658: 61 | I1658: 华兰生物 | J1658: 河南 | K1658: 新乡 | L1658: 生物医药
A1659: 1658 | B1659: 2010 | C1659: 58 | D1659: 史玉柱 | E1659: 102 | F1659: 男 | G1659: =INT(RC[1]/10)*10 -> 40 | H1659: 48 | I1659: 巨人集团 | J1659: 上海 | K1659: 上海 | L1659: 保健品、网络游戏、投资
A1660: 1659 | B1660: 2010 | C1660: 59 | D1660: 龚虹嘉夫妇 | E1660: 100 | F1660: 男 | G1660: =INT(RC[1]/10)*10 -> 40 | H1660: 45 | I1660: 海康威视 | J1660: 香港 | K1660: 香港 | L1660: 电子产品制造
A1661: 1660 | B1661: 2010 | C1661: 60 | D1661: 马兴田家族 | E1661: 97 | F1661: 男 | G1661: =INT(RC[1]/10)*10 -> 40 | H1661: 41 | I1661: 康美药业 | J1661: 广东 | K1661: 普宁 | L1661: 医药
A1662: 1661 | B1662: 2010 | C1662: 61 | D1662: 朱保国家族 | E1662: 95.5 | F1662: 男 | G1662: =INT(RC[1]/10)*10 -> 40 | H1662: 48 | I1662: 健康元药业 | J1662: 广东 | K1662: 深圳 | L1662: 医药、保健品
A1663: 1662 | B1663: 2010 | C1663: 62 | D1663: 蒋仁生父子 | E1663: 95 | F1663: 男 | G1663: =INT(RC[1]/10)*10 -> 50 | H1663: 57 | I1663: 重庆智飞生物 | J1663: 重庆 | K1663: 重庆 | L1663: 生物制药
A1664: 1663 | B1664: 2010 | C1664: 63 | D1664: 李振江 | E1664: 93 | F1664: 男 | G1664: =INT(RC[1]/10)*10 -> 50 | H1664: 54 | I1664: 神威药业 | J1664: 河北 | K1664: 石家庄 | L1664: 医药
A1665: 1664 | B1665: 2010 | C1665: 63 | D1665: 王水福 | E1665: 93 | F1665: 男 | G1665: =INT(RC[1]/10)*10 -> 50 | H1665: 55 | I1665: 西子联合控股 | J1665: 浙江 | K1665: 杭州 | L1665: 电梯、装备制造、房地产
A1666: 1665 | B1666: 2010 | C1666: 65 | D1666: 丁欣欣夫妇 | E1666: 92.5 | F1666: 男 | G1666: =INT(RC[1]/10)*10 -> 50 | H1666: 52 | I1666: 浙江亚厦装饰 | J1666: 浙江 | K1666: 上虞 | L1666: 装修装饰
A1667: 1666 | B1667: 2010 | C1667: 66 | D1667: 潘政民夫妇 | E1667: 92 | F1667: 男 | G1667: =INT(RC[1]/10)*10 -> 40 | H1667: 41 | I1667: AAC声学科技 | J1667: 广东 | K1667: 深圳 | L1667: 声学器材
A1668: 1667 | B1668: 2010 | C1668: 67 | D1668: 张成飞 | E1668: 91.5 | F1668: 男 | G1668: =INT(RC[1]/10)*10 -> 40 | H1668: 40 | I1668: 玖龙纸业 | J1668: 广东 | K1668: 东莞 | L1668: 造纸
A1669: 1668 | B1669: 2010 | C1669: 68 | D1669: 刘志强夫妇 | E1669: 91 | F1669: 男 | G1669: =INT(RC[1]/10)*10 -> 40 | H1669: 46 | I1669: 广东香江集团 | J1669: 广东 | K1669: 广州 | L1669: 房地产、家居流通、能源、金融
A1670: 1669 | B1670: 2010 | C1670: 69 | D1670: 徐镜人父子 | E1670: 90 | F1670: 男 | G1670: =INT(RC[1]/10)*10 -> 60 | H1670: 66 | I1670: 扬子江药业 | J1670: 江苏 | K1670: 泰州 | L1670: 医药
A1671: 1670 | B1671: 2010 | C1671: 70 | D1671: 张中能 | E1671: 89 | F1671: 男 | G1671: =INT(RC[1]/10)*10 -> 40 | H1671: 47 | I1671: 东阳光集团 | J1671: 广东 | K1671: 深圳 | L1671: 铝电解电容器、医药、煤炭
A1672: 1671 | B1672: 2010 | C1672: 70 | D1672: 丁志忠 | E1672: 89 | F1672: 男 | G1672: =INT(RC[1]/10)*10 -> 30 | H1672: 39 | I1672: 安踏 | J1672: 福建 | K1672: 泉州 | L1672: 运动服饰及体育用品
A1673: 1672 | B1673: 2010 | C1673: 72 | D1673: 童锦泉 | E1673: 88.5 | F1673: 男 | G1673: =INT(RC[1]/10)*10 -> 50 | H1673: 55 | I1673: 长峰房地产 | J1673: 上海 | K1673: 上海 | L1673: 房地产
A1674: 1673 | B1674: 2010 | C1674: 72 | D1674: 王玉锁夫妇 | E1674: 88.5 | F1674: 男 | G1674: =INT(RC[1]/10)*10 -> 40 | H1674: 46 | I1674: 新奥集团 | J1674: 河北 | K1674: 廊坊 | L1674: 能源、房地产
A1675: 1674 | B1675: 2010 | C1675: 74 | D1675: 李洪信家族 | E1675: 88 | F1675: 男 | G1675: =INT(RC[1]/10)*10 -> 50 | H1675: 57 | I1675: 太阳纸业 | J1675: 山东 | K1675: 兖州 | L1675: 造纸
A1676: 1675 | B1676: 2010 | C1676: 75 | D1676: 何金明家族 | E1676: 87 | F1676: 男 | G1676: =INT(RC[1]/10)*10 -> 50 | H1676: 58 | I1676: 人人乐商业集团 | J1676: 广东 | K1676: 深圳 | L1676: 零售
A1677: 1676 | B1677: 2010 | C1677: 76 | D1677: 梁庆德父子 | E1677: 86.5 | F1677: 男 | G1677: =INT(RC[1]/10)*10 -> 70 | H1677: 73 | I1677: 格兰仕 | J1677: 广东 | K1677: 佛山 | L1677: 日用电器制造
A1678: 1677 | B1678: 2010 | C1678: 76 | D1678: 黄如论 | E1678: 86.5 | F1678: 男 | G1678: =INT(RC[1]/10)*10 -> 50 | H1678: 59 | I1678: 世纪金源集团 | J1678: 北京 | K1678: 北京 | L1678: 房地产、投资
A1679: 1678 | B1679: 2010 | C1679: 76 | D1679: 丁世家 | E1679: 86.5 | F1679: 男 | G1679: =INT(RC[1]/10)*10 -> 40 | H1679: 46 | I1679: 安踏 | J1679: 福建 | K1679: 泉州 | L1679: 运动服饰及体育用品
A1680: 1679 | B1680: 2010 | C1680: 79 | D1680: 鲜扬 | E1680: 85 | F1680: 男 | G1680: =INT(RC[1]/10)*10 -> 30 | H1680: 36 | I1680: 恒鼎实业 | J1680: 四川 | K1680: 攀枝花 | L1680: 煤炭
A1681: 1680 | B1681: 2010 | C1681: 80 | D1681: 谢炳 | E1681: 84 | F1681: 男 | G1681: =INT(RC[1]/10)*10 -> 50 | H1681: 58 | I1681: 中国生物制药 | J1681: 香港 | K1681: 香港 | L1681: 医药
A1682: 1681 | B1682: 2010 | C1682: 80 | D1682: 戚金兴父子 | E1682: 84 | F1682: 男 | G1682: =INT(RC[1]/10)*10 -> 40 | H1682: 48 | I1682: 杭州滨江房产集团 | J1682: 浙江 | K1682: 杭州 | L1682: 房地产
A1683: 1682 | B1683: 2010 | C1683: 82 | D1683: 邵根伙 | E1683: 83.5 | F1683: 男 | G1683: =INT(RC[1]/10)*10 -> 40 | H1683: 45 | I1683: 北京大北农科技集团 | J1683: 北京 | K1683: 北京 | L1683: 饲料及粮食
A1684: 1683 | B1684: 2010 | C1684: 83 | D1684: 陈金霞 | E1684: 83 | F1684: 女 | G1684: =INT(RC[1]/10)*10 -> 40 | H1684: 42 | I1684: 涌金集团 | J1684: 上海 | K1684: 上海 | L1684: 金融投资、医药
A1685: 1684 | B1685: 2010 | C1685: 84 | D1685: 黄联禧 | E1685: 81.5 | F1685: 男 | G1685: =INT(RC[1]/10)*10 -> 40 | H1685: 48 | I1685: 中国联塑集团 | J1685: 香港 | K1685: 香港 | L1685: 塑料制造
A1686: 1685 | B1686: 2010 | C1686: 84 | D1686: 方威 | E1686: 81.5 | F1686: 男 | G1686: =INT(RC[1]/10)*10 -> 30 | H1686: 37 | I1686: 辽宁方大集团 | J1686: 辽宁 | K1686: 抚顺 | L1686: 石墨碳素、钢铁
A1687: 1686 | B1687: 2010 | C1687: 86 | D1687: 于泳 | E1687: 80 | F1687: 男 | G1687: / | H1687: / | I1687: 上海鸿商产业控股集团 | J1687: 上海 | K1687: 上海 | L1687: 投资
A1688: 1687 | B1688: 2010 | C1688: 86 | D1688: 庞庆华 | E1688: 80 | F1688: 男 | G1688: / | H1688: / | I1688: 庞大汽贸集团 | J1688: 河北 | K1688: 唐山 | L1688: 汽车销售服务
A1689: 1688 | B1689: 2010 | C1689: 86 | D1689: 姚巨货家族 | E1689: 80 | F1689: 男 | G1689: =INT(RC[1]/10)*10 -> 70 | H1689: 79 | I1689: 美锦集团 | J1689: 山西 | K1689: 太原 | L1689: 煤炭、房地产
A1690: 1689 | B1690: 2010 | C1690: 86 | D1690: 袁凯飞 | E1690: 80 | F1690: 男 | G1690: =INT(RC[1]/10)*10 -> 50 | H1690: 57 | I1690: 江苏新世纪造船 | J1690: 江苏 | K1690: 靖江 | L1690: 造船
A1691: 1690 | B1691: 2010 | C1691: 86 | D1691: 陈卓林夫妇 | E1691: 80 | F1691: 男 | G1691: =INT(RC[1]/10)*10 -> 40 | H1691: 48 | I1691: 雅居乐地产 | J1691: 广东 | K1691: 中山 | L1691: 房地产
A1692: 1691 | B1692: 2010 | C1692: 91 | D1692: 张桂平父子 | E1692: 79.5 | F1692: 男 | G1692: =INT(RC[1]/10)*10 -> 50 | H1692: 59 | I1692: 苏宁环球集团 | J1692: 江苏 | K1692: 南京 | L1692: 房地产
A1693: 1692 | B1693: 2010 | C1693: 92 | D1693: 马云 | E1693: 79 | F1693: 男 | G1693: =INT(RC[1]/10)*10 -> 40 | H1693: 46 | I1693: 阿里巴巴 | J1693: 浙江 | K1693: 杭州 | L1693: 电子商务、网上零售及支付
A1694: 1693 | B1694: 2010 | C1694: 93 | D1694: 傅光明家族 | E1694: 78 | F1694: 男 | G1694: =INT(RC[1]/10)*10 -> 50 | H1694: 57 | I1694: 圣农实业 | J1694: 福建 | K1694: 南平 | L1694: 家禽饲养加工
A1695: 1694 | B1695: 2010 | C1695: 94 | D1695: 吴建龙 | E1695: 77.5 | F1695: 男 | G1695: =INT(RC[1]/10)*10 -> 40 | H1695: 43 | I1695: 浙江向日葵光能科技 | J1695: 浙江 | K1695: 绍兴 | L1695: 太阳能
A1696: 1695 | B1696: 2010 | C1696: 94 | D1696: 陈丽华家族 | E1696: 77.5 | F1696: 女 | G1696: =INT(RC[1]/10)*10 -> 60 | H1696: 69 | I1696: 富华集团 | J1696: 北京 | K1696: 北京 | L1696: 房地产
A1697: 1696 | B1697: 2010 | C1697: 96 | D1697: 宋作文家族 | E1697: 77 | F1697: 男 | G1697: =INT(RC[1]/10)*10 -> 60 | H1697: 63 | I1697: 山东南山集团 | J1697: 山东 | K1697: 龙口 | L1697: 铝业、建筑、服饰
A1698: 1697 | B1698: 2010 | C1698: 96 | D1698: 李宁 | E1698: 77 | F1698: 男 | G1698: =INT(RC[1]/10)*10 -> 40 | H1698: 47 | I1698: 李宁公司 | J1698: 北京 | K1698: 北京 | L1698: 运动服饰及体育用品
A1699: 1698 | B1699: 2010 | C1699: 98 | D1699: 任正非 | E1699: 76 | F1699: 男 | G1699: =INT(RC[1]/10)*10 -> 60 | H1699: 66 | I1699: 华为技术 | J1699: 广东 | K1699: 深圳 | L1699: 通信
A1700: 1699 | B1700: 2010 | C1700: 98 | D1700: 王文京 | E1700: 76 | F1700: 男 | G1700: =INT(RC[1]/10)*10 -> 40 | H1700: 45 | I1700: 用友软件 | J1700: 北京 | K1700: 北京 | L1700: 软件
A1701: 1700 | B1701: 2010 | C1701: 100 | D1701: 林立 | E1701: 75 | F1701: 男 | G1701: =INT(RC[1]/10)*10 -> 40 | H1701: 47 | I1701: 深圳立业集团 | J1701: 广东 | K1701: 深圳 | L1701: 金融、投资
A1702: 1701 | B1702: 2010 | C1702: 101 | D1702: 孙飘扬 | E1702: 74 | F1702: 男 | G1702: =INT(RC[1]/10)*10 -> 50 | H1702: 52 | I1702: 恒瑞医药 | J1702: 江苏 | K1702: 连云港 | L1702: 医药
A1703: 1702 | B1703: 2010 | C1703: 101 | D1703: 姜滨夫妇 | E1703: 74 | F1703: 男 | G1703: =INT(RC[1]/10)*10 -> 40 | H1703: 44 | I1703: 歌尔声学 | J1703: 山东 | K1703: 潍坊 | L1703: 电声元器及产品
A1704: 1703 | B1704: 2010 | C1704: 103 | D1704: 陈启源夫妇 | E1704: 73 | F1704: 男 | G1704: =INT(RC[1]/10)*10 -> 40 | H1704: 48 | I1704: 霸王国际 | J1704: 广东 | K1704: 广州 | L1704: 日化用品
A1705: 1704 | B1705: 2010 | C1705: 103 | D1705: 黄文仔 | E1705: 73 | F1705: 男 | G1705: =INT(RC[1]/10)*10 -> 50 | H1705: 57 | I1705: 星河湾地产 | J1705: 广东 | K1705: 广州 | L1705: 房地产
A1706: 1705 | B1706: 2010 | C1706: 103 | D1706: 魏建军 | E1706: 73 | F1706: 男 | G1706: =INT(RC[1]/10)*10 -> 40 | H1706: 47 | I1706: 长城汽车 | J1706: 河北 | K1706: 保定 | L1706: 汽车
A1707: 1706 | B1707: 2010 | C1707: 103 | D1707: 修涞贵 | E1707: 73 | F1707: 男 | G1707: =INT(RC[1]/10)*10 -> 50 | H1707: 55 | I1707: 修正药业集团 | J1707: 吉林 | K1707: 通化 | L1707: 医药
A1708: 1707 | B1708: 2010 | C1708: 107 | D1708: 李国强 | E1708: 72.5 | F1708: 男 | G1708: =INT(RC[1]/10)*10 -> 40 | H1708: 46 | I1708: 中升集团 | J1708: 辽宁 | K1708: 大连 | L1708: 汽车销售服务
A1709: 1708 | B1709: 2010 | C1709: 108 | D1709: 刘革新 | E1709: 72 | F1709: 男 | G1709: =INT(RC[1]/10)*10 -> 50 | H1709: 59 | I1709: 四川科伦药业 | J1709: 四川 | K1709: 成都 | L1709: 医药
A1710: 1709 | B1710: 2010 | C1710: 109 | D1710: 张宏伟 | E1710: 71.5 | F1710: 男 | G1710: =INT(RC[1]/10)*10 -> 50 | H1710: 55 | I1710: 北京东方集团 | J1710: 北京 | K1710: 北京 | L1710: 家居连锁、金融、矿业、港口
A1711: 1710 | B1711: 2010 | C1711: 109 | D1711: 黄晞家族 | E1711: 71.5 | F1711: 女 | G1711: =INT(RC[1]/10)*10 -> 40 | H1711: 48 | I1711: 福信集团 | J1711: 福建 | K1711: 厦门 | L1711: 房地产、投资
A1712: 1711 | B1712: 2010 | C1712: 109 | D1712: 陈天桥夫妇 | E1712: 71.5 | F1712: 男 | G1712: =INT(RC[1]/10)*10 -> 30 | H1712: 37 | I1712: 盛大网络 | J1712: 上海 | K1712: 上海 | L1712: 网络游戏等
A1713: 1712 | B1713: 2010 | C1713: 109 | D1713: 许景南家族 | E1713: 71.5 | F1713: 男 | G1713: =INT(RC[1]/10)*10 -> 50 | H1713: 55 | I1713: 匹克集团 | J1713: 福建 | K1713: 泉州 | L1713: 运动服饰及体育用品
A1714: 1713 | B1714: 2010 | C1714: 113 | D1714: 张文中 | E1714: 71 | F1714: 男 | G1714: =INT(RC[1]/10)*10 -> 40 | H1714: 48 | I1714: 物美集团 | J1714: 北京 | K1714: 北京 | L1714: 零售、投资
A1715: 1714 | B1715: 2010 | C1715: 113 | D1715: 孔健岷 | E1715: 71 | F1715: 男 | G1715: =INT(RC[1]/10)*10 -> 40 | H1715: 42 | I1715: 合景泰富 | J1715: 广东 | K1715: 广州 | L1715: 房地产
A1716: 1715 | B1716: 2010 | C1716: 113 | D1716: 吴光明父子 | E1716: 71 | F1716: 男 | G1716: =INT(RC[1]/10)*10 -> 40 | H1716: 48 | I1716: 江苏鱼跃医疗设备 | J1716: 江苏 | K1716: 丹阳 | L1716: 医疗器械
A1717: 1716 | B1717: 2010 | C1717: 116 | D1717: 昝圣达 | E1717: 70 | F1717: 男 | G1717: =INT(RC[1]/10)*10 -> 40 | H1717: 47 | I1717: 综艺集团 | J1717: 江苏 | K1717: 南通 | L1717: 太阳能、投资
A1718: 1717 | B1718: 2010 | C1718: 116 | D1718: 梁信军 | E1718: 70 | F1718: 男 | G1718: =INT(RC[1]/10)*10 -> 40 | H1718: 42 | I1718: 复星国际 | J1718: 上海 | K1718: 上海 | L1718: 钢铁、房地产、医药、零售、金融
A1719: 1718 | B1719: 2010 | C1719: 116 | D1719: 朱兴良 | E1719: 70 | F1719: 男 | G1719: =INT(RC[1]/10)*10 -> 50 | H1719: 51 | I1719: 苏州金螳螂 | J1719: 江苏 | K1719: 苏州 | L1719: 装修装饰
A1720: 1719 | B1720: 2010 | C1720: 119 | D1720: 顾伟 | E1720: 69 | F1720: 男 | G1720: =INT(RC[1]/10)*10 -> 40 | H1720: 45 | I1720: 深圳兆驰股份 | J1720: 广东 | K1720: 深圳 | L1720: 数字影音设备制造
A1721: 1720 | B1721: 2010 | C1721: 120 | D1721: 车冯升 | E1721: 68.5 | F1721: 男 | G1721: =INT(RC[1]/10)*10 -> 40 | H1721: 47 | I1721: 四环医药控股集团 | J1721: 海南 | K1721: 海口 | L1721: 医药
A1722: 1721 | B1722: 2010 | C1722: 120 | D1722: 李登海 | E1722: 68.5 | F1722: 男 | G1722: =INT(RC[1]/10)*10 -> 60 | H1722: 61 | I1722: 山东登海种业 | J1722: 山东 | K1722: 莱州 | L1722: 农业
A1723: 1722 | B1723: 2010 | C1723: 120 | D1723: 柯希平夫妇 | E1723: 68.5 | F1723: 男 | G1723: =INT(RC[1]/10)*10 -> 50 | H1723: 50 | I1723: 恒兴实业 | J1723: 福建 | K1723: 厦门 | L1723: 房地产、投资
A1724: 1723 | B1724: 2010 | C1724: 123 | D1724: 叶远西父子 | E1724: 67 | F1724: 男 | G1724: =INT(RC[1]/10)*10 -> 40 | H1724: 47 | I1724: 深圳广田装饰集团 | J1724: 广东 | K1724: 深圳 | L1724: 装修装饰
A1725: 1724 | B1725: 2010 | C1725: 123 | D1725: 陈建强 | E1725: 67 | F1725: 男 | G1725: =INT(RC[1]/10)*10 -> 50 | H1725: 52 | I1725: 华地国际 | J1725: 香港 | K1725: 香港 | L1725: 零售
A1726: 1725 | B1726: 2010 | C1726: 125 | D1726: 陈金凤 | E1726: 66.5 | F1726: 女 | G1726: =INT(RC[1]/10)*10 -> 40 | H1726: 47 | I1726: 苏宁电器 | J1726: 江苏 | K1726: 南京 | L1726: 家电零售
A1727: 1726 | B1727: 2010 | C1727: 125 | D1727: 韩国龙家族 | E1727: 66.5 | F1727: 男 | G1727: =INT(RC[1]/10)*10 -> 50 | H1727: 55 | I1727: 香港冠城集团 | J1727: 福建 | K1727: 福州 | L1727: 房地产
A1728: 1727 | B1728: 2010 | C1728: 125 | D1728: 李华 | E1728: 66.5 | F1728: 男 | G1728: =INT(RC[1]/10)*10 -> 40 | H1728: 44 | I1728: 卓越集团 | J1728: 广东 | K1728: 深圳 | L1728: 房地产
A1729: 1728 | B1729: 2010 | C1729: 125 | D1729: 荣智健 | E1729: 66.5 | F1729: 男 | G1729: =INT(RC[1]/10)*10 -> 60 | H1729: 68 | I1729: 中信泰富 | J1729: 香港 | K1729: 香港 | L1729: 投资
A1730: 1729 | B1730: 2010 | C1730: 129 | D1730: 刘沧龙 | E1730: 65.5 | F1730: 男 | G1730: =INT(RC[1]/10)*10 -> 50 | H1730: 55 | I1730: 四川宏达集团 | J1730: 四川 | K1730: 成都 | L1730: 冶金、矿业、化工、房地产、金融
A1731: 1730 | B1731: 2010 | C1731: 129 | D1731: 刘晓萌 | E1731: 65.5 | F1731: 女 | G1731: =INT(RC[1]/10)*10 -> 50 | H1731: 55 | I1731: 苏宁电器 | J1731: 江苏 | K1731: 南京 | L1731: 家电零售
A1732: 1731 | B1732: 2010 | C1732: 131 | D1732: 霍庆华 | E1732: 65 | F1732: 男 | G1732: =INT(RC[1]/10)*10 -> 40 | H1732: 49 | I1732: 中国庆华集团 | J1732: 内蒙古 | K1732: 阿拉善 | L1732: 煤炭、化工
A1733: 1732 | B1733: 2010 | C1733: 132 | D1733: 阙文彬夫妇 | E1733: 64.5 | F1733: 男 | G1733: =INT(RC[1]/10)*10 -> 40 | H1733: 47 | I1733: 独一味 /西部资源 | J1733: 四川 | K1733: 成都 | L1733: 医药、矿业
A1734: 1733 | B1734: 2010 | C1734: 133 | D1734: 潘慰 | E1734: 64 | F1734: 女 | G1734: =INT(RC[1]/10)*10 -> 50 | H1734: 54 | I1734: 味千拉面 | J1734: 上海 | K1734: 上海 | L1734: 餐饮
A1735: 1734 | B1735: 2010 | C1735: 134 | D1735: 俞敏洪 | E1735: 63.5 | F1735: 男 | G1735: =INT(RC[1]/10)*10 -> 40 | H1735: 48 | I1735: 新东方教育 | J1735: 北京 | K1735: 北京 | L1735: 教育
A1736: 1735 | B1736: 2010 | C1736: 134 | D1736: 文一波夫妇 | E1736: 63.5 | F1736: 男 | G1736: =INT(RC[1]/10)*10 -> 40 | H1736: 45 | I1736: 桑德集团 | J1736: 北京 | K1736: 北京 | L1736: 环保产业
A1737: 1736 | B1737: 2010 | C1737: 134 | D1737: 倪召兴家族 | E1737: 63.5 | F1737: 男 | G1737: =INT(RC[1]/10)*10 -> 50 | H1737: 54 | I1737: 中融集团 | J1737: 上海 | K1737: 上海 | L1737: 房地产、能源
A1738: 1737 | B1738: 2010 | C1738: 137 | D1738: 任元林 | E1738: 63 | F1738: 男 | G1738: =INT(RC[1]/10)*10 -> 50 | H1738: 56 | I1738: 扬子江造船 | J1738: 江苏 | K1738: 江阴 | L1738: 造船
A1739: 1738 | B1739: 2010 | C1739: 137 | D1739: 孟庆南家族 | E1739: 63 | F1739: 男 | G1739: =INT(RC[1]/10)*10 -> 50 | H1739: 52 | I1739: 武汉凡谷 | J1739: 湖北 | K1739: 武汉 | L1739: 移动通信设备元件
A1740: 1739 | B1740: 2010 | C1740: 137 | D1740: 黄俊康夫妇 | E1740: 63 | F1740: 男 | G1740: =INT(RC[1]/10)*10 -> 50 | H1740: 55 | I1740: 莱蒙鹏源 | J1740: 香港 | K1740: 香港 | L1740: 房地产、零售
A1741: 1740 | B1741: 2010 | C1741: 140 | D1741: 张克强 | E1741: 62.5 | F1741: 男 | G1741: =INT(RC[1]/10)*10 -> 50 | H1741: 50 | I1741: 广东华美国际投资集团 | J1741: 广东 | K1741: 广州 | L1741: 教育、投资
A1742: 1741 | B1742: 2010 | C1742: 141 | D1742: 朱孟依 | E1742: 62 | F1742: 男 | G1742: =INT(RC[1]/10)*10 -> 50 | H1742: 51 | I1742: 合生创展 | J1742: 广东 | K1742: 广州 | L1742: 房地产
A1743: 1742 | B1743: 2010 | C1743: 142 | D1743: 夏佐全 | E1743: 61.5 | F1743: 男 | G1743: =INT(RC[1]/10)*10 -> 40 | H1743: 48 | I1743: 比亚迪 | J1743: 广东 | K1743: 深圳 | L1743: 电池、汽车、新能源
A1744: 1743 | B1744: 2010 | C1744: 143 | D1744: 周亚仙夫妇 | E1744: 61 | F1744: 女 | G1744: =INT(RC[1]/10)*10 -> 50 | H1744: 50 | I1744: 神冠控股 | J1744: 广西 | K1744: 梧州 | L1744: 食品
A1745: 1744 | B1745: 2010 | C1745: 144 | D1745: 黄立 | E1745: 60.7 | F1745: 男 | G1745: =INT(RC[1]/10)*10 -> 40 | H1745: 47 | I1745: 武汉高德红外 | J1745: 湖北 | K1745: 武汉 | L1745: 电子设备制造
A1746: 1745 | B1746: 2010 | C1746: 144 | D1746: 唐修国 | E1746: 60.7 | F1746: 男 | G1746: =INT(RC[1]/10)*10 -> 40 | H1746: 47 | I1746: 三一集团 | J1746: 湖南 | K1746: 长沙 | L1746: 机械装备制造
A1747: 1746 | B1747: 2010 | C1747: 146 | D1747: 牛宜顺家族 | E1747: 60.5 | F1747: 男 | G1747: =INT(RC[1]/10)*10 -> 50 | H1747: 55 | I1747: 华勤橡胶工业集团 | J1747: 山东 | K1747: 兖州 | L1747: 橡胶制造
A1748: 1747 | B1748: 2010 | C1748: 147 | D1748: 高彦明 | E1748: 60 | F1748: 男 | G1748: =INT(RC[1]/10)*10 -> 50 | H1748: 53 | I1748: 河北远洋运输集团 | J1748: 河北 | K1748: 秦皇岛 | L1748: 海运
A1749: 1748 | B1749: 2010 | C1749: 147 | D1749: 茹伯兴家族 | E1749: 60 | F1749: 男 | G1749: =INT(RC[1]/10)*10 -> 60 | H1749: 63 | I1749: 百兴集团 | J1749: 江苏 | K1749: 常州 | L1749: 制造、商贸、房地产、物流
A1750: 1749 | B1750: 2010 | C1750: 147 | D1750: 严彬 | E1750: 60 | F1750: 男 | G1750: =INT(RC[1]/10)*10 -> 50 | H1750: 56 | I1750: 华彬国际集团 | J1750: 北京 | K1750: 北京 | L1750: 房地产、体育产业、饮料、旅游、贸易
A1751: 1750 | B1751: 2010 | C1751: 147 | D1751: 赵步长父子 | E1751: 60 | F1751: 男 | G1751: =INT(RC[1]/10)*10 -> 60 | H1751: 67 | I1751: 步长集团 | J1751: 陕西 | K1751: 西安 | L1751: 医药
A1752: 1751 | B1752: 2010 | C1752: 147 | D1752: 马建荣 | E1752: 60 | F1752: 男 | G1752: =INT(RC[1]/10)*10 -> 40 | H1752: 46 | I1752: 申洲国际集团 | J1752: 浙江 | K1752: 宁波 | L1752: 纺织、服装
A1753: 1752 | B1753: 2010 | C1753: 147 | D1753: 周泽荣 | E1753: 60 | F1753: 男 | G1753: =INT(RC[1]/10)*10 -> 50 | H1753: 56 | I1753: 侨鑫集团 | J1753: 广东 | K1753: 广州 | L1753: 房地产、餐饮、媒体
A1754: 1753 | B1754: 2010 | C1754: 147 | D1754: 车建新 | E1754: 60 | F1754: 男 | G1754: =INT(RC[1]/10)*10 -> 40 | H1754: 46 | I1754: 红星美凯龙 | J1754: 上海 | K1754: 上海 | L1754: 商业地产、家居流通
A1755: 1754 | B1755: 2010 | C1755: 147 | D1755: 何著胜家族 | E1755: 60 | F1755: 男 | G1755: =INT(RC[1]/10)*10 -> 60 | H1755: 63 | I1755: 海城后英经贸集团 | J1755: 辽宁 | K1755: 海城 | L1755: 耐火材料、钢铁、大豆加工
A1756: 1755 | B1756: 2010 | C1756: 147 | D1756: 邱光和 | E1756: 60 | F1756: 男 | G1756: =INT(RC[1]/10)*10 -> 50 | H1756: 59 | I1756: 森马集团 | J1756: 浙江 | K1756: 温州 | L1756: 服装
A1757: 1756 | B1757: 2010 | C1757: 147 | D1757: 袁亚非 | E1757: 60 | F1757: 男 | G1757: =INT(RC[1]/10)*10 -> 40 | H1757: 47 | I1757: 三胞集团 | J1757: 江苏 | K1757: 南京 | L1757: 零售连锁、房地产、制造
A1758: 1757 | B1758: 2010 | C1758: 147 | D1758: 袁富根父子 | E1758: 60 | F1758: 男 | G1758: =INT(RC[1]/10)*10 -> 50 | H1758: 59 | I1758: 苏州东山精密制造 | J1758: 江苏 | K1758: 苏州 | L1758: 通信及半导体设备精密金属制造
A1759: 1758 | B1759: 2010 | C1759: 158 | D1759: 薛向东家族 | E1759: 59.5 | F1759: 男 | G1759: =INT(RC[1]/10)*10 -> 50 | H1759: 51 | I1759: 东华软件 | J1759: 北京 | K1759: 北京 | L1759: 计算机应用服务
A1760: 1759 | B1760: 2010 | C1760: 158 | D1760: 耿建明 | E1760: 59.5 | F1760: 男 | G1760: =INT(RC[1]/10)*10 -> 40 | H1760: 48 | I1760: 荣盛控股 | J1760: 河北 | K1760: 廊坊 | L1760: 房地产
A1761: 1760 | B1761: 2010 | C1761: 158 | D1761: 李仲初 | E1761: 59.5 | F1761: 男 | G1761: =INT(RC[1]/10)*10 -> 40 | H1761: 47 | I1761: 石基信息 | J1761: 北京 | K1761: 北京 | L1761: 计算机应用服务
A1762: 1761 | B1762: 2010 | C1762: 161 | D1762: 黄怒波 | E1762: 59 | F1762: 男 | G1762: =INT(RC[1]/10)*10 -> 50 | H1762: 54 | I1762: 中坤集团 | J1762: 北京 | K1762: 北京 | L1762: 房地产、旅游
A1763: 1762 | B1763: 2010 | C1763: 161 | D1763: 盛百椒 | E1763: 59 | F1763: 男 | G1763: =INT(RC[1]/10)*10 -> 50 | H1763: 58 | I1763: 百丽 | J1763: 广东 | K1763: 深圳 | L1763: 鞋业、零售
A1764: 1763 | B1764: 2010 | C1764: 161 | D1764: 张祥青夫妇 | E1764: 59 | F1764: 男 | G1764: =INT(RC[1]/10)*10 -> 40 | H1764: 41 | I1764: 荣程联合钢铁 | J1764: 天津 | K1764: 天津 | L1764: 钢铁
A1765: 1764 | B1765: 2010 | C1765: 164 | D1765: 刘汉元夫妇 | E1765: 58 | F1765: 男 | G1765: =INT(RC[1]/10)*10 -> 40 | H1765: 46 | I1765: 通威集团 | J1765: 四川 | K1765: 成都 | L1765: 饲料、房地产、太阳能
A1766: 1765 | B1766: 2010 | C1766: 164 | D1766: 王兴春 | E1766: 58 | F1766: 男 | G1766: =INT(RC[1]/10)*10 -> 40 | H1766: 46 | I1766: 永晖焦煤 | J1766: 新加坡 | K1766: 新加坡 | L1766: 炼焦、煤炭
A1767: 1766 | B1767: 2010 | C1767: 166 | D1767: 黄焕明 | E1767: 57.5 | F1767: 男 | G1767: =INT(RC[1]/10)*10 -> 40 | H1767: 47 | I1767: 厦门明发集团 | J1767: 福建 | K1767: 厦门 | L1767: 房地产
A1768: 1767 | B1768: 2010 | C1768: 166 | D1768: 朱吉满夫妇 | E1768: 57.5 | F1768: 男 | G1768: =INT(RC[1]/10)*10 -> 40 | H1768: 46 | I1768: 哈尔滨誉衡药业 | J1768: 黑龙江 | K1768: 哈尔滨 | L1768: 医药
A1769: 1768 | B1769: 2010 | C1769: 168 | D1769: 毛中吾 | E1769: 57 | F1769: 男 | G1769: =INT(RC[1]/10)*10 -> 40 | H1769: 48 | I1769: 三一集团 | J1769: 湖南 | K1769: 长沙 | L1769: 机械装备制造
A1770: 1769 | B1770: 2010 | C1770: 168 | D1770: 李勤夫 | E1770: 57 | F1770: 男 | G1770: =INT(RC[1]/10)*10 -> 40 | H1770: 48 | I1770: 九龙山股份 | J1770: 上海 | K1770: 上海 | L1770: 房地产
A1771: 1770 | B1771: 2010 | C1771: 170 | D1771: 彭小峰 | E1771: 56 | F1771: 男 | G1771: =INT(RC[1]/10)*10 -> 30 | H1771: 35 | I1771: 江西赛维LDK太阳能 | J1771: 江西 | K1771: 新余 | L1771: 太阳能
A1772: 1771 | B1772: 2010 | C1772: 170 | D1772: 许健康家族 | E1772: 56 | F1772: 男 | G1772: =INT(RC[1]/10)*10 -> 50 | H1772: 58 | I1772: 宝龙集团 | J1772: 福建 | K1772: 厦门 | L1772: 房地产
A1773: 1772 | B1773: 2010 | C1773: 172 | D1773: 刘绍喜 | E1773: 55.7 | F1773: 男 | G1773: =INT(RC[1]/10)*10 -> 40 | H1773: 47 | I1773: 宜华企业集团 | J1773: 广东 | K1773: 汕头 | L1773: 木业、房地产
A1774: 1773 | B1774: 2010 | C1774: 173 | D1774: 南存辉 | E1774: 55.5 | F1774: 男 | G1774: =INT(RC[1]/10)*10 -> 40 | H1774: 47 | I1774: 正泰集团 | J1774: 浙江 | K1774: 乐清 | L1774: 输配电及控制设备制造
A1775: 1774 | B1775: 2010 | C1775: 173 | D1775: 向文波 | E1775: 55.5 | F1775: 男 | G1775: =INT(RC[1]/10)*10 -> 40 | H1775: 48 | I1775: 三一集团 | J1775: 湖南 | K1775: 长沙 | L1775: 机械装备制造
A1776: 1775 | B1776: 2010 | C1776: 175 | D1776: 丁水波 | E1776: 55 | F1776: 男 | G1776: =INT(RC[1]/10)*10 -> 40 | H1776: 40 | I1776: 特步 | J1776: 福建 | K1776: 泉州 | L1776: 运动服饰及体育用品
A1777: 1776 | B1777: 2010 | C1777: 176 | D1777: 阮水龙家族 | E1777: 54.7 | F1777: 男 | G1777: =INT(RC[1]/10)*10 -> 70 | H1777: 75 | I1777: 龙盛集团 | J1777: 浙江 | K1777: 上虞 | L1777: 纺织化学品
A1778: 1777 | B1778: 2010 | C1778: 177 | D1778: 苗连生 | E1778: 54.5 | F1778: 男 | G1778: =INT(RC[1]/10)*10 -> 50 | H1778: 53 | I1778: 天威英利新能源 | J1778: 河北 | K1778: 保定 | L1778: 太阳能
A1779: 1778 | B1779: 2010 | C1779: 178 | D1779: 袁志敏夫妇 | E1779: 54 | F1779: 男 | G1779: =INT(RC[1]/10)*10 -> 40 | H1779: 49 | I1779: 金发科技 | J1779: 广东 | K1779: 广州 | L1779: 塑料、投资
A1780: 1779 | B1780: 2010 | C1780: 178 | D1780: 苏萌 | E1780: 54 | F1780: 男 | G1780: / | H1780: / | I1780: 高德置地 | J1780: 广东 | K1780: 广州 | L1780: 房地产
A1781: 1780 | B1781: 2010 | C1781: 180 | D1781: 胡柏藩 | E1781: 53.7 | F1781: 男 | G1781: =INT(RC[1]/10)*10 -> 40 | H1781: 48 | I1781: 浙江新和成 | J1781: 浙江 | K1781: 绍兴 | L1781: 医药
A1782: 1781 | B1782: 2010 | C1782: 181 | D1782: 欧宗荣 | E1782: 53.5 | F1782: 男 | G1782: =INT(RC[1]/10)*10 -> 40 | H1782: 46 | I1782: 正荣集团 | J1782: 福建 | K1782: 福州 | L1782: 房地产
A1783: 1782 | B1783: 2010 | C1783: 181 | D1783: 易小迪 | E1783: 53.5 | F1783: 男 | G1783: =INT(RC[1]/10)*10 -> 40 | H1783: 46 | I1783: 阳光100 | J1783: 北京 | K1783: 北京 | L1783: 房地产
A1784: 1783 | B1784: 2010 | C1784: 183 | D1784: 鲁楚平 | E1784: 53 | F1784: 男 | G1784: =INT(RC[1]/10)*10 -> 40 | H1784: 45 | I1784: 中山大洋电机 | J1784: 广东 | K1784: 中山 | L1784: 微电机制造
A1785: 1784 | B1785: 2010 | C1785: 183 | D1785: 张瑜平 | E1785: 53 | F1785: 男 | G1785: =INT(RC[1]/10)*10 -> 50 | H1785: 50 | I1785: 新宇亨得利 | J1785: 广东 | K1785: 东莞 | L1785: 钟表连锁
A1786: 1785 | B1786: 2010 | C1786: 183 | D1786: 罗韶宇夫妇 | E1786: 53 | F1786: 男 | G1786: =INT(RC[1]/10)*10 -> 40 | H1786: 41 | I1786: 重庆东银集团 | J1786: 重庆 | K1786: 重庆 | L1786: 房地产、汽车、能源
A1787: 1786 | B1787: 2010 | C1787: 186 | D1787: 江南春 | E1787: 52.5 | F1787: 男 | G1787: =INT(RC[1]/10)*10 -> 30 | H1787: 37 | I1787: 分众传媒 | J1787: 上海 | K1787: 上海 | L1787: 数字户外传媒
A1788: 1787 | B1788: 2010 | C1788: 187 | D1788: 王久芳父子 | E1788: 52 | F1788: 男 | G1788: =INT(RC[1]/10)*10 -> 40 | H1788: 46 | I1788: 荣安地产 | J1788: 浙江 | K1788: 宁波 | L1788: 房地产
A1789: 1788 | B1789: 2010 | C1789: 187 | D1789: 熊续强 | E1789: 52 | F1789: 男 | G1789: =INT(RC[1]/10)*10 -> 50 | H1789: 54 | I1789: 宁波银亿集团 | J1789: 浙江 | K1789: 宁波 | L1789: 房地产、煤炭
A1790: 1789 | B1790: 2010 | C1790: 189 | D1790: 杨文龙夫妇 | E1790: 51.5 | F1790: 男 | G1790: =INT(RC[1]/10)*10 -> 40 | H1790: 48 | I1790: 仁和集团 | J1790: 江西 | K1790: 樟树 | L1790: 医药
A1791: 1790 | B1791: 2010 | C1791: 189 | D1791: 曲乃杰 | E1791: 51.5 | F1791: 男 | G1791: =INT(RC[1]/10)*10 -> 50 | H1791: 50 | I1791: 海昌集团 | J1791: 辽宁 | K1791: 大连 | L1791: 旅游、海运、石化
A1792: 1791 | B1792: 2010 | C1792: 191 | D1792: 戴志康 | E1792: 51 | F1792: 男 | G1792: =INT(RC[1]/10)*10 -> 40 | H1792: 46 | I1792: 证大集团 | J1792: 上海 | K1792: 上海 | L1792: 房地产、金融、能源
A1793: 1792 | B1793: 2010 | C1793: 192 | D1793: 李进 | E1793: 50.7 | F1793: 男 | G1793: =INT(RC[1]/10)*10 -> 40 | H1793: 47 | I1793: 李宁公司 | J1793: 北京 | K1793: 北京 | L1793: 运动服饰及体育用品
A1794: 1793 | B1794: 2010 | C1794: 192 | D1794: 李兆会 | E1794: 50.7 | F1794: 男 | G1794: =INT(RC[1]/10)*10 -> 20 | H1794: 29 | I1794: 海鑫实业 | J1794: 山西 | K1794: 运城 | L1794: 钢铁、金融
A1795: 1794 | B1795: 2010 | C1795: 194 | D1795: 康宝华 | E1795: 50.5 | F1795: 男 | G1795: / | H1795: / | I1795: 辽宁远大集团 | J1795: 辽宁 | K1795: 沈阳 | L1795: 建筑装饰、电梯、机电装备
A1796: 1795 | B1796: 2010 | C1796: 195 | D1796: 陈泽民家族 | E1796: 50 | F1796: 男 | G1796: =INT(RC[1]/10)*10 -> 60 | H1796: 67 | I1796: 三全食品 | J1796: 河南 | K1796: 郑州 | L1796: 速冻食品、餐饮连锁
A1797: 1796 | B1797: 2010 | C1797: 195 | D1797: 李德文 | E1797: 50 | F1797: 男 | G1797: =INT(RC[1]/10)*10 -> 60 | H1797: 60 | I1797: 金帝集团 | J1797: 福建 | K1797: 泉州 | L1797: 房地产、教育
A1798: 1797 | B1798: 2010 | C1798: 197 | D1798: 黄光裕 | E1798: 49.7 | F1798: 男 | G1798: =INT(RC[1]/10)*10 -> 40 | H1798: 41 | I1798: 鹏润投资 | J1798: 北京 | K1798: 北京 | L1798: 家电零售、房地产
A1799: 1798 | B1799: 2010 | C1799: 197 | D1799: 仇建平夫妇 | E1799: 49.7 | F1799: 男 | G1799: =INT(RC[1]/10)*10 -> 40 | H1799: 48 | I1799: 杭州巨星科技 | J1799: 浙江 | K1799: 杭州 | L1799: 工具制造
A1800: 1799 | B1800: 2010 | C1800: 199 | D1800: 张德生 | E1800: 49.5 | F1800: 男 | G1800: =INT(RC[1]/10)*10 -> 60 | H1800: 60 | I1800: 浙江万马电气电缆集团 | J1800: 浙江 | K1800: 杭州 | L1800: 输配电及控制设备制造
A1801: 1800 | B1801: 2010 | C1801: 199 | D1801: 陈五奎家族 | E1801: 49.5 | F1801: 男 | G1801: =INT(RC[1]/10)*10 -> 50 | H1801: 52 | I1801: 拓日新能源 | J1801: 广东 | K1801: 深圳 | L1801: 太阳能
A1802: 1801 | B1802: 2010 | C1802: 201 | D1802: 沈锦华 | E1802: 49 | F1802: 男 | G1802: =INT(RC[1]/10)*10 -> 40 | H1802: 43 | I1802: 焦点科技 | J1802: 江苏 | K1802: 南京 | L1802: 电子商务
A1803: 1802 | B1803: 2010 | C1803: 202 | D1803: 万连步 | E1803: 48.5 | F1803: 男 | G1803: =INT(RC[1]/10)*10 -> 40 | H1803: 45 | I1803: 山东金正大生态工程 | J1803: 山东 | K1803: 临沂 | L1803: 化肥
A1804: 1803 | B1804: 2010 | C1804: 202 | D1804: 施正荣 | E1804: 48.5 | F1804: 男 | G1804: =INT(RC[1]/10)*10 -> 40 | H1804: 47 | I1804: 尚德太阳能 | J1804: 江苏 | K1804: 无锡 | L1804: 太阳能
A1805: 1804 | B1805: 2010 | C1805: 204 | D1805: 左宗申家族 | E1805: 48 | F1805: 男 | G1805: =INT(RC[1]/10)*10 -> 50 | H1805: 58 | I1805: 宗申集团 | J1805: 重庆 | K1805: 重庆 | L1805: 摩托车
A1806: 1805 | B1806: 2010 | C1806: 204 | D1806: 刘益谦 | E1806: 48 | F1806: 男 | G1806: =INT(RC[1]/10)*10 -> 40 | H1806: 46 | I1806: 新理益集团 | J1806: 上海 | K1806: 上海 | L1806: 投资
A1807: 1806 | B1807: 2010 | C1807: 204 | D1807: 尹明善 | E1807: 48 | F1807: 男 | G1807: =INT(RC[1]/10)*10 -> 70 | H1807: 72 | I1807: 力帆集团 | J1807: 重庆 | K1807: 重庆 | L1807: 摩托车、汽车
A1808: 1807 | B1808: 2010 | C1808: 204 | D1808: 李国昌 | E1808: 48 | F1808: 男 | G1808: =INT(RC[1]/10)*10 -> 50 | H1808: 52 | I1808: 中国森林控股 | J1808: 北京 | K1808: 北京 | L1808: 林业
A1809: 1808 | B1809: 2010 | C1809: 208 | D1809: 邹节明家族 | E1809: 47.7 | F1809: 男 | G1809: =INT(RC[1]/10)*10 -> 60 | H1809: 67 | I1809: 桂林三金药业 | J1809: 广西 | K1809: 桂林 | L1809: 医药
A1810: 1809 | B1810: 2010 | C1810: 208 | D1810: 崔根良 | E1810: 47.7 | F1810: 男 | G1810: =INT(RC[1]/10)*10 -> 50 | H1810: 52 | I1810: 亨通集团 | J1810: 江苏 | K1810: 吴江 | L1810: 通信设备制造、金融、投资
A1811: 1810 | B1811: 2010 | C1811: 210 | D1811: 秦志威 | E1811: 47 | F1811: 男 | G1811: =INT(RC[1]/10)*10 -> 40 | H1811: 45 | I1811: 中金再生 | J1811: 香港 | K1811: 香港 | L1811: 金属回收
A1812: 1811 | B1812: 2010 | C1812: 210 | D1812: 季琦 | E1812: 47 | F1812: 男 | G1812: =INT(RC[1]/10)*10 -> 40 | H1812: 44 | I1812: 如家快捷酒店、汉庭连锁酒店 | J1812: 上海 | K1812: 上海 | L1812: 酒店连锁
A1813: 1812 | B1813: 2010 | C1813: 212 | D1813: 蒲忠杰夫妇 | E1813: 46.5 | F1813: 男 | G1813: =INT(RC[1]/10)*10 -> 40 | H1813: 47 | I1813: 乐普医疗 | J1813: 北京 | K1813: 北京 | L1813: 医疗器械
A1814: 1813 | B1814: 2010 | C1814: 212 | D1814: 钭正刚 | E1814: 46.5 | F1814: 男 | G1814: =INT(RC[1]/10)*10 -> 50 | H1814: 57 | I1814: 杭州锦江集团 | J1814: 浙江 | K1814: 杭州 | L1814: 环保能源、有色金属、建材
A1815: 1814 | B1815: 2010 | C1815: 212 | D1815: 梁光夫父子 | E1815: 46.5 | F1815: 男 | G1815: =INT(RC[1]/10)*10 -> 70 | H1815: 78 | I1815: 春和集团 | J1815: 浙江 | K1815: 宁波 | L1815: 造船
A1816: 1815 | B1816: 2010 | C1816: 215 | D1816: 张小明 | E1816: 46 | F1816: 男 | G1816: / | H1816: / | I1816: 深圳爱施德 | J1816: 广东 | K1816: 深圳 | L1816: 移动通讯产品销售服务
A1817: 1816 | B1817: 2010 | C1817: 215 | D1817: 陈锦石家族 | E1817: 46 | F1817: 男 | G1817: =INT(RC[1]/10)*10 -> 40 | H1817: 48 | I1817: 中南控股集团 | J1817: 江苏 | K1817: 南通 | L1817: 房地产、建筑施工
A1818: 1817 | B1818: 2010 | C1818: 215 | D1818: 傅利泉夫妇 | E1818: 46 | F1818: 男 | G1818: =INT(RC[1]/10)*10 -> 40 | H1818: 43 | I1818: 浙江大华技术 | J1818: 浙江 | K1818: 杭州 | L1818: 电子设备制造
A1819: 1818 | B1819: 2010 | C1819: 218 | D1819: 尤小平家族 | E1819: 45.7 | F1819: 男 | G1819: =INT(RC[1]/10)*10 -> 50 | H1819: 52 | I1819: 华峰集团 | J1819: 浙江 | K1819: 瑞安 | L1819: 化学纤维制造
A1820: 1819 | B1820: 2010 | C1820: 219 | D1820: 邓伟 | E1820: 45.5 | F1820: 男 | G1820: =INT(RC[1]/10)*10 -> 40 | H1820: 47 | I1820: 亿阳集团 | J1820: 北京 | K1820: 北京 | L1820: 计算机应用服务、交通、能源、投资
A1821: 1820 | B1821: 2010 | C1821: 219 | D1821: 王莺妹夫妇 | E1821: 45.5 | F1821: 女 | G1821: =INT(RC[1]/10)*10 -> 40 | H1821: 45 | I1821: 浙江永太科技 | J1821: 浙江 | K1821: 台州 | L1821: 化学
A1822: 1821 | B1822: 2010 | C1822: 219 | D1822: 陈邦 | E1822: 45.5 | F1822: 男 | G1822: =INT(RC[1]/10)*10 -> 40 | H1822: 45 | I1822: 爱尔眼科医院集团 | J1822: 湖南 | K1822: 长沙 | L1822: 卫生、保健、护理服务
A1823: 1822 | B1823: 2010 | C1823: 219 | D1823: 杜双华 | E1823: 45.5 | F1823: 男 | G1823: =INT(RC[1]/10)*10 -> 40 | H1823: 45 | I1823: 京华创新集团、日照钢铁 | J1823: 河北 | K1823: 衡水 | L1823: 钢铁
A1824: 1823 | B1824: 2010 | C1824: 223 | D1824: 孙尚传夫妇 | E1824: 45 | F1824: 男 | G1824: =INT(RC[1]/10)*10 -> 40 | H1824: 47 | I1824: 深圳大富科技 | J1824: 广东 | K1824: 深圳 | L1824: 移动通信设备
A1825: 1824 | B1825: 2010 | C1825: 223 | D1825: 陈光标 | E1825: 45 | F1825: 男 | G1825: =INT(RC[1]/10)*10 -> 40 | H1825: 42 | I1825: 江苏黄埔投资集团 | J1825: 江苏 | K1825: 南京 | L1825: 材料制造、再生资源利用
A1826: 1825 | B1826: 2010 | C1826: 223 | D1826: 高雪峰 | E1826: 45 | F1826: 男 | G1826: =INT(RC[1]/10)*10 -> 50 | H1826: 52 | I1826: 内蒙古鄂尔多斯市金诚泰化工 | J1826: 内蒙古 | K1826: 鄂尔多斯 | L1826: 化工
A1827: 1826 | B1827: 2010 | C1827: 223 | D1827: 缪汉根家族 | E1827: 45 | F1827: 男 | G1827: =INT(RC[1]/10)*10 -> 40 | H1827: 45 | I1827: 盛虹集团 | J1827: 江苏 | K1827: 吴江 | L1827: 化纤、印染、热电、房地产
A1828: 1827 | B1828: 2010 | C1828: 227 | D1828: 徐万茂 | E1828: 44.7 | F1828: 男 | G1828: =INT(RC[1]/10)*10 -> 60 | H1828: 65 | I1828: 宁波华茂 | J1828: 浙江 | K1828: 宁波 | L1828: 教育、金融
A1829: 1828 | B1829: 2010 | C1829: 228 | D1829: 楼忠福家族 | E1829: 44.5 | F1829: 男 | G1829: =INT(RC[1]/10)*10 -> 50 | H1829: 56 | I1829: 广厦集团 | J1829: 浙江 | K1829: 杭州 | L1829: 房地产、建筑施工
A1830: 1829 | B1830: 2010 | C1830: 229 | D1830: 刘丞霖 | E1830: 44 | F1830: 男 | G1830: / | H1830: / | I1830: 蒙古能源 | J1830: 香港 | K1830: 香港 | L1830: 能源、矿业
A1831: 1830 | B1831: 2010 | C1831: 229 | D1831: 郭浩 | E1831: 44 | F1831: 男 | G1831: =INT(RC[1]/10)*10 -> 50 | H1831: 59 | I1831: 超大农业 | J1831: 福建 | K1831: 福州 | L1831: 农业
A1832: 1831 | B1832: 2010 | C1832: 231 | D1832: 徐明家族 | E1832: 43.5 | F1832: 男 | G1832: =INT(RC[1]/10)*10 -> 30 | H1832: 39 | I1832: 大连实德集团 | J1832: 辽宁 | K1832: 大连 | L1832: 化工、建材、金融
A1833: 1832 | B1833: 2010 | C1833: 232 | D1833: 成清波 | E1833: 43 | F1833: 男 | G1833: =INT(RC[1]/10)*10 -> 40 | H1833: 48 | I1833: 深圳中技实业 | J1833: 广东 | K1833: 深圳 | L1833: 房地产、公用事业投资
A1834: 1833 | B1834: 2010 | C1834: 233 | D1834: 黄宏生 | E1834: 42.7 | F1834: 男 | G1834: =INT(RC[1]/10)*10 -> 50 | H1834: 54 | I1834: 创维集团 | J1834: 广东 | K1834: 深圳 | L1834: 日用电子器具制造
A1835: 1834 | B1835: 2010 | C1835: 234 | D1835: 牟金香 | E1835: 42.5 | F1835: 女 | G1835: =INT(RC[1]/10)*10 -> 50 | H1835: 56 | I1835: 联化科技 | J1835: 浙江 | K1835: 台州 | L1835: 精细化工
A1836: 1835 | B1836: 2010 | C1836: 234 | D1836: 宋卫平夫妇 | E1836: 42.5 | F1836: 男 | G1836: =INT(RC[1]/10)*10 -> 50 | H1836: 52 | I1836: 绿城集团 | J1836: 浙江 | K1836: 杭州 | L1836: 房地产
A1837: 1836 | B1837: 2010 | C1837: 236 | D1837: 杜厦 | E1837: 42 | F1837: 男 | G1837: =INT(RC[1]/10)*10 -> 60 | H1837: 63 | I1837: 天津家世界集团 | J1837: 天津 | K1837: 天津 | L1837: 投资
A1838: 1837 | B1838: 2010 | C1838: 236 | D1838: 杨雪岗夫妇 | E1838: 42 | F1838: 男 | G1838: =INT(RC[1]/10)*10 -> 40 | H1838: 45 | I1838: 旭阳煤化工集团 | J1838: 北京 | K1838: 北京 | L1838: 煤化工
A1839: 1838 | B1839: 2010 | C1839: 236 | D1839: 郑坚江 | E1839: 42 | F1839: 男 | G1839: =INT(RC[1]/10)*10 -> 40 | H1839: 48 | I1839: 奥克斯 | J1839: 浙江 | K1839: 宁波 | L1839: 日用电器制造、房地产
A1840: 1839 | B1840: 2010 | C1840: 239 | D1840: 林海峰家族 | E1840: 41.5 | F1840: 男 | G1840: =INT(RC[1]/10)*10 -> 30 | H1840: 35 | I1840: 东方日升新能源 | J1840: 浙江 | K1840: 宁波 | L1840: 太阳能
A1841: 1840 | B1841: 2010 | C1841: 239 | D1841: 梁衍锋家族 | E1841: 41.5 | F1841: 男 | G1841: =INT(RC[1]/10)*10 -> 40 | H1841: 45 | I1841: 中庚集团 | J1841: 福建 | K1841: 福州 | L1841: 房地产
A1842: 1841 | B1842: 2010 | C1842: 241 | D1842: 任宇 | E1842: 41 | F1842: 男 | G1842: / | H1842: / | I1842: 超越集团有限公司 | J1842: 香港 | K1842: 香港 | L1842: 水及空气净化设备、采矿
A1843: 1842 | B1843: 2010 | C1843: 242 | D1843: 邵建明 | E1843: 40.700000000000003 | F1843: 男 | G1843: =INT(RC[1]/10)*10 -> 40 | H1843: 47 | I1843: 广东海印集团 | J1843: 广东 | K1843: 广州 | L1843: 零售、房地产、高岭土
A1844: 1843 | B1844: 2010 | C1844: 242 | D1844: 许智明 | E1844: 40.700000000000003 | F1844: 男 | G1844: =INT(RC[1]/10)*10 -> 40 | H1844: 46 | I1844: 中联石油化工国际 | J1844: 香港 | K1844: 香港 | L1844: 石油、天然气、化工
A1845: 1844 | B1845: 2010 | C1845: 242 | D1845: 蔡东青 | E1845: 40.700000000000003 | F1845: 男 | G1845: =INT(RC[1]/10)*10 -> 40 | H1845: 41 | I1845: 广东奥飞动漫 | J1845: 广东 | K1845: 汕头 | L1845: 动漫
A1846: 1845 | B1846: 2010 | C1846: 245 | D1846: 苏增福父子 | E1846: 40.5 | F1846: 男 | G1846: =INT(RC[1]/10)*10 -> 60 | H1846: 69 | I1846: 苏泊尔集团 | J1846: 浙江 | K1846: 杭州 | L1846: 厨具、小家电
A1847: 1846 | B1847: 2010 | C1847: 245 | D1847: 许晓明 | E1847: 40.5 | F1847: 男 | G1847: =INT(RC[1]/10)*10 -> 40 | H1847: 47 | I1847: 武汉南国置业 | J1847: 湖北 | K1847: 武汉 | L1847: 房地产
A1848: 1847 | B1848: 2010 | C1848: 245 | D1848: 吴冠江 | E1848: 40.5 | F1848: 男 | G1848: =INT(RC[1]/10)*10 -> 40 | H1848: 41 | I1848: 重庆智飞生物 | J1848: 重庆 | K1848: 重庆 | L1848: 生物制药
A1849: 1848 | B1849: 2010 | C1849: 248 | D1849: 莫天全 | E1849: 40 | F1849: 男 | G1849: =INT(RC[1]/10)*10 -> 40 | H1849: 46 | I1849: 搜房 | J1849: 北京 | K1849: 北京 | L1849: 房地产服务
A1850: 1849 | B1850: 2010 | C1850: 248 | D1850: 沈南鹏 | E1850: 40 | F1850: 男 | G1850: =INT(RC[1]/10)*10 -> 40 | H1850: 43 | I1850: 红杉资本(中国) | J1850: 上海 | K1850: 上海 | L1850: 投资
A1851: 1850 | B1851: 2010 | C1851: 248 | D1851: 孙伟挺夫妇 | E1851: 40 | F1851: 男 | G1851: =INT(RC[1]/10)*10 -> 40 | H1851: 47 | I1851: 华孚色纺 | J1851: 广东 | K1851: 深圳 | L1851: 纺织
A1852: 1851 | B1852: 2010 | C1852: 248 | D1852: 高振东 | E1852: 40 | F1852: 男 | G1852: / | H1852: / | I1852: 苏州宝时得电动工具 | J1852: 江苏 | K1852: 苏州 | L1852: 工具制造
A1853: 1852 | B1853: 2010 | C1853: 248 | D1853: 贾廷亮夫妇 | E1853: 40 | F1853: 男 | G1853: =INT(RC[1]/10)*10 -> 50 | H1853: 54 | I1853: 大土河焦化 | J1853: 山西 | K1853: 吕梁 | L1853: 炼焦、煤炭
A1854: 1853 | B1854: 2010 | C1854: 248 | D1854: 李金元 | E1854: 40 | F1854: 男 | G1854: =INT(RC[1]/10)*10 -> 50 | H1854: 52 | I1854: 天狮集团 | J1854: 天津 | K1854: 天津 | L1854: 保健品
A1855: 1854 | B1855: 2010 | C1855: 248 | D1855: 金福音家族 | E1855: 40 | F1855: 男 | G1855: =INT(RC[1]/10)*10 -> 60 | H1855: 60 | I1855: 上海人民企业集团 | J1855: 上海 | K1855: 上海 | L1855: 输配电及控制设备制造
A1856: 1855 | B1856: 2010 | C1856: 248 | D1856: 刘建民夫妇 | E1856: 40 | F1856: 男 | G1856: =INT(RC[1]/10)*10 -> 50 | H1856: 57 | I1856: 甘肃建新实业集团 | J1856: 甘肃 | K1856: 兰州 | L1856: 有色金属
A1857: 1856 | B1857: 2010 | C1857: 248 | D1857: 缪寿良 | E1857: 40 | F1857: 男 | G1857: =INT(RC[1]/10)*10 -> 50 | H1857: 55 | I1857: 富源集团 | J1857: 广东 | K1857: 深圳 | L1857: 房地产
A1858: 1857 | B1858: 2010 | C1858: 248 | D1858: 杨休 | E1858: 40 | F1858: 男 | G1858: =INT(RC[1]/10)*10 -> 40 | H1858: 49 | I1858: 江苏天地集团 | J1858: 江苏 | K1858: 徐州 | L1858: 房地产、博物馆
A1859: 1858 | B1859: 2010 | C1859: 248 | D1859: 叶立培家族 | E1859: 40 | F1859: 男 | G1859: =INT(RC[1]/10)*10 -> 60 | H1859: 66 | I1859: 仲盛集团 | J1859: 上海 | K1859: 上海 | L1859: 房地产
A1860: 1859 | B1860: 2010 | C1860: 248 | D1860: 张宝全夫妇 | E1860: 40 | F1860: 男 | G1860: =INT(RC[1]/10)*10 -> 50 | H1860: 53 | I1860: 今典集团 | J1860: 北京 | K1860: 北京 | L1860: 房地产、文化
A1861: 1860 | B1861: 2010 | C1861: 248 | D1861: 陈福成 | E1861: 40 | F1861: 男 | G1861: =INT(RC[1]/10)*10 -> 30 | H1861: 38 | I1861: 松芝股份 | J1861: 上海 | K1861: 上海 | L1861: 交通运输设备制造
A1862: 1861 | B1862: 2010 | C1862: 261 | D1862: 王柏兴父子 | E1862: 39.700000000000003 | F1862: 男 | G1862: =INT(RC[1]/10)*10 -> 50 | H1862: 54 | I1862: 中利科技集团 | J1862: 江苏 | K1862: 常熟 | L1862: 特种电缆制造
A1863: 1862 | B1863: 2010 | C1863: 261 | D1863: 郑永刚 | E1863: 39.700000000000003 | F1863: 男 | G1863: =INT(RC[1]/10)*10 -> 50 | H1863: 51 | I1863: 杉杉投资控股 | J1863: 上海 | K1863: 上海 | L1863: 服装、新能源新材料、投资
A1864: 1863 | B1864: 2010 | C1864: 261 | D1864: 张继民 | E1864: 39.700000000000003 | F1864: 男 | G1864: / | H1864: / | I1864: 西部水泥 | J1864: 陕西 | K1864: 蒲城 | L1864: 水泥
A1865: 1864 | B1865: 2010 | C1865: 264 | D1865: 陈建成家族 | E1865: 39.5 | F1865: 男 | G1865: =INT(RC[1]/10)*10 -> 50 | H1865: 51 | I1865: 卧龙控股集团 | J1865: 浙江 | K1865: 上虞 | L1865: 制造、房地产、投资
A1866: 1865 | B1866: 2010 | C1866: 264 | D1866: 林来嵘 | E1866: 39.5 | F1866: 男 | G1866: =INT(RC[1]/10)*10 -> 40 | H1866: 42 | I1866: 内蒙古众兴集团 | J1866: 内蒙古 | K1866: 包头 | L1866: 铁矿、煤炭
A1867: 1866 | B1867: 2010 | C1867: 264 | D1867: 刘长乐 | E1867: 39.5 | F1867: 男 | G1867: =INT(RC[1]/10)*10 -> 50 | H1867: 59 | I1867: 凤凰卫视 | J1867: 香港 | K1867: 香港 | L1867: 媒体
A1868: 1867 | B1868: 2010 | C1868: 264 | D1868: 李学纯 | E1868: 39.5 | F1868: 男 | G1868: =INT(RC[1]/10)*10 -> 50 | H1868: 59 | I1868: 阜丰集团 | J1868: 山东 | K1868: 临沂 | L1868: 生物发酵产品
A1869: 1868 | B1869: 2010 | C1869: 264 | D1869: 徐锦鑫夫妇 | E1869: 39.5 | F1869: 男 | G1869: =INT(RC[1]/10)*10 -> 50 | H1869: 55 | I1869: 上海置信集团 | J1869: 上海 | K1869: 上海 | L1869: 输配电及控制设备制造
A1870: 1869 | B1870: 2010 | C1870: 264 | D1870: 冯海良 | E1870: 39.5 | F1870: 男 | G1870: =INT(RC[1]/10)*10 -> 50 | H1870: 50 | I1870: 海亮集团 | J1870: 浙江 | K1870: 诸暨 | L1870: 铜加工、房地产
A1871: 1870 | B1871: 2010 | C1871: 270 | D1871: 周国辉 | E1871: 39 | F1871: 男 | G1871: =INT(RC[1]/10)*10 -> 40 | H1871: 45 | I1871: 怡亚通物流 | J1871: 广东 | K1871: 深圳 | L1871: 物流
A1872: 1871 | B1872: 2010 | C1872: 270 | D1872: 刘满世 | E1872: 39 | F1872: 男 | G1872: =INT(RC[1]/10)*10 -> 60 | H1872: 61 | I1872: 内蒙古满世煤炭集团 | J1872: 内蒙古 | K1872: 鄂尔多斯 | L1872: 煤炭、化工、房地产
A1873: 1872 | B1873: 2010 | C1873: 270 | D1873: 吴岳明 | E1873: 39 | F1873: 男 | G1873: =INT(RC[1]/10)*10 -> 40 | H1873: 44 | I1873: 丰立集团 | J1873: 江苏 | K1873: 张家港 | L1873: 金属加工、港口、贸易
A1874: 1873 | B1874: 2010 | C1874: 273 | D1874: 杨龙忠 | E1874: 38.700000000000003 | F1874: 男 | G1874: =INT(RC[1]/10)*10 -> 40 | H1874: 46 | I1874: 比亚迪 | J1874: 广东 | K1874: 深圳 | L1874: 电池、汽车、新能源
A1875: 1874 | B1875: 2010 | C1875: 273 | D1875: 杨绍鹏 | E1875: 38.700000000000003 | F1875: 男 | G1875: =INT(RC[1]/10)*10 -> 50 | H1875: 52 | I1875: 海丰国际控股 | J1875: 山东 | K1875: 青岛 | L1875: 航运、物流
A1876: 1875 | B1876: 2010 | C1876: 273 | D1876: 陈华 | E1876: 38.700000000000003 | F1876: 男 | G1876: =INT(RC[1]/10)*10 -> 40 | H1876: 44 | I1876: 京基集团 | J1876: 广东 | K1876: 深圳 | L1876: 房地产
A1877: 1876 | B1877: 2010 | C1877: 273 | D1877: 孙宏斌 | E1877: 38.700000000000003 | F1877: 男 | G1877: =INT(RC[1]/10)*10 -> 40 | H1877: 47 | I1877: 融创中国 | J1877: 天津 | K1877: 天津 | L1877: 房地产
A1878: 1877 | B1878: 2010 | C1878: 277 | D1878: 陆克平 | E1878: 38.5 | F1878: 男 | G1878: =INT(RC[1]/10)*10 -> 60 | H1878: 66 | I1878: 江苏阳光集团 | J1878: 江苏 | K1878: 江阴 | L1878: 纺织、太阳能
A1879: 1878 | B1879: 2010 | C1879: 277 | D1879: 林龙安 | E1879: 38.5 | F1879: 男 | G1879: =INT(RC[1]/10)*10 -> 40 | H1879: 46 | I1879: 禹洲地产 | J1879: 福建 | K1879: 厦门 | L1879: 房地产
A1880: 1879 | B1880: 2010 | C1880: 277 | D1880: 缪双大 | E1880: 38.5 | F1880: 男 | G1880: =INT(RC[1]/10)*10 -> 50 | H1880: 59 | I1880: 双良集团 | J1880: 江苏 | K1880: 江阴 | L1880: 家电、化工新材料、酒店
A1881: 1880 | B1881: 2010 | C1881: 277 | D1881: 王勇 | E1881: 38.5 | F1881: 男 | G1881: =INT(RC[1]/10)*10 -> 60 | H1881: 60 | I1881: 西王集团 | J1881: 山东 | K1881: 滨州 | L1881: 糖业
A1882: 1881 | B1882: 2010 | C1882: 277 | D1882: 徐传化父子 | E1882: 38.5 | F1882: 男 | G1882: =INT(RC[1]/10)*10 -> 70 | H1882: 75 | I1882: 传化集团 | J1882: 浙江 | K1882: 杭州 | L1882: 化工、物流、农业、投资
A1883: 1882 | B1883: 2010 | C1883: 277 | D1883: 李非列家族 | E1883: 38.5 | F1883: 男 | G1883: =INT(RC[1]/10)*10 -> 40 | H1883: 44 | I1883: 深圳飞尚实业 | J1883: 广东 | K1883: 深圳 | L1883: 有色金属、钢铁、交通物流、煤炭矿产
A1884: 1883 | B1884: 2010 | C1884: 283 | D1884: 郑有全 | E1884: 38 | F1884: 男 | G1884: =INT(RC[1]/10)*10 -> 50 | H1884: 56 | I1884: 瑞贝卡发制品 | J1884: 河南 | K1884: 许昌 | L1884: 发制品
A1885: 1884 | B1885: 2010 | C1885: 283 | D1885: 李兴 | E1885: 38 | F1885: 男 | G1885: =INT(RC[1]/10)*10 -> 50 | H1885: 57 | I1885: 江阴澄星集团 | J1885: 江苏 | K1885: 江阴 | L1885: 化工(精细磷化工)
A1886: 1885 | B1886: 2010 | C1886: 283 | D1886: 王张兴 | E1886: 38 | F1886: 男 | G1886: =INT(RC[1]/10)*10 -> 40 | H1886: 43 | I1886: 家饰佳 | J1886: 上海 | K1886: 上海 | L1886: 房地产、建材零售
A1887: 1886 | B1887: 2010 | C1887: 286 | D1887: 王东 | E1887: 37.700000000000003 | F1887: 男 | G1887: =INT(RC[1]/10)*10 -> 50 | H1887: 51 | I1887: 扬子江造船 | J1887: 江苏 | K1887: 江阴 | L1887: 造船
A1888: 1887 | B1888: 2010 | C1888: 287 | D1888: 李贤义家族 | E1888: 37.5 | F1888: 男 | G1888: =INT(RC[1]/10)*10 -> 50 | H1888: 58 | I1888: 信义玻璃 | J1888: 香港 | K1888: 香港 | L1888: 玻璃
A1889: 1888 | B1889: 2010 | C1889: 287 | D1889: 梁亮胜 | E1889: 37.5 | F1889: 男 | G1889: =INT(RC[1]/10)*10 -> 50 | H1889: 59 | I1889: 丝宝集团 | J1889: 湖北 | K1889: 武汉 | L1889: 日化用品、药业、房地产
A1890: 1889 | B1890: 2010 | C1890: 287 | D1890: 王树生 | E1890: 37.5 | F1890: 男 | G1890: =INT(RC[1]/10)*10 -> 50 | H1890: 56 | I1890: 大田集团 | J1890: 天津 | K1890: 天津 | L1890: 物流
A1891: 1890 | B1891: 2010 | C1891: 290 | D1891: 梁国兴 | E1891: 37 | F1891: 男 | G1891: =INT(RC[1]/10)*10 -> 40 | H1891: 44 | I1891: 银基集团 | J1891: 广东 | K1891: 深圳 | L1891: 酒销售
A1892: 1891 | B1892: 2010 | C1892: 290 | D1892: 崔志祥 | E1892: 37 | F1892: 男 | G1892: =INT(RC[1]/10)*10 -> 40 | H1892: 47 | I1892: 山东方圆有色金属集团 | J1892: 山东 | K1892: 东营 | L1892: 铜加工、有色金属
A1893: 1892 | B1893: 2010 | C1893: 290 | D1893: 张大中 | E1893: 37 | F1893: 男 | G1893: =INT(RC[1]/10)*10 -> 60 | H1893: 62 | I1893: 北京大中投资 | J1893: 北京 | K1893: 北京 | L1893: 投资
A1894: 1893 | B1894: 2010 | C1894: 293 | D1894: 姜照柏 | E1894: 36.700000000000003 | F1894: 男 | G1894: =INT(RC[1]/10)*10 -> 40 | H1894: 47 | I1894: 鹏欣集团 | J1894: 上海 | K1894: 上海 | L1894: 房地产、投资
A1895: 1894 | B1895: 2010 | C1895: 293 | D1895: 何伯权 | E1895: 36.700000000000003 | F1895: 男 | G1895: =INT(RC[1]/10)*10 -> 50 | H1895: 50 | I1895: 今日投资 | J1895: 广东 | K1895: 广州 | L1895: 投资
A1896: 1895 | B1896: 2010 | C1896: 293 | D1896: 吴瑞林 | E1896: 36.700000000000003 | F1896: 男 | G1896: =INT(RC[1]/10)*10 -> 50 | H1896: 58 | I1896: 侨兴集团 | J1896: 广东 | K1896: 惠州 | L1896: 通信设备制造、矿业
A1897: 1896 | B1897: 2010 | C1897: 293 | D1897: 徐其明 | E1897: 36.700000000000003 | F1897: 男 | G1897: =INT(RC[1]/10)*10 -> 50 | H1897: 57 | I1897: 徐龙集团 | J1897: 浙江 | K1897: 宁波 | L1897: 水产养殖加工
A1898: 1897 | B1898: 2010 | C1898: 297 | D1898: 姜伟 | E1898: 36.5 | F1898: 男 | G1898: =INT(RC[1]/10)*10 -> 40 | H1898: 48 | I1898: 贵州百灵企业集团 | J1898: 贵州 | K1898: 安顺 | L1898: 医药
A1899: 1898 | B1899: 2010 | C1899: 297 | D1899: 叶华能 | E1899: 36.5 | F1899: 男 | G1899: =INT(RC[1]/10)*10 -> 50 | H1899: 58 | I1899: 宝丽华集团 | J1899: 广东 | K1899: 梅州 | L1899: 新能源
A1900: 1899 | B1900: 2010 | C1900: 297 | D1900: 马兴法家族 | E1900: 36.5 | F1900: 男 | G1900: =INT(RC[1]/10)*10 -> 40 | H1900: 48 | I1900: 天马控股集团 | J1900: 浙江 | K1900: 杭州 | L1900: 轴承制造
A1901: 1900 | B1901: 2010 | C1901: 300 | D1901: 陈劲松夫妇 | E1901: 36 | F1901: 男 | G1901: =INT(RC[1]/10)*10 -> 40 | H1901: 46 | I1901: 深圳世联地产 | J1901: 广东 | K1901: 深圳 | L1901: 房地产服务
A1902: 1901 | B1902: 2010 | C1902: 300 | D1902: 陈卓贤 | E1902: 36 | F1902: 男 | G1902: =INT(RC[1]/10)*10 -> 40 | H1902: 43 | I1902: 雅居乐地产 | J1902: 广东 | K1902: 中山 | L1902: 房地产
A1903: 1902 | B1903: 2010 | C1903: 302 | D1903: 陈大年 | E1903: 35.700000000000003 | F1903: 男 | G1903: =INT(RC[1]/10)*10 -> 30 | H1903: 32 | I1903: 盛大网络 | J1903: 上海 | K1903: 上海 | L1903: 网络
A1904: 1903 | B1904: 2010 | C1904: 302 | D1904: 刘迎建夫妇 | E1904: 35.700000000000003 | F1904: 男 | G1904: =INT(RC[1]/10)*10 -> 50 | H1904: 57 | I1904: 汉王科技 | J1904: 北京 | K1904: 北京 | L1904: 计算机应用
A1905: 1904 | B1905: 2010 | C1905: 302 | D1905: 宋伯康家族 | E1905: 35.700000000000003 | F1905: 男 | G1905: =INT(RC[1]/10)*10 -> 50 | H1905: 52 | I1905: 新朋实业 | J1905: 上海 | K1905: 上海 | L1905: 金属制品(机电产品零部件制造)
A1906: 1905 | B1906: 2010 | C1906: 302 | D1906: 阮加根 | E1906: 35.700000000000003 | F1906: 男 | G1906: =INT(RC[1]/10)*10 -> 50 | H1906: 50 | I1906: 浙江闰土 | J1906: 浙江 | K1906: 上虞 | L1906: 化学原料及化学制品制造
A1907: 1906 | B1907: 2010 | C1907: 306 | D1907: 刘德群父女 | E1907: 35.5 | F1907: 男 | G1907: =INT(RC[1]/10)*10 -> 40 | H1907: 45 | I1907: 大连壹桥海洋苗业 | J1907: 辽宁 | K1907: 大连 | L1907: 水产养殖
A1908: 1907 | B1908: 2010 | C1908: 306 | D1908: 姜俊平 | E1908: 35.5 | F1908: 男 | G1908: =INT(RC[1]/10)*10 -> 50 | H1908: 50 | I1908: 青岛巴龙集团 | J1908: 山东 | K1908: 青岛 | L1908: 服饰，建设，房地产开发
A1909: 1908 | B1909: 2010 | C1909: 306 | D1909: 赖宁昌 | E1909: 35.5 | F1909: 男 | G1909: =INT(RC[1]/10)*10 -> 40 | H1909: 41 | I1909: 广州东凌粮油股份有限公司 | J1909: 广东 | K1909: 广州 | L1909: 植物油加工
A1910: 1909 | B1910: 2010 | C1910: 309 | D1910: 薛伟成父子 | E1910: 35 | F1910: 男 | G1910: =INT(RC[1]/10)*10 -> 50 | H1910: 52 | I1910: 罗莱家纺 | J1910: 江苏 | K1910: 南通 | L1910: 纺织
A1911: 1910 | B1911: 2010 | C1911: 309 | D1911: 朱庆伊 | E1911: 35 | F1911: 男 | G1911: / | H1911: / | I1911: 珠江投资 | J1911: 广东 | K1911: 广州 | L1911: 房地产、投资
A1912: 1911 | B1912: 2010 | C1912: 309 | D1912: 柴慧京家族 | E1912: 35 | F1912: 男 | G1912: =INT(RC[1]/10)*10 -> 40 | H1912: 49 | I1912: 浙江国都房产集团 | J1912: 浙江 | K1912: 杭州 | L1912: 房地产
A1913: 1912 | B1913: 2010 | C1913: 309 | D1913: 黄红云夫妇 | E1913: 35 | F1913: 男 | G1913: =INT(RC[1]/10)*10 -> 40 | H1913: 44 | I1913: 金科实业 | J1913: 重庆 | K1913: 重庆 | L1913: 房地产
A1914: 1913 | B1914: 2010 | C1914: 309 | D1914: 刘宝林 | E1914: 35 | F1914: 男 | G1914: =INT(RC[1]/10)*10 -> 50 | H1914: 57 | I1914: 九州通 | J1914: 湖北 | K1914: 武汉 | L1914: 医药零售
A1915: 1914 | B1915: 2010 | C1915: 309 | D1915: 米恩华 | E1915: 35 | F1915: 男 | G1915: =INT(RC[1]/10)*10 -> 50 | H1915: 52 | I1915: 新疆华凌工贸集团 | J1915: 新疆 | K1915: 乌鲁木 | L1915: 齐批发零售
A1916: 1915 | B1916: 2010 | C1916: 309 | D1916: 陈国鹰家族 | E1916: 35 | F1916: 男 | G1916: =INT(RC[1]/10)*10 -> 40 | H1916: 47 | I1916: 国脉科技 | J1916: 福建 | K1916: 福州 | L1916: 电信网络技术服务
A1917: 1916 | B1917: 2010 | C1917: 316 | D1917: 侯建芳 | E1917: 34.700000000000003 | F1917: 男 | G1917: =INT(RC[1]/10)*10 -> 40 | H1917: 43 | I1917: 河南雏鹰农牧 | J1917: 河南 | K1917: 新郑 | L1917: 家禽饲养
A1918: 1917 | B1918: 2010 | C1918: 316 | D1918: 孙伟杰 | E1918: 34.700000000000003 | F1918: 男 | G1918: =INT(RC[1]/10)*10 -> 40 | H1918: 47 | I1918: 烟台杰瑞石油服务集团 | J1918: 山东 | K1918: 烟台 | L1918: 油田矿山设备制造
A1919: 1918 | B1919: 2010 | C1919: 316 | D1919: 林国芳夫妇 | E1919: 34.700000000000003 | F1919: 男 | G1919: =INT(RC[1]/10)*10 -> 50 | H1919: 56 | I1919: 深圳市富安娜家居用品 | J1919: 广东 | K1919: 深圳 | L1919: 纺织
A1920: 1919 | B1920: 2010 | C1920: 316 | D1920: 文剑平 | E1920: 34.700000000000003 | F1920: 男 | G1920: =INT(RC[1]/10)*10 -> 40 | H1920: 48 | I1920: 北京碧水源科技 | J1920: 北京 | K1920: 北京 | L1920: 污水处理
A1921: 1920 | B1921: 2010 | C1921: 320 | D1921: 陈隆基 | E1921: 34.5 | F1921: 男 | G1921: =INT(RC[1]/10)*10 -> 50 | H1921: 54 | I1921: 利嘉国际 | J1921: 香港 | K1921: 香港 | L1921: 投资
A1922: 1921 | B1922: 2010 | C1922: 320 | D1922: 杨贰珠 | E1922: 34.5 | F1922: 男 | G1922: =INT(RC[1]/10)*10 -> 50 | H1922: 59 | I1922: 碧桂园 | J1922: 广东 | K1922: 佛山 | L1922: 房地产
A1923: 1922 | B1923: 2010 | C1923: 320 | D1923: 郭金东 | E1923: 34.5 | F1923: 男 | G1923: =INT(RC[1]/10)*10 -> 40 | H1923: 47 | I1923: 江苏金浦集团 | J1923: 江苏 | K1923: 南京 | L1923: 石油化工、房地产
A1924: 1923 | B1924: 2010 | C1924: 320 | D1924: 金惠明家族 | E1924: 34.5 | F1924: 男 | G1924: =INT(RC[1]/10)*10 -> 50 | H1924: 57 | I1924: 上海大华集团 | J1924: 上海 | K1924: 上海 | L1924: 房地产
A1925: 1924 | B1925: 2010 | C1925: 320 | D1925: 李赶坡 | E1925: 34.5 | F1925: 男 | G1925: =INT(RC[1]/10)*10 -> 60 | H1925: 60 | I1925: 河北敬业集团 | J1925: 河北 | K1925: 石家庄 | L1925: 钢铁、化工、发电
A1926: 1925 | B1926: 2010 | C1926: 325 | D1926: 裘国根夫妇 | E1926: 34 | F1926: 男 | G1926: =INT(RC[1]/10)*10 -> 40 | H1926: 41 | I1926: 上海重阳投资 | J1926: 上海 | K1926: 上海 | L1926: 金融投资
A1927: 1926 | B1927: 2010 | C1927: 325 | D1927: 郑和平 | E1927: 34 | F1927: 男 | G1927: =INT(RC[1]/10)*10 -> 50 | H1927: 59 | I1927: 山东得利斯食品 | J1927: 山东 | K1927: 诸城 | L1927: 屠宰加工
A1928: 1927 | B1928: 2010 | C1928: 325 | D1928: 张朝阳 | E1928: 34 | F1928: 男 | G1928: =INT(RC[1]/10)*10 -> 40 | H1928: 46 | I1928: 搜狐 | J1928: 北京 | K1928: 北京 | L1928: 门户网站、网络游戏
A1929: 1928 | B1929: 2010 | C1929: 325 | D1929: 李西廷 | E1929: 34 | F1929: 男 | G1929: =INT(RC[1]/10)*10 -> 50 | H1929: 59 | I1929: 迈瑞医疗 | J1929: 广东 | K1929: 深圳 | L1929: 医疗器械
A1930: 1929 | B1930: 2010 | C1930: 325 | D1930: 梁社增父子 | E1930: 34 | F1930: 男 | G1930: =INT(RC[1]/10)*10 -> 70 | H1930: 78 | I1930: 广东世荣兆业 | J1930: 广东 | K1930: 珠海 | L1930: 房地产
A1931: 1930 | B1931: 2010 | C1931: 325 | D1931: 王填夫妇 | E1931: 34 | F1931: 男 | G1931: =INT(RC[1]/10)*10 -> 40 | H1931: 42 | I1931: 步步高商业连锁 | J1931: 湖南 | K1931: 湘潭 | L1931: 零售
A1932: 1931 | B1932: 2010 | C1932: 325 | D1932: 张跃 | E1932: 34 | F1932: 男 | G1932: =INT(RC[1]/10)*10 -> 50 | H1932: 50 | I1932: 远大空调 | J1932: 湖南 | K1932: 长沙 | L1932: 家电
A1933: 1932 | B1933: 2010 | C1933: 332 | D1933: 陈基鸿 | E1933: 33.5 | F1933: 男 | G1933: / | H1933: / | I1933: 德正资源 | J1933: 山东 | K1933: 青岛 | L1933: 电解铝、投资
A1934: 1933 | B1934: 2010 | C1934: 332 | D1934: 黄世再 | E1934: 33.5 | F1934: 男 | G1934: =INT(RC[1]/10)*10 -> 50 | H1934: 59 | I1934: 大中华国际 | J1934: 广东 | K1934: 深圳 | L1934: 房地产
A1935: 1934 | B1935: 2010 | C1935: 332 | D1935: 徐勇 | E1935: 33.5 | F1935: 男 | G1935: =INT(RC[1]/10)*10 -> 40 | H1935: 46 | I1935: 百度 | J1935: 北京 | K1935: 北京 | L1935: 搜索引擎
A1936: 1935 | B1936: 2010 | C1936: 335 | D1936: 张松桥 | E1936: 33 | F1936: 男 | G1936: =INT(RC[1]/10)*10 -> 40 | H1936: 44 | I1936: 中渝置地 | J1936: 香港 | K1936: 香港 | L1936: 房地产
A1937: 1936 | B1937: 2010 | C1937: 335 | D1937: 蒋泉龙夫妇 | E1937: 33 | F1937: 男 | G1937: =INT(RC[1]/10)*10 -> 50 | H1937: 58 | I1937: 中国稀土 | J1937: 江苏 | K1937: 宜兴 | L1937: 稀土
A1938: 1937 | B1938: 2010 | C1938: 335 | D1938: 张和灿 | E1938: 33 | F1938: 男 | G1938: / | H1938: / | I1938: 广东浩和创业集团 | J1938: 广东 | K1938: 广州 | L1938: 建筑、房地产
A1939: 1938 | B1939: 2010 | C1939: 335 | D1939: 杨铿 | E1939: 33 | F1939: 男 | G1939: =INT(RC[1]/10)*10 -> 40 | H1939: 48 | I1939: 四川蓝光 | J1939: 四川 | K1939: 成都 | L1939: 房地产
A1940: 1939 | B1940: 2010 | C1940: 335 | D1940: 王力平 | E1940: 33 | F1940: 男 | G1940: =INT(RC[1]/10)*10 -> 50 | H1940: 50 | I1940: 福山能源 | J1940: 香港 | K1940: 香港 | L1940: 煤炭
A1941: 1940 | B1941: 2010 | C1941: 340 | D1941: 袁金华 | E1941: 32.700000000000003 | F1941: 男 | G1941: =INT(RC[1]/10)*10 -> 50 | H1941: 51 | I1941: 三一集团 | J1941: 湖南 | K1941: 长沙 | L1941: 机械装备制造
A1942: 1941 | B1942: 2010 | C1942: 340 | D1942: 王超斌 | E1942: 32.700000000000003 | F1942: 男 | G1942: =INT(RC[1]/10)*10 -> 50 | H1942: 54 | I1942: 中陆物流 | J1942: 河南 | K1942: 郑州 | L1942: 房地产、物流
A1943: 1942 | B1943: 2010 | C1943: 340 | D1943: 姚新义 | E1943: 32.700000000000003 | F1943: 男 | G1943: =INT(RC[1]/10)*10 -> 40 | H1943: 45 | I1943: 盾安集团 | J1943: 浙江 | K1943: 杭州 | L1943: 装备制造、民爆化工、房地产、能源
A1944: 1943 | B1944: 2010 | C1944: 343 | D1944: 郭维城 | E1944: 32.5 | F1944: 男 | G1944: =INT(RC[1]/10)*10 -> 40 | H1944: 46 | I1944: 四环医药控股集团 | J1944: 黑龙江 | K1944: 哈尔滨 | L1944: 医药
A1945: 1944 | B1945: 2010 | C1945: 343 | D1945: 洪江游 | E1945: 32.5 | F1945: 男 | G1945: =INT(RC[1]/10)*10 -> 40 | H1945: 46 | I1945: 海南康芝药业 | J1945: 海南 | K1945: 海口 | L1945: 医药
A1946: 1945 | B1946: 2010 | C1946: 343 | D1946: 邢利斌夫妇 | E1946: 32.5 | F1946: 男 | G1946: =INT(RC[1]/10)*10 -> 40 | H1946: 43 | I1946: 联盛能源 | J1946: 山西 | K1946: 吕梁 | L1946: 煤炭
A1947: 1946 | B1947: 2010 | C1947: 343 | D1947: 吴开贤家族 | E1947: 32.5 | F1947: 男 | G1947: =INT(RC[1]/10)*10 -> 50 | H1947: 59 | I1947: 众业达电气 | J1947: 广东 | K1947: 汕头 | L1947: 机械、电子设备批发
A1948: 1947 | B1948: 2010 | C1948: 343 | D1948: 靳保芳 | E1948: 32.5 | F1948: 男 | G1948: =INT(RC[1]/10)*10 -> 50 | H1948: 58 | I1948: 河北晶龙集团 | J1948: 河北 | K1948: 邢台 | L1948: 太阳能
A1949: 1948 | B1949: 2010 | C1949: 343 | D1949: 王海鹏 | E1949: 32.5 | F1949: 男 | G1949: =INT(RC[1]/10)*10 -> 30 | H1949: 39 | I1949: 深圳美盈森环保科技 | J1949: 广东 | K1949: 深圳 | L1949: 造纸包装
A1950: 1949 | B1950: 2010 | C1950: 349 | D1950: 王伟林夫妇 | E1950: 32 | F1950: 男 | G1950: =INT(RC[1]/10)*10 -> 40 | H1950: 48 | I1950: 华丽家族 | J1950: 上海 | K1950: 上海 | L1950: 房地产
A1951: 1950 | B1951: 2010 | C1951: 349 | D1951: 霍东龄 | E1951: 32 | F1951: 男 | G1951: =INT(RC[1]/10)*10 -> 50 | H1951: 53 | I1951: 京信通信 | J1951: 广东 | K1951: 广州 | L1951: 移动通信设备制造
A1952: 1951 | B1952: 2010 | C1952: 349 | D1952: 丁美清 | E1952: 32 | F1952: 女 | G1952: =INT(RC[1]/10)*10 -> 30 | H1952: 38 | I1952: 特步 | J1952: 福建 | K1952: 泉州 | L1952: 运动服饰及体育用品
A1953: 1952 | B1953: 2010 | C1953: 349 | D1953: 董才平 | E1953: 32 | F1953: 男 | G1953: =INT(RC[1]/10)*10 -> 40 | H1953: 47 | I1953: 中天钢铁 | J1953: 江苏 | K1953: 常州 | L1953: 钢铁
A1954: 1953 | B1954: 2010 | C1954: 353 | D1954: 范伟 | E1954: 31.7 | F1954: 男 | G1954: =INT(RC[1]/10)*10 -> 40 | H1954: 41 | I1954: 复星国际 | J1954: 上海 | K1954: 上海 | L1954: 钢铁、房地产、医药、零售、金融
A1955: 1954 | B1955: 2010 | C1955: 353 | D1955: 汪群斌 | E1955: 31.7 | F1955: 男 | G1955: =INT(RC[1]/10)*10 -> 40 | H1955: 40 | I1955: 复星国际 | J1955: 上海 | K1955: 上海 | L1955: 钢铁、房地产、医药、零售、金融
A1956: 1955 | B1956: 2010 | C1956: 353 | D1956: 卢柏强家族 | E1956: 31.7 | F1956: 男 | G1956: =INT(RC[1]/10)*10 -> 40 | H1956: 48 | I1956: 诺普信 | J1956: 广东 | K1956: 深圳 | L1956: 农药制剂
A1957: 1956 | B1957: 2010 | C1957: 356 | D1957: 张道才家族 | E1957: 31.5 | F1957: 男 | G1957: =INT(RC[1]/10)*10 -> 60 | H1957: 60 | I1957: 三花控股集团 | J1957: 浙江 | K1957: 绍兴 | L1957: 机械制造、房地产
A1958: 1957 | B1958: 2010 | C1958: 356 | D1958: 徐航 | E1958: 31.5 | F1958: 男 | G1958: =INT(RC[1]/10)*10 -> 40 | H1958: 48 | I1958: 迈瑞医疗 | J1958: 广东 | K1958: 深圳 | L1958: 医疗器械
A1959: 1958 | B1959: 2010 | C1959: 356 | D1959: 周建平 | E1959: 31.5 | F1959: 男 | G1959: =INT(RC[1]/10)*10 -> 50 | H1959: 50 | I1959: 海澜集团 | J1959: 江苏 | K1959: 江阴 | L1959: 服装、造船
A1960: 1959 | B1960: 2010 | C1960: 359 | D1960: 孙少锋 | E1960: 31 | F1960: 男 | G1960: =INT(RC[1]/10)*10 -> 40 | H1960: 44 | I1960: 中国绿色食品控股 | J1960: 福建 | K1960: 厦门 | L1960: 绿色食品
A1961: 1960 | B1961: 2010 | C1961: 359 | D1961: 黄朝阳 | E1961: 31 | F1961: 男 | G1961: =INT(RC[1]/10)*10 -> 40 | H1961: 43 | I1961: "中骏集团 | J1961: 福建 | K1961: 厦门 | L1961: 制造业、房地产
A1962: 1961 | B1962: 2010 | C1962: 361 | D1962: 周忻 | E1962: 30.7 | F1962: 男 | G1962: =INT(RC[1]/10)*10 -> 40 | H1962: 43 | I1962: 易居中国 | J1962: 上海 | K1962: 上海 | L1962: 房地产服务
A1963: 1962 | B1963: 2010 | C1963: 361 | D1963: 朱新礼 | E1963: 30.7 | F1963: 男 | G1963: =INT(RC[1]/10)*10 -> 50 | H1963: 58 | I1963: 汇源集团 | J1963: 北京 | K1963: 北京 | L1963: 饮料
A1964: 1963 | B1964: 2010 | C1964: 361 | D1964: 周和平 | E1964: 30.7 | F1964: 男 | G1964: =INT(RC[1]/10)*10 -> 40 | H1964: 46 | I1964: 深圳沃尔核材 | J1964: 广东 | K1964: 深圳 | L1964: 新材料、电子元器件制造
A1965: 1964 | B1965: 2010 | C1965: 364 | D1965: 王旭宁 | E1965: 30.5 | F1965: 男 | G1965: =INT(RC[1]/10)*10 -> 40 | H1965: 41 | I1965: 九阳股份 | J1965: 山东 | K1965: 济南 | L1965: 小家电
A1966: 1965 | B1966: 2010 | C1966: 364 | D1966: 王伟贤 | E1966: 30.5 | F1966: 男 | G1966: =INT(RC[1]/10)*10 -> 40 | H1966: 46 | I1966: 盛高置地 | J1966: 上海 | K1966: 上海 | L1966: 房地产
A1967: 1966 | B1967: 2010 | C1967: 366 | D1967: 周庆治夫妇 | E1967: 30 | F1967: 男 | G1967: =INT(RC[1]/10)*10 -> 50 | H1967: 55 | I1967: 南都集团 | J1967: 浙江 | K1967: 杭州 | L1967: 通信电源、投资
A1968: 1967 | B1968: 2010 | C1968: 366 | D1968: 姚新泉 | E1968: 30 | F1968: 男 | G1968: =INT(RC[1]/10)*10 -> 40 | H1968: 43 | I1968: 盾安集团 | J1968: 浙江 | K1968: 杭州 | L1968: 装备制造、民爆化工、房地产、能源
A1969: 1968 | B1969: 2010 | C1969: 366 | D1969: 吴惠天 | E1969: 30 | F1969: 男 | G1969: =INT(RC[1]/10)*10 -> 60 | H1969: 67 | I1969: 万利达集团 | J1969: 福建 | K1969: 漳州 | L1969: 消费电子、新能源
A1970: 1969 | B1970: 2010 | C1970: 366 | D1970: 包文东夫妇 | E1970: 30 | F1970: 男 | G1970: =INT(RC[1]/10)*10 -> 50 | H1970: 50 | I1970: 云南临沧鑫圆锗业 | J1970: 云南 | K1970: 临沧 | L1970: 红外光学、太阳能
A1971: 1970 | B1971: 2010 | C1971: 366 | D1971: 郭信平 | E1971: 30 | F1971: 男 | G1971: =INT(RC[1]/10)*10 -> 40 | H1971: 45 | I1971: 北京合众思壮科技 | J1971: 北京 | K1971: 北京 | L1971: 通信及相关设备制造业
A1972: 1971 | B1972: 2010 | C1972: 366 | D1972: 陈学利 | E1972: 30 | F1972: 男 | G1972: =INT(RC[1]/10)*10 -> 50 | H1972: 59 | I1972: 威高集团 | J1972: 山东 | K1972: 威海 | L1972: 医疗器械
A1973: 1972 | B1973: 2010 | C1973: 366 | D1973: 虞阿五父子 | E1973: 30 | F1973: 男 | G1973: =INT(RC[1]/10)*10 -> 60 | H1973: 69 | I1973: 日月首饰 | J1973: 浙江 | K1973: 绍兴 | L1973: 珠宝连锁、投资
A1974: 1973 | B1974: 2010 | C1974: 366 | D1974: 戴皓 | E1974: 30 | F1974: 男 | G1974: =INT(RC[1]/10)*10 -> 40 | H1974: 46 | I1974: 中发集团 | J1974: 北京 | K1974: 北京 | L1974: 保险、房地产
A1975: 1974 | B1975: 2010 | C1975: 366 | D1975: 孙荫环 | E1975: 30 | F1975: 男 | G1975: =INT(RC[1]/10)*10 -> 60 | H1975: 60 | I1975: 亿达集团 | J1975: 辽宁 | K1975: 大连 | L1975: 房地产、软件园
A1976: 1975 | B1976: 2010 | C1976: 366 | D1976: 张雷 | E1976: 30 | F1976: 男 | G1976: =INT(RC[1]/10)*10 -> 40 | H1976: 48 | I1976: 当代集团 | J1976: 北京 | K1976: 北京 | L1976: 房地产
A1977: 1976 | B1977: 2010 | C1977: 366 | D1977: 陈育新 | E1977: 30 | F1977: 男 | G1977: =INT(RC[1]/10)*10 -> 60 | H1977: 60 | I1977: 华西希望集团 | J1977: 四川 | K1977: 成都 | L1977: 农牧、百货零售
A1978: 1977 | B1978: 2010 | C1978: 366 | D1978: 董现君 | E1978: 30 | F1978: 男 | G1978: =INT(RC[1]/10)*10 -> 40 | H1978: 47 | I1978: 江苏华厦融创置地 | J1978: 江苏 | K1978: 徐州 | L1978: 房地产
A1979: 1978 | B1979: 2010 | C1979: 366 | D1979: 徐之伟 | E1979: 30 | F1979: 男 | G1979: =INT(RC[1]/10)*10 -> 50 | H1979: 57 | I1979: 隆力奇集团 | J1979: 江苏 | K1979: 常熟 | L1979: 日化用品
A1980: 1979 | B1980: 2010 | C1980: 366 | D1980: 姚振华 | E1980: 30 | F1980: 男 | G1980: =INT(RC[1]/10)*10 -> 40 | H1980: 40 | I1980: 宝能控股 | J1980: 广东 | K1980: 深圳 | L1980: 物流、房地产
A1981: 1980 | B1981: 2010 | C1981: 366 | D1981: 王圣忠 | E1981: 30 | F1981: 男 | G1981: / | H1981: / | I1981: 福佳集团 | J1981: 辽宁 | K1981: 大连 | L1981: 石化、房地产
A1982: 1981 | B1982: 2010 | C1982: 366 | D1982: 赵满堂 | E1982: 30 | F1982: 男 | G1982: =INT(RC[1]/10)*10 -> 40 | H1982: 49 | I1982: 盛达集团 | J1982: 甘肃 | K1982: 兰州 | L1982: 有色金属、矿业
A1983: 1982 | B1983: 2010 | C1983: 382 | D1983: 王飘扬 | E1983: 29.7 | F1983: 男 | G1983: =INT(RC[1]/10)*10 -> 40 | H1983: 46 | I1983: 北京万邦达环保技术 | J1983: 北京 | K1983: 北京 | L1983: 污水处理
A1984: 1983 | B1984: 2010 | C1984: 382 | D1984: 饶陆华 | E1984: 29.7 | F1984: 男 | G1984: =INT(RC[1]/10)*10 -> 40 | H1984: 45 | I1984: 深圳科陆电子 | J1984: 广东 | K1984: 深圳 | L1984: 电子器件制造
A1985: 1984 | B1985: 2010 | C1985: 382 | D1985: 穆来安 | E1985: 29.7 | F1985: 男 | G1985: =INT(RC[1]/10)*10 -> 50 | H1985: 55 | I1985: 上海凯宝药业 | J1985: 上海 | K1985: 上海 | L1985: 医药
A1986: 1985 | B1986: 2010 | C1986: 385 | D1986: 潘慧 | E1986: 29.5 | F1986: 女 | G1986: =INT(RC[1]/10)*10 -> 40 | H1986: 48 | I1986: 四川科伦药业 | J1986: 四川 | K1986: 成都 | L1986: 医药
A1987: 1986 | B1987: 2010 | C1987: 385 | D1987: 俞国生家族 | E1987: 29.5 | F1987: 男 | G1987: =INT(RC[1]/10)*10 -> 50 | H1987: 53 | I1987: 野风集团 | J1987: 浙江 | K1987: 杭州 | L1987: 服装、房地产
A1988: 1987 | B1988: 2010 | C1988: 385 | D1988: 徐长江 | E1988: 29.5 | F1988: 男 | G1988: =INT(RC[1]/10)*10 -> 50 | H1988: 59 | I1988: 江苏文峰集团 | J1988: 江苏 | K1988: 南通 | L1988: 零售
A1989: 1988 | B1989: 2010 | C1989: 385 | D1989: 赵一弘 | E1989: 29.5 | F1989: 男 | G1989: =INT(RC[1]/10)*10 -> 40 | H1989: 43 | I1989: 碧生源 | J1989: 北京 | K1989: 北京 | L1989: 保健品
A1990: 1989 | B1990: 2010 | C1990: 385 | D1990: 张泽民夫妇 | E1990: 29.5 | F1990: 男 | G1990: =INT(RC[1]/10)*10 -> 40 | H1990: 46 | I1990: 佛山星期六鞋业 | J1990: 广东 | K1990: 佛山 | L1990: 制鞋
A1991: 1990 | B1991: 2010 | C1991: 390 | D1991: 王广西 | E1991: 29 | F1991: 男 | G1991: =INT(RC[1]/10)*10 -> 40 | H1991: 41 | I1991: 泰安鲁润股份 | J1991: 江苏 | K1991: 南京 | L1991: 能源、煤炭
A1992: 1991 | B1992: 2010 | C1992: 390 | D1992: 周福贵 | E1992: 29 | F1992: 男 | G1992: =INT(RC[1]/10)*10 -> 40 | H1992: 48 | I1992: 三一集团 | J1992: 湖南 | K1992: 长沙 | L1992: 机械装备制造
A1993: 1992 | B1993: 2010 | C1993: 390 | D1993: 郑钟南家族 | E1993: 29 | F1993: 男 | G1993: =INT(RC[1]/10)*10 -> 60 | H1993: 61 | I1993: 广东南洋电缆集团 | J1993: 广东 | K1993: 汕头 | L1993: 输配电及控制设备制造
A1994: 1993 | B1994: 2010 | C1994: 390 | D1994: 盛静生 | E1994: 29 | F1994: 男 | G1994: =INT(RC[1]/10)*10 -> 30 | H1994: 39 | I1994: 罗蒙集团 | J1994: 浙江 | K1994: 宁波 | L1994: 服饰
A1995: 1994 | B1995: 2010 | C1995: 390 | D1995: 吴长江 | E1995: 29 | F1995: 男 | G1995: =INT(RC[1]/10)*10 -> 40 | H1995: 45 | I1995: 雷士照明 | J1995: 广东 | K1995: 惠州 | L1995: 照明
A1996: 1995 | B1996: 2010 | C1996: 395 | D1996: 王文彪 | E1996: 28.7 | F1996: 男 | G1996: =INT(RC[1]/10)*10 -> 50 | H1996: 53 | I1996: 亿利资源集团 | J1996: 内蒙古 | K1996: 鄂尔多斯 | L1996: 化工、医药
A1997: 1996 | B1997: 2010 | C1997: 395 | D1997: 周耀庭家族 | E1997: 28.7 | F1997: 男 | G1997: =INT(RC[1]/10)*10 -> 60 | H1997: 67 | I1997: 红豆集团 | J1997: 江苏 | K1997: 无锡 | L1997: 服装、化纤、房地产
A1998: 1997 | B1998: 2010 | C1998: 395 | D1998: 周文夫妇 | E1998: 28.7 | F1998: 男 | G1998: =INT(RC[1]/10)*10 -> 40 | H1998: 45 | I1998: 上海普利特复合材料 | J1998: 上海 | K1998: 上海 | L1998: 塑料制造
A1999: 1998 | B1999: 2010 | C1999: 395 | D1999: 寿柏年 | E1999: 28.7 | F1999: 男 | G1999: =INT(RC[1]/10)*10 -> 50 | H1999: 56 | I1999: 绿城房地产集团 | J1999: 浙江 | K1999: 杭州 | L1999: 房地产
A2000: 1999 | B2000: 2010 | C2000: 399 | D2000: 傅军 | E2000: 28.5 | F2000: 男 | G2000: =INT(RC[1]/10)*10 -> 50 | H2000: 53 | I2000: 新华联集团 | J2000: 北京 | K2000: 北京 | L2000: 能源、化工、房地产、金融
A2001: 2000 | B2001: 2010 | C2001: 399 | D2001: 钱毅湘夫妇 | E2001: 28.5 | F2001: 男 | G2001: =INT(RC[1]/10)*10 -> 30 | H2001: 36 | I2001: 博耳电力控股 | J2001: 江苏 | K2001: 无锡 | L2001: 电力仪表